"_type","category","isi","judul"
"dict","foto","Garuda Muda Tersingkir dari Kualifikasi Piala Asia U-23 2020  Timnas U-23 Indonesia dipastikan tersingkir dari kualifikasi Piala Asia U-23 2020.  Hal ini tidak lepas dari kekalahan 0-1 Indonesia dari Vietnam pada laga kedua Grup K di Stadion My Dinh, Hanoi, Minggu (24/03/2019). Kekalahan ini begitu menyakitkan karena gawang Indonesia kebobolan di masa injury time babak kedua (90+3') lewat gol Trieu Viet Hung. Kekalahan kedua ini membuat Indonesia dipastikan gagal tampil di Piala Asia U-23 2020 tahun depan. Sementara itu, Vietnam dan Thailand akan bersaing memperebutkan status juara Grup K di laga terakhir. Thailand untuk sementara memimpin klasemen dengan koleksi enam poin dan unggul dari Vietnam di urutan kedua. Sementara itu, Indonesia tertahan di peringkat ketiga dan hanya unggul selisih gol dari Brunei yang berada di dasar klasemen. Indonesia bahkan bisa saja mengakhiri kualifikasi di dasar klasemen jika kalah di laga terakhir melawan Brunei. Laga pamungkas Grup K akan berlangsung pada Selasa (26/03/2019). Di babak pertama, kedua tim bermain sangat hati-hati dengan tempo sedang. Tercatat hanya ada dua tembakan tepat sasaran untuk masing-masing tim hingga turun minum. Berjalan ke babak kedua, laga ini berjalan lebih terbuka dan tempo sedikit meningkat. Indonesia lebih berani menyerang meski mengandalkan serangan balik. Pada 15 menit pertama, Indonesia mampu menciptakan dua tembakan tepat sasaran. Dua peluang ini didapat setelah kiper Vietnam, Bui Tien Dung, melakukan kesalahan ketika membuang bola. Beruntung Bui Tien Dung berhasil membayar kesalahannya dengan menepis tembakan Egy Maulana Vikri dan Marinus Wanewar. Seusai dua peluang ini, Indonesia tidak lagi menemukan momen untuk menyerang dan dipaksa bertahan oleh Vietnam. Sadar dalam tekanan, pelatih Indra Sjafri memasukkan Gian Zola untuk memperkuat lini tengah. Masuknya Gian Zola membuat Egy Maulana Vikri digeser ke sayap kanan. Hingga menit ke-80, strategi ini belum membuat Indonesia keluar dari tekanan. Indra Sjafri kemudian memasukkan Dimas Drajad sehingga bermain dengan dua penyerang. Ketika laga terlihat akan berakhir imbang, Vietnam mencetak gol pada menit ke-90+3. Memanfaatkan umpan sepak pojok, Trieu Viet Hung yang tidak terkawal sukses merobek gawang Awan Setho dengan sundulannya. Skor 1-0 untuk Vietnam berakhir hingga peluit panjang. ","Garuda Muda Tersingkir dari Kualifikasi Piala Asia U-23 2020"
"dict","bola","Coach Justin jadi Penasihat Teknis Timnas Futsal Indonesia  Justinus Lhaksana dipastikan kembali terlibat mengurus Timnas    Indonesia. Hal itu diungkapkan langsung oleh pengamat sepak bola yang akrab disapa dengan Coach Justin itu. Justin ditunjuk sebagai Penasihat Teknis oleh Sekjen Federasi Futsal Indonesia (FFI), Edy Prasetyo, pada Senin (8/4/2019). ""Saya bahagia dengan penunjukkan ini. Saya juga yakin bisa memberi kontribusi dengan mengangkat timnas ke level lebih tinggi dari sekarang,"" kata Justin kepada Kompas.com, Senin sore. Justin dikontrak hingga Piala Dunia 2020. Sebagai penasihat teknis, Justin akan membantu pelatih Kensuke Takahashi dalam melakukan seleksi timnas    senior. ""Tim futsal senior itu akan terjun di Piala AFF pada Oktober 2019. Lalu, akan ada Piala Asia pada Maret 2020,"" kata Justin. ""Untuk Piala Asia kalau bisa tembus empat besar biar bisa lolos Piala Dunia yang akan dilangsungkan pada November 2020,"" kata pria berusia 51 tahun itu. Justinus Lhaksana bukanlah sosok baru di dunia futsal nasional. Dia pernah menjadi pelatih timnas futsal pada 2005-2009. Setelah itu, dia menjadi direktur teknik timnas futsal pada 2011 dan 2013. Dia lalu muncul sebagai komentator dan pengamat sepak bola di sejumlah stasiun televisi.","Coach Justin jadi Penasihat Teknis Timnas Futsal Indonesia"
"dict","bola","Final Piala Presiden 2019, Arema FC Boyong 18 Pemain ke Surabaya  - Babak final    2019 akan mempertemukan dua klub asal Jawa Timur yang sudah lama berseteru, yakni    dengan   . Pertandingan final leg pertama Piala Piala Presiden 2019 antara Persebaya Vs Arema FC akan diselenggarakan di Stadion Gelora Bung Tomo, Surabaya, Selasa (9/4/2019) pukul 18.30 WIB. Pelatih Arema FC, Milomir Seslija, telah mempersiapkan 18 pemain yang akan dibawa bertandang ke markas Persebaya. Sang kapten Singo Edan, Hamka Hamzah, masih menjadi andalan untuk menjadi mentor di lini belakang. Kemudian di lini tengah, Makan Konate, Hendro Siswanto, dan Jayus Hariono dipastikan ikut serta dalam lawatan kali ini. Sementara pada posisi depan, Dedik Santoso, Dedik Setiawan, dan Ricky Kayame dipastikan tetap akan menjadi ujung tombak Singo Edan. Namun dalam melawat ke markas Persebaya, Arema FC harus kehilangan dua legiun asing, yakni Pavel Smolyachenko dan Robert Lima Guimaraes karena cedera. Milomir Seslija menegaskan akan memilih siapa pemain yang siap dalam menghadapi Persebaya di partai puncak. ""Setiap selesai pertandingan kami selalu melakukan analisis pada pemain yang tampil, dari situ kami jadikan modal untuk pertandingan berikutnya,"" ucap Milo. ""Yang pasti besok kami akan memainkan pemain yang kami rasa paling siap,"" tambahnya. Pavel Smolyachenko dan Robert Lima Guimaraes tidak akan dibawa ke Surabaya, keduanya tetap mengikuti latihan terakhir di Malang pada Senin (8/4/2019) pagi. Robert Lima Guimaraes tampaknya harus menepi agak panjang karena mengalami cedera robek otot betis. : Kurniawan Kartika Ajie, Utam Rusdiana : Hamka Hamzah, Alfin Tuasalamony, Arthur Cunha, Johan Ahmat Farizi, Ikhfanul Alam : Jayus Hariono, Makan Konate, Dendi Santoso, Hanif Sjahbandi, Hendro Siswanto, Ricky Akbar Ohorella : Ricky Kayame, Muhammad Rafli, Dedik Setiawan, Rivaldi Bawuo, Ahmad Nur Hardianto","Final Piala Presiden 2019, Arema FC Boyong 18 Pemain ke Surabaya"
"dict","foto","Kemenangan Indonesia atas Brunei pada Laga Terakhir Kualifikasi Piala Asia U-23","Kemenangan Indonesia atas Brunei pada Laga Terakhir Kualifikasi Piala Asia U-23"
"dict","bola","Pulih dari Cedera, Felipe Anderson Siap Bantu West Ham Hadapi Chelsea  -    akan dijamu    di Stamford Bridge pada lanjutan Liga Inggris, Senin (8/4/2019) atau Selasa dini hari WIB. Duel ini menjadi pertandingan terakhir di pekan ke-33 Liga Inggris. Tampil di hadapan pendukungnya, Chelsea akan berusaha meneruskan tren positif demi finis di empat besar pada akhir musim nanti. Chelsea kembali diunggulkan setelah mampu menang di dua pertandingan terakhir Liga Inggris. Di pertandingan terakhir melawan Brighton Hove Albion, The Blues menang dengan skor meyakinkan 3-0. Sarri kemungkinan akan menurunkan skuad yang hampir sama seperti saat melawan Brighton. Sebab, Marcos Alonso dan Pedro masih diragukan tampil karena cedera. Pemain muda timnas Inggris, Callum Hudson-Odoi, berpeluang kembali tampil sejak menit awal seperti saat melawan Brighton. Meski demikian, Chelsea harus waspada saat menghadapi West Ham. Tim tamu tidak bisa dianggap enteng karena kemungkinan akan tampil dengan komposisi skuad lebih lengkap. West Ham akan kembali diperkuat gelandang andalannya, Felipe Anderson, yang telah pulih dari cedera engkel. Sebelumnya, Anderson telah menepi karena cedera sejak pertengahan Maret. West Ham juga bisa kembali mengandalkan Samir Nasri dan Ryan Fredericks yang juga sudah pulih dari cedera.   ","Pulih dari Cedera, Felipe Anderson Siap Bantu West Ham Hadapi Chelsea"
"dict","bola","Persebaya Vs Arema FC, Milo Optimistis dengan Kekuatan Singo Edan  - Pelatih   , Milomir Seslija, mengungkapkan optimismenya jelang laga final leg pertama    melawan   , di Stadion Gelora Bung Tomo, Surabaya, Jawa Timur, Selasa (9/4/2019). Menurut Seslija, Persebaya jelas bukan lawan yang mudah. Terlebih lagi, mereka akan bertindak sebagai tuan rumah pada laga final leg pertama besok. Namun, ia percaya Hamka Hamzah dkk bakal menunjukkan kemampuan terbaik mereka guna meraih hasil optimal di Kota Pahlawan. ""Untuk saat ini, Persebaya dan Arema sama-sama tim kuat di Indonesia. Kedua tim sama-sama memiliki kualitas yang bagus,"" ujar Seslija saat konferensi pers di Surabaya, Senin (8/4/2019). ""Kami mencoba menikmati permainan kami dan kemenangan akan datang. Ini tidak mudah, tetapi kami percaya pada tim kami, kami optimistis dan sedang dalam penampilan yang baik."" Hal senada juga diungkapkan gelandang Arema FC, Hanif Sjahbandi, yang turut hadir dalam sesi konferensi pers. Hanif mengaku tak sabar untuk melakoni laga final leg pertama yang sarat akan gengsi karena rivalitas di antara kedua tim. ""Kami harus siap dan akan mengeluarkan segala kemampuan serta tenaga kami demi kebahagiaan suporter kami, Aremania. Jadi, saya mewakili pemain, kami siap menghadapi pertandingan besok,"" ucap Hanif.  laga final leg pertama Piala Piala Presiden 2019 antara Persebaya vs Arema FC akan berlangsung pada pukul 18.30 WIB. Adapun laga final leg kedua bakal diselenggarakan di markas Arema, Stadion Kanjuruhan, Malang, pada Sabtu (12/4/2019).","Persebaya Vs Arema FC, Milo Optimistis dengan Kekuatan Singo Edan"
"dict","bola","Legenda Muay Thai Akan Pertaruhkan Gelar Juara di Jakarta  -    akan kembali menggelar pertarungan di Istora Senayan, Jakarta, pada 3 Mei 2019 mendatang dengan tajuk ONE: For Honor. Para petarung seni bela diri campuran (mixed martial art/MMA) terbaik dunia akan unjuk gigi, salah satunya pemegang gelar ONE Flyweight Muay Thai World Champion, Sam-A Gaiyanghadao (Thailand). Sam-A bakal berupaya mempertahankan gelar juaranya pada laga utama ONE: For Honor dengan melawan petarung asal Inggris, Jonathan Haggerty. Sepanjang 25 tahun kariernya, Sam-A telah melakoni lebih dari 400 pertarungan dalam berbagai kelas, dan saat ini dia dikenal sebagai salah satu petarung kickboxer muay thai terbaik sepanjang masa. Lahir dari keluarga petani di Buriram, provinsi di Timur Laut Thailand, Sam-A memulai karir kompetisi muay thai pada usia 9 tahun. Sam-A kemudian pindah ke Bangkok pada usia 15 tahun dan mulai berlatih di akademi Muay Thai Petchyindee yang terkenal. Kerja keras dan dedikasinya segera terbayar dengan kariernya yang terus menanjak. Adapun sang penantang, Haggerty, sudah menggeluti bela diri pada usia relatif muda. Dia mulai berlatih muay thai pada usia 7 tahun di bawah pengawasan ayahnya, John, yang juga merupakan petarung aktif. Haggerty dengan cepat meraih banyak penghargaan dalam muay thai sebagai seorang amatir. Ia pernah menjadi juara di Inggris sebanyak tiga kali, serta memenangi gelar tingkat Eropa. Sebagai seorang profesional, rekornya terus bertambah dan dia telah mendominasi hampir semua lawan yang dihadapinya serta memenangkan dengan nyaris selalu menang   (KO). Kini, Haggerty mendapat kesempatan untuk menantang legenda muay thai Sam-A Gaiyanghadao untuk memperebutkan gelar juara dunia ONE Flyweight Muay Thai.","Legenda Muay Thai Akan Pertaruhkan Gelar Juara di Jakarta"
"dict","bola","Persebaya Vs Arema FC, Bejo Ingin Ubah Asa Jadi Juara  Asisten Pelatih   , Bejo Sugiantoro mengatakan, Persebaya akan bermain ngeyel dan ngotot kala menjamu    pada pertandingan pertama final    di Stadion Gelora Bung Tomo, Surabaya, Selasa (9/4/2019). Di sisi lain, tim pelatih, kata Bejo, juga akan melakukan observasi dan melihat kelebihan Singo Edan, julukan Arema FC. Hal itu dilakukan untuk mengantisipasi kelebihan lawan supaya pemain tidak melakukan kesalahan di pertandingan krusial tersebut. ""Jadi kami semua, tim Persebaya sudah siap untuk pertandingan final besok. Kami akan bermain dengan gaya Persebaya sendiri,"" kata Bejo dalam sesi jumpa pers di Rumdin Wawali Surabaya. Menurut dia, Arema FC merupakan klub yang dihuni pemain berkualitas dan sebagian pemain juga membela timnas. Sama halnya dengan Arema, Persebaya menurut Bejo juga memiliki pemain berkualitas dan beberapa pemain membela timnas. ""Kami respect sama Arema. Karena dua tim terbaik melangkah ke final. Ini menjadi salah satu catatan positif,"" tutur Bejo. Meski demikian, legenda hidup Persebaya itu ingin mewujudkan asa, harapan, dan angan-angan masa silam dengan menjadi juara bersama Persebaya. ""Masa silam itu ibarat pemain punya harapan di saat dia kecil ingin menjadi juara. Mumpung di sini final, ya, ubah angan-angan di masa kecil untuk menjadi juara,"" ucap Bejo. ""Itu masa depannya, ubah masa silam demi masa depan. Pertandingan besok akan sangat menarik menjadi tontonan Bonek dan Bonita,"" imbuh Bejo. Sementara itu, Gelandang Persebaya Misbakus Solikin menyatakan, ia dan rekan-rekannya sudah siap 100 persen untuk menghadapi Arema FC.  Ia mengaku tidak memiliki target pribadi melawan Arema FC. Namun, semua pemain ingin bekerja keras untuk memberikan kemenangan bagi klub kebanggaan Arek Suroboyo itu.  ""Untuk pertandingan final besok enggak ada target. Siapa pun yang cetak gol yang penting Persebaya menang,"" pungkasnya.","Persebaya Vs Arema FC, Bejo Ingin Ubah Asa Jadi Juara"
"dict","bola","Ketika Olahragawan dan Pekerja Seni Menolak Bebas Nilai  - Ikrar dukungan kalangan insan olkahraga terhadap pasangan calon Presiden dan Wapres Jokowi-Maruf Amin di ICE, BSD, Minggu (7/04/2019) ternyata menuai kecaman. Melalui akun medsos masing-masing mereka yang menentang menyebut seharusnya atlet itu berkonsentrasi kepada prestasi dan tidak membawa-bawa olahraga ke ranah politik. Dalam kondisi apa pun. Mengenai hal ini, salah serorang penggagas, Richard Sambera pernah menyebut bahwa bagaimanana pun atlet atau mereka yang bergerak di bidang olahraga adalah juga warganegara yang memiliki keinginan politik yang berkaitan dengan kepentingan mereka. ""Ya kalau mengutarakan keinginan akan seperti apa negara ideal mereka, masak tidak boleh? Atlet kan juga butuh kondisi sosial politik negara ini untuk dapat berprestasi secara maksimal."" Sikap bebas nilai ini juga ditolak oleh Gerakan Alumni Universitas Indonesia (UI) untuk Jokowi-Amin dan Alumni Institut Kesenian Jakarta (IKJ) dengan menggelar  acara doa bersama Lintas Agama dan Festival Seni Budaya bertajuk ""Satukan Doa Menuju Kemenangan"" pada Jumat (12/04/2019) mendatang. Dalam keterangan pers di Jakarta, Senin (08/04/2019), Leni Lolang dari Alumni IKJ menyebut kondisi politik yang terbentuk sejak 2014 memaksa para pekerja seni alumni IKJ harus merumuskan sikap politik mereka. ""Dari pengalaman 2014, kami sadar bahwa secara perlahan ada kekuatan yang menyeret kita secara sadar atau tidak sadar untuk kembali ke masa-masa represif dulu. Masa ketika banyak dari teman-teman kami ditangkap bahkan harus dipenjara,""kata Leni. 'Setelah 2014, kami komunitas seni dari IKJ  sadar penuh bahwa kondisi yang kondusif untuk perkembangan dunia seni harus kita usahakan karena tidak ada yang mau memberikannya dengan gratis. Karena kami lihat Pak Jokowi pada 2014 hingga kini mampu menjaga kondusiv9itas tersebut, maka kami aktif mendukung dia,""katanya ;lagi. Ia mengakui bahwa tidak semua alumni IKJ berpikiran sama dan mendukung Paslon 01. ""Kalau diperbandingkan ya 80:20 lah. Itu pun kebanyakan dari mereka yang tidak setuju memang  maju sebagai Caleg,""ungkapnya. Sementara Fajar Soeharto, Ketua Gerakan    untuk Jokowi-Amin menyebut  acara yang akan berlangsung di Kuningan ini merupakan bentuk rangkaian yang tak terputus. ""Baik doa verbal dari para pemuka agama, serta bentuk  kesenian yang kami tampilkan semua melambangkan  kebhinnekaan kebudayaan serta kepercayaan di negara ini. Baik itu tari kecak dari Bali/Hindu, paduan suara (Kristen/Katolik), rebana (Islam) serta tentu saja lagu-lagu wajib seperti Indonesia Raya dan lainnya yang nanti dipimpin Addie MS,""kata Fajar. Pekerja seni yang telah sepakat untuk tampil antara lain PM Toh dari Aceh, Addie MS, Oppie Andaresta, Michael Idol dan Jalu Pratidina. ""rakaiuan akan dibuka dengan lagu-lagu dangdut jalanan serta aklan diakhiri penampilan Saykoji."" Fajar menyebut acara ini secara  organisatoris tidak berhubungan dnegna rencana pentas eni p[ada kampanye terakhiur pasangan caolon No.01, Jokowi-Amin yang akan dimerihakan Slank dan berlangsung di GBK Senayan pada Sabtu (13/04/2019). ""Secara organisatori tidak, tetapi tentu semangatnya serupa,  seperti juga deklarasi Gerakan Alumni UI untuk Jokowi-Amin di GBK pada 12 Januari lalu,""kata Fajar lagi.  ","Ketika Olahragawan dan Pekerja Seni Menolak Bebas Nilai"
"dict","bola","Persebaya Vs Arema FC, Djanur Dipastikan Dampingi Bajul Ijo  Pelatih   , Djadjang Nurdjaman dipastikan bisa mendampingi Bajul Ijo kala menghadapi    di Partai Final Piala Presiden 2019 di Stadion Gelora Bung Tomo, Surabaya, Selasa (9/4/2019). Hal itu dikatakan oleh Media Officer Persebaya Nanang Prianto saat jumpa pers di rumah dinas Wakil Wali Kota Surabaya, Senin (8/4/2019). Pelatih yang akrab disapa Djanur itu terancam tidak bisa mendampingi Persebaya karena harus mengikuti modul pelatihan lisensi A AFC di Yogyakarta. ""Saya mendapat update bahwa nanti malam Coach Djanur bisa mendarat sempurna di Surabaya,"" kata Nanang. Sementara itu, Asisten Pelatih Persebaya Bejo Sugiantoro mengaku tidak akan berandai-andai bila Persebaya tak didampingi Djanur. Sebab nantinya semua keputusan tetap ada ditangan pelatih kepala. Seandainya harus menggantikan Djanur untuk mendampingi tim, Bejo akan melakukan strategi dan taktik yang tidak jauh dari apa yang sudah diputuskan Djanur. ""Kalau saya tidak mau berandai-andai. Karena saya membantu di tim. Saya asisten dari coach Djanur. Kalau saya dampingi tim, tidak jauh dari arahan Djanur,"" kata Bejo. ""Saya mendoakan dan memberikan dukungan kepada coach Djanur supaya lulus dengan hasil terbaik,"" kata Bejo.","Persebaya Vs Arema FC, Djanur Dipastikan Dampingi Bajul Ijo"
"dict","bola","Buru Pengganti Washington Brandao, Persela Kantongi 5 Sosok Incaran  Pascadicoretnya Washington Brandao dari daftar skuad,    coba berusaha untuk mencari sosok striker asing haus gol yang dianggap sesuai dengan pola permainan dan strategi yang bakal digunakan saat mengarungi kompetisi Liga 1 musim ini. Sesuai dengan harapan pelatih tim Laskar Joko Tingkir ketika memutuskan untuk melepas Brandao, mereka berharap bisa mendapatkan sosok striker murni sebelum kompetisi dimulai pada 8 Mei 2019 mendatang.  ""Sudah ada lima pemain (incaran), rata-rata (berkebangsaan) Brasil, tapi ada dari Peru juga,"" ucap asisten pelatih Persela Danur Dara, usai memimpin latihan tim di Stadion Surajaya, Senin (8/4/2019).  Hanya saja, Danur masih belum berkenan mengungkapkan lebih rinci mengenai siapa saja striker asing yang masuk dalam list tersebut. Termasuk, apakah penyerang tersebut sudah pernah bermain di Indonesia sebelumnya atau pendatang baru.  ""Yang pasti, kami ingin mendatangkan penyerang yang bagus, lebih bagus dari striker (asing) sebelum-sebelumnya,"" kata dia.  Dalam sesi latihan skuad Persela tersebut, sementara dipimpin oleh Danur lantaran pelatih kepala    dikatakan tengah kembali mengikuti lanjutan kursus kepelatihan lisensi pro.","Buru Pengganti Washington Brandao, Persela Kantongi 5 Sosok Incaran"
"dict","bola","Persebaya Vs Arema FC, Jumlah Gol yang Memudahkan Bajul Ijo Jadi Juara  Asisten pelatih   , Bejo Sugiantoro, tidak memiliki target gol untuk memudahkan langkah Bajul Ijo menjadi juara   . Pada partai puncak Piala Presiden 2019 Persebaya vs   , Bejo menyebut kedua tim sama-sama berambisi untuk menang dan juara. Lantaran pertandingan final Persebaya vs Arema ada dua leg, kata Bejo, agregat gol akan sangat berpengaruh.  Sebagai tuan rumah lebih dulu, ia menegaskan akan memaksimalkan kekuatan tim untuk bisa meraih kemenangan. Bejo menyebut para pemain semakin termotivasi menatap laga final. Terlebih lagi, pada laga semifinal, Persebaya bisa mengalahkan Madura United yang dihuni pemain bintang. ""Tanpa saya sampaikan, Persebaya juga ingin menang. Karena agregat, ya kita sebisa mungkin ada satu-dua (gol),"" kata Bejo saat sesi jumpa pers di Rumdin Wakil Wali Kota Surabaya, Senin (8/4/2019). Meski demikian, Bejo tak mau menjanjikan apa pun terkait jumlah gol yang harus didapat Persebaya agar lebih mudah saat bertanding di final leg kedua di kandang Arema FC. Ia memastikan, tim pelatih dan khususnya para pemain akan berupaya dan bekerja keras agar bisa mendapatkan hasil positif pada pertandingan besok. ""Motivasi pemain untuk pertandingan besok sangat berlipat. Saya enggak mau janji untuk skor yang aman. Pelatih cuma di pinggir lapangan, yang memenangkan pertandingan nanti adalah pemain,"" pungkasnya. Untuk diketahui, Kick-off laga final leg pertama Piala Piala Presiden 2019 antara Persebaya vs Arema FC akan berlangsung pada pukul 15.30 WIB. Adapun laga final leg kedua bakal diselenggarakan di markas Arema FC di Stadion Kanjuruhan, Malang, pada Sabtu (12/4/2019).","Persebaya Vs Arema FC, Jumlah Gol yang Memudahkan Bajul Ijo Jadi Juara"
"dict","bola","Coret 4 Pemain Lokal, Persela Kedatangan 2 Pemain Seleksi  -    terus melakukan bongkar-pasang amunisi untuk mengarungi kompetisi    2019. Terbaru, tim Laskar Joko Tingkir mencoret lima pemain yang sempat ikut seleksi.  Selain Washington Brandao, manajemen juga memutuskan tidak menggunakan jasa Yusuf Brian, Sendi Pratama, Dian Endra, serta Jefri Kurniawan untuk pemain lokal. Nama terakhir disebut, sempat dicoba mengisi sektor sayap sewaktu    melakoni Piala Presiden 2019.  ""Kayak Jefri pindah, ditransfer ke Badak Lampung FC. Sebagian ada lagi yang ke Persiba (Balikpapan) dan tim-tim Divisi Dua (Liga 2),"" ujar asisten pelatih Persela, Danur Dara, usai memimpin sesi latihan tim di Stadion Surajaya, Senin (8/4/2019).  Kepergian para pemain itu langsung diganti beberapa wajah baru, yang mulai tampak mengikuti seleksi untuk dapat meraih perhatian dan menjadi bagian dari skuad Persela.  ""Satu posisi bek kanan, namanya Fander dari Persewar (Waropen). Satu lagi namanya Marcel (Alexander Kararbo) asal Persipura yang posisinya sayap,"" ucap dia.  Terkait dua pemain seleksi tersebut, Danur belum berani memastikan tempat bagi mereka. Dua pemain itu diberikan waktu untuk memperlihatkan skill dalam beberapa hari ke depan.  ""Paling tidak akan kami lihat dulu selama satu minggu ke depan, kebetulan coach Aji (Santoso) juga sedang ikut kursus lisensi pro sampai tanggal 13. Sambil pantau, nanti akan kami laporkan (progress),"" kata dia.","Coret 4 Pemain Lokal, Persela Kedatangan 2 Pemain Seleksi"
"dict","nasional","Gubernur Aceh Irwandi Yusuf Divonis 7 Tahun Penjara ,  . Gubernur nonaktif Aceh Irwandi Yusuf divonis 7 tahun penjara oleh majelis hakim pada Pengadilan Tindak Pidana    Jakarta. Irwandi juga dihukum membayar denda Rp 300 juta subsider 3 bulan kurungan.  ""Mengadili, menyatakan terdakwa telah terbukti secara sah dan meyakinkan bersalah melakukan    bersama-sama dan berlanjut,"" ujar ketua majelis hakim Saifuddin Zuhri saat membacakan putusan di Pengadilan Tipikor Jakarta, Senin (8/4/2019).  Dalam pertimbangan, hakim menilai perbuatan Irwandi tidak mendukung pemerintah dalam pemberantasan korupsi. Irwandi juga tidak mengakui perbuatan.   Namun, hakim mempertimbangkan Irwandi yang memiliki peran penting dalam perdamaian di Aceh, sebagai hal yang meringankan.  Irwandi Yusuf terbukti menerima suap Rp 1,050 miliar dari Bupati Bener Meriah Ahmadi. Suap tersebut diberikan melalui staf dan orang kepercayaan Irwandi, yakni Hendri Yuzal dan Teuku Saiful Bahri.  Uang tersebut diberikan agar Irwandi mengarahkan Unit Layanan Pengadaan (ULP) Pemerintah Provinsi Aceh memberikan persetujuan terkait usulan Bupati Bener Meriah Ahmadi. Sebelumnya, Ahmadi mengusulkan kontraktor yang akan mengerjakan kegiatan pembangunan di Kabupaten Bener Meriah.  Adapun, proyek tersebut akan menggunakan anggaran yang bersumber dari Dana Otonomi Khusus Aceh (DOKA) Tahun 2018. Menurut jaksa, DOKA untuk Kabupaten Bener Meriah sebesar Rp 108 miliar.  Selain itu, Irwandi Irwandi juga terbukti menerima gratifikasi sebesar Rp 8,7 miliar.  Sejak November 2017 hingga Mei 2018, Irwandi menerima uang melalui rekening bank atas nama Muklis. Totalnya, Irwandi menerima Rp 4,2 miliar.  Kemudian, sejak Oktober 2017 hingga Januari 2018, Irwandi menerima uang melalui Steffy Burase. Totalnya, Irwandi menerima uang sebesar Rp 568 juta dari Teuku Fadhilatul Amri.  Menurut hakim, Teuku Amri mengirimkan uang ke rekening milik Steffy Burase setiap kali diperintah oleh Teuku Saiful Bahri. Adapun, Saiful merupakan salah satu tim sukses Irwandi pada Pilkada Gubernur Aceh 2017.   Selain itu, sejak April 2018 hingga Juni 2018, Irwandi menerima gratifikasi melalui Nizarli yang merupakan Kepala Unit Layanan Pengadaan Provinsi Aceh. Nizarli juga merangkap sebagai Kepala Biro Pengadaan Barang dan Jasa Pemprov Aceh.  Nizarli atas sepengetahuan Irwandi telah menerima Rp 3,7 miliar.  Adapun, uang tersebut berasal dari pihak mantan tim sukses Irwandi yang akan mengikuti paket pekerjaan pengadaan barang dan jasa di Pemerintah Provinsi Aceh.  Menurut jaksa, setelah menerima uang tersebut, Irwandi tidak melaporkan penerimaan kepada KPK. Sesuai batas waktu yang ditetapkan undang-undang, gratifikasi yang diterima penyelenggara negara harus dilaporkan sebelum 30 hari sejak diterima.  Irwandi melanggar Pasal 12 huruf a Undang-Undang Nomor 31 Tahun 1999 sebagaimana diubah UU Nomor 20 Tahun 2001 tentang Pemberantasan Tindak Pidana Korupsi jo Pasal 55 ayat 1 ke-1 jo Pasal 64 ayat 1 KUHP.  Kemudian, melanggar Pasal 12 B Undang-Undang Nomor 31 Tahun 1999 sebagaimana diubah UU Nomor 20 Tahun 2001 tentang Pemberantasan Tindak Pidana Korupsi jo Pasal 65 ayat 1 KUHP.","Gubernur Aceh Irwandi Yusuf Divonis 7 Tahun Penjara"
