"_type","category","isi","judul"
"dict","regional","Mahfud MD: Masukan SBY Perlu Diperhatikan...  — Masukan dari Ketua Umum DPP Partai Demokrat Susilo Bambang Yudhoyono (SBY) terkait konsep kampanye terbuka capres-cawapres nomor urut 02 Prabowo Subianto dan Sandiaga Uno di Gelora Bung Karno, Minggu (7/4/2019), perlu diperhatikan. Demikian kata pakar hukum tata negara Prof    di   , Minggu. ""Saya sudah membaca (  ) dan perlu memperhatikan nasihat dari orang memiliki banyak pengalaman mengelola Indonesia serta kecintaannya terhadap negara ini tak diragukan lagi,"" ujarnya. Mantan Ketua Mahkamah Konstitusi itu mengajak untuk memperhatikan bersama-sama masukan itu tanpa harus menyatakan bahwa yang dilakukan satu kelompok tersebut salah. Menurut dia, masukan dari SBY kemungkinan sebagai saran saja agar tidak hanya fokus pada upaya menggalang satu ikatan primordial, misalnya shalat Subuh dan Tahajud bersama. ""Mungkin itu dianggap terlalu eksklusif. Lalu bagaimana yang tidak Subuh dan Tahajud, mungkin, tetapi ya kita dengarkan nasihat sebagai orang tua dan mantan presiden. Itu boleh,"" ucapnya. Sementara itu, melalui surat yang telah beredar tersebut, SBY menugaskan Ketua Dewan Kehormatan PD Amir Syamsudin, Waketum PD Syarief Hasan, dan Sekjen PD Hinca Panjaitan untuk menyampaikannya kepada Prabowo. Dia berharap, penyelenggaraan kampanye nasional pasangan capres dan cawapres yang juga didukung Partai Demokrat senantiasa mencerminkan   dengan sasanti ""Indonesia untuk Semua"", juga mencerminkan kebinekaan atau kemajemukan. Selain itu, kampanye juga disarankan mencerminkan persatuan, unity in diversity, upaya mencegah demonstrasi apalagi   identitas, baik yang berbasiskan agama, etnis serta kedaerahan, maupun yang bernuansa ideologi, paham dan polarisasi politik yang ekstrem. Sementara itu, Kadiv Advokasi dan Bantuan Hukum Partai Demokrat Ferdinand Hutahaean mengatakan surat SBY itu benar adanya. Namun, sejatinya hanya untuk kalangan internal dan tidak seharusnya beredar keluar Partai Demokrat.   Pesan itu terungkap dalam surat yang disampaikan SBY kepada tiga petinggi Demokrat, yaitu Ketua Dewan Kehormatan Partai Demokrat Amir Syamsudin, Waketum Partai Demokrat Syarief Hasan, dan Sekjen Partai Demokrat Hinca Panjaitan. Surat itu ditulis SBY dari Singapura tertanggal 6 April 2019. "" ,"" kata SBY dalam suratnya.","Mahfud MD: Masukan SBY Perlu Diperhatikan..."
"dict","edukasi","Menyiapkan Pendidikan Berdaya Saing dan Berintegritas President School menggelar seminar motivasi sebagai upaya menyiapkan SDM generasi milenial yang siap menghadapi tantangan era    dengan menghadirkan pembicara utama S.D Darmono selaku pendiri PT Jababeka dan Yayasan    Universitas Presiden. Kegiatan berlangsung di    Presiden, Kawarang, Jawa Barat (2/4/2019) dan diikuti lebih 200 siswa kelas 9 dan kelas 12, guru, kepala sekolah dan koordinator sekolah. Dalam paparan S.D Darmono menekankan pentingnya SDM generasi milenial yang terdidik dan terampil dengan karakter kuat, habit dan perilaku baik sebagai keunggulan manusia dibandingkan mesin dan robot. Dalam menghadapi perubahan zaman hal yang harus terus dilatih dan diasah selain karakter dan cara pandang positif dan optimis adalah kejelian melihat peluang kemajuan, penguasaan bahasa asing sebagai sarana komunikasi, membangun jaringan dan penguasaan teknologi untuk kinerja lebih baik dan produktif. ""Di era digital dan robotik, semua dilakukan mesin dan robot, karena itu belajarlah hal-hal yang tidak bisa dikerjakan robot dan mesin, yaitu   atau kemampuan manusia sebagai komunikator, fasilitator yang memiliki rasa dan optimisme,"" jelas S.D Darmono. Terkait    dalam bisnis global S.D Darmono menegaskan pentingnya identitas diri dan kebangsaan sebagai kompetensi diferensiasi. Ia juga memandang perlu daya kompetisi    Indonesia di bidang bioteknologi, seni dan desain dalam pengemasan, promosi, branding, marketing dan penguasaan ICT. ""Dengan daya-daya itulah   akan dapat terkomunikasikan dengan baik, terkolaborasikan dengan baik dan terkoneksi dengan baik. Dalam bisnis kita membutuhkan komunikasi, kolaborasi dan jejaring, secara sinergis antara akademisi, dunia usaha dan pemerintah,"" tambahnya. Terhadap para guru, kepala sekolah dan koordinator sekolah, S.D Darmono berpesan pentingnya kurikulum pendidikan yang mengantar siswa bukan hanya memperoleh kompetensi dan gelar akademik. Menurutnya pendidikan harus mampu melahirkan pribadi optimis, mau dan mampu bekerja keras, serta peka untuk berbagi atau menolong orang lain dalam setiap kesempatan. ""Praktek riil pendidikan itu ada di lapangan, kerja. Jiwa pengusaha, begitupun guru, adalah melihat masalah sebagai kesempatan untuk menolong orang,"" ujarnya. Ia melanjutkan, ""Menjadi pengusaha itu membutuhkan kejelian melihat masalah dan membaca peluang. Kesempatan dan praktik, bukan kesarjanaan atau gelar."" S.D Darmono juga menyoroti masalah pendidikan lain di mana lembaga pendidikan hanya menghasilkan lulusan dengan nilai tinggi namun tidak diiringi pendidikan karakter dan kesiapan memasuki dunia kerja. Hal ini melahirkan banyak lulusan dengan gelar namun sulit dalam memperoleh pekerjaan. Direktur President School Justin Endramukti mengharapkan acara ini dapat menginspirasi dan memotivasi  siswa untuk menjadi ""presiden-presiden"" yang sukses dan tangguh bagi Indonesia pada zamannya. Kepada para pendidik ia juga meneguhkan dedikasi dan integritas para kepala sekolah dan guru untuk menyiapkan generasi Indonesia masuk ke zamannya dengan tetap memperbaharui kompetensi untu memberikan layanan pendidikan terbaik.","Menyiapkan Pendidikan Berdaya Saing dan Berintegritas"
"dict","regional","Viral, Foto Sampah Plastik Bungkus Indomie Berusia 19 Tahun di Sendang Biru, Malang  — Foto       bertuliskan ""Dirgahayu 55 Tahun Indonesiaku"" yang ditemukan di    di selatan Kabupaten   , Jawa Timur, viral di media sosial. Foto sampah plastik itu ramai diperbincangkan karena diduga berusia sekitar 19 tahun. Foto tersebut diunggah oleh Fianisa Tiara Pradani, pemilik akun Twitter @selfeeani. Beberapa jam kemudian,   itu menuai banyak perhatian warganet. Bahkan, Menteri Perikanan dan Kelautan Susi Pudjiastuti juga merespons dengan me-  melalui akun Twitter @susipudjiastuti. Dalam   itu, mahasiswa semester VIII Program Studi Ilmu Kelautan Universitas Brawijaya (UB) itu menuliskan bahwa sampah plastik bungkus Indomie itu sudah berusia sekitar 19 tahun. Hal itu ditunjukkan dengan tulisan 55 Tahun Dirgahayu Indonesiaku yang tertera di bungkus plastiknya. Sementara itu, pada 2019 ini Indonesia akan merayakan HUT ke-74. Agustus nanti indonesia akan berumur 74 tahun. Namun, pagi ini saya menemukan bungkus indomie yang bertuliskan dirgahayu indonesia ke-55. Saya merenung sejenak karena perbedaannya 19 tahun jadi bungkus ini terombang ambing di laut sampai hanyut ke bibir pantai selama 19 tahun????  Fia mengatakan, sampah itu ditemukan saat mengambil sampel air dan sedimentasi di Sendang Biru bersama teman-temannya.  ""Menemukannya itu sudah selesai ambil sampel air,   surut. Ada sampah banyak, ya sudahlah, sekalian bersihin sampah,"" kata mahasiswa angkatan 2015 itu melalui sambungan telepon kepada  , Minggu (7/4/2019) malam. ""Masak saya penelitian tidak bersihin sampah juga. Pikir saya seperti itu. Ambil-ambillah sampah plastiknya,"" lanjutnya kemudian. Menurut Fia, sampel itu untuk penelitian skripsi yang menganalisis makro dan mikro plastik. ""Tadi pengambilan sampel yang ketiga. Maret saya sudah ke sana, Februari bahkan sudah survei,"" katanya. Meski begitu, Fia menilai bahwa kondisi sampah di Pantai Sendang Biru tidak sebanyak di pantai-pantai lain. Sementara itu, Kepala Dinas Pariwisata dan Kebudayaan Kabupaten Malang Made Arya Wedhantara belum bisa dimintai tanggapan terkait sampah plastik bungkus Indomie itu. ""Itu sebenarnya Dinas Lingkungan Hidup. Nanti saya telepon lagi. Saya masih ada acara,"" katanya. Plt Bupati Malang M Sanusi juga belum merespons ketika dihubungi untuk diminta tanggapan soal sampah di pantai.","Viral, Foto Sampah Plastik Bungkus Indomie Berusia 19 Tahun di Sendang Biru, Malang"
"dict","edukasi","Kisah Inspiratif 5 Siswi Sanur Bersihkan MRT, Teladan Tanpa ""Nyinyiran"" Beberapa waktu lalu media sosial sempat dihebohkan polemik soal budaya pengguna    (Moda Raya Terpadu) yang belum teredukasi dalam memanfaatkan fasilitas transportasi baru ini. Buang    sembarangan, menggelar makan minum sampai menginjak-injak kursi menjadi bahan ""nyinyir"" dan sindiran yang sempat ramai mewarnai perdebatan di media sosial.  Berbagai argumen dan pembelaan muncul, mulai dari anggapan kurang tersedia fasilitas kebersihan hingga belum siapnya masyarakat dalam memasuki budaya modern dalam menggunakan MRT. Di tengah perdebatan tersebut, 5    kelas 9 SMP Santa Ursula (  ) Jakarta Patricia, Angie, Andrea, Wynnona, dan Brigidta tergerak melakukan aksi nyata membersihkan sampah-sampah yang masih berserakan di dalam moda transportasi tersebut pada 30 Maret 2019. ""Itu bukan dari sekolah, itu murni atas inisiatif spontan mereka. Hari itu mereka jalani Penilaian Akhir Semester (UAS) kelas 9, di hari terakhir, terus mereka berlima ingin naik MRT. Nah, mungkin melihat sampah yang berserakan, mereka tergerak hatinya,"" ujar Bambang Purwita, Kepala SMP Sanur Jakarta. Hal ini dibenarkan Angie, salah satu siswa Sanur yang melakukan kegiatan ini.  ""Jadi awalnya   memang kita naik mau MRT cuma untuk   dan sekalian   karena kita baru saja selesai ulangan umum. Sebenarnya kita sudah lihat   keadaan MRT yang kotor dari foto-foto yang beredar di  , tapi banyak juga orang-orang yang bilang kalau MRT sudah bersih,"" cerita Angie. Akhirnya mereka memutuskan naik MRT dan merasa prihatin melihat kondisi yang ada.  Ia menyayangkan masih adanya sikap kurang menghargai keberadaan fasilitas pemerintah yang sangat bagus ini. ""Pas sampai di situ, kita sedikit kaget melihat kondisi stasiun MRT yang tidak sesuai sama ekspektasi kita, kotor banget. Parahnya, semua orang seperti tidak peduli   sama sampah-sampah yang berserakan,"" lanjutnya. Kelima siswi SMP Sanur ini akhirnya memutuskan untuk membersihkan sampah yang masih ditemukan sepanjang stasiun dari Lebak Bulus hingga Thamrin. Tindakan ini tidak berhenti sampai di situ, mereka juga mengumpulkan sampah-sampah yang masih berserakan sepanjang trotoar Jalan Thamrin. ""Kita memungut sampah di beberapa tempat. Kalau di Lebak Bulus kebanyakan tisu dan bungkus makanan. Kalau di sepanjang trotoar Thamrin itu bungkus makanan dan minuman. Yang di Thamrin parah, sampahnya banyak   Kalau di Sarinah itu kebanyakan botol bekas dan tisu,"" kata Angie. ""Ada juga minuman dan es krim yang masih ada isinya dibuang ke tanaman. Sedih sih lihatnya,"" lanjutnya. Tidak merasa jijik membersihkan sampah dan sisa orang lain? ""Sebenarnya agak geli  , tapi setelah itu kita langsung beli tisu basah dan  ,"" ujarnya. Rasa cinta dan kepedulian terhadap    mendorong kelima siswi ini menyingkirkan rasa jijik dan geli tersebut. ""Pasti ada sih rasa geli. Tapi demi kebersihan stasiunnya kami lawan rasa gelinya,"" tegas Winona, salah satu siswi yang tergerak melakukan kegiatan ini. Tindakan nyata yang dilakukan kelima siswi SMP Sanur ini mendapat tanggapan positf dari netijen. Kisah ini kemudian menjadi viral di media sosial dan grup WA. ""Seorang wanita petugas MRT dibuat terkesima dan takjub saat melihat dari pantauan CCTV-nya, ada 5 anak sekolah yang cantik2 sedang sibuk   sampah di area stasiun MRT,"" begitu cerita yang beredar di grup WA. Petugas tersebut segera turun menghampiri dan menyambut ke-5 orang anak sekolah tersebut. Tidak cukup sampai di situ kekagumannya, sang petugas tersebut mengajak mereka foto bersama juga. Foto inilah yang kemudian banyak beredar di media sosial. ""Kalau enggak salah namanya Kak Amanda. Rupanya dia mengamati lewat CCTV dan menghampiri kami dan mengajak foto selfie,"" cerita Winona. Ia berharap apa yang dilakukan bersama teman-temannya ini dapat menjadi inspirasi bagi generasi milenial lainnya. ""Awalnya sih kita merasa, kita pantas enggak sih dipuji seperti ini soalnya kita baru sekali pungut doang,"" ujar Winona. ""Tetapi semoga kita bisa menjadi inspirasi bagi teman remaja lain juga dan orang-orang yang masih buang sampah sembarangan,"" harapnya. ""Kami merasa bangga dan berhasil menanamkan nilai-nilai hidup kepada anak-anak untuk peduli kepada lingkungannya. Mereka menjadi siswa yang peka terhadap situasi lingkungannya,"" ujar Bambang saat diminta tanggapan tentang kegiatan yang dilakukan kelima siswanya ini. Bambang menjelaskan, SMP Sanur menerapkan pembiasaan piket pungut sampah saat istirahat pertama dan kedua. Ini dilakukan siswa sesuai tugas terjadwal dengan pendampingan guru piket. Para siswa juga dibiasakan membawa tempat makan dan minum sendiri sehingga kantin sekolah tidak menyediakan plastik kemasan. ""Ada progam '  yang dilakukan para siswa untuk menumbuhkan rasa peduli terhadap lingkungan sekitar. Berbagai kegiatan bisa dilakukan siswa mulai dari mengajar dan bermain bersama adik-adik di TK- SD, ke panti asuhan dan jompo, atau mengunjugi guru-guru yang sudah pensiun,"" jelas Bambang. Ia menambahkan, ""  sendiri artinya melayani. Hal ini menjadi salah satu keutamaan di Sekolah Santa Ursula."" Ia berharap apa yang telah dilakukan para siswa SMP Santa Ursula ini dapat menjadi inspirasi bagi sekolah lain dan masyarakat untuk melakukan tindakannya nyata peduli terhadap lingkungan. ","Kisah Inspiratif 5 Siswi Sanur Bersihkan MRT, Teladan Tanpa ""Nyinyiran"""
"dict","edukasi","""Student Day"" GIIAS, Metode Pembelajaran Langsung di Pameran Otomotif  GIIAS Surabaya 2019 tidak hanya bisa dinikmati oleh pengunjung dan penggiat otomotif saja namun juga memberi kesempatan pada para pelajar. Salah satu program GIIAS Surabaya yang diadakan pada 2-4 April 2019 adalah ""Student Day"" di mana seluruh pelajar   ,    dan universitas diundang mengunjungi pameran GIIAS untuk mengenal berbagai perkembangan industri otomotif. Program edukasi ini ditujukan kepada beberapa sekolah SMA dan SMK Teknik di Surabaya dan diharapkan dapat meningkatkan pengetahuan tentang dunia otomotif. Lebih dari 200 siswa dari 5 SMK dan 2 perguruan tinggi hadir mengunjungi GIIAS Surabaya melihat berbagai produk terbaru dari   yang ada di pameran ini. Beberapa kesan positif disampaikan beberapa siswa yang berkesempatan berkunjung ke acara ini. “Acara GIIAS Surabaya nya keren banget, dari semalam sudah melihat macam macam mobil modifikasi, dan senang sekali bisa hadir ke acara ini, karena sealiran juga dengan jurusan saya yaitu otomotif,” ujar Anugerah Dimas pelajar SMK Khusus Angkatan Laut 1 jurusan otomotif seperti dikutip dari rilis resmi GIIAS.    Hal senada disampaikan Dian dari Universitas Surabaya, “Senang sekali bisa masuk ke acara ini dan difasilitasi oleh penyelenggara, saya sebagai penggemar otomotif bisa melihat mobil – mobil terbaru dari beberapa merek ternama di GIIAS Surabaya 2019.” Pihak GIIAS Surabaya 2019 sendiri berharap acara pameran ini tidak hanya membahas mengenai transaksi, tapi juga bisa memberikan berbagai edukasi kepada masyarakat mengenai dunia otomotif dan teknologi terbaru. Dampak positif program ini disampaikan Ali Kepala Jurusan di SMK KAL 1 Surabaya “Kesan yang saya rasakan sangat bagus. Hal semacam ini juga bisa sebagai metode pembelajaran yang baik. Karena di GIIAS adalah    dimana terdapat teknologi terbaru dan berbagai alat- alat yang bisa mengembangkan pendidikan bagi murid.”   Menurut Sri Vista Limbong Project Director GIIAS The Series, diadakannya ""Student Day"" diharapkan bisa mengumpulkan pelajar-pelajar Surabaya untuk melihat secara langsung perkembangan teknologi otomotif. “Program ini kami adakan untuk membagikan informasi terkini dari Industri Otomotif Indonesia. Di GIIAS Surabaya 2019 mereka bisa melihat kendaraan keluaran terbaru dan bertanya langsung dengan para APM apa kelebihan dari masing-masing kendaraan tersebut,” ujarnya.","""Student Day"" GIIAS, Metode Pembelajaran Langsung di Pameran Otomotif "
"dict","edukasi","Pradita Institute Gandeng Desainer Korea dalam ""Family Evolution""  - Pradita Institute yang berada di bawah naungan PT Summarecon Agung Tbk terus berupaya mempersiapkan mahasiswanya agar mampu bersaing secara global. Mencapai hal ini, salah satu upaya yang ditempuh adalah dengan berbagi wawasan global bersama para pengajar dan praktisi internasional dalam proses pembelajaran. Salah satu program studi (prodi) yang secara konsisten melakukan hal ini adalah prodi Desain Komunikasi Visual (DKV) dan Desain Interior (DI). Pradita Institute terus diberikan kesempatan belajar untuk mengadakan kerjasama internasional dalam bentuk knowledge sharing. Hal ini bertujuan agar mahasiwa DKV dan DI dapat melihat inovasi karya dari sudut pandang desainer mancanegara.   Melalui acara ""Worldwide Graphic Designers"" (WGD), DKV dan DI Pradita Institute memperkenalkan Byoung Il Sun, seorang    dunia dan profesor Desain Komunikasi Visual di salah satu Universitas    sejak tahun 1995. Karya Byoung Il Sun telah dipamerkan pada berbagai    bergengsi dan mendapatkan penghargaan di beberapa negara. “Pradita Institute membantu mahasiswa untuk dapat terus mengembangkan diri melalui pengalaman langsung dengan para desainer terbaik di bidangnya. Hal ini dilakukan untuk memperkenalkan mahasiswa/i prodi DKV dan DI Pradita Institute terhadap mekanisme berpikir dan bekerja seorang profesional desainer,"" jelas James Darmawan Ketua Prodi DKV dan DI Pradita Institute. Ia berharap melalui kegiatan ini dapat menanamkan semangat dan kepercayaan diri para mahasiswa prodi DKV dan DI Pradita untuk dapat bersaing di kancah internasional. Bersama Byoung Il Sun, mahasiswa prodi DKV dan DI Pradita Institute mengadakan kuliah desain kelas internasional secara daring. Pada kesempatan tersebut, mahasiswa berinteraksi langsung dengan Byoung Il Sun yang dikemas dalam workshop komunikasi sosial mengusung 5 tema: peperangan, penyakit dan kemiskinan, bencana alam, lingkungan, dan hak asasi.   Melalui   dengan Byoung Il Sun, workshop ini menghasilkan 18    dari prodi DKV dan 12 poster dari prodi DI yang kemudian dipamerkan bersama 40 karya Byoung Il Sun serta 50 karya WGD. Pameran bertema ""Family Evolution"" dipamerkan pada Downtown Walk Festival 2019 di Summarecon Mall Serpong (SMS) mulai tanggal 1 - 14 April 2019. “Kami merasa bangga dapat memfasilitasi karya mahasiswa/i Pradita dalam Byoung Il Sun    Exhibition kali ini. Kegiatan ini masih dalam rangkaian event Downtown Walk Festival 2019,"" ujar Willy Effendy Center Director SMS. Ia berharap kegiatan ini dapat  menjadi media anak muda dan remaja yang memiliki kreatifitas untuk menyalurkan ide dan hobi mereka. Selain Byoung Il Sun Poster Exhibition, dalam event tahunan ini penggemar K-Pop juga dapat hadir dalam ""Hansan Festival"" yang menggelar beragam budaya Korea hingga 28 April 2019.","Pradita Institute Gandeng Desainer Korea dalam ""Family Evolution"""
"dict","properti","Hanya Stasiun MRT Lebak Bulus dan Fatmawati yang Cocok Dibangun TOD  – Ketua Bidang Transportasi Ikatan Ahli Perencanaan (IAP) DKI Jakarta Reza Firdaus mengungkapkan, hanya ada dua stasiun dari total 13 stasiun MRT yang masih bisa dikembangkan dengan konsep transit oriented development (TOD). Dua stasiun tersebut adalah Stasiun Lebak Bulus dan Fatmawati. Keduanya di wilayah Jakarta Selatan.  “Kalau paling   untuk   yang eksisting sekarang mungkin di Lebak Bulus dan Fatmawati, tapi perlu dilihat status tanah di sekitar situ,” kata Reza menjawab  , Jumat (5/4/2019). Sementara 11 stasiun lainnya sudah dipadati kawasan permukiman padat penduduk, perkantoran, dan juga komersial. Ke-11 stasiun tersebut adalah Cipete Raya, Haji Nawi, Blok A, Blok M, Sisingamangaraja, Senayan, Istora, Bendungan Hilir, Setiabudi, Dukuh Atas, dan Bundaran HI. “Kalau untuk   MRT yang sudah beroperasi sekarang, di mana sudah terbangun semua, tampaknya susah jika tidak ada upaya densifikasi,” ucap Reza. Menurut dia, apabila dilihat dari area jangkauan TOD hingga radius 800 meter dari stasiun MRT, maka beberapa lokasi stasiun yang sudah eksis sekarang bisa dibilang mubazir. Artinya, sudah tidak bisa dibuat bangunan baru lagi karena telah dipenuhi dengan   dan   Contohnya di Stasiun Cipete, Haji Nawi, dan Blok A. Selain itu, lanjut Reza, harga tanahnya juga sangat tinggi sehingga tidak memungkinkan untuk dikembangkan lagi. Adapun di daerah sekitar Stasiun Blok M sampai Bundaran HI juga padat dengan bangunan komersial, perkantoran, pemerintahan, dan jasa. “Tidak ada yang  . Hampir tidak mungkin ada hunian baru,” imbuhnya. Untuk diketahui, MRT fase pertama di Jakarta memiliki rute dari Lebak Bulus sampai Bundaran Hotel Indonesia (HI) sepanjang 16 kilometer. Moda transportasi baru di Ibu Kota ini telah menjalani uji coba operasional pada 12 sampai 24 Maret 2019 tanpa dikenakan tarif. Kemudian, Presiden Joko Widodo meresmikan operasionalnya pada Minggu (24/3/2019). Mengenai tarifnya, menurut catatan  , Pemerintah Provinsi DKI Jakarta dan DPRD DKI Jakarta telah menyepakati perhitungan tarif yang berlaku mulai 1 April 2019 sesuai jarak tempuh pengguna MRT. Tarif paling murah yaitu Rp 3.000, sedangkan tarif paling mahal untuk jarak terjauh sebesar Rp 14.000. Ada dua jenis tiket yang disediakan bagi penumpang, yaitu   untuk perjalanan dengan batas waktu maksimal tujuh hari dan   untuk jangka panjang.","Hanya Stasiun MRT Lebak Bulus dan Fatmawati yang Cocok Dibangun TOD"
"dict","edukasi","""Edutech"" Quipper Raih Penghargaan ""PR Indonesia Award 2019"" Quipper, sebagai salah satu perusahaan pendidikan berbasis teknologi (edutek) berhasil meraih prestasi di ajang Public Relations Indonesia Awards (PRIA) 2019 dengan merebut 2 penghargaan untuk kategori ""Owned Media - Website"" dan ""Program Marketing   "" pada Kamis (27/3/2019). Untuk ""Owned Media - Website"" Quipper Indonesia berhasil meraih   dan kategori program marketing PR “Paket Intensif    2018”, Quipper meraih  . Kedua penghargaan tersebut diterima langsung   Quipper Indonesia Tri Nuraini, pada malam puncak PR Indonesia Awards 2018, di Bandung, Jawa Barat. Tri Nuraini menyampaikan, “Penghargaan yang berhasil kami raih menjadi wujud apresiasi dari pihak eksternal terhadap program yang kami miliki sekaligus menjadi pemacu untuk tetap berinovasi dalam program-program kami lainnya."" Program “Paket Intensif SBMPTN 2018” yang berhasil meraih penghargaan kategori Marketing PR ini hadir karena dilatarbelakangi perubahan sistem SBMPTN pada tahun tersebut. Dengan strategi yang matang serta keseriusan dalam menjalankan aktivitas PR dan marketing selama periode program berlangsung, “Paket Intensif SBMPTN 2018” menghasilkan   positif bagi pengguna Quipper kelas 12 dan menjadi program marketing PR paling berhasil sepanjang tahun 2018. Menurut survei Quipper, sebanyak 52% penggunanya dinyatakan berhasil lulus PTN. Adapun hal tersebut dapat terjadi karena usaha dari berbagai divisi yang ada, bukan kerja tim PR dan Marketing semata. Secara aktivitas, tim PR dan Marketing melibatkan Maudy Ayunda untuk turut serta mengajar, menginspirasi anak muda dengan posting di sosial medianya, melakukan aktivitas marketing seperti iklan TV, iklan di Youtube dan sosial media. Dari sisi PR Quipper menerima 23 berita yang spesifik membahas isu SBMPTN, pendidikan dan teknologi. Yang mana pada saat itu belum ada pemain industri edukasi teknologi yang menyosialisasikan hal tersebut kepada media. Selain Quipper, perusahaan swasta, BUMN, serta instansi pemerintah baik pusat maupun daerah juga berkesempatan meraih penghargaan PR Indonesia Awards 2019. Diantaranya Telkomsel, Citibank dan beberapa agensi PR dari pihak swasta. Pertamina yang mewakili BUMN dan instansi pemerintah seperti DPR RI hingga Humas Kota Bandung sebagai tuan rumah juga berkesempatan membawa pulang penghargaan. PR Indonesia Awards merupakan ajang yang diselenggarakan oleh PR Indonesia dalam mengapresiasi kinerja humas yang unggul dari korporasi, kementerian, lembaga, dan pemerintah daerah di seluruh Indonesia. Rangkaian PR Indonesia Awards 2019 ini melibatkan 15 juri profesional dengan latar belakang kehumasan. Pada tahun ini, PR Indonesia Awards memberi apresiasi untuk 19 kategori penghargaan yang penilaiannya dilakukan dengan cara non presentasi dan presentasi.","""Edutech"" Quipper Raih Penghargaan ""PR Indonesia Award 2019"""
"dict","properti","Pemerintah Ende Bangun Akses Mulus Menuju Tempat Wisata Unggulan  Pemerintah Kabupaten   , Nusa Tenggara Timur (NTT), akan melanjutkan pembangunan akses jalan menuju objek-objek wisata alam dan budaya yang menjadi penyangga destinasi wisata unggulan Taman Nasional (TN) Kelimutu. Bupati Ende Marsel Petu menyampaikan hal tersebut saat menggelar jumpa pers bersama sejumlah wartawan di Kupang, Minggu (7/4/2019). Menurut Marsel, akses jalan yang dibangun yakni jalan lintas utara dan selatan Kabupaten Ende. ""Terpilihnya saya dengan Pak Djafar (Wakil Bupati Ende) untuk kali kedua, merupakan amanah dan kesempatan berharga untuk melanjutkan berbagai program pembangunan sebelumnya termasuk sektor pariwisata dan infrastruktur,"" tutur Marsel. Marsel menyebut, pada lima tahun sebelumnya, telah dibangun lima ruas jalan paralel di wilayah utara dan selatan Kabupaten Ende dengan total jarak lebih dari 200 kilometer. Ruas-ruas jalan tersebut, menghubungkan objek-objek wisata penyangga seperti wisata alam, laut dan pantai, kampung adat, dan wisata budaya lainnya. ""Dulunya ruas-ruas jalan kabupaten ini masih jalan tanah dan sekarang sudah  ,"" kata Marsel. Saat ini, hanya tersisa beberapa titik pada lima ruas jalan tersebut yang belum dibangun dan akan dituntaskan dalam satu atau dua tahun ke depan. Sementara itu, untuk ruas jalan utama menuju Taman Nasional Kelimutu sepenuhnya dibangun Kementerian Pekerjaan Umum dan Perumahan Rakyat (PUPR) melalui APBN.","Pemerintah Ende Bangun Akses Mulus Menuju Tempat Wisata Unggulan"
