"_type","category","isi","judul"
"dict","travel","Melihat Buaya di Taman Mini Indonesia Indah  – Sebagai seekor   ,    merupakan hewan liar yang sangat berbahaya. Tanpa didampingi pawangnya, mendekati buaya sangat riskan dilakukan. Namun lain ceritanya di Taman Reptilia, kawasan    Komodo, Taman Mini Indonesia Indah (  ), Jakarta Timur. Anda tak perlu takut untuk berinteraksi dengan hewan buas berkaki empat ini, meskipun hanya dari jarak jauh. Taman Reptilia memiliki tiga spesies buaya, yakni buaya muara, buaya sepit atau senyulong, dan buaya irian. Tiga spesies tersebut ditempatkan dalam kandang yang berbeda. Semua kandang diberi pembatas pagar yang cukup tinggi. Ketiganya berada di luar ruangan alias  , sehingga pengunjung bisa leluasa melihat buaya dari berbagai sisi. Dadang, pawang buaya di Taman Reptilia mengatakan, kegiatan pengunjung memberi makan buaya ini dinamakan ‘pancing buaya’ lantaran caranya memang seperti   . Umpan ayam yang akan diberikan ke buaya, lanjut Dadang, diikat terlebih dahulu dengan dedaunan. Hal ini bertujuan guna menghindari luka pada buaya jika langsung terkena tali. “Biasanya kita pakai daun pandan untuk mengikat umpannya. Ini juga bertujuan untuk keamanan pengunjung, jadi tali daun pandan itu bisa langsung putus saat digigit,” katanya kepada   di Taman Reptilia, Kamis (11/04/2019). Pengunjung tinggal menyodorkan bambu tersebut ke salah satu buaya yang sudah menunggu. Dengan sigap, buaya langsung menyergap makanannya dalam satu gigitan yang menggetarkan bambu pancingan. Pengunjung yang ingin memberi makan tetap akan didampingi oleh petugas. Pengunjung dianjurkan untuk tetap waspada dan berhati-hati. Untuk sekali memberi makan, pengunjung dikenakan tarif Rp 10.000 saja sepanjang jam operasional di hari Minggu. Biaya masuk kawasan Museum Komodo Rp 25.000 per orang.","Melihat Buaya di Taman Mini Indonesia Indah"
"dict","internasional","Presiden Ekuador Tuduh Julian Assange Pakai Kedutaan untuk Kegiatan Mata-mata  — Presiden    Lenin Moreno menyebut pendiri       menggunakan kedutaan besar di London, Inggris, untuk melakukan kegiatan spionase. Ucapan Moreno itu muncul setelah dia mencabut status suaka dan kewarganegaraan Assange yang membuat polisi London bisa memasuki kedubes dan menangkapnya pekan lalu. Kepada   dilansir   Minggu 914/4/2019), Moreno menjabarkan bahwa saat era Presiden Rafael Correa, Kedubes Ekuador diperlengkapi dengan peralatan canggih. Tujuannya adalah mencegah ""gangguan"" dari negara lain. Namun, Moreno menjelaskan bahwa Assange melakukan pelanggaran dengan melakukan kegiatan   . ""Kami tidak bisa membiarkan rumah kami, rumah yang pintunya terbuka lebar, menjadi sarang mata-mata,"" kata Moreno yang terpilih pada 2017 seperti dilaporkan  . Pernyataan itu senada dengan laporan harian Spanyol   bahwa Assange mulai bertingkah mencurigakan ketika pertama kali masuk ke kedubes pada 2012. Saat itu, Assange meminta izin untuk melihat siapa orang yang selalu melempar benda ke jendelanya menggunakan peralatan perekam, dengan staf diplomatik mengizinkan. Namun, setelah itu Assange mulai menggunakan peralatan rahasia lain di tempat yang diebut ""Batcave"" dan sempat dicegah seorang penjaga kedubes yang melihatnya. Kemudian pada November 2014 ada laporan yang ditulis kepada Duta Besar Ekuador untuk Inggris saat itu, Juan Falconi, mengenai sebuah koper yang ditemukan. Koper itu berisi peralatan penyadap di mana dia curiga Assange berusaha mencari tahu informasi penting yang didapat staf diplomatik dan menurunkan kepercayaan kedubes. ""Dia berupaya mendapatkan informasi khusus yang bisa dipakai mempertahankan statusnya di kedutaan. Dalam hal ini, dia melanggar kepercayaan duta besar,"" demikian isi laporan itu. Moreno membantah keputusan mencabut suaka Assange merupakan tekanan Amerika Serikat (AS). ""Kami bertindak atas nama hukum internasional,"" katanya. Assange menjadi orang paling dicari AS karena dianggap bertanggung jawab atas bocornya 250.000 kabel diplomatik terkait peran Washington di Irak dan Afghanistan.","Presiden Ekuador Tuduh Julian Assange Pakai Kedutaan untuk Kegiatan Mata-mata"
"dict","travel","Ini Promo Wisata di Ancol Taman Impian pada Hari Pencoblosan  Pada    2019 seluruh masyarakat Indonesia akan menggunakan hak pilihnya dalam pemilu. Untuk merayakan momen ini,    berikan berbagai harga spesial untuk para pengunjung.   Untuk memperoleh harga spesial tersebut syaratnya cukup mudah yaitu hanya dengan menunjukkan jari bertinta sebagai bukti telah mencoblos. Berikut diantaranya promo dari Ancol dalam merayakan momen Pemilu 2019. Khusus tanggal 17 April 2019 pengunjung bisa menunjukkan jari bertinta dan bisa mendapatkan harga tiket masuk sebesar Rp 170.000 per orang dari harga normal Rp 295.000. Satu jari bertinta ini bisa digunakan untuk pembelian lima tiket. Lalu juga promo dari wahana permainan air, di tanggal tersebut pengunjung bisa membeli tiket Atlantis seharga Rp 170.000, dan akan mendapatkan Annual Pass Atlantis, yang dapat digunakan berenang fratis selama setahun. Bila Anda ingin berkunjung ke wahana edukasi biota laut bisa juga mendapatkan harga spesial pada tanggal 17 April 2019.   Pengunjung bisa mendapatkan Annual Pass Samudra seharga Rp 160.000 yang bisa digunakan secara gratis selama setahun. Rasanya obyek wisata ini sudah tak asing lagi. Sea World Ancol menggelar aksi penyelam di dalam aquarium besar yang akan melakukan gerakan flag movement divers menggunakan bendera merah putih oleh 5 penyelam dilanjutkan pembentangan spanduk pemilu damai.   Melalui acara ini Sea World Ancol mengajak seluruh masyarakat untuk ikut serta menyukseskan Pemilu 2019 dan menggunakan hak pilihnya sesuai dengan hati nurani masing-masing.   Acara ini akan berlangsung sejak 13 hingga 17 April 2019 pada pukul 10.45 WIB setiap harinya, dan tambahan pada 17 April 2019 pada pukul 13.45 WIB. Bila pengunjung  di tanggal 17 April dan menunjukkan jari bertinta maka bisa menikmati harga spesial mulai dari Rp 699.300.   Selain itu ada juga promo ""Buy 1 Get 1 Free"" di Nyiur Resto Putri Duyung dengan menunjukkan tinta bukti keikutsertaan pemilu khusus di hari tersebut. Pengunjung bisa pula berkunjung ke Pulau Bidadari dengan paket   Rp 320.000 per orang atau paket menginap 2 hari 1 malam seharga Rp 750.000 per orang dan Anda bisa menikmati fasilitas penginapan baru di cottage tematik di pulau tersebut. Bila Anda hanya ingin menikmati pantai bisa pula melihat hiburan musik. Karena tepat di hari Pemilu akan digelar konser Flashback The 90's Music di Floating Stage Pantai Lagoon Ancol mulai pukul 17.00 WIB.   Akan hadir diantaranya Iwa K & Sweet Martabak, ME/NEO dan T-Five. ","Ini Promo Wisata di Ancol Taman Impian pada Hari Pencoblosan"
"dict","megapolitan","Gubernur Anies Sebut Penyebab Kotornya Udara Jakarta adalah...  —       menyebut pola mobilitas warga sebagai penyebab kotornya udara di Jakarta. Ia menilai, penggunaan kendaraan yang berlebihan sebagai penyumbang polusi utama.  ""Memang ini fakta, bukan opini. Fakta tentang polusi yang itu adalah efek dari pola kita melakukan mobilitas saat ini di mana transportasi pribadi mendominasi,"" kata Anies di Balai Kota DKI Jakarta, Senin (15/4/2019).  Menurut Anies, buruknya kualitas udara Jakarta merupakan salah bersama. Untuk itu, ia mengatakan perbaikan juga harus dilakukan sama-sama.  ""Nah pemerintah siapkan regulasi nanti kita sama-sama,"" ujar dia.  Regulasi yang disiapkan, kata Anies, berkaitan dengan emisi gas buang kendaraan. Selain itu, DKI menguji coba Transjakarta bertenaga listrik. Terkait pencemaran udara di Jakarta yang sudah di luar ambang batas, Lembaga Bantuan Hukum (LBH) Jakarta dan Yayasan Lembaga Bantuan Hukum Indonesia (YLBHI) membuka pos pengaduan untuk calon penggugat dalam gugatan warga negara.  Pengacara publik LBH Jakarta, Ayu Eza Tiara, mengatakan, pos pengaduan dibuka selama satu bulan, terhitung dari 14 April 2019 hingga 14 Mei 2019.  Untuk mendaftar sebagai calon penggugat, masyarakat dapat mengisi formulir secara   di https://www.bantuanhukum.or.id/web/formulir-pengaduan-calon-penggugat-pada-gugatan-warga-negara-pencemaran-udara- jakarta/.","Gubernur Anies Sebut Penyebab Kotornya Udara Jakarta adalah..."
"dict","nasional","Bantah Prabowo, Wapres Kalla Sebut Tak Ada Deindustrialisasi  - Wakil Presiden Jusuf Kalla membantah pernyataan capres nomor urut 02    Subianto yang menyatakan Indonesia tengah mengalami deindustrialisasi. Prabowo sempat menyatakan Indonesia tengah mengalami deindustrialisasi saat debat kelima Pilpres 2019 di Hotel Sultan, Jakarta, Sabtu (13/4/2019). ""Saya sudah jelaskan, bahwa tidak benar itu terjadi deindustrialisasi, karena perkembangan industri kita 5 persen per tahun. Berkembang, tidak ada yang berkurang. Cuma pernah akibat harga-harga komoditi naik maka pertambangan, pertanian naik,"" ujar Kalla saat ditemui Indonesa Convention Exhibition BSD, Tangerang Selatan, Senin (15/4/2019). Kalla mengklaim, industri menyumbang 21 persen untuk Produk Domestik Bruto (PDB) Indonesia pada 2014-2017. Karena itu, Kalla mengatakan, Industri merupakan penyumbang terbesar dalam struktur PDB Indonesia. ""Industri seperti disampaikan tadi oleh Saudara Menteri Perindustrian, tetap menjadi sektor tertinggi dalam GDP kita, PDB kita. Yang pada tahun 2014-2017 kurang lebih rata-ratanya 21,30 persen,"" tutur Kalla. ""Artinya adalah, industri tetap yang tertinggi, sektor tertinggi dalam pendapatan nasional. Karena itulah maka industri tetap berkembang dan tak akan terjadi deindustrialisasi,"" lanjut dia. Prabowo sebelumnya dalam debat kelima mengatakan saat ini bangsa Indonesia sedang mengalami deindustrialisasi. Hal ini dia sampaikan dalam pemaparan visi dan misi pada segmen pertama debat terakhir di Hotel Sultan, Jakarta, Sabtu (13/4/2019). ""Kalau negara lain industrialisasi, kita deindustrialisasi. Sekarang bangsa Indonesia tidak produksi apa-apa,"" ujar Prabowo.","Bantah Prabowo, Wapres Kalla Sebut Tak Ada Deindustrialisasi"
"dict","travel","Mengenal Tari Kafuk, Budaya Pencair Suasana dari Tambrauw       …       …       …    ","Mengenal Tari Kafuk, Budaya Pencair Suasana dari Tambrauw"
"dict","travel","Pizza yang Memecahkan Rekor Dunia Menggunakan 154 Topping Keju  Pada film   (2014), salah satu tokoh kura kura Ninja yakni Donatello menyebutkan    dengan topping 99 macam    sama dengan mustahil di dunia kuliner. Rupanya kalimat Donatello di film tersebut menjadi motivasi seorang koki untuk membuat pizza dengan banyak topping. Tidak hanya topping dengan 99 jenis keju, koki ini membuat pizza dengan 154 jenis keju! Ia adalah Jhonny Di Fransesco, seorang koki di restoran 400 Gradi, Melbourne, Australia. ""Walaupun jelas topping pizza dengan 154 jenis keju bukan mustahil di dunia kuliner, tetapi ini  sebuah tantangan! Kami tahu ini sungguh ide yang ambisius, tetapi ini bahkan melebihi apa yang diharapkan di awal,"" kata Fransesco. Beragam jenis keju dari yang umum di pasaran sampai yang kurang umum dipakai. Sebut saja keju jenis gorgonzola, pecorino, taleggio, aged cheddar, gouda, dan masih banyak lainnya. ""Kami harus memastikan setiap jenis keju cukup berbeda satu sama lain, tetapi soal rasa harus saling melengkapi satu sama lain. Benar-benar dapat dicampur dengan baik,"" kata Fransesco. Untuk membuat pizza pemecah rekor ini, setelah membuat adonan pizza, Fransesco mencampur 154 jenis keju dengan berat masing-masing satu gram. Kemudian pizza dengan topping keju ini dibakar. ""Ada banyak masukan, tetapi kebanyakan positif. Banyak yang takjub dan yang paling penting adalah melihat ekspresi konsumen saat pertama kali menggigit pizza penuh keju ini. Reaksinya sungguh tak terbayar,"" jelas Fransesco. Dengan pizza ini, Fransesco juga berhasil memecahkan    dan tercatat di Guiness World Records sebagai Pemegang Rekor    dengan Topping    Terbanyak di Dunia. ""Mohon maaf Donatello, kemustahilan dalam dunia kuliner ini kami pecahkan!"" kata Fransesco.","Pizza yang Memecahkan Rekor Dunia Menggunakan 154 Topping Keju"
"dict","travel","Festival Bale Nagi, Ajang Promosi Pariwisata Flores Timur   Sabtu (6/4/2019), saya bersama jurnalis dari Maumere, Kabupaten Sikka, Nusa Tenggara Timur berkesempatan melakukan tour ke Pantai Oa dan Pantai Rako di Kabupaten Flores Timur. Kami memutuskan menikmati akhir pekan di Pantai Oa dan Rako yang konon kedua pantai ini disebut-sebut cantik seperti gadis manis yang masih perawan. Dari kota Maumere kami berangkat pukul 07.00. Cuaca pagi itu memang cerah. Motor yang kami tumpangi pun bisa melaju dengan cepat. Tepat pukul 09.00 kami tiba di Hokeng, sebuah kampung yang letaknya di bawah kaki Gunung Lewotobi, Kecamatan Wulanggitang. Kami istirahat sejenak di salah satu rumah teman jurnalis yang berasal dari kampung Hokeng. Kami disuguhkan dengan kopi khas Hokeng yang terkenal dengan sebutan ""kopi leworok"". Sambil menikmati enaknya kopi leworok, kami mendengar cerita dari salah satu tokoh muda Kampung Hokeng bahwa di Pantai Oa sedang diselenggarakan   . Semangat kami untuk pelisir ke Pantai Oa dan Pantai Rako pun semakin membuncah. ""Kita jalan sudah. Sekalian kita liput Festival Bale Nagi itu,"" ujar salah seorang teman jurnalis. Kami pun melanjutkan perjalanan menuju Pantai Oa dan Rako. Letaknya tidak cukup jauh dari Kampung Hokeng. Kalau dengan kendaaran bermotor, dalam waktu 30 menit kita bisa sampai di 2 pantai ini. Siang itu di Pantai Oa suasana tampak ramai. Ribuan warga tengah mengikuti meriahnya Festival Bale Nagi. Beraneka tarian, musik, adat dipentaskan dalam festival ini. Ikut memeriahkan juga, masyarakat setempat berjualan kuliner khas desa, ada pula yang memamerkan kain tenun adat kepada pengunjung yang hadir. ""Bale Nagi artinya pulang kampung. Melalui beragam pentas yang digelar Festival Bale Nagi, kita ingin promosikan potensi wisata di Flores Timur. Ini adalah   perdana sebagai sarana promosi potensi wisata di Flores Timur,"" ujar Bupati Flotim, Anton Gege Hadjon dalam acara Festival Bale Nagi, Sabtu (6/4/2019). Selama ini para wisatawan yang datang mengikuti prosesi Semana Santa selalu mengeluh akan minimnya tempat wisata untuk dinikmati selama berada di Larantuka, Flores Timur. ""Dengan terselenggaranya Festival Bale Nagi dengan berbagai atraksi aneka budaya, diharapkan para wisatawan bisa memiliki nilai lebih saat berkunjung ke Flotim. Artinya, para pengunjung tidak hanya menyaksikan prosesi Semana Santa, tetapi ada paket wisata lain untuk dikunjungi,"" kata Bupati Anton. Ia menambahkan, tujuan lain dari…","Festival Bale Nagi, Ajang Promosi Pariwisata Flores Timur "
"dict","megapolitan","Dilarang Panglima, KPU Tak Dirikan TPS di Kompleks dan Asrama TNI  - Komisi Pemilihan Umum tidak akan mendirikan    di kompleks dan asrama TNI bagi keluarga anggota TNI yang hendak memberikan suara mereka. Ketua KPU Jakarta Timur Wage Wardhana menyatakan, TPS tak didirikan di dalam kompleks dan asrama TNI karena menyangkut netralitas mereka dalam Pemilu 2019. ""TPS ada tapi ditempatkan di luar kompelek, TNI Kan terkait netralitas , Panglima TNI melarang TPS dalam kompleks,"" kata Wage kepada wartawan, Senin (15/4/2019). Wage menuturkan, sebetulnya tak ada aturan yang melarang adanya TPS di dalam kompleks TNI dan Polri. Ia menjelaskan, tidak adanya    murni karena instruksi Panglima TNI. Oleh karena itu, Wage menyebut pihaknya tetap mendirikan TPS di kompleks dan asrama Polri yang berada di wilayah Jakarta Timur untuk keluarga anggota Polri. ""Sebetulnya tidak ada masalah secara aturan, jadi nanti asrama atau kompleks Polri masih ada TPS,"" ujar Wage. Adapun TPS yang disediakan bagi keluarga anggota TNI dan Polri di Jakarta Timur berjumlah 260 TPS yang terdiri atas 218 TPS untuk keluarga anggota TNI dan 42 TPS untuk keluarga anggota Polri.","Dilarang Panglima, KPU Tak Dirikan TPS di Kompleks dan Asrama TNI"
"dict","regional","Petugas Bersenjata Laras Panjang Kawal Distribusi Surat Suara di Aceh Utara    – Tim Polres    mengawal pendistribusian logistik pemilihan umum dengan menempatkan polisi bersenjata laras panjang. Bahkan, polisi juga ditempatkan selama 24 jam di gudang logistik di seluruh kantor camat.  Kepala Bagian Operasi Polres Aceh Utara, Kompol Iswahyudi menyebutkan, sejak dari Kantor Komisi Independen Pemilihan (KIP) Aceh Utara di Lhoksukon, Kecamatan Lhoksukon, Aceh Utara, hingga ke seluruh kecamatan, polisi mengawal mobil dengan menggunakan senjata api.  “Pengamanan terbuka, personel ditempatkan mengawal logistik ke kantor Panitia Pemilihan Kecamatan (PPK). Mereka semua bersenjata api laras panjang, untuk pengamanan tertutup juga ditempatkan polisi,” kata Kompol Iswahyudi, kepada  , Senin (15/4/2019).  Bahkan, tiba di kantor PPK masing-masing kecamatan, polisi juga ditempatkan selama 24 jam. “Tidak ada cerita tidur. Dikawal dari pintu depan kantor hingga pintu belakang. Tak ada celah masuk pihak yang tidak bertanggungjawab selama 24 jam sehari,” kata dia.  Dia menyebutkan,    yang merupakan dokumen negara itu harus aman dan bisa digunakan pada hari pemilihan umum 17 April 2019 mendatang.  Masyarakat, sambung Iswahyudi, dipastikan aman dan nyaman saat memberikan hak pilihnya. “Apapun kejadian, TNI dan polisi siap mengamankan. Kami siaga 24 jam, jadi tak perlu khawatir. Silakan beri hak pilih sesuai hati nurani masing-masing,” pungkas dia. ","Petugas Bersenjata Laras Panjang Kawal Distribusi Surat Suara di Aceh Utara"
"dict","nasional","Masa Tenang, Ini Imbauan Perludem untuk Pendukung Capres dan Caleg  - Pada masa tenang    2019, alat peraga kampanye sudah diturunkan. Peserta   , baik calon presiden-calon wakil presiden dan calon anggota legislatif juga tak dibolehkan membicarakan program kerja atau visi-misi. Namun, perdebatan mengenai Pemilu 2019 masih terjadi di media sosial, baik itu Facebook, Twitter, bahkan Instagram. Ada netizen yang menyampaikan dukungan terbuka, hingga unek-unek terhadap kandidat yang tak akan dipilihnya.  Menanggapi ini, Perkumpulan untuk Pemilu dan Demokrasi (  ) berharap masa tenang dijadikan momentum untuk mendalami informasi seputar pencoblosan. ""Harus diingat oleh setiap pemilih, mestinya masa tenang ini adalah masa di mana kita berkontemplasi, merenung kembali, dan memantapkan pilihan. Sehingga, kita betul-betul punya bekal informasi yang cukup untuk memilih di TPS nanti,"" ujar Direktur Eksekutif Perludem, Titi Anggraini saat dihubungi   pada Senin (15/4/2019). Titi menyarankan para pendukung untuk mengisi konten media sosial dengan informasi seputar pemilu. Dengan demikian, dukungan politik itu juga akan tersalurkan dengan baik, yaitu di kotak suara. ""Berikan dukungan politik itu nanti saja di bilik suara. Nah, di media sosial lebih baik kita menyosialisasikan soal bagaimana tata cara mencoblos yang baik, bagaimana memilih pemilu yang benar, sehingga nanti suara kita bisa dihitung sebagai suara sah,"" ujar Titi. Titi berharap masyarakat memanfaatkan masa tenang untuk tidak saling menghina atas dasar dukungan dalam pemilu. Di sisi lain, Perludem memahami bahwa tidak ada aturan yang melarang perbuatan itu dilakukan di media sosial. ""Kalau terhadap warga dan pemilih, memang tidak ada pengaturan yang melarang untuk menyampaikan unek-unek (di media sosial),"" kata Titi.   Titi mengingatkan, hal yang tidak boleh dilakukan warganet adalah menyebar fitnah, menyampaikan ujaran kebencian, menyebarkan informasi bohong, atau memprovokasi orang lain.  ","Masa Tenang, Ini Imbauan Perludem untuk Pendukung Capres dan Caleg"
"dict","travel","Kapal Pesiar Albatros Berpenumpang 900 Wisman, Menepi di Sabang  ","Kapal Pesiar Albatros Berpenumpang 900 Wisman, Menepi di Sabang"
"dict","news","",""
"dict","regional","Ini Cerita Keluarga Soal AP, Tersangka Pemutilasi Mayat dalam Koper di Blitar - Supriyanto (56), bapak dari AP, salah satu dari dua tersangka pembunuhan terhadap Budi Hartanto (28) yang mayatnya ditemukan termutilasi di dalam koper, masih belum percaya sang anak terlibat. Bahkan, selama dua minggu ini atau setelah ramai penemuan   , dia melihat tidak ada gelagat yang mencurigakan dari anaknya tersebut.    Selama itu pula, anaknya tersebut turut membantunya sebagai tenaga pemasangan terop hajatan milik tetangganya.     ""Jadi selama ini juga biasa saja,"" ujarnya. Di mata keluarga, AP (23) dikenal sosok yang baik, setia kawan, dan pekerja keras.  Menurut Supriyanto , anak keempatnya itu sangat jauh dari sifat-sifat negatif dan bahkan termasuk anak yang sopan dan penurut terhadap orang tua.    ""Sama kawan, dia setia kawan. Dimintai tolong teman, susah menolaknya,,"" ujar Supriyanto ditemui di rumahnya, Sabtu (13/4/2019). Namun, dia mengaku menerima kenyataan yang prosesnya masih terus berjalan ini. Hanya saja, dia meyakini anaknya tersebut kemungkinan terlibat pada hal yang lain, bukan pada pembunuhannya.    ""Mungkin disuruh buang identitas atau apa, mungkin. Kalau membunuh, enggak mungkin tega,"" ujarnya.   Kepolisian melakukan penangkapan terhadap AP pada Jumat (12/4/2019) dini hari di rumahnya Kecamatan Ringinrejo. Penangkapan itu dilakukan sehari setelah penangkapan terhadap tersangka AS di Jakarta.    Supriyanto menuturkan, penangkapan itu terjadi sekitar pukul 01.00 WIB, bermula dari kedatangan beberapa petugas polisi ke rumahnya dan langsung menangkap anaknya.    ""Saat dia itu belum tidur karena baru saja pulang dari warung kopi bersama teman-temannya,"" tambahnya.    Petugas saat itu hanya menjelaskan kalau anaknya terkait dengan peristiwa kekerasan yang menyebabkan korban meninggal dunia, lalu membawa anaknya ke kantor polisi.    Supriyanto hingga saat ini belum bisa menemui anaknya. Upayanya mendatangi Mapolsek untuk bertemu juga tidak membuahkan hasil karena anaknya masih dalam pemeriksaan.    ""Padahal saya ingin sekali bertemu,"" ujarnya. Supriyanto membantah adanya kabar yang menyebut anaknya mempunyai kelainan orientasi seksual. Menurutnya, anaknya lelaki normal dan beberapa kali mempunyai pasangan kekasih perempuan.    Salah seorang perempuan itu, menurutnya, pernah diajaknya pulang ke rumah menemuinya. Bahkan dia sempat menasehatinya agar tidak mudah membawa keluar anak gadis kalau tidak ada restu dari orang tua.    ""Saat itu yang diajaknya gadis asal Tulungagung,"" ungkapnya. Selain itu, anaknya itu bahkan cukup lembut dengan perempuan. Hingga suatu kali pernah berhenti dari tempat kerjanya karena khawatir mengganggu fokusnya karena ada seorang perempuan yang mendekatinya.    Bahkan saat ini, kata dia, juga masih mempunyai pacar. Namun urung melangsungkan pernikahan karena masih ada kakaknya yang belum menikah sehingga tidak mau melangkahinya. ""Kemarin juga katanya mau kerja keras untuk bahan menikah,"" ujarnya.        Menurut Supriyanto, anaknya AP memang kenal dengan tersangka AS. Hanya saja perkenalannya itu, sepengetahuannya, tidak begitu dekat.  Bahkan anaknya tersebut selama ini lebih dekat dan akrab pada D yang merupakan adik tersangka AS. D itu selama ini juga kerap datang ke rumah AP untuk sekedar menikmati kopi. ""Kalau Aris, perilakunya memang mbanceni (berperilaku perempuan),"" ujarnya.    Sebelumnya diberitakan, kepolisian telah menangkap dua orang tersangka pelaku pembunuhan terhadap Budi Hartanto (28), yakni AP warga Ringinrejo    dan AS warga Udanawu   . AS ditangkap saat berada di Jakarta dan AP ditangkap di rumahnya.    Dari penangkapan dua tersangka itu, petugas juga berhasil menemukan organ kepala Budi Hartanto. Kepala ditemukan di sungai Desa Bleber, Kecamatan Kras, Kabupaten Kediri.     Potongan kepala itu saat ini sudah dimakamkan di lubang yang sama dengan tubuh Budi di pemakaman umum Kelurahan Tamanan, Kota Kediri, Jumat (12/4/2019).","Ini Cerita Keluarga Soal AP, Tersangka Pemutilasi Mayat dalam Koper di Blitar"
"dict","regional","5 Fakta Kasus Pengeroyokan Siswi SMP di Pontianak, AD Sudah Pulang ke Rumah Hingga Tersangka Jadi Korban ""Bully""  - Siswi SMP korban pengeroyokan, AD (14), sudah kembali ke rumah setelah menjalani kurang lebih 10 hari perawatan di Rumah Sakit Pro Medika   . Ketua Tim Pengacara korban, Daniel Tangkau, membenarkan hal tersebut. Menurutnya, kondisi korban saat ini membaik dibandingkan saat dirawat di rumah sakit. Sementara itu, keluarga tersangka kasus pengeroyokan diketahui melaporkan sejumlah akun media sosial karena dianggap telah melakukan fitnah dan hoaks kepada para tersangka. Selain itu, para tersangka juga menjadi korban ""  "" di media sosial akibat informasi hoaks yang beredar tersebut.  Baca fakta lengkapnya berikut ini: Setelah menjalani perawatan kurang lebih sejak Jumat (5/4/2019), AD akhirnya diperbolehkan pulang oleh pihakk Rumah Sakit Pro Medika, Pontianak, Sabtu (13/4/2019). Ketua Tim Pengacara AD, Daniel Tangkau, menerangkan, saat berada di rumahnya, kondisi korban, terlihat lebih baik dan bahagia dibanding saat masih menjalani perawatan di rumah sakit. ""Dia keluar tadi malam. Dia dirawat di Rumah Sakit Pro Medika Pontianak, sejak Jumat (5/4/2019),"" kata Daniel kepada  , Minggu (14/4/2019). Namun demikian, pihak rumah sakit meminta AD untuk tetap menjalani rawat jalan. Pihak keluarga juga akan membawa AD menjalan menjalani ultrasonografi (USG). ""Tapi kapannya itu (ultrasonografi) belum tahu. Karena itu urusan keluarga dan rumah sakit. Kami fokus penanganan hukum,"" terangnya. Daniel menjelaskan, pihak keluarga berencana akan melakukan Ultrasonografi medis (sonografi) terhadap AD. Ultrasonografi adalah sebuah teknik diagnostik…","5 Fakta Kasus Pengeroyokan Siswi SMP di Pontianak, AD Sudah Pulang ke Rumah Hingga Tersangka Jadi Korban ""Bully"""
