"_type","category","isi","judul"
"dict","sains","Lebih Cepat dari Cheetah, Laba-laba ini Meluncur Menerkam Mangsanya  Selama ini mungkin kita menganggap    sebagai predator pasif yang hanya mengunggu mangsanya terperangkap dalam sarang buatannya. Namun, laba-laba yang satu ini tidak demikian. Alih-alih menunggu kedatangan mangsanya, laba-laba ini justru meluncur dengan kecepatan ekstrim untuk menerkam mangsa yang lewat di hadapannya.    ini meluncur dengan memanfaatkan jaringnya yang memiliki bentuk khusus. Jaring ditenun membentuk kerucut, dengan untai jaring tunggal yang menempel pada ujungnya. Sebagai persiapan, laba-laba ini bergerak sambil menggulung untai tunggal, menciptakan tegangan pada jaring. Saat laba-laba mendeteksi keberadaan mangsa potensial, untai tersebut dilepas, sehingga laba-laba dengan cepat meluncur bersamaan dengan jaring kerucut, yang digunakannya untuk  menjerat mangsa. Berdasarkan perilaku berburunya tersebut, laba-laba ini dinamakan laba-laba   . Spesies ini dapat dijumpai di hutan hujan yang dilintasi sungai Amazon di Peru. “Luncuran jaring ini membuat laba-laba ini menjadi leba-laba tercepat yang kita ketahui”, ungkap Symone Alexander, peneliti dari Georgia Tech, dilansir dari  , Rabu (10/4/2019). Alexander dan kolegannya menggunakan kamera portabel berkecepatan tinggi untuk merekam aksi laba-laba ini. Hasilnya, diketahui bahwa kecepatannya dapat mencapai 4 meter per detik. Fakta yang lebih mencengangkan lagi adalah kemampuan akselerasinya. Saat meluncur, laba-laba ini sanggup mencapai akselerasi lebih dari 1.100 meter per detik kuadrat. Angka ini jauh melebihi cheetah, hewan darat tercepat yang selama ini kita kenal. Cheetah hanya sanggup berakselerasi sekitar 13 meter per detik kuadrat. “Untung saja kita tidak termasuk mangsanya”, canda Alexander.","Lebih Cepat dari Cheetah, Laba-laba ini Meluncur Menerkam Mangsanya"
"dict","sso","",""
"dict","sains","Tak Direkomendasikan WHO, Amankah Minum Obat Penghenti BAB Saat Diare?  Ketika sedang dilanda   , mungkin hal pertama yang Anda lakukan adalah meminum   -obatan penghenti diare. Namun, rupanya tindakan ini tidak direkomendasikan oleh Badan Kesehatan Dunia (  ). Hal tersebut diungkapkan oleh dr Felix Samuel, M.Kes, Dokter Umum dan Kepala Unit Emergency RS Pondok Indah dalam paparan bertajuk ""Kasus Gawat Darurat Saat Liburan"" di Royal Tulip Gunung Geulis Resort & Golf, Bogor, Jumat (12/4/2019). Dia mengatakan, diare merupakan mekanisme tubuh untuk mengeluarkan toksin. Karena tidak nyaman, loperamide diminum untuk menghentikan diare. Namun, hal ini bisa berbahaya. Pasalnya, loperamide bekerja dengan memperlambat gerakan usus sehingga frekuensi buang air besar berkurang. Pada diare non spesifik, seperti diare yang disebabkan oleh alergi susu atau santan, mungkin hal ini tak akan menjadi masalah. Namun pada kasus diare serius, seperti disentri, penggunaan loperamide malah bisa menyebabkan nyeri perut dan kembung, sementara diare tidak selesai dan akan berlanjut setelah efek loperamide hilang. ""Makanya yang harus kita obati bukan gejalanya, tetapi penyebabnya,"" ujar Felix. Selain itu, diare akut atau gastroenteritis yang biasanya terjadi saat liburan sebetulnya bisa sembuh sendiri dalam tujuh hari bila disebabkan oleh   . Namun bila disebabkan oleh   , penanganannya memang memerlukan antibiotik. Felix pun menjelaskan cara membedakan bila diare disebabkan oleh virus atau bakteri. Penyakit yang ditandai dengan berak encer lebih dari tiga kali sehari pada umumnya, terutama pada anak-anak, disebabkan oleh virus. Ketika disebabkan oleh virus, seperti rotavirus, umumnya frekuensinya lebih sering daripada yang disebabkan oleh bakteri.    akibat virus juga sering disertai oleh demam tinggi. Selain itu, tinja bersifat asam sehingga dapat menimbulkan ruam pada pantat. Sebaliknya, frekuensi diare akibat bakteri biasanya tidak sesering diare akibat virus walaupun tetap lebih dari tiga kali sehari. Demam yang menyertainya juga tidak setinggi yang disebabkan oleh virus. Namun, diare jenis ini biasanya juga dibarengi nyeri perut, dan pada kasus-kasus disentri, juga menimbulkan buang air besar berdarah. Untungnya, tata laksana keduanya tidak jauh berbeda. Pertama, diperlukan rehidrasi atau  . Ketika diare, zat pertama yang hilang dari tubuh adalah elektrolit dan cairan. Oleh karena, pasien perlu diberikan   (oralit) sebagai pengganti. Setelah rehidrasi dilaksanakan, pasien diare juga harus makan sesegera mungkin. ""Tubuh perlu kalori, jangan malah enggak mau makan,"" kata Felix. Pasien anak-anak juga perlu mengonsumsi zinc 10-20 mg setiap hari selama 14 hari untuk membantu menangani diare. Sementara itu, seperti diungkapkan di atas, antibiotik hanya diberikan bila diare disebabkan oleh bakteri. Akan tetapi, apabila diare disertai penyulit, maka pasien harus segera dibawa ke dokter untuk mendapat penangan lebih lanjut. Felix menjelaskan bahwa penyulit ini seperti muntah-muntah hebat, padahal pasien diare memerlukan rehidrasi; demam yang menandakan infeksi dan dehidrasi pada anak-anak. ""Orang dewasa 2-3 hari bisa bertahan (drngan diare), tapi kalau anak-anak itu (kalau dehidrasi) jadi lemas, ngantuk, dan tidak mau makan atau minum,"" imbuhnya.","Tak Direkomendasikan WHO, Amankah Minum Obat Penghenti BAB Saat Diare?"
"dict","properti","Tol Pandaan-Malang Batal Diresmikan Jumat Ini  Jalan    yang sedianya diresmikan, Jumat (12/4/2019), batal dilaksanakan. Hal ini karena Presiden Joko Widodo (Jokowi) yang semula dijadwalkan meresmikan, mendadak membatalkan kegiatan di Jawa Timur. Menurut Menteri Pekerjaan Umum dan Perumahan Rakyat (PUPR) Basuki Hadimuljono, sedianya Seksi 1-3 dari Pandaan-Singosari sepanjang 30,55 kilometer sudah siap untuk diresmikan. “Harusnya Pak Presiden kan ke Malang untuk (menghadiri final) Piala Presiden itu. Mungkin karena ada acara lain, jadi itu tidak jadi diresmikan,” kata Basuki di kantornya, Jumat (12/4/2019) siang.  Ia mengaku, belum dapat memastikan kapan peresmian jalan tol yang akan dikelola PT Jasamarga Pandaan Malang tersebut akan dilaksanakan. Namun, bila memang akan dibuka fungsional guna mendukung kelancaran arus kendaraan dan logistik masyarakat, hal tersebut tidak dipersoalkan.  “Kalau mau dipakai menurut saya bisa dipakai saja. Sebenarnya tidak harus juga, peresmian itu kan hanya inagurasi,” ujarnya.  Adapun untuk tarif, Kepala Badan Pengatur Jalan Tol (BPJT) Danang Parikesit menyatakan, hingga kini belum ditentukan. BPJT sejauh ini baru menerima permohonan izin operasi dari badan usaha jalan tol (BUJT). “Rata-rata kan Rp 1.100 (per kilometer) kalau di Jawa timur kecuali Pasuruan- Probolinggo,” kata dia. Tol Pandaan-Malang memiliki panjang 38,488 kilometer dan terdiri dari lima seksi. Seksi 1 adalah Pandaan hingga Purwodadi sepanjang 15,475 kilometer. Lalu, Seksi 2 Purwodadi-Lawang sepanjang 8,05 kilometer; Seksi 3 Lawang-Singosari sepanjang 7,10 kilometer; Seksi 4 Singosari-Pakis sepanjang 4,75 kilometer; dan Seksi 5 Pakis-Malang sepanjang 3,11 kilometer. Setelah beroperasi, kehadiran jalan tol ini diharapkan menjadi bagian vital arus mobilisasi orang dan barang, serta mempercepat waktu tempuh dari Surabaya ke Malang dan sebaliknya.  ""Selama ini, perjalanan dari Surabaya ke Malang di masa libur bisa mencapai empat hingga enam jam. Dengan melalui jalan tol ini, waktu tempuhnya bisa kurang dari satu jam,"" ucap Direktur Utama PT Jasamarga Pandaan Malang (JPM), Agus Purnomo.    ","Tol Pandaan-Malang Batal Diresmikan Jumat Ini"
"dict","properti","Kritik Karya Zaha Hadid, ""Blogger"" China Didenda  — Seorang   China didenda 200.000 yuan atau sekitar Rp 421 juta.   tersebut mengkritik desain pengembangan Wangjing SOHO yang dirancang oleh arsitek   , November 2018. Pada Rabu (12/4/2019), Pengadilan Chaoyang memutuskan bahwa    yang tidak disebutkan namanya itu harus membayar denda kepada pemilik bangunan karena telah dianggap menghina dengan kata-kata buruk. Penulis yang tidak diketahui namanya itu menulis di    bernama S Shengunju S. Dalam tulisannya, ia mengatakan, rancangan gedung tidak sesuai fengsui. Hal ini, menurutnya, buruk untuk para penyewa. Sementara Zhuhai Shengun Internet Technology yang mengoperasikan blog tersebut harus meminta maaf kepada pemilik gedung, Pan Shiyi. Pengadilan juga mengatakan, tulisan dalam blog tersebut dapat menyesatkan pembaca dan merusak pendapat orang tentang bangunan itu. Bahkan, tulisan tersebut juga mendorong para penyewa untuk pindah sesegera mungkin. ""Jalan-jalan di sekitar Wangjing SOHO membentuk roh jahat yang besar, melambangkan konflik. Semua yang tabu dalam fengsui dapat ditemui di Wangjing SOHO,"" demikian tulis blog tersebut. Fengsui merupakan salah satu pertimbangan penting dalam arsitektur China. Pakem ini masih digunakan di sebagian besar pengembangan proyek, termasuk pusat perbelanjaan, menara perkantoran, dan kasino di seluruh Asia. Dalam sebuah pernyataan, hakim Hua Ou yang menangani kasus ini mengatakan tulisan tersebut menyesatkan. ""Tulisan itu meninggalkan kesan sepihak dan sewenang-wenang kepada pembaca dan mengotori reputasi perusahaan SOHO,"" tulisnya. Pengembangan proyek ini berada di timur laut Beijing yang terdiri dari tiga menara. Masing-masing menara dibangun dengan tinggi 387 meter, 417 meter, dan 656 meter. Hingga akhir 2018, okupansi di gedung tersebut mencapai 98 persen.","Kritik Karya Zaha Hadid, ""Blogger"" China Didenda"
"dict","sains","Kronologi dan Dugaan Penyebab Gempa Banggai Sulteng Versi BMKG  Jumat (12/4/2019) malam    kuat dengan magnitudo 6,9 mengguncang wilayah Kabupaten Morowali, Morowali Utara, dan Kepulauan Banggai, Sulawesi Tengah. Namun, setelah dilakukan pemutakhiran, magnitudo gempa turun menjadi 6,8 dengan episenter terletak di Teluk Tolo yang berjarak 82 kilometer arah barat daya dari Kepulauan Banggai, dengan kedalaman 17 kilometer. Hasil pemodelan menunjukkan adanya potensi    sehingga 5 menit setelah terjadinya gempa dikeluarkan peringatan dini tsunami dengan estimasi tinggi sekitar 50 sentimeter. Setelah dilakukan monitoring muka air laut melalui pengamatan   di Kendari, Sulawesi Tenggara, dan Taliabu, Maluku Utara tidak ada kenaikan air laut yang signifikan. Pengecekan lapangan yang dilakukan oleh    dan BPBD setempat juga tidak menemukan tanda air surut dan tsunami sehingga pada pukul 19.47 peringatan dini tsunami berakhir. Berdasarkan lokasi episenter dan kedalaman hiposenter, gempa diperkirakan dipicu oleh aktivitas sesar aktif. Dugaan kuat mengerucut pada Sesar Peleng, yang memiliki jalur berarah barat daya-timur laur Pulau Peleng menerus ke Teluk Tolo. Hasil analisis mekanisme sumber menunjukkan bahwa gempa ini dibangkitkan oleh deformasi batuan dengan mekanisme pergerakan mendatar. Gempa dengan insensitas terbesar dirasakan oleh masyarakat di wilayah Poso, Buol, Morowali, Banggai, dan Palu. Intensitas lebih kecil dirasakan di daerah Kolaka, Toli-toli, Kotamobagu, Palopo, Makassar, Kepulauan Konawe, Gorontalo, Kendari, dan Manado. Berdasarkan siaran pers yang diterima   Sabtu (13/4/2019), belum ada laporan dampak kerusakan yang ditimbulkan akibat gempa. Hingga pukul 23.50 WIB, hasil monitoring BMKG menunjukkan adanya aktivitas gempa susulan sebanyak 43 kali dengan magnitudo antara 3,4 dan 5,6.  ","Kronologi dan Dugaan Penyebab Gempa Banggai Sulteng Versi BMKG"
"dict","sains","Gempa Besar Sulteng, Bagaimana Sejarah Mencatat Tektonik dan Tsunami?  Kepala Bidang Informasi    Bumi dan Peringatan Dini       Daryono mengatakan,    yang semalam mengguncang kabupaten Morowali, Morowali Utara dan Kepulauan Banggai, Provinsi Sulawesi Tengah dipicu oleh   . Berdasarkan analisis lokasi episenter dan kedalaman hiposenter, tampak bahwa gempa yang terjadi merupakan jenis gempa dangkal akibat aktivitas sesar aktif. Dugaan Daryono, sesar yang menjadi pembangkit gempa adalah sesar Peleng dengan jalur arah barat daya ke timur laut dan meneruk ke Teluk Tolo. Sesar Peleng merupakan sesar aktif yang memiliki laju sesar sebesar 1,0 milimeter per tahun dan magnitudo maksimum yang mencapai magnitudo 6,9. ""Hasil analisis mekanisme sumber menunjukkan bahwa gempa ini dibangkitkan oleh deformasi batuan dengan mekanisme pergerakan mendatar (strike slip),"" tulis Daryono dalam analisisnya yang disampaikan pada  , Sabtu (13/4/2019). Dia melanjutkan, dugaan itu berdasar alasan bahwa lokasi episenter terletak pada kelurusan Sesar Peleng yang menerus ke laut dan sumber gempa ini memiliki mekanisme pergerakan mendatar menganan ( ). Dampak gempa ini berdasarkan laporan masyarakat dirasakan di wilayah Poso, Buol, Morowali, Banggai dan Palu pada skala intensitas IV MMI; di Kolaka Utara dan Toli-toli III-IV MMI; di Kotamobagu, Palopo, Kolaka, Makassar dan Kep. Konawe III MMI; di Gorontalo dan Kendari II-III MMI; di Manado, Pinrang dan Konawe II MMI. Saat ini belum ada laporan dampak kerusakan yang ditimbulkan akibat gempa. Hingga pukul 23.50 WIB, hasil monitoring BMKG menunjukkan terjadinya aktivitas gempa susulan (aftershock) sebanyak 43 kali dengan kekuatan paling besar M 5,6 dan terkecil dengan M 3,4. Wilayah Kepulauan Banggai berada di kawasan rawan gempa dan   . Secara tektonik di wilayah ini terdapat beberapa sesar aktif, seperti Sesar Naik Batui, Sesar Balantak, Sesar Ambelang, dan Sesar Peleng, ""Berdasarkan catatan sejarah di Kepualauan Banggai sudah beberapa kali terjadi tsunami,"" ujar Daryono. Wilayah ini pernah dilanda tsunami pada 13 Desember 1858. Terjangan tsunami menyebabkan banyak desa-desa di pesisir pantai Kepulauan Banggai mengalami kerusakan yang parah. Selanjutnya pada 29 Juli 1859 wilayah Kepulauan Pulau Banggai kembali dilanda tsunami yang menerjang dan merusak banyak bangunan rumah yang terletak di wilayah pesisir. Terakhir adalah tsunami akibat gempa dengan magnitudo 7,5 pada 4 Mei 2000. Gempa ini memicu tsunami yang kemudian melanda Luwuk, Banggai, dan Peleng. Tsunami Banggai saat itu memiliki ketinggian mencapai 3 hingga 6 meter di Kecamatan Totikum, Kayutanyo, dan Uwedikan dengan landaan tsunami sejauh 100 meter dari garis pantai. Di dermaga Totikum air surut kurang lebih 200 meter. ""Kejadian gempa dan tsunami tahun 2000 ini mengakibatkan korban meninggal sebanyak 46 orang dan 264 orang luka-luka,"" tutupnya.","Gempa Besar Sulteng, Bagaimana Sejarah Mencatat Tektonik dan Tsunami?"
"dict","sains","Fakta Katie Bouman, Wanita di balik Foto Lubang Hitam, dan Perempuan dalam Sains  Sepanjang minggu ini, masyarakat global disuguhkan salah satu gambar terpenting yang pernah disaksikan umat manusia, foto dari  . Kepopuleran foto ini di seantero dunia juga menjadi hal yang patut disyukuri, khususnya bagi wanita yang berkarier di bidang STEM ( ) karena individu di balik alogaritma penghasil foto tersebut adalah Katherine Bouman, wanita 29 tahun dari MIT. Dua tahun lalu, tepatnya April 2017, jaringan teloskop radio yang tersebar di berbagai belahan dunia mulai menatap angkasa. “Pandangan” mereka terfokus pada    yang berjarak sekitar 54 juta tahun cahaya dari Bumi, tepatnya di pusat galaksi Messier 87. Dalam kurun waktu dua tahun itu pulalah, Bouman, bersama tim Event Horizon Telescope yang terdiri dari 200 ilmuwan, bekerja tanpa henti untuk menerjemahkan informasi yang diterima oleh gabungan teleskop radio tersebut hingga menghasilkan foto lubang hitam yang kita nikmati sekarang. Meski demikian, tidak semua orang bahagia akan pujian yang disematkan kepada Bouman, dan berbagai perilaku   yang dilakukan oleh warganet mulai bermunculan. Mereka menganggap bahwa Andrew Chael, anggota lain dari tim tersebutlah yang merupakan otak di balik proyek ini dan mengerjakan sebagian besar kode. Namun, media dan para “ ” menggunakan Bouman untuk mendorong agenda “sayap kiri” dan “feminis” mereka. Tentunya, tuduhan tersebut sama sekali tidak benar. “Gambar ini tidak hanya melibatkan satu algoritma atau satu orang,"" kata Bouman pada  . “Dibutuhkan talenta satu tim ilmuwan yang tersebar di seluruh dunia serta kerja keras bertahun-tahun untuk mengembangkan instrumen, pengolahan data, metode imaji, dan teknik analisis yang dibutuhkan untuk mengerjakan usaha yang tampak mustahil ini,"" katanya. Chael juga membela koleganya tersebut dan mengklarifikasi bahwa ia tidak mengerjakan “850.000 baris kode” yang diatributkan kepadanya. “Saya sangat senang Katie mendapat penghargaan atas hasil kerjanya dan bahwa ia menginspirasi banyak orang sebagai contoh dari kepemimpinan wanita di bidang STEM,"" ungkapnya lewat  . Keberadaan wanita di bidang STEM perlu diapresiasi. Selama ini, kehadiran mereka masih dihantui berbagai dilema, terutama karena bidang ini merupakan pekerjaan yang didominasi pria. Keberagaman dibutuhkan dalam bidang sains. Representasi wanita yang rendah dalam bidang sains sama saja dengan hilangnya talenta, ide, serta perspektif yang potensial.  ","Fakta Katie Bouman, Wanita di balik Foto Lubang Hitam, dan Perempuan dalam Sains"
"dict","sains","Manusia Purba Filipina Masih Kerabat Hobbit Flores, Ini Ciri Keduanya  Asia Tenggara mungkin bisa disebut rumah bagi para spesies      . Ada   yang dijuluki manusia    dari Flores dan spesies manusia paling baru  dari Filipina. Berbeda lokasi hampir 3.000 kilometer, menariknya kedua moyang spesies manusia ini memiliki beberapa persamaan dan perbedaan. Selain sama-sama berasal dari kawasan Asia Tenggara, keduanya memiliki ciri fisik yang mirip dengan spesies manusia awal seperti  , makhluk mirip kera yang berjalan tegak dan hidup di Afrika sekitar dua sampai empat juta tahun lalu. Secara fisik, Homo luzonensis dan Homo floresiensis memiliki tubuh sama-sama pendek. Kalau   tingginya hanya sekitar 4 kaki atau 1,2 meter, sedangkan    Flores tingginya sekitar 3,7 kaki atau 1,1 meter. Seperti diberitakan sebelumnya,   diperkirakan hidup sekitar 67 ribu sampai 50 ribu tahun lalu di pulau Luzon, Filipina. Ini artinya   hidup di zaman yang sama dengan  , di mana mereka bertahan hidup di pulau Flores, Indonesia sejak 100 ribu hingga 50 ribu tahun lalu. Meski manusia hobbit Flores ditemukan sejak 2003, hingga saat ini sebenarnya masih banyak teka-teki yang belum terungkap tentang spesies ini. Salah satu yang sempat menjadi perdebatan adalah tentang identitasnya. Banyak yang mempertanyakan apakah manusia kerdil dari Flores itu termasuk jenis manusia modern atau tidak. Baru pada 2016 lalu para ilmuwan sepakat bahwa hobbit Flores bukan manusia seperti kita,  Meski begitu teka-teki belum usai. Para ahli kemudian mempertanyakan apakah hobbit Flores dengan berat hanya 25 kilogram itu merupakan manusia Jawa ( ) atau    bernama  Studi selanjutnya yang dipublikasikan ilmuwan Australia National University (ANU) dan dipublikasikan di   edisi April 2017 mengungkap bahwa Hobbit bukan hasil    manusia Jawa ( ). ""Kami menemukan, jika Anda berusaha…","Manusia Purba Filipina Masih Kerabat Hobbit Flores, Ini Ciri Keduanya"
"dict","sains","Fosil Korban Perubahan Iklim dari Zaman Es Terpendam di Bawah Kota LA Di bawah kota Los Angeles, di pantai barat Amerika, para pekerja yang sedang memperluas jaringan jalan kereta api bawah tanah menemukan sejumlah    hewan yang berasal dari   . Koleksi fosil itu ditemukan dibawah jalan-jalan di kota Los Angeles, tepatnya di kawasan Wilshire Boulevard, ketika para pekerja sedang menggali terowongan untuk memperluas jaringan kereta bawah tanah.   -fosil itu berhasil diselamatkan karena adanya peraturan keras negara bagian California yang mengatakan, para pakar paleontologi harus diikutsertakan dalam tiap penggalian besar. ""Kita sangat beruntung karena California punya peraturan ini. Itu berarti tiap kali ada fossil yang muncul dari tempat penggalian, para pakar paleontologi segera memeriksa dan mengamankannya. Tapi sayangnya peraturan seperti ini tidak ada di semua tempat, dan karena itu banyak fosil yang hilang atau musnah sama sekali,"" kata Ashley Leger, direktur Paleontologi Cogstone Resource Management. Di antara penemuan yang menarik adalah tengkorak kepala seekor mamut, dan tengkorak kepala kungkang raksasa. Juga ada tulang belulang harimau bertaring tajam dan serigala yang langka. Pejabat kota Los Angeles Dave Sotero dan para pakar paleontologi sadar bahwa menghentikan pekerjaan penggalian terowongan bisa mengakibatkan peningkatan biaya, oleh karena itu mereka dengan cepat mengambil fosil-fosil itu. ""California punya peraturan pelestarian alam yang paling ketat di Amerika dan mungkin di dunia. Karena itu, tugas kita adalah bekerja sama dengan para pakar paleontologi dan pihak kontraktor supaya kita bisa mengamankan fosil-fosil yang berharga itu tanpa harus menghambat pekerjaan mereka,"" imbuh dia. Fosil-fosil itu memberikan gambaran bagaimana kawasan itu sekitar 20 hingga 50 ribu tahun lalu. ""Isu    yang kini banyak dibicarakan orang, juga terjadi dulu dan mengakibatkan hewan-hewan besar itu punah kira-kira pada waktu yang hampir bersamaan dengan tibanya manusia pertama di benua Amerika dari Asia,"" kata pakar paleontologi Emily Lindsay. Fosil-fosil itu nantinya akan dipamerkan di National History Museum di Los Angeles.","Fosil Korban Perubahan Iklim dari Zaman Es Terpendam di Bawah Kota LA"
"dict","sains","Gempa Hari Ini, Lindu M 5,2 Kembali Guncang Sulawesi Tengah  Sabtu (13/4/2019) Badan Meteorologi Klimatologi dan Geofisika (BMKG) kembali menginformasikan bahwa    berkekuatan 5,2 kembali mengguncang wilayah Sulawesi Tengah pada pukul 12.26 WIB. Menurut pantauan BMKG, lokasi terjadinya gempa masih ada di satu lokasi dengan gempa yang terjadi semalam. Pusat gempa semalam berada di titik koordinat garis lintang 1.90 LS dan garis bujur 122.54 BT, tepatnya 85 kilometer arah barat daya kepulauan Banggai, Sulawesi Tengah.    yang terjadi siang tadi berpusat di titik koordinat garis lintang 1.85 LS dan garis bujur 122.58, tepatnya 107 kilometer arah barat daya kepulauan Banggai, Sulawesi Tengah. Lokasi hiposenter gempa terjadi di kedalaman 10 kilometer. BMKG juga menginformasikan bahwa gempa siang tadi tidak berpotensi tsunami.","Gempa Hari Ini, Lindu M 5,2 Kembali Guncang Sulawesi Tengah"
"dict","properti","Lebaran, Tol Terbanggi Besar-Palembang Dibuka Fungsional  - Masyarakat yang akan melakukan perjalanan mudik dari Terbanggi Besar hingga Palembang saat musim Lebaran 2019, dapat melintasi jalan tol. Pemerintah berencana membuka jalan bebas hambatan di ruas tersebut secara fungsional. ""Ini kalau harapan baik dari Menteri PU maupun Menteri BUMN itu bisa fungsional saat arus mudik dan balik,"" kata Kepala Badan Pengatur Jalan Tol (BPJT) Danang Parikesit di Jakarta, beberapa waktu lalu. Merujuk data monitoring BPJT, saat ini progres konstruksi untuk ruas Terbanggi Besar-Kayu Agung sepanjang 189,2 kilometer 92,86 persen. Jalan tol yang digarap PT Hutama Karya (Persero) itu terbagi ke dalam dua seksi. Seksi 1 Terbanggi Besar-Pematang Panggang sepanjang 112,2 kilometer dan Seksi 2 Pematang Panggang-Kayu Agung sepanjang 77 kilometer. Adapun ruas Kayu Agung-Palembang-Betung yang dikerjakan PT Sriwijaya Markmore Persada, saat ini pekerjaan konstruksi sepenuhnya telah mencapai 32,82 persen. Seksi 1 Kayu Agung-Jakabaring sepanjang 33,5 kilometer menjadi seksi yang paling progresif pekerjaan konstruksinya yakni 60,34 persen. Sementara Seksi 2 Jakabaring-Musilindas sepanjang 33,9 km baru mencapai 40,85 persen dan Seksi 3 Musilindas-Betung baru mencapai 5,85 persen. Danang mengungkapkan, sebelum dibuka fungsional, pihaknya akan meninjau kesiapan ruas tersebut sebelum puasa dimulai. ""Kami akan melakukan survei di lapangan. Harapan kami sebelum puasa dilakukan pengecekan bersama Kemenhub dan Korlantas,"" ujarnya.","Lebaran, Tol Terbanggi Besar-Palembang Dibuka Fungsional"
"dict","sains","Bagaimana Nasib Manusia jika Lubang Hitam Sedekat Bulan?  Foto pertama    yang populer di jagad maya selama dua hari belakangan ini memancing rasa keingintahuan publik. Selama ini, lubang hitam dipersepsikan bak sumur tanpa dasar yang menyedot apapun yang berada di sekitarnya. Apakah anggapan itu benar? Jawabannya, iya dan tidak, tergantung dari ukuran serta seberapa jauh jarak suatu benda dari lubang hitam tersebut. Lantas, bagaimana jika sebuah lubang hitam itu ada di dekat Bumi, katakanlah sejauh jarak antara Bumi dengan   ? “   memiliki massa minimal 3-5 kali lipat massa Matahari, dengan diameter sekitar 10-20 km saja”, ujar Marufin Sudibyo, seorang astronom amatir saat dihubungi oleh  , Sabtu (13/4/2019). “Secara teoritis, benda yang ada di sekitar lubang hitam dengan jarak 6 juta km (jika massanya tiga kali lipat Matahari) akan hancur akibat gaya pasang surut gravitasi”, jelas Marufin. Marufin juga menambahkan bahwa puing hamburan dari benda tersebut akan ditarik ke arah lubang hitam, meski hanya sebagian kecil yang benar-benar memasukinya. Penting untuk diketahui, jarak antara Bumi dengan Bulan hanyalah 384.000 km saja. Lalu, jika sebuah lubang hitam supermasif seperti Messier 87 yang baru saja kita dapatkan fotonya berada di posisi Bulan saat ini, apa yang akan terjadi? Jawabannya, Bumi-nya saja tak mungkin ada. “Segenap tata surya kita akan lenyap”, jawab Marufin. Marufin menjelaskan bahwa horizon peristiwa ( ) Messier 87 memiliki diameter melebihi separuh ukuran tata surya kita, yakni jarak antara Matahari hingga sisi dalam awan komet Opik-Oort. Untuk dapat lepas dari horizon peristiwa, dibutuhkan kecepatan setara kecepatan cahaya. “Jika pusat lubang hitam supermasif ini berada di posisi Bulan, maka Bumi dan penghuninya akan tercabik-cabik menjadi partikel paling elementer berupa kuark dan elektron. Semuanya lantas dimampatkan dalam ruang sangat sempit” lanjut Marufin. Lubang hitam merupakan suatu kawasan pada ruang-waktu yang memiliki efek gravitasi sangat kuat, dimana bahkan cahaya saja tidak sanggup kabur darinya. Keberadaannya dibatasi oleh horizon peristiwa, batas akhir dimana suatu benda dapat melarikan diri sebelum memasuki lubang hitam.","Bagaimana Nasib Manusia jika Lubang Hitam Sedekat Bulan?"
