"_type","category","isi","judul"
"dict","bola","Liverpool Vs Chelsea, Mohamed Salah Optimistis The Reds Juara     mengatakan bahwa    butuh empat kemenangan lagi untuk menjuarai    musim 2018-2019, Senin (15/4/2019). Perebutan takhta juara kompetisi teratas negeri Ratu Elizabeth antara Liverpool dan    kian memanas memasuki pekan ke-34. Kedua tim saling bergantian menduduki puncak klasemen. Posisi The Reds sempat tergusur oleh The Citizens yang meraih kemenangan 3-1 di markas Crystal Palace. Namun,  tak berselang lama, pasukan Juergen Klopp kembali ke posisi puncak klasemen berkat kemenangan penting saat bersua Chelsea di kandang mereka, Anfield. Jika melirik calon lawan yang akan dihadapi keduanya pada pengujung musim ini, Liverpool memiliki jadwal yang lebih menguntungkan dibanding pesaing terdekatnya. The Reds ""hanya"" akan berhadapan dengan Cardiff City, Newcastle United, Wolverhampton Wanderers, dan Huddersfield Town. Sementara itu, pasukan Pep Guardiola harus melakoni laga berat melawan Tottenham Hotspur dan rival sekota, Manchester United, dalam dua pekan secara berurutan sebelum menghadapi Burnley, Leicester City, dan Brighton and Hove Albion pada tiga pekan terakhir. Dengan jadwal pertandingan yang lebih ringan dibanding rivalnya, Salah cukup optimistis Liverpool akan mengangkat trofi Liga Inggris musim ini jika mampu menyapu bersih kemenangan di empat partai sisa. ""Pendapat saya, ya. Kami harus fokus pada pertandingan kami. Kami berharap Man City akan kehilangan poin. Liga Premier adalah hal yang paling penting bagi saya,"" kata pemain asal Mesir itu kepada Sky Sports. ""Saya mengikuti perkembangan City untuk melihat hasil mereka. Ini dapat membantu dan dapat mendorong kami untuk tampil lebih baik. Kami fokus pada permainan kami, tetapi saya tahu hasil Man City (melawan Palace),"" katanya. Saat ini, Liverpool masih bercokol di puncak klasemen Liga Inggris dengan raihan 85 poin dari 34 pertandingan, sedangkan Man City tepat berada di bawahnya dengan koleksi 83 poin dan masih menyimpan satu laga tunda.","Liverpool Vs Chelsea, Mohamed Salah Optimistis The Reds Juara"
"dict","megapolitan","Balita yang Diduga Diculik Nenek Kerudung Merah Ditemukan di Stasiun Senen  - Balita bernama Anisa Suci Ardiwibowo (3) yang diculik orang tak dikenal di lingkungan Masjid Al-Amin, Bintara, Bekasi Barat, Kota Bekasi pada Selasa (9/4/2019) sudah ditemukan setelah lima hari dilakukan pencarian. Aprilina Lestari, ibu kandung dari Anisa mengatakan, anaknya sudah ditemukan oleh dirinya dan pihak kepolisian dari Polda Metro Jaya di area Stasiun Senen, Jakarta Pusat pada Minggu (14/4/2019,) sekitar pukul 17.00 WIB. ""Sudah ketemu Nisanya, ketemu di Stasiun Senen,"" kata Aprilina saat dikonfirmasi, Minggu. Saat ditemukan, kata Aprilina, anaknya bersama seorang nenek yang diduga menculik. Nenek tersebut diduga mirip dengan yang aksinya tertangkap kamera CCTV masjid. ""(Ditemukannya) masih sama nenek-nenek itu. Ketemu sama polisi pas mau sholat, dia lihat anak,"" ujar Aprilina. Polisi membawa Anisa beserta nenek tersebut ke Mapolda Metro Jaya untuk pemeriksaan lebih lanjut. Anisa hilang diculik nenek tak dikenal pada Selasa (9/4/2019) sekitar pukul 10.00 WIB. Saat itu, Anisa sedang berada di rumahnya bersama neneknya bernama Sri Wahyuni (34). Lalu dia keluar dari rumah untuk bermain dan jajan di warung. ""Dia lari ke masjid, sampingnya kan (ada) TK (Taman Kanak-kanak). Jadi senang main di situ, dia lari-larian saja. Pas saya coba cari dia di masjid, saya lihat sandalnya ada, tapi orangnya enggak ada,"" kata Sri. Setelah mencari cucunya keliling kompleks, Sri tidak menemukan jejak cucunya yang dibawa nenek tak dikenal tersebut. Hal itu terlihat dari kamera CCTV yang dipasang di area masjid. Berdasarkan rekaman CCTV, nenek itu memakai baju biru serta berkerudung merah. Dia terlihat memangku Anisa di halaman depan masjid. Tak lama kemudian, nenek itu menggendong Anisa dan pergi dari area masjid.","Balita yang Diduga Diculik Nenek Kerudung Merah Ditemukan di Stasiun Senen"
"dict","bola","PSG Vs Lille, Mbappe Sebut Timnya Bermain Seperti Pemula  Striker muda    (  ),   , mengutarakan kekecewaannya seusai timnya dibantai tuan rumah Lille dalam laga pekan ke-32    Perancis, Senin (15/4/2019) dini hari WIB. Dalam pertandingan yang berlangsung di Stade Pierre Mauroy, Mbappe dkk dibantai   sementara Ligue 1, Lille, dengan skor telak 1-5. Lima gol kemenangan Lille masing-masing dicetak oleh Thomas Meunier (7’ bunuh diri), Nicolas Pepe (51’), Jonathan Bamba (65’), Gabriel Magalhaes (71’), dan Jose Fonte (84’). Sementara itu, gol semata wayang PSG dicetak oleh Juan Bernat pada menit ke-11, yang kemudian diusir ke luar lapangan oleh wasit akibat pelanggaran kerasnya terhadap Nicolas Pepe. Hasil buruk yang didapat   dalam laga penentuan gelar juara tersebut membuat Mbappe kecewa. Ia menyebutkan timnya tidak bermain seperti biasanya. Bahkan penyerang asal Perancis ini menyebut PSG bermain seperti tim pemula. ""Suatu saat, kami bisa berada di atas, berikutnya kami tidak biasa. Kami memang bisa kalah, tetapi kami tidak bisa kalah seperti ini (kalah telak). Kami tidak boleh kalah dengan kebobolan tiga, empat, atau sampai lima gol,"" kata Mbappe dikutip  ""Bermain sepak bola di atas lapangan, ini bukan hanya tentang mengatakan sesuatu. Kami bermain seperti pemula, dan kami tidak boleh kalah seperti itu.” Hasil ini membuat pasukan Thomas Tuchel itu telah melewatkan kesempatan mengunci gelar juara lebih cepat untuk kedua kalinya secara beruntun. Pada pekan lalu, Thiago Silva dkk gagal mengunci gelar juara setelah hanya mampu bermain imbang 2-2 saat menjamu Strasbourg di Parc des Princes   Saat ini, PSG masih kokoh di puncak klasemen Ligue 1 dengan perolehan 81 poin dari 31 laga, unggul 17 angka dari Lille di posisi kedua yang telah memainkan 32 laga.","PSG Vs Lille, Mbappe Sebut Timnya Bermain Seperti Pemula"
"dict","bola","Andrea Dovizioso Gembira Raih Puncak Klasemen Sementara MotoGP 2019  - Pebalap Mission Winnow Ducati,   , senang karena berhasil menduduki puncak klasemen sementara MotoGP musim ini setelah meraih hasil apik di Amerika. Dovizioso memang tak meraih podium di    yang digelar Minggu (14/4/2019) atau Senin dini hari WIB. Dia finis di urutan keempat, di belakang Alex Rins, Valentino Rossi, dan Jack Miller yang menduduki podium tiga teratas.  Meski demikian, Dovizioso tetap merasa puas karena bisa mengambil alih puncak klasemen sementara musim ini. Pebalap Italia itu meraih tambahan poin untuk menduduki puncak klasemen karena pebalap Honda, Marc Marquez, gagal finis. Dovizioso mengoleksi 54 poin, unggul tiga poin atas pembalap veteran MotoGP dari tim Monster Energy Yamaha, Valentino Rossi, yang menempati urutan kedua. Finis di posisi keempat cukup bagus untuk Dovizioso yang mengawali balapan MotoGP Amerika dari urutan ke-13. Hasil ini juga membuat Dovizioso mampu mentatap seri MotoGP selanjutnya yang akan digelar di Jerez dengan kepala tegak. ""Ya saya senang karena kemarin memulai dari posisi ke-13 dan itu adalah masalah besar,” kata Dovizioso seperti dilansir   dari laman MotoGP. ""Tetapi, kami harus senang dengan finis pada urutan keempat, Marquez dan Cal (Crutchlow) telah kehilangan banyak poin untuk klasemen itu yang terpenting dan saya senang akan pergi ke Jerez dengan situasi seperti ini,"" ujar Dovizioso. MotoGP Spanyol akan berlangsung di Sirkuit Jerez, Spanyol, pada 3-5 Mei 2019 Mendatang. ","Andrea Dovizioso Gembira Raih Puncak Klasemen Sementara MotoGP 2019"
"dict","nasional","Presiden Jokowi Ajak Gibran dan Kaesang Bertemu Raja Salman  Presiden Joko Widodo mengajak kedua putranya, yakni Gibran Rakabuming Raka dan Kaesang Pangarep, saat bertemu dengan Raja Salman bin Abdulaziz al-Saud di Istana Pribadi Raja di Riyadh, Arab Saudi, Minggu (14/4/2019). Ibu Negara Iriana Jokowi juga ikut mendampingi. Dalam kunjungan ke Arab Saudi, Presiden Jokowi hanya membawa rombongan terbatas, tetapi termasuk di dalamnya kedua putranya, Gibran dan Kaesang. Foto pertemuan mereka viral di media sosial, bahkan hingga kini di Jakarta, Senin pagi. Dalam foto tersebut tampak Raja Salman berdiri di tengah diapit oleh Presiden Jokowi dan Ibu Negara Iriana Jokowi. Sementara Gibran di sisi Jokowi dan Kaesang berdiri di samping Iriana. Keduanya mengenakan jas atau pakaian sipil lengkap dengan dasi. Mereka tiba pada pukul 13.50 waktu setempat dan disambut langsung oleh Raja Salman di halaman depan Istana Pribadi Raja (Al-Qasr Al-Khas). Presiden dan Ibu Negara Iriana sempat berbincang sebentar dengan Raja Salman di ruang tunggu utama. “Saya merasa berbahagia sekali karena hari ini diundang Sri Baginda Raja ke Istana ini,” kata Presiden Jokowi seperti dikutip  Raja Salman sebagaimana disampaikan Deputi Bidang Protokol, Pers, dan Media Sekretariat Presiden Bey Machmudin menyambut mereka dengan sangat hangat. “Saya juga senang Presiden Jokowi bisa memenuhi undangan saya,” ucap Raja Salman. Setelah berbincang sebentar di ruang utama, Presiden dan Ibu Iriana kemudian dijamu santap siap bersama oleh Raja Salman. Adapun menu yang disuguhkan Raja Salman kepada Presiden Jokowi adalah makanan khas Timur Tengah, antara lain sup harira, daging iga sapi, nasi mandhi dengan ayam, dan sejumlah makanan penutup dan manisan khas Arab Saudi. Turut mendampingi Presiden Jokowi dan Ibu Iriana antara lain Menteri Luar Negeri Retno Marsudi, Kepala Staf Kepresidenan Moeldoko, Duta Besar Indonesia untuk Kerajaan Arab Saudi Agus Maftuh Abegebriel.","Presiden Jokowi Ajak Gibran dan Kaesang Bertemu Raja Salman"
"dict","bola","Liverpool Vs Chelsea, Cerita di Balik Selebrasi ""Yoga"" Mohamed Salah  —    menjelaskan alasannya melakukan selebrasi dengan gaya yoga pada laga    vs    di Stadion Anfield, Minggu (14/4/2019). Salah mencetak gol spektakuler untuk membawa The Reds meraih kemenangan 2-0 pada pertandingan pekan ke-34   , kasta teratas Liga Inggris. Setelah mencetak gol, Salah dengan spontan melakukan gerakan yoga menghadap suporter Liverpool. Dia melakukan pose pohon ( ) yang kerap disebut sebagai gaya ""namaste"". Seusai laga, penyerang asal Mesir itu pun menjelaskan makna di balik selebrasinya. ""Saya adalah pegiat yoga. Saya melakukan yoga dan (selebrasi) itu yang terlintas di kepala,"" ujarnya kepada  seperti dilansir   dari  . Mohamed Salah juga menjelaskan bagaimana ia mencetak gol spektakuler tersebut. ""Saya tak berpikir. Saya hanya merasakan. Secara normal, saya akan menembak dengan bagian dalam kaki saya. Tetapi saat itu saya memutuskan, karena terlalu jauh, menembaknya dengan kekuatan penuh,"" ujar dia. ""Saya beruntung bola bisa menembus gawang seperti itu,"" kata Salah lagi. Berkat gol di laga ini, Mohamed Salah kini memimpin daftar top skor sementara Liga Inggris bersama Sergio Aguero yang sama-sama mencetak 19 gol. Meski begitu, Salah mengaku cuek soal perebutan sepatu emas di akhir musim. Ia lebih mementingkan tim untuk terus meraih kemenangan. ""Saya hanya senang karena hasil pertandingan. Saya   bersama Aguero. Bagi saya, abaikan segalanya, Premier League adalah yang terpenting,"" ujar Salah. Sebelum Salah menorehkan gol spektakuler dari luar kotak penalti, Liverpool telah unggul 1-0 berkat gol yang dicetak Sadio Mane. Kemenangan atas Chelsea mengukuhkan posisi The Reds di puncak klasemen Liga Premier. Mereka mengantongi 85 poin, unggul dua poin atas Manchester City yang berada di peringkat kedua. ","Liverpool Vs Chelsea, Cerita di Balik Selebrasi ""Yoga"" Mohamed Salah"
"dict","internasional","Setelah Santap Siang, Jokowi dan Raja Salman Bahas Kerja Sama  - Raja   , Salman bin Abdulaziz Al Saud, menerima kunjungan Presiden Republik Indonesia Joko Widodo di Riyadh, Minggu (14/4/2019). Diwartakan kantor berita  ,    menyatakan kegembiraannya bisa mengunjungi kerajaan tersebut dan bertemu dengan   , sang Penjaga Dua Masjid Suci. Laporan itu menyebutkan, presiden yang mencalonkan diri untuk periode kedua ini juga berjabat tangan dengan para pangeran dan militer yang datang menyambutnya. Di istana pribadi raja, Al-Qasr Al-Khas, pada sore hari, keduanya menggelar pertemuan selepas jamuan santap siang. Dalam momen tersebut, Presiden Jokowi dan Raja Salman sepakat akan meningkatkan kerja sama di bidang ekonomi. Dalam pertemuan, Jokowi juga menyampaikan apresiasi dari masyarakat Indonesia atas kuota tambahan sebesar 10.000 bagi jemaah haji dari tanah air. ""Raja Salman juga menyampaikan apresiasi yang tinggi atas kepemimpinan Indonesia di dalam menjaga stabilitas kawasan dan dunia,"" ucap Retno. Menurutnya, pertemuan bilateral itu turut memperlihatkan apresiasi Raja Salman terhadap Indonesia atas kepemimpinan di dunia Islam. ""Dari pembicaraan tadi tampak sekali kedekatan antara kedua kepala negara,"" ujarnya. Selain Retno, Kepala Staf Kepresidenan Moeldoko, Duta Besar Indonesia untuk Kerajaan Arab Saudi Agus Maftuh Abegebriel, dan Staf Khusus Presiden Abdul Ghofarrozin turut menemani Jokowi dalam momen tersebut. Setelah pertemuan dengan Raja Salman, presiden dan Ibu Negara Iriana akan bertolak ke Jeddah pada malam harinya. Dari Jeddah, Jokowi dan istrinya Iriana akan melanjutkkan perjalanan menuju    untuk menunaikan ibadah   . Presiden Jokowi dan Ibu Iriana bersama rombongan direncanakan tiba kembali di Jakarta pada Senin (15/4/2019) malam. ""Malam nanti, Insya Allah, saya bersama Ibu Negara menuju kota suci Makkah untuk menunaikan ibadah umrah,"" demikian tulis Jokowi di akun Instagram-nya. A post shared by   (@jokowi) on Apr 14, 2019 at 2:47am PDT","Setelah Santap Siang, Jokowi dan Raja Salman Bahas Kerja Sama"
"dict","bola","Piala Presiden 2019 Jadi Pembuktian Integritas Wasit Indonesia  Dunia sepak bola tanah air sedang diramaikan dengan skandal pengaturan skor pertandingan alias . Beberapa sosok yang menjadi perbincangan dalam skandal   berhasil ditangkap oleh Tim Satuan Tugas (Satgas) Antimafia Bola untuk diproses hukum lebih lanjut. Para jajaran wasit tanah air pun tak luput dari sorotan karena kerap dianggap memihak beberapa tim di sejumlah pertandingan tertentu. Hal ini pun diakui Oki Dwi Putra, salah satu wasit berlabel FIFA yang dimiliki Indonesia. Dirinya mangamini bahwa saat ini profesinya sebagai pengadil lapangan di Indonesia telah mendapat pandangan buruk dari masyarakat. Melalui   , Oki ingin membuktikan integritasnya sebagai sang pengadil lapangan dan berusaha menghapus stigma negatif yang selama ini melekat di tubuh para wasit tanah air. “Kami mencoba, istilahnya mengubah paradigma (buruk) kemarin yang banyak digembor-gemborkan. Di sini kami mempunyai tekad bulat untuk meningkatkan mutu dan kualitas wasit. Itu yang ditekankan komite wasit terhadap kami, untuk menjaga amanah itu,"" kata Oki dikutip dari laman resmi   . “Banyaknya permasalahan-permasalahan itu membuat kami, para wasit di Indonesia terus meningkatkan mutu dan kualitas. Integritas harus selalu dijaga,"" ujar dia. Oki juga merasa bahwa Piala Presiden kemarin sebagai ajang untuk meningkatkan kualitas para wasit di Indonesia.  Ia juga mengapresiasi keputusan pantia penyelenggara yang memakai sitem kandang dan tandang pada Piala Presiden tahun ini. ""Kami para wasit sangat mengapresiasi panitia Piala Presiden tahun ini. Dari pengalaman saya, setiap tahunnya selalu berbeda,” ujar dia. “Terutama sekarang ada  jadi kami harus terus meningkatkan mutu dan kualitas. Wasit juga saling berlomba-lomba untuk meningkatkan hal tersebut,"" tutupnya.","Piala Presiden 2019 Jadi Pembuktian Integritas Wasit Indonesia"
"dict","bola","Mario Gomez Resmi Latih Borneo FC  Mantan pelatih   ,    Roberto Carlos, resmi menangani tim asal Kalimantan,   . Borneo FC memang sedang gencar mecari pelatih baru menjelang   Liga 1 2019. Mario Gomez akan menggantikan posisi Fabio Lopez yang didepak dari kursi pelatih Borneo FC setelah tersingkir dari Piala Presiden 2019. Beberapa nama pelatih besar kerap dikaitkan dengan Borneo FC untuk mengisi posisi yang ditinggalkan Fabio Lopez. Di antaranya adalah mantan pelatih Bali United, Widido Cahyono Putro, eks pelatih PSM Makassar, Robert Rene Alberts, dan direktur akademi Borneo FC, Ricky Nelson. Kepastian Mario Gomez melatih Borneo FC sudah diumumkan melalui laman Instagram resmi Tim pesut Etam,  “Mari Kita Perjelas Teka-Teki Head Coach Borneo FC. Please Welcome, Mario Gomez. Semoga Tahun Ini Kita Juara, Aamiin! Manyala,” tulis Borneo FC. A post shared by   (@borneofc.id) on Apr 14, 2019 at 9:32pm PDT Pada musim lalu, Gomez sempat membawa Persib Bandung menjadi salah satu favorit juara Liga 1. Sayangnya, sejumlah sanksi membuat performa Persib menurun pada paruh musim kedua dan harus mengakhiri kompetisi di posisi keempat. Pelatih asal Argentina itu sebelumnya juga sempat menukangi sejumlah klub di Asia, seperti South China dan Johor Darul Takzim. Gomez juga sempat membawa JDT meraih gelar juara Piala AFC pada 2014.","Mario Gomez Resmi Latih Borneo FC"
"dict","bola","Unggul Lebih dari Selusin Gol, Messi Dominan di Top Skor Liga Spanyol  - Megabintang   , Lionel   , tampaknya benar-benar tidak memiliki pesaing lagi di   . Hal itu terbukti dari sangat superiornya Messi pada daftar top skor Liga Spanyol musim 2018-2019. Penyerang berpaspor Argentina itu menduduki posisi teratas dalam daftar top skor sementara di Liga Spanyol, yakni dengan koleksi 33 gol. Hebatnya, jumlah gol itu dicetak Messi hanya dari 29 penampilan untuk Barca di Liga Spanyol musim ini. Bahkan, jika diteliti lebih jauh, Messi sanggup membukukan 33 gol cuma dari 2.366 menit. Artinya, Messi sekadar membutuhkan rata-rata 71,6 menit untuk menceploskan satu gol. Kini, satu-satunya pemain yang bisa mendekati    di daftar pencetak gol terbanyak Liga Spanyol sementara hanyalah Luis Suarez. Suarez pun sudah tertinggal lebih dari selusin gol alias 13 gol dari Messi selama musim ini. Penyerang berusia 31 tahun itu memang menjadi bagian penting dalam setiap penampilan Barcelona.  Ketiadaan Lionel Messi memberi dampak begitu besar bagi daya dobrak Barcelona saat melawan Huesca pada lanjutan Liga Spanyol, Sabtu (13/4/2019).  Tanpa Messi, Barcelona ditahan imbang 0-0 dalam lawatan ke markas Huesca, Stadion El Alcoraz, itu. Pelatih Barcelona, Ernesto Valverde, memang sengaja mengistirahatkan Messi demi menghadapi laga melawan Manchester United di leg kedua perempat final Liga Champions, tengah pekan ini.    1. Lionel Messi (Barcelona) - 33 gol 2. Luis Suarez (Barcelona) - 20 gol 3. Cristhian Stuani (Girona) - 18 gol 4. Karim Benzema (Real Madrid) - 17 gol 5. Wissam Ben Yedder (Sevilla) - 16 gol 6. Iago Aspas (Celta Vigo) - 15 gol 7. Raul de Tomas (Rayo Vallecano) - 14 gol 8. Antoine Griezmann (Atletico Madrid) - 14 gol","Unggul Lebih dari Selusin Gol, Messi Dominan di Top Skor Liga Spanyol"
"dict","nasional","KPU Bantah soal Kabar Samsul Bahri, WNA yang Disebut Mengurus Pencoblosan di Sydney   — Komisioner Komisi Pemilihan Umum (KPU), Ilham Saputra, membantah nama Samsul Bahri sebagai Ketua Kelompok Penyelenggara Pemungutan Suara Luar Negeri (KPPSLN) di   , Australia.  Nama Samsul Bahri mencuat di media sosial dan dikaitkan dengan dugaan kecurangan Pilpres 2019 di Sydney.  ""Di hoaks itu muncul bahwa seakan-akan Samsul Bahri anggota KPPSLN. Di kita enggak ada yang namanya Samsul Bahri,"" ungkap Ilham saat dihubungi oleh  , Minggu (14/4/2019).  Bahkan, nama tersebut dikatakannya tidak tercantum sebagai anggota KPPSLN di mana pun.  Dalam sebuah unggahan di Facebook oleh akun Revolusi Mental tertulis bahwa Ketua KPPSLN di Sydney dengan nama Samsul Bahri merupakan pendukung paslon Prabowo Subianto-Sandiaga Uno.  Akun tersebut juga menuliskan informasi bahwa Samsul sudah menjadi warga negara Australia tetapi mengurusi    Indonesia.  Menurut akun tersebut, terdapat dugaan kecurangan untuk memenangkan paslon tertentu di pilpres yang diselenggarakan di Sydney.  Unggahan tersebut juga disertai sebuah video yang menampilkan sekelompok orang beradu mulut dengan seorang laki-laki berkacamata dan berjas biru. Posisi di antara keduanya dibatasi oleh sebuah pagar.  Terkait video tersebut, Ilham juga mengaku tidak mengetahuinya.  ""Ya enggak  , Samsul Bahri itu siapa,"" tuturnya.  Berikut tulisan lengkap pada unggahan akun tersebut seperti dikutip  :","KPU Bantah soal Kabar Samsul Bahri, WNA yang Disebut Mengurus Pencoblosan di Sydney "
"dict","edukasi","Nagekeo, Kabupaten Termuda Ini Gelar Festival Literasi Nagekeo 2019!  - Nagekeo adalah salah satu kabupaten di Nusa Tenggara Timur yang merupakan hasil pemekaran dari Kabupaten Ngada. Meski baru berusia 12 tahun, Nagekeo siap menggelar Festival    pada Agustus 2019 mendatang. Hal tersebut disampaikan   , Johanes Don Bosco Do, pada   Festival Literasi di Gedung Perpusnas, Jalan Medan Merdeka Selatan, Kamis, (11/4/2019). Meski masih berusia muda,    tidak ingin ketinggalan dalam berpartisipasi menebarkan virus   . ""Apalagi di era digital seperti sekarang ini, kemampuan literasi mutlak diperlukan agar tidak ditinggal zaman. Kita semua tahu bahwa perpustakaan adalah penyangga peradaban. Lewat literasi, Nagekeo bisa menyongsong era digital,"" ucap Don Bosco. Menurut dia, literasi sendiri bukan hanya diartikan sebagai gemar membaca buku. Untuk itulah, pada Festival Literasi Nagekeo yang dilaksanakan Agustus nanti akan ada literasi tenun, literasi wisata, hingga literasi kuliner. Pada kesempatan yang sama, Deputi Pengembangan Bahan Pustaka dan Jasa Informasi   , Ofy Sofiana, mengatakan bahwa bangsa Indonesia menjadi besar seperti saat ini karena keinginan masyarakatnya yang kuat untuk belajar. Ofy menambahkan, menciptakan masyarakat literasi adalah hal yang mutlak dilakukan. Bahkan, untuk itulah pemerintah daerah bisa menggunakan momen-momen massal, seperti festival, bazar buku, atau bisa juga dengan memperbanyak sumber-sumber bacaan berkualitas yang mudah diakses oleh siapapun, baik masyarakat di desa maupun di perkotaan. ""Festival Literasi Nagekeo ini merupakan kerjasama antara Kabupaten Nagekeo dengan Perpustakaan Nasional sehingga kami berharap dengan diadakannya acara ini dapat menjadi langkah awal untuk memperkenalkan Kabupaten Nagekeo secara nasional,"" ujar Ofy.","Nagekeo, Kabupaten Termuda Ini Gelar Festival Literasi Nagekeo 2019!"
"dict","bola","Lille Vs PSG, Kalah Telak 1-5 Bikin Pesta Juara Mbappe dkk Tertunda  -    (  ) harus menerima kekalahan telak dari    pada lanjutan laga Ligue 1, kasta teratas Liga Perancis, Minggu (14/4/2019) atau Senin dini hari WIB. Pada laga yang berlangsung di markas Lille, Stade Pierre Mauroy,    dkk takluk dengan skor 1-5. Gol-gol kemenangan tuan rumah pada laga tersebut dicetak oleh Meunier (bunih diri 7'), Pepe (51'), Bamba (65'), dos Santos Magalhães (71'), dan Jose Fonte (84'). Adapun satu-satunya gol PSG dicetak oleh Juan Bernat pada menit ke-11, yang kemudian mendapat kartu merah pada menit ke-36 karena melakukan pelanggaran keras terhadap Nicolas Pepe. Hasil ini membuat PSG melewatkan kesempatan untuk mengunci gelar juara Ligue 1 lebih awal untuk kali kedua berturut-turut. Sebelumnya, pada pekan lalu, pasukan Thomas Tuechel itu memiliki kesempatan untuk memastikan gelar juara, tetapi ditahan 2-2 Strasbourg di Stadion Parc des Princes. Ini adalah pertama kalinya PSG kebobolan lima gol dalam pertandingan liga sejak 2 Desember 2000, sejak mereka kalah 1-5 dari Sedan di Divisi 1. PSG masih memimpin klasemen Liga Perancis. Mereka mengumpulkan 81 poin dari 31 laga, unggul 17 angka atas Lille yang sudah bermain 32 kali.  Pasukan Thomas Tuechel memiliki kesempatan ketiga untuk memastikan gelar juara pada Rabu (17/4/2019), membutuhkan kemenangan di Nantes untuk memastikan gelar Ligue 1 kelima dalam enam musim terakhir.  ","Lille Vs PSG, Kalah Telak 1-5 Bikin Pesta Juara Mbappe dkk Tertunda"
"dict","nasional","Politik Uang Terang Benderang, Hanya 5 Km dari Pusat Kota Jakarta     masih ada? Bagaimana caranya dilakukan? Aiman membuktikannya, nyata. Tidak perlu jauh-jauh, dekat dengan pusat kota. Masih di Jakarta.   ,  ,  , serangan fajar, apa pun istilahnya, marak terjadi jelang pencoblosan. Aktivitas terlarang ini terdengar sulit dibuktikan. Para pelaku bergerak di masa tenang hingga hari-H pencoblosan. Apa yang dilakukan? Bagaimana caranya? Entahlah. Tapi yang jelas, politik uang masih kerap kita dengar. Penelitian yang dilakukan peneliti psikologi politik Universitas Indonesia (UI), Hamdi Muluk, mendapatkan, keterpilihan seorang calon ditentukan oleh tiga hal: diketahui, dikenal, dan disukai. Cara tercepat agar seorang calon mendapatkan ketiga syarat itu adalah dengan tatap muka dalam bentuk apa pun, disengaja ataupun tidak disengaja, dan memberikan bantuan. Dengan dua cara ini, konsep diketahui, dikenal, dan disukai, akan semakin melekat pada calon. Tapi ada cara instan untuk mendapatkan suara tanpa harus bersusah payah mengejar tiga syarat di atas. Dalam kesempatan wawancara dengan program  , Profesor Hamdi Muluk mengungkapkan, hanya dengan politik uang seorang caleg bisa menembus kontestasi dan menjadi pemenang. Ini masuk akal karena di antara sekian banyak jumlah caleg yang dipampang tentu hanya sedikit yang diingat. Paling banter diingat kalau tidak saudara ya tetangga. Namun, banyak orang yang tidak mengenal siapa caleg di wilayahnya. Persoalan ini dipecahkan dengan memberikan ""sesuatu"" kepada para pemilih. Tak perlu jauh bagi saya untuk menemukan praktik politik uang seperti ini. Saya hanya mengembara dalam radius sekitar 5 kilometer dari pusat Ibu Kota Jakarta dan menemukan praktik politik uang secara terang benderang. Saya menemukan sebuah perkampungan padat. Di sana banyak dihuni oleh warga asli dan juga warga keturunan yang merupakan pendatang selama puluhan tahun bahkan lebih. Daerah itu dikenal sebagai pusat perdagangan grosir dan sentra industri mikro dan kecil rumahan. Di tempat itu saya bertemu…","Politik Uang Terang Benderang, Hanya 5 Km dari Pusat Kota Jakarta"
