"_type","category","isi","judul"
"dict","tekno","""Unboxing"" Samsung Galaxy A30, Ponsel 3 Kamera Harga Rp 3 Jutaan  -    secara resmi memboyong ponsel terbarunya, yakni    pada 22 Maret kemarin. Ponsel ini dibawa bersamaan dengan seri A lainnya yaitu Galaxy A50. Galaxy A30 memiliki layar AMOLED dengan bentang seluas 6,4 inci. Pada bagian atas, terdapat sebuah   yang membungkus kamera depan. Samsung Galaxy A30 memiliki tiga kamera, dua di belakang dan satu di bagian depan. Kamera selfie milik Galaxy A30 memiliki resolusi 16 megapiksel. Cukup besar untuk sebuah kamera depan. Lensa ini memiliki bukaan f/2.0 untuk menangkap cahaya yang lebih besar. Berbeda dengan A50, Galaxy A30 memiliki sensor sidik jari di bagian belakang. Ponsel ini memiliki dua kamera belakang dengan sensor 16 megapiksel (kamera utama) dan 5 megapiksel wide-angle. Di bagian bawah, terdapat sebuah port USB Type C untuk mengisi daya. Samsung juga masih memertahankan keberadaan jack audio 3,5 mm pada ponsel ini. Pada bagian kiri ponsel, terdapat sebuah slot SIM dan MicroSD. Penyimpanan ponsel ini bisa diekspansi hingga 512 GB. Samsung Galaxy A30 menggunakan bahan yang mengkilat pada kaver belakang. Alhasil, sidik jari pengguna mudah menempel dan ponsel jadi gampang terlihat kotor. Galaxy A30 menggunakan sistem operasi Android 9.0 Pie yang telah dipoles dengan One UI. Sayangnya Galaxy A30 hanya memiliki satu varian RAM dan penyimpanan yakni 4 GB dan 64 GB. Samsung Galaxy A30 dibanderol dengan harga Rp 3,4 juta dan sudah bisa dibeli sejak 29 Maret lalu. ( Bagi Anda yang ingin melihat lebih dekat dengan Galaxy A30, Anda bisa melihat lewat galeri ","""Unboxing"" Samsung Galaxy A30, Ponsel 3 Kamera Harga Rp 3 Jutaan"
"dict","foto","Atiqah Hasiholan Jadi Pemeran Utama di Film Mantan Manten  - Artis peran Atiqah Hasiholan menuturkan, sejak menjadi seorang ibu, ia jadi lebih sensitif.   Tak cuma itu, Atiqah juga sekarang memiliki cara pandang yang berbeda dalam melihat kehidupan.   ""Perubahan enggak tahu ya mungkin kalau aku semenjak jadi ibu, aku jadi lebih sensitif,"" kata Atiqah saat berkunjung ke redaksi Kompas.com di Menara Kompas di Palmerah Selatan, Jakarta Pusat, Rabu (3/4/2019).  ""Aku kayak lebih ngerasa, kepekaannya beda, sebelum dan sesudah jadi ibu cara pandang tentang hidup tuh beda. Pokoknya beda aja,"" sambungnya. Perasaan seperti itu Atiqah rasakan ketika membaca skenario film Mantan Manten. Istri Rio Dewanto ini didapuk menjadi pemeran utama dalam film garapan Visinema Pictures itu. ""Kalau Mantan Manten ini film pertama aku setelah melahirkan, kalau shooting aku sebelumnya ke Malaysia cuma memang belum rilis,"" ujar Atiqah.   ""Jadi ketika aku baca skrip walaupun hubungannya bukan hubungan ibu dan anak, jadi merasa sudut pandangnya bisa melihat lebih luas,"" ucapnya lagi.  Dalam film produksi Visinema Pictures itu, Atiqah berperan sebagai Yasnina, seorang perempuan modern yang belajar menjadi dukun manten atau pemaes. ","Atiqah Hasiholan Jadi Pemeran Utama di Film Mantan Manten"
"dict","tekno","9 Tahun Xiaomi, Ini Deretan Ponsel Inovatif yang Pernah Dibikin","9 Tahun Xiaomi, Ini Deretan Ponsel Inovatif yang Pernah Dibikin"
"dict","entertainment","Kuasa Hukum Anggap P21 Berkas Steve Emmanuel Terburu-buru  - Tim kuasa hukum artis peran   , menilai pihak penegak hukum terlalu terburu-buru dalam memberikan status P21 alias lengkap atas berkas kasus hukum kliennya itu.   Kuasa hukum mengatakan, bahwa hal itu terlihat dari tak cermatnya dakwaan atas dugaan kasus narkoba kepada Steve.   ""Kok seakan terburu-buru langsung P21. Steve juga bertanya-tanya, kayak terburu-buru dan belum lengkap,"" ucap tim kuasa hukum Steve, Jaswin Damanik dalam jumpa pers di kawasan SCBD, Jakarta Selatan, Senin (8/4/2019).   Salah satu contohnya, kata Jaswin, perihal hasil tes urine yang terbukti positif namun tak ada di dalam dakwaan.  Sikap tergesa-gesa itu, kata Jaswin, membuat detail materi dakwaan Steve tak sesuai dengan fakta kasus hukum yang sebenarnya.   ""Sehingga pihak keluarga bertanya-tanya. Soal urine petugas lalai, mereka sudah tes urine (kepada Steve) dan ada fotonya, tapi tidak dimasukkan ke dalam berita acara pemeriksaan,"" ungkap Jaswin.   Jaswin pun meminta kepada pihak penegak hukum untuk memasukkan pasal 127 tentang narkotika yang mengatur tentang pengguna narkotika.   ""Urine hasilnya positif, kenapa tidak dimasukan pasal 127. Dalam hal ini penyidik salah memasukan hukuman (pasal). Tidak menjunjung tinggi asas praduga tidak bersalah. Kami tegaskan, Steve pemakai (bukan pengedar),"" ucapnya.   Steve sendiri ditangkap pada 21 Desember 2018 lalu oleh pihak kepolisian di sebuah kondominium di kawasan Pela Mampang, Jakarta Selatan.   Steve ditangkap dengan barang bukti kokain seberat 92,04 gram dan satu buah alat hisap untuk narkotika jenis kokain bernama Bullet.  Steve diancam dengan pasal 114 ayat (2) Sub 112 ayat (2) undang-undang Republik Indonesia nomor 35 tahun 2009 tentang narkotika.  Dengan ancaman hukuman pidana penjara minimum 5 tahun dan maksimum seumur hidup atau hukuman mati. Kemudian, pihak kepolisian menyatakan berkas kasus hukum Steve telah lengkap untuk dilimpahkan ke kejaksaan pada 21 Februari 2019.  ","Kuasa Hukum Anggap P21 Berkas Steve Emmanuel Terburu-buru"
"dict","tekno","Mirip Waze, Google Maps Kini Punya Fitur untuk Melaporkan Kemacetan","Mirip Waze, Google Maps Kini Punya Fitur untuk Melaporkan Kemacetan"
"dict","foto","Arifin Putra Beradu Akting Dengan Atiqah Hasiholan di Film Mantan Manten - Artis peran   menilai waktu ideal untuk bisa mendalami sebuah peran, kemudian melepaskannya lagi membutuhkan waktu selama satu tahun. Namun, hal itu tidak berlaku saat banyaknya tawaran akting yang berdatangan. ""Ada optimal, ada kenyataan. Kalau optimalnya satu tahun satu film saja,"" kata Arifin saat berkunjung ke redaksi   Menara Kompas di Palmerah Selatan, Jakarta Pusat, Rabu (3/4/2019). ""Di situ ada waktu  di situ ada waktu cukup untuk dalami karakter, terus  lagi, masuk ke karakter selanjutnya. Tapi kenyataannya dalam satu tahun bisa  tiga sampai empat film   ya nanti ada proyek-proyek lagi,"" sambungnya. Arifin bercerita, dia pernah hanya diberikan waktu kurang dari dua minggu untuk berpindah karkater dalam dua film yang berbeda. ""Jadi waktu untuk keluar dari karakter tuh benar-benar sangat terbatas, ya pernah sih cuma ada waktu satu setengah minggu untuk pindah karakter,"" ujar Arifin. ""Buat aku itu enggak wow, itu tragis, karena seharusnya ada waktu untuk persiapan, dan itu juga perpindahannya cukup drastis,"" tambahnya. Arifin mengaku, saat itu dia cukup merasa stres karena dua peran tersebut memiliki perbedaan yang sangat drastis. ""Dari karakter mahasiswa yang drama komedi biasa, tiba-tiba harus ke film yang sangat serius di mana aku harus belajar  ,   dan karakternya beda total,"" ujar Arifin. ""Itu cuma ada waktu satu setengah minggu yang buat aku sih lumayan bikin stres ya,"" lanjut bintang film   itu. ","Arifin Putra Beradu Akting Dengan Atiqah Hasiholan di Film Mantan Manten"
"dict","entertainment","33 Tahun Berkarya, Hedi Yunus Rilis Album Greatest Hits - Menandai 33 tahun berkarya di dunia tarik suara,    (50) merilis album  . Di album ini, terdapat sembilan lagu lama dan tiga karya terbaru dari Hedi.   ""Hari ini alhamdulillah baru   album baru solo saya   yang sebetulnya sudah rilis dari tanggal 1 Desember 2018 lalu,"" ujar Hedi saat menggelar jumpa pers peluncuran album   di Atrium Plaza Semanggi, Jakarta Selatan, Senin (8/4/2019).  Hedi menambahkan, untuk proses kreatif album ini dirinya bekerja sama dengan beberapa penyanyi.  ""(Sebanyak) 12 lagu  , artinya adalah lagu-lagu yang lama banyak yang saya aransemen ulang lagi,"" ungkap Hedi.   ""Kemudian ada beberapa lagu lama yang juga dinyanyikan orang lain seperti, Sara Fajira. Ada juga lagu yang baru, semuanya istilahnya saya menyanyikan kembali ada 'Suratku', 'Prahara Cinta', 'Sebatas Mimpi',""imbuh Hedi.  Sedangkan lagu-lagu yang ia nyanyikan kembali tersebut dihadirkan dengan aransemen baru.   ""Lagu-lagu yang solo di album lama saya, diarensemen ulang sama Andi Rianto, Yovie Widianto, Ifa Fachir, Andez, ada Yudhistira Arianto, ada Tohpati,"" ucapnya.   Beberapa lagunya di album ini digarap dengan aransemen musik   (EDM). Menurut Hedi, hal ini dilakukan demi mengikuti perkembangan zaman.   ""Memang harus menyesuaikan zaman ya, harus kalau itu. Mengikuti alur kekinian harus tapi jangan memaksakan. Jadi, ada unsur EDM tapi enggak terlalu jauh dari aslinya. Biar bisa dinyanyikan dengan baik, enak dan nyaman,"" ujarnya.   Dengan demikian, vokalis grup band Kahitna ini berharap bisa mencakup para pendengar baru dari kalangan milenial.   ""Kan   saya 25 tahun ke atas, tapi dengan terobosan baru ini inginnya bisa memperluas   saya,"" jelasnya.","33 Tahun Berkarya, Hedi Yunus Rilis Album Greatest Hits"
"dict","foto","Penampilan John Mayer di ICE BSD  - Penyanyi John Mayer menampilkan sesuatu yang spesial dalam konser John Mayer World Tour 2019 yang digelar di ICE, BSD City, Tangerang, pada Jumat (5/4/2019).  Selain dengan suara emas dan kepiawaiannya bermain gitar, Mayer menghanyutkan para penonton dengan permainan harmonika yang dia tampilkan saat membawakan lagu ""XO"".  Tak ingin melewatkan momen berharga itu, para penonton ikut bernyanyi sambil mengabadikan aksi panggung Mayer, yang saat itu menggunakan gitar akustik. Kemudian Mayer berjalan mengarah ke bibir panggung sambil memainkan melodi ""Your Body Is Wonderland"".  Suasana semakin pecah ketika Mayer tertangkap kamera sedang memainkan alis ketika bersolo gitar.  Tampak hampir seluruh penonton bergoyang menikmati sajian panggung malam ini. Sebelumnya  Mayer telah berhasil menghibur para penonton dengan lagu-lagu andalannya yakni ""Belief"", ""Helpless"", ""Love On Weekend"", ""Edge of Desire"", dan ""Moving on and Getting Over"". ","Penampilan John Mayer di ICE BSD"
"dict","entertainment","Kirana Larasati: Politisi Lebih Banyak Dibuli daripada Artis  -- Artis peran    (31) mengatakan bahwa politisi lebih banyak dibuli daripada artis.  Kirana menjadi calon anggota legislatif untuk DPR RI dalam Pileg 2019. Ia mencalonkan diri lewat Daerah Pemilihan (Dapil) Jawa Barat 1, yang meliputi Kota Bandung dan Kota Cimahi.  ""Jadi politisi dibuli lebih banyak daripada jadi artis. Ya, dijalani  ,"" kata Kirana dalam wawancara di Plaza Senayan XXI, Jakarta, Senin (8/4/2019).  Kirana Larasati mengatakan pula bahwa buli bisa menimpa profesi apa pun. Ia tidak mau mengambil pusing ketika mengalaminya. ""Biarin  . Buli kan untuk menumbuhkan semangat kita dan kita harus percaya diri  . Namanya hidup, ada orang yang suka dan enggak suka,"" ujarnya. Untuk Pilpres dan Pileg 2019, Kirana Larasati meminta masyarakat untuk tidak menjadi golput alias tak menggunakan hak pilih.   ""Kita bisa makan dan senang-senang, kayak   bioskop, itu kan sebuah kebijakan politik. Kalau kamu mau itu, harus coblos. Golput tidak memberikan apa-apa,"" tekannya.","Kirana Larasati: Politisi Lebih Banyak Dibuli daripada Artis"
"dict","entertainment","Hedi Yunus Kesulitan Bawakan Lagu Bergenre EDM - Dalam album terbarunya berjudul  , penyanyi Hedi Yunus (50) mengaransemen lagu-lagu lamanya dengan memasukkan unsur   (EDM).   Bagi Hedi, hal ini dilakukan agar lagu-lagunya bisa kembali diterima dengan musik yang segar.   ""Supaya lebih kekinian itu kan aransemen yang agak orkestra ada, program EDM-nya juga ada, jadi yang kekinian-kekinian membuat jadi lebih  ,"" ujar Hedi saat menggelar jumpa pers peluncuran album   di Atrium Plaza Semanggi, Jakarta Selatan, Senin (8/4/2019). Hedi mengatakan bahwa membawakan kembali lagunya dengan aransemen musik EDM bukanlah hal yang mudah.  ""Nah pada saat saya lagu dapat aransemen lagu 'Jika' ini kan EDM, sesuatu yang baru buat saya gitu. Pas dengar musiknya, musik dasar, bingung ini nyanyinya kayak   ya,"" ungkapnya.  Pasalnya, musik EDM merupakan sesuatu yang baru bagi vokalis grup band Kahitna.   ""Karena ya jujur   satu hal yang sangat baru yang harus saya lakukan di pernyanyian saya  . Jadi saya enggak   ini musik kayak   nyanyinya, harus seperti apa,   sih yang enak,"" katanya.   Beruntung Hedi bertemu dengan beberapa penyanyi muda yang turut berkolaborasi dalam albumnya seperti Sara Fajira, penyanyi muda yang berduet dengannya di lagu ""Jika"".  ""Jadi ketemu Sara juga yang usianya setengah lebih muda dari usia saya. Tapi dengan pendekatan, saya harus bisa dan alhamdulillah berhasil,"" ujarnya.  Hedi Yunus merilis album baru miliknya berjudul  . Album ini berisi sembilan lagu lagu lama yang diaransemen dan dinyanyikan ulang dan tiga lagu baru. Untuk album barunya Hedi bekerja sama dengan sejumlah musisi, di antaranya Yovie Widianto, Andi Rianto, Tohpati, Ifa Fachir, Yudhistira Arianto dan Andez.","Hedi Yunus Kesulitan Bawakan Lagu Bergenre EDM"
"dict","entertainment","Addie MS Bakal Pandu Penonton Konser Putih Bersatu Nyanyikan ""Indonesia Raya"" - Komposer    akan memandu audiens Konser Putih Bersatu untuk menyanyikan lagu kebangsaan ""Indonesia Raya"".  Konser tersebut akan digelar di Gelora Bung Karno, Jakarta Pusat, pada 13 April 2019 mendatang.  ""Nanti saya akan melakukan hal yang sering saya lakukan, yaitu memimpin   untuk menyanyikan lagu 'Indonesia Raya',"" kata Addie saat ditemui di kawasan Kuningan, Jakarta Selatan, Senin (8/4/2019).  Lagu ""Indonesia Raya"" akan membuka konser yang rencananya dihadiri oleh 500 artis, musisi, budayawan dan seniman Indonesia.  ""Biasanya kalau di daerah-daerah kan ditambah lagu perjuangan, kali ini jadi pembukaan lagu ini  ,"" sambungnya.  Selain Addie, nama musisi besar yang turut terlibat dalam konser itu adalah   .  Pemain drum    ""Slank"" mengatakan bahwa dia dan kawan-kawan masih belum menentukan lagu apa yang akan mereka bawakan.   ""Kita masih bingung. Wah Slank   berapa lagu nih. Jadi kita masih memikirkan   caranya   yang bagus,"" ucap Bimbim.","Addie MS Bakal Pandu Penonton Konser Putih Bersatu Nyanyikan ""Indonesia Raya"""
"dict","entertainment","Addie MS Sebut Lebih Sulit Memandu Orkestra daripada Memandu Massa  - Komposer    mengatakan, sebagai seorang konduktor, lebih sulit baginya memandu sebuah tim orkestra daripada memandu massa.   Addie diketahui akan memandu ribuan penonton Konser Putoh Bersatu menyanyikan lagu ""Indonesia Raya"" pada Sabtu (13/4/2019) di GBK, Jakarta Pusat.  ""Lebih susah pandu orkestra. Ya kalau ini (pandu massa) susah susah gampang lah,"" kata Addie saat di kawasan Kuningan, Jakarta Selatan, Senin (8/4/2019).  Addie bercerita, saat memandu tim orkestranya, dia akan lebih banyak mengatur segala sesuatu di waktu latihan.  ""Kalau di orkestra kan terdiri dari beberapa instrumen yang masing-masing punya partitur, jadi saya memandunya itu lebih banyak di latihan,"" tutur Addie.  ""Di latihan saya akan lebih banyak cerewet. Kalu satu lebih keras dari yang lain saya kasih tahu. Begitu konser saya memandu mereka sesuai partitur,"" sambung suami penyanyi Memes itu.  Sedangkan ketika memandu massa, Addie bertugas untuk menciptakan keselarasan antara musik pengiring dengan suara  .   ""Kalau memandu   itu persoalannya lain sama sekali. Kita punya pengiring musik yang sudah direkam. Nah  pengiring musik itu untuk diselaraskan dengan   itu memang tantangannya luar biasa,"" ujar Addie.  ""Kalau mereka enggak bisa dengar jelas suara rekamannya itu bisa enggak sinkron. Dan kadang saya sering alami itu. Nah tugas saya menyelaraskan itu, tantangannya beda,"" tambahnya.","Addie MS Sebut Lebih Sulit Memandu Orkestra daripada Memandu Massa "
"dict","entertainment","Dewi Rezer Belum Berpikir untuk Menikah Lagi  - Artis peran    mengaku tidak mau buru-buru menikah, meski kini sedang menjalani hubungan dengan pria asal Kanada, Ethan Alarmk.  ""Seserius apa kami jalan saat ini, aku enggak mau bilang ini itu, mau jalani aja saat ini,"" kata Dewi saat dijumpai di XXI Plaza Indonesia, Thamrin, Jakarta Selatan, Senin (8/4/2019).  Dewi mengaku masih ingin mengenal lebih dalam dan masih menikmati hubungannya dengan Ethan saat ini. Mantan istri dari Marcellino Lefrandt tersebut juga enggan menargetkan kapan akan menikah.  ""Menikah itu kan ikatan kontrak yang legal. Aku belum berpikiran sampai ke sana sih, jalani aja,"" ucap dia.  Dewi mengaku bahagia menjalani hubungannya dengan Ethan saat ini. Berbagai kesamaan menyatukan rasa di antara mereka.  ""Kami sama-sama suka  , suka sama  , suka sama kuliner, dan sama-sama suka  ,"" kata dia.","Dewi Rezer Belum Berpikir untuk Menikah Lagi"
"dict","entertainment","Rayakan 10 Tahun Pernikahan, Vega Darwanti Terima Hadiah Cincin  - Pembawa acara    merayakan 10 tahun pernikahannya dengan Dema Sany Sanjaya di Bali beberapa waktu lalu. Menurut Vega, suaminya yang selama ini agak cuek berubah menjadi romantis saat perayaan tersebut. ""Biasanya cuma kasih kue atau apa kalau  . Kalau ini suamiku bisa romantis di Bali, dia kasih cincin,"" kata Vega saat dijumpai di XXI Plaza Indonesia, Thamrin, Jakarta Pusat, Senin (8/4/2019). Vega yang namanya melambung lewat program   mengaku senang dengan kejutan yang diberi oleh suaminya. Vega mengambil hikmah dari 10 tahun membina rumah tangga bersama Dema. ""Menurut aku semua pasangan harus bisa saling mengisi. Kami bertahan karena cinta,"" kata Vega. Selama 10 tahun menikah, Vega mengaku kerap menjalani hubungan jarak jauh dengan Dema lantaran suaminya bekerja di luar kota. Suka dan senang mesti Vega jalani. ""Orang yang tinggal bareng  masih bisa ribut dalam hubungan. Harus komitmen, ada keterlibatan Tuhan, dan menghadapi kesulitan harus bareng-bareng,"" kata Vega.","Rayakan 10 Tahun Pernikahan, Vega Darwanti Terima Hadiah Cincin"
"dict","otomotif","",""
"dict","entertainment","Kata Adiknya, Steve Emmanuel Berhak Mendapatkan Rehabilitasi  - Adik kandung   , Karenina Sunny (32) berharap kakaknya bisa menjalani    atas dugaan kasus narkoba yang kini menjeratnya, bukan sebaliknya.  Karenina berpendapat bahwa hasil positif tes urine yang menunjukkan Steve sebagai pengguna narkoba tak bisa diabaikan oleh penegak hukum yang justru menjeratnya dengan pasal sebagai pengedar.   ""Saya tahu kakak saya (Steve Emmanuel) adalah orang yang baik dan dia hanyalah korban penyalahgunaan narkotika (kokain),"" kata Karenina yang didampingi kuasa hukum Steve, Jaswin Damanik dan pihak keluarga lainnya dalam jumpa pers Richard Claproth di kawasan SCBD, Jakarta Selatan, Senin (8/4/2019).  Meski tidak mengetahui persis prosedur hukum yang dijalani kakaknya, wanita yang akrab disapa Nina percaya bahwa semua proses hukum yang terbaik bisa diberikan oleh tim kuasa hukum Steve.  ""Intinya saya paham, yang jelas Steve itu pemakai atau pengguna narkotika. Tetapi,   tidak dimasukkan ke dalam dakwaan? Kalau pemakai kan wajib dilakukan asesmen atau rehab. Dia punya hak untuk dapat bantuan rehab,"" ucapnya.  Karenina mengatakan, apa yang ia lakukan bukanlah upaya untuk memperlambat proses hukum yang sedang berjalan, melainkan sekadar membantu dan memberi dukungan kepada Steve.  ""Sebenarnya polisi dan jaksa mengatakan kalau Steve pemakai sebenarnya. Kita tidak melawan mereka. Kita sangat mendukung apa yang dikatakan jaksa penuntut umum (JPU) dalam dakwaan. Fakta adalah didakwaan, faktanya adalah membuktikan Steve adalah pemakai dan pengguna, tidak yang lain,"" jelasnya.  Diberitakan sebelumnya, pemain sinetron bernama panjang Steve Emmanuel Halim itu ditangkap Satuan Reserse Narkotika Polres Metro Jakarta Barat ketika berada di lobi Apartemen Kondominum Kintamani, kawasan Mampang Prapatan, Jakarta Selatan, 21 Desember 2018.  Saat diamankan polisi, Steve diketahui memiliki narkotika jenis kokain seberat 92,04 gram? beserta alat hisapnya.  Atas perbuatannya, Steve Emmanuel dikenakan Ppasal 112 ayat 2 juncto Pasal 114 ayat 2 Undang Undang Narkotika.  Steve Emmanuel mengaku, barang haram itu adalah sisa 100 gram kokain yang diselundupkannya dari Belanda pada 11 September 2018.   Pihak penegak hukum sendiri menjerat Steve dengan pasal pengedar lantaran jumlah barang bukti yang ada terbilang cukup banyak untuk kategori pengguna.   Pasalnya, dengan barang bukti seberat 91,08 gram narkotika jenis kokain, Steve Emmanuel disangkalkan dengan pasal pengedar narkotika, karena diduga berhasil menyelundupkan kokain dari Belanda ke Indonesia dengan jumlah yang besar.","Kata Adiknya, Steve Emmanuel Berhak Mendapatkan Rehabilitasi"
"dict","otomotif","",""
"dict","entertainment","Cut Meyriska Lebih Selektif Terima Tawaran Peran - Setelah memutuskan untuk berhijab, artis peran Cut Ratu Meyriska (25) mengaku lebih selektif dalam menerima tawaran untuk berakting.  Meski demikian, wanita yang karib disapa Chika ini mengaku tak akan meninggalkan dunia  .   ""Enggak kok tetap (berkarya), tapi aku ada beberapa sinetron yang lepas hijab dan itu aku benar-benar enggak aku ambil. Kalau tawarannya pakai hijab ya aku ambil,"" ungkap Chika saat ditemui di kawasan Cipete, Jakarta Selatan, Senin (8/4/2019).  Sejauh ini, meski ada beberapa tawaran menghampirinya, Chika mengatakan dirinya tidak tergoda.   ""Alhamdulillah enggak (tergoda) sih, enggak ada yang pikiran pekerjaan, kalau nanti yang gimana-gimana sih Alhamdulillah kuat banget,"" ujar Chika.  Meski kini menjadi lebih selektif, Chika tak merasa takut akan kehilangan pekerjaannya. Bagi Chika rezeki untuknya sudah ada yang mengatur.   ""Oh enggak (takut) semua rezeki di tangan Allah, jadi rezeki itu enggak akan ketukar,"" jelasnya   ""Jadi kalau takut pekerjaan bersaing, aku enggak pernah takut sama sekali. Kalau sudah menetapkan rezeki buat aku, ya buat aku, tapi kalau itu bukan buat aku ya itu bukan buat aku,"" kata Chika.  ","Cut Meyriska Lebih Selektif Terima Tawaran Peran"
"dict","otomotif","",""
"dict","otomotif","",""
"dict","entertainment","Raffi Ahmad Sebut Rumput Tetangga sebagai Film Termahal  - Artis peran sekaligus produser    mengatakan, bahwa   adalah film termahal yang digarap rumah produksi RA Pictures. ""Jujur ini film kami termahal, karena kami mau coba yang terbaik,"" kata Raffi yang enggan menyebutnya dalam wawancara di XXI Plaza Indonesia, Thamrin, Jakarta Pusat, Senin (8/4/2019). ""Mahal itu bukan foya-foya, tapi memberikan yang terbaik dari pemain, produksi  , semua dari promo kami coba,"" sambung Raffi. Sejak awal mendirikan RA Pictures, suami dari artis peran Nagita Slavina itu memang tidak mau setengah-setengah menjalaninya. Menurut Raffi, dari sejumlah film RA Pictures yang telah dirilis, pendapatannya cukup lumayan. Raffi juga meminimalisir kerugian dalam hal ini. Sejumlah film telah dirilis oleh RA Pictures sejak awal 2018 lalu adalah The Secret, Dimsum Martabak, 13 Haunted, Arwah, Kesempatan Keduda, Nyai, dan After Met You. ""Ini ( ) jagoan kami, walau minggu depan ada film  , tapi mudah-mudahan di-  sama semua,"" kata Raffi.","Raffi Ahmad Sebut Rumput Tetangga sebagai Film Termahal"
"dict","otomotif","",""
"dict","otomotif","",""
"dict","otomotif","",""
"dict","entertainment","Soal Tak Ajukan Praperadilan, Kuasa Hukum Steve Emmanuel Sebut Nasi Sudah Menjadi Bubur  - Kuasa Hukum   , Jaswin Damanik menilai banyak kejanggalan atas dugaan kasus narkoba yang menjerat kliennya, terutama berkait dakwaan yang diberikan kepada Steve.   Meski demikian, Jaswin mengatakan bahwa pihaknya akan melakukan upaya hukum melalui eksepsi serta pembelaan lainnya selama proses persidangan yang kini sedang berlangsung.   Berkait upaya praperadilan yang menjadi hak Steve untuk diajukan atas penahanan dirinya, Jaswin menyatakan bahwa pihaknya sudah tak bisa menempuh upaya itu karena dianggap telah terlambat secara hukum.   ""Jadi kami itu mepet waktunya kalau mau ajukan praperadilan. Kami menangani Steve hanya beberapa minggu sebelum sidang pertama digelar,"" ucap Jaswin dalam jumpa pers di kawasan SCBD, Jakarta Selatan, Senin (8/4/2019).     Kata Jaswin, andaikata dipaksakan maka hasilnya tak akan maksimal karena butuh banyak persiapan.   ""Ibarat kata nasi sudah menjadi bubur, begitulah kira-kira,"" ungkap Jaswin.   Namun, Jaswin akan mengupayakan yang terbaik atas proses hukum yang kini dijalani oleh Steve.   ""Meski sudah jadi bubur, tapi kan bubur itu bisa dikasih kecap, bumbu supaya enak, begitulah kira-kira yang akan dilakukan kami,"" ucapnya.    Yang paling penting, kata Jaswin, ia dan tim tengah menanti hasil dari putusan sela oleh majelis hakim atas eksepsi yang diajukan oleh pihaknya atas dakwaan yang diberikan oleh jaksa kepada Steve.  Sidang lanjutan dugaan kasus narkoba Steve dijadwalkan akan digelar kembali dengan agenda putusan sela pada Kamis (11/4/2019) lusa.  Steve sendiri dikenakan Pasal 112 ayat 2   Pasal 114 ayat 2 Undang Undang tentang Narkotika.  Karena kasus ini, Steve yang ditangkap pada 21 Desember 2018 lalu terancam hukuman pidana penjara minimum 5 tahun dan maksimum seumur hidup atau hukuman mati.","Soal Tak Ajukan Praperadilan, Kuasa Hukum Steve Emmanuel Sebut Nasi Sudah Menjadi Bubur"
"dict","entertainment","Raffi Ahmad Bantah Nagita Slavina Hamil Anak Kedua  - Artis peran dan pembawa acara    membantah kabar bahwa istrinya,    alias Gigi, sedang hamil anak kedua. ""Iya, itu banyak yang bilang Gigi hamil, Gigi hamil. Belum,"" kata Raffi dalam wawancara di XXI Plaza Indonesia, Thamrin, Jakarta Pusat, Senin (8/4/2019). Kalaupun Nagita hamil, kata Raffi, ia tidak akan menyembunyikan kabar baik tersebut kepada publik. ""Kalau sudah hamil pasti dikasih tahu, doakan saja. Kami juga sekarang lagi enggak menggebu-ngebu, santai saja,"" kata ayah dari Rafathar Malik Ahmad ini. Raffi juga menegaskan, bahwa ia dan Nagita tak merasa perlu menjalani program kehamilan. ""Sedikasihnya saja kalau anak mah. Kami santai saja yang penting berjalan terus ke depan,"" kata dia.","Raffi Ahmad Bantah Nagita Slavina Hamil Anak Kedua"
