"_type","category","isi","judul"
"dict","hot","Jakarta - Anak Gisella Anastasia, Gempita Nora Marten akhirnya sudah bertemu Wijin, pria yang tengah lengket dengan sang ibunda. Pertemuan itu beredar dalam video.Gisel yang serasi memakai gaun putih bareng Gempita menggiring sang putri bertemu dengan Wijin yang santai memakai kaus hitam.Baca juga: Makin Lengket, Gisel dan Wijin Dapat Dukungan dari Para Artis googletag.cmd.push(function() { googletag.display('div-gpt-ad-1535944650921-0'); }); Pertemuan itu singkat. Tapi tampaknya bikin pusat perhatian orang sekitar yang melihat.Gisel yang belum lama bercerai dari Gading Marten memang semakin dekat dan lengket dengan sang pebasket. Sementara Wijin dari konfirmasinya tampak meminta doa agar hubungannya semakin lebih jauh.Ia mengisyaratkan memang ingin lebih dekat dengan jebolan Indonesian Idol tersebut. Ia menganggap statusnya yang sama-sama single adalah langkah awal yang baik.Tonton juga: Cie! Akhirnya Gisel Pertemukan Gempi dengan Wijin[Gambas:Video 20detik] (kmb/lth) gempita wijin wijaya saputra gisel gisella anastasia Photo Gallery 1 celeb Lewat Film, Gisel Siap Bersatu dengan Gading Marten celeb Lewat Film, Gisel Siap Bersatu dengan Gading Marten celeb Lewat Film, Gisel Siap Bersatu dengan Gading Marten celeb Lewat Film, Gisel Siap Bersatu dengan Gading Marten celeb Lewat Film, Gisel Siap Bersatu dengan Gading Marten celeb Lewat Film, Gisel Siap Bersatu dengan Gading Marten 1 celeb Senyum Gisel saat Dapatkan Hak Asuh Gempita Usai Resmi Cerai celeb Senyum Gisel saat Dapatkan Hak Asuh Gempita Usai Resmi Cerai celeb Senyum Gisel saat Dapatkan Hak Asuh Gempita Usai Resmi Cerai celeb Senyum Gisel saat Dapatkan Hak Asuh Gempita Usai Resmi Cerai celeb Senyum Gisel saat Dapatkan Hak Asuh Gempita Usai Resmi Cerai celeb Senyum Gisel saat Dapatkan Hak Asuh Gempita Usai Resmi Cerai 2 celeb Ariel Tatum Jadi Mermaid hingga Mata Sembab Gisel di Sidang Cerai celeb Ariel Tatum Jadi Mermaid hingga Mata Sembab Gisel di Sidang Cerai celeb Ariel Tatum Jadi Mermaid hingga Mata Sembab Gisel di Sidang Cerai celeb Ariel Tatum Jadi Mermaid hingga Mata Sembab Gisel di Sidang Cerai celeb Ariel Tatum Jadi Mermaid hingga Mata Sembab Gisel di Sidang Cerai celeb Ariel Tatum Jadi Mermaid hingga Mata Sembab Gisel di Sidang Cerai celeb Ariel Tatum Jadi Mermaid hingga Mata Sembab Gisel di Sidang Cerai 3 celeb Penampilan Gisel dan Mata Sembabnya di Sidang Cerai celeb Penampilan Gisel dan Mata Sembabnya di Sidang Cerai celeb Penampilan Gisel dan Mata Sembabnya di Sidang Cerai celeb Penampilan Gisel dan Mata Sembabnya di Sidang Cerai celeb Penampilan Gisel dan Mata Sembabnya di Sidang Cerai celeb Penampilan Gisel dan Mata Sembabnya di Sidang Cerai 4 celeb Angela Lee Bebas, Duka Ayu Dewi hingga Ge Pamungkas Nikah celeb Angela Lee Bebas, Duka Ayu Dewi hingga Ge Pamungkas Nikah celeb Angela Lee Bebas, Duka Ayu Dewi hingga Ge Pamungkas Nikah celeb Angela Lee Bebas, Duka Ayu Dewi hingga Ge Pamungkas Nikah celeb Angela Lee Bebas, Duka Ayu Dewi hingga Ge Pamungkas Nikah celeb Angela Lee Bebas, Duka Ayu Dewi hingga Ge Pamungkas Nikah celeb Angela Lee Bebas, Duka Ayu Dewi hingga Ge Pamungkas Nikah celeb Angela Lee Bebas, Duka Ayu Dewi hingga Ge Pamungkas Nikah celeb Angela Lee Bebas, Duka Ayu Dewi hingga Ge Pamungkas Nikah celeb Angela Lee Bebas, Duka Ayu Dewi hingga Ge Pamungkas Nikah celeb Angela Lee Bebas, Duka Ayu Dewi hingga Ge Pamungkas Nikah 5 celeb Senyum Gisel dan Tatapan Kosong Gading Marten celeb Senyum Gisel dan Tatapan Kosong Gading Marten celeb Senyum Gisel dan Tatapan Kosong Gading Marten celeb Senyum Gisel dan Tatapan Kosong Gading Marten celeb Senyum Gisel dan Tatapan Kosong Gading Marten celeb Senyum Gisel dan Tatapan Kosong Gading Marten celeb Senyum Gisel dan Tatapan Kosong Gading Marten celeb Senyum Gisel dan Tatapan Kosong Gading Marten celeb Senyum Gisel dan Tatapan Kosong Gading Marten 6 celeb Angel Lelga Digerebek Vicky, Gisel dan Gading hingga Baim Wong Nikah celeb Angel Lelga Digerebek Vicky, Gisel dan Gading hingga Baim Wong Nikah celeb Angel Lelga Digerebek Vicky, Gisel dan Gading hingga Baim Wong Nikah celeb Angel Lelga Digerebek Vicky, Gisel dan Gading hingga Baim Wong Nikah celeb Angel Lelga Digerebek Vicky, Gisel dan Gading hingga Baim Wong Nikah celeb Angel Lelga Digerebek Vicky, Gisel dan Gading hingga Baim Wong Nikah celeb Angel Lelga Digerebek Vicky, Gisel dan Gading hingga Baim Wong Nikah celeb Angel Lelga Digerebek Vicky, Gisel dan Gading hingga Baim Wong Nikah celeb Angel Lelga Digerebek Vicky, Gisel dan Gading hingga Baim Wong Nikah celeb Angel Lelga Digerebek Vicky, Gisel dan Gading hingga Baim Wong Nikah celeb Angel Lelga Digerebek Vicky, Gisel dan Gading hingga Baim Wong Nikah 7 celeb Gisel Buka-bukaan Cerai, Mereka Benci Penggerebekan Angel Lelga celeb Gisel Buka-bukaan Cerai, Mereka Benci Penggerebekan Angel Lelga celeb Gisel Buka-bukaan Cerai, Mereka Benci Penggerebekan Angel Lelga celeb Gisel Buka-bukaan Cerai, Mereka Benci Penggerebekan Angel Lelga celeb Gisel Buka-bukaan Cerai, Mereka Benci Penggerebekan Angel Lelga celeb Gisel Buka-bukaan Cerai, Mereka Benci Penggerebekan Angel Lelga celeb Gisel Buka-bukaan Cerai, Mereka Benci Penggerebekan Angel Lelga 8 celeb Blak-blakan Gisel soal Gugatan Cerainya ke Gading Marten celeb Blak-blakan Gisel soal Gugatan Cerainya ke Gading Marten celeb Blak-blakan Gisel soal Gugatan Cerainya ke Gading Marten celeb Blak-blakan Gisel soal Gugatan Cerainya ke Gading Marten celeb Blak-blakan Gisel soal Gugatan Cerainya ke Gading Marten celeb Blak-blakan Gisel soal Gugatan Cerainya ke Gading Marten 9 celeb Jika Gading Marten dan Gisel Cerai, Gempi Ikut Siapa? celeb Jika Gading Marten dan Gisel Cerai, Gempi Ikut Siapa? celeb Jika Gading Marten dan Gisel Cerai, Gempi Ikut Siapa? celeb Jika Gading Marten dan Gisel Cerai, Gempi Ikut Siapa? celeb Jika Gading Marten dan Gisel Cerai, Gempi Ikut Siapa? celeb Jika Gading Marten dan Gisel Cerai, Gempi Ikut Siapa? celeb Jika Gading Marten dan Gisel Cerai, Gempi Ikut Siapa? celeb Jika Gading Marten dan Gisel Cerai, Gempi Ikut Siapa? celeb Jika Gading Marten dan Gisel Cerai, Gempi Ikut Siapa? 10 celeb Dikabarkan Cerai, Ingat Momen Ini Gading Marten dan Gisel? celeb Dikabarkan Cerai, Ingat Momen Ini Gading Marten dan Gisel? celeb Dikabarkan Cerai, Ingat Momen Ini Gading Marten dan Gisel? celeb Dikabarkan Cerai, Ingat Momen Ini Gading Marten dan Gisel? celeb Dikabarkan Cerai, Ingat Momen Ini Gading Marten dan Gisel? celeb Dikabarkan Cerai, Ingat Momen Ini Gading Marten dan Gisel? 11 celeb Melihat Lagi Kemesraan Gading Marten dan Gisel celeb Melihat Lagi Kemesraan Gading Marten dan Gisel celeb Melihat Lagi Kemesraan Gading Marten dan Gisel celeb Melihat Lagi Kemesraan Gading Marten dan Gisel celeb Melihat Lagi Kemesraan Gading Marten dan Gisel celeb Melihat Lagi Kemesraan Gading Marten dan Gisel celeb Melihat Lagi Kemesraan Gading Marten dan Gisel 12 celeb Deretan Seleb Hot Mom yang Bikin Salfok celeb Deretan Seleb Hot Mom yang Bikin Salfok celeb Deretan Seleb Hot Mom yang Bikin Salfok celeb Deretan Seleb Hot Mom yang Bikin Salfok celeb Deretan Seleb Hot Mom yang Bikin Salfok celeb Deretan Seleb Hot Mom yang Bikin Salfok 13 celeb Perubahan Dratis Penyanyi dari Ajang Pencarian Bakat celeb Perubahan Dratis Penyanyi dari Ajang Pencarian Bakat celeb Perubahan Dratis Penyanyi dari Ajang Pencarian Bakat celeb Perubahan Dratis Penyanyi dari Ajang Pencarian Bakat celeb Perubahan Dratis Penyanyi dari Ajang Pencarian Bakat celeb Perubahan Dratis Penyanyi dari Ajang Pencarian Bakat 14 celeb Saat Gisel Pamer Otot Punggung celeb Saat Gisel Pamer Otot Punggung celeb Saat Gisel Pamer Otot Punggung celeb Saat Gisel Pamer Otot Punggung celeb Saat Gisel Pamer Otot Punggung celeb Saat Gisel Pamer Otot Punggung 15 celeb Serunya Momen Liburan Keluarga Gading-Gisel di Milan celeb Serunya Momen Liburan Keluarga Gading-Gisel di Milan celeb Serunya Momen Liburan Keluarga Gading-Gisel di Milan celeb Serunya Momen Liburan Keluarga Gading-Gisel di Milan celeb Serunya Momen Liburan Keluarga Gading-Gisel di Milan celeb Serunya Momen Liburan Keluarga Gading-Gisel di Milan 16 celeb Gisel yang Makin Manis Saja celeb Gisel yang Makin Manis Saja celeb Gisel yang Makin Manis Saja celeb Gisel yang Makin Manis Saja celeb Gisel yang Makin Manis Saja 17 celeb Dibilang Terlalu Seksi, Gisel Kena Nyinyir Netizen celeb Dibilang Terlalu Seksi, Gisel Kena Nyinyir Netizen celeb Dibilang Terlalu Seksi, Gisel Kena Nyinyir Netizen celeb Dibilang Terlalu Seksi, Gisel Kena Nyinyir Netizen celeb Dibilang Terlalu Seksi, Gisel Kena Nyinyir Netizen celeb Dibilang Terlalu Seksi, Gisel Kena Nyinyir Netizen celeb Dibilang Terlalu Seksi, Gisel Kena Nyinyir Netizen celeb Dibilang Terlalu Seksi, Gisel Kena Nyinyir Netizen celeb Dibilang Terlalu Seksi, Gisel Kena Nyinyir Netizen 18 celeb Lihat Senyum Manis Gisel Temani Gerimis Sore Ini celeb Lihat Senyum Manis Gisel Temani Gerimis Sore Ini celeb Lihat Senyum Manis Gisel Temani Gerimis Sore Ini celeb Lihat Senyum Manis Gisel Temani Gerimis Sore Ini celeb Lihat Senyum Manis Gisel Temani Gerimis Sore Ini 19 celeb Saat Gisel Pamer Bahu Seksinya celeb Saat Gisel Pamer Bahu Seksinya celeb Saat Gisel Pamer Bahu Seksinya celeb Saat Gisel Pamer Bahu Seksinya celeb Saat Gisel Pamer Bahu Seksinya celeb Saat Gisel Pamer Bahu Seksinya 20 1","Cihuy... Gempita Akhirnya Sudah Kenalan dengan Wijin!"
"dict","sport","Jakarta - Sirkuit Mandalika akan aman buat para rider MotoGP. CEO Dorna, Carmelo Ezpeleta, yang mengungkapkan hal itu.Indonesia ditunjuk menjadi salah satu tuan rumah seri MotoGP 2021. Keputusan itu sudah dipresentasikan pada seri perdana balapan musim ini, MotoGP Qatar.Ezpeleta juga sudah bertemu dengan Presiden RI Joko Widodo sebagai bentuk komitmen untuk menggelar balapan kuda besi tingkat Indonesia itu ke tanah air. googletag.cmd.push(function() { googletag.display('div-gpt-ad-1535945783791-0'); }); Mandalika, salah satu daerah di Lombok, Nusa Tenggara Barat, yang akan menjadi temat balapan. Balapan di sana akan menjadi adu cepat dengan sirkuit jalan raya yang pertama di MotoGP.Baca juga: Ternyata Ini Alasan MotoGP Pilih Indonesia Jadi Tuan RumahPihak konsultan balapan, MRK1 Consulting, sadar bahwa ada keraguan balapan MotoGP akan berlangsung di jalan raya. Lewat Managing Director-nya, Mark Hughes, yang menjelaskan itu.""Kami sangat sadar bahwa kami mengumumkan proyek ini ada banyak skeptisme mengenai konsep sirkuit jalanan,"" kata Hughes di Crash.""Kami harus membuatnya sangat jelas bahwa treknya suah didesain dan akan dibangun dengan standar keamanan FIM untuk MotoGP,"" dia menambahkan.Hal yang sama juga diungkapkan Ezpelata. Fasilitas lengkap juga akan mendukung sirkuit Mandalika.""Kami selalu bilang bahwa kami tak akan membalap di sirkuit jalan raya, tapi yang ini mempunyai semua fasilitas dari sirkuit jalan raya --di tengah 'kota', semua hotel akan ada di sana-- tapi dengan keamaman (safety) penuh untuk para rider,"" kata Ezpeleta.Baca juga: Jokowi: Sirkuit Mandalika Indah Sekali, Mepet Pantai (cas/mrp) motogp indonesia sirkuit mandalika motogp","Sirkuit Jalan Raya Mandalika Dijamin Aman untuk Para Riders"
"dict","hot","Jakarta - Tsania Marwa menjelaskan kronologi cekcok yang dialaminya di kediaman Atalarik Syah. Saat itu, dirinya bermaksud mengunjungi kedua buah hatinya, setelah dua tahun lamanya tak bertemu.""Pada hari Sabtu tgl 16 Maret pukul 5 sore saya mendatangi kediaman Atalarik dengan tujuan bertemu anak-anak dan membawa kado. Saya hanya diantar supir dan ditemenin adik saya di mobil,"" ujar Tsania Marwa saat konferensi pers di kawasan Gambir, Jakarta Pusat, Selasa (19/3/2019).Baca juga: Cekcok Saat Bertemu Anak, Tsania Marwa Laporkan Atalarik Syah ke Polisi googletag.cmd.push(function() { googletag.display('div-gpt-ad-1535944650921-0'); }); ""Sesuai request, saya masuk sendiri. Mobil saya berhenti dari dua rumah. Saya turun, saya lihat posisi pagar terbuka. Saya masuk sendiri. Ketika masuk, kan ada taman di sana. Emang udah jalan Tuhan anak anak saya lagi main di taman,"" sambungnya lagi.Tsania Marwa pun melepas rindu dengan kedua anaknya. Ia memberikan kado yang sudah disiapkan sebelumnya. Saat itu pula, Atalarik Syah tak henti menyindirnya dengan kata-kata tak pantas. Mantan suaminya itu pun makin geram ketika Tsania Marwa mencoba melawan dengan menaikkan nada bicaranya. Cekcok makin tak terhindarkan ketika dua saudara Atalarik Syah ikut dalam pertikaian tersebut. Tsania Marwa menyebut kedua lelaki itu turut memanaskan suasana hingga membuat Atalarik makin emosi.""Terus ada yang bilang, 'itu pasti bawa rekaman pak'. Terus dia tarik tas saya, saya didorong. Akhirnya main dorong-dorongan. Tas dan itu dirampas,"" kata Tsania Marwa. Saat itu, Tsania Marwa hanya bisa pasrah karena merasa tak mampu lagi untuk melawan. Ia pun pergi meninggalkan kediaman Atalarik Syah dengan air mata dan kenangan buruk.""Terus ya udahlah. Saya nggak mungkin menang lawan tiga laki-laki. Saya cuma mau main sama anak saya. Akhirnya saya keluar, di situ saya sudah syok. Saya nangis,"" ia menandaskan. (hnh/kmb) tsania marwa atalarik syah tsania marwa gugat atalarik syah polisi Photo Gallery 1 kpop Tiba di Kantor Polisi, Seungri Menunduk dan Minta Maaf kpop Tiba di Kantor Polisi, Seungri Menunduk dan Minta Maaf kpop Tiba di Kantor Polisi, Seungri Menunduk dan Minta Maaf kpop Tiba di Kantor Polisi, Seungri Menunduk dan Minta Maaf kpop Tiba di Kantor Polisi, Seungri Menunduk dan Minta Maaf kpop Tiba di Kantor Polisi, Seungri Menunduk dan Minta Maaf 1 photo Ekspresi Zul, Vokalis Band Zivilia Terduga Bandar Narkoba photo Ekspresi Zul, Vokalis Band Zivilia Terduga Bandar Narkoba photo Ekspresi Zul, Vokalis Band Zivilia Terduga Bandar Narkoba photo Ekspresi Zul, Vokalis Band Zivilia Terduga Bandar Narkoba photo Ekspresi Zul, Vokalis Band Zivilia Terduga Bandar Narkoba photo Ekspresi Zul, Vokalis Band Zivilia Terduga Bandar Narkoba photo Ekspresi Zul, Vokalis Band Zivilia Terduga Bandar Narkoba photo Ekspresi Zul, Vokalis Band Zivilia Terduga Bandar Narkoba photo Ekspresi Zul, Vokalis Band Zivilia Terduga Bandar Narkoba 2 kpop Dituduh Terlibat Narkoba, Sikap Jantan Seungri Bikin Netizen Salut kpop Dituduh Terlibat Narkoba, Sikap Jantan Seungri Bikin Netizen Salut kpop Dituduh Terlibat Narkoba, Sikap Jantan Seungri Bikin Netizen Salut kpop Dituduh Terlibat Narkoba, Sikap Jantan Seungri Bikin Netizen Salut kpop Dituduh Terlibat Narkoba, Sikap Jantan Seungri Bikin Netizen Salut kpop Dituduh Terlibat Narkoba, Sikap Jantan Seungri Bikin Netizen Salut 3 celeb Pesona Atalarik Syah, Si Duda Keren celeb Pesona Atalarik Syah, Si Duda Keren celeb Pesona Atalarik Syah, Si Duda Keren celeb Pesona Atalarik Syah, Si Duda Keren celeb Pesona Atalarik Syah, Si Duda Keren 4 celeb Fachri Albar Dituntut Sembilan Bulan celeb Fachri Albar Dituntut Sembilan Bulan celeb Fachri Albar Dituntut Sembilan Bulan celeb Fachri Albar Dituntut Sembilan Bulan celeb Fachri Albar Dituntut Sembilan Bulan celeb Fachri Albar Dituntut Sembilan Bulan 5 celeb Ini Lingga, Polisi Ganteng Penakluk Hati Vanessa Angel celeb Ini Lingga, Polisi Ganteng Penakluk Hati Vanessa Angel celeb Ini Lingga, Polisi Ganteng Penakluk Hati Vanessa Angel celeb Ini Lingga, Polisi Ganteng Penakluk Hati Vanessa Angel celeb Ini Lingga, Polisi Ganteng Penakluk Hati Vanessa Angel celeb Ini Lingga, Polisi Ganteng Penakluk Hati Vanessa Angel celeb Ini Lingga, Polisi Ganteng Penakluk Hati Vanessa Angel celeb Ini Lingga, Polisi Ganteng Penakluk Hati Vanessa Angel celeb Ini Lingga, Polisi Ganteng Penakluk Hati Vanessa Angel 6 celeb Wajah Lesu Fachri Albar di Polres Jaksel celeb Wajah Lesu Fachri Albar di Polres Jaksel celeb Wajah Lesu Fachri Albar di Polres Jaksel celeb Wajah Lesu Fachri Albar di Polres Jaksel celeb Wajah Lesu Fachri Albar di Polres Jaksel celeb Wajah Lesu Fachri Albar di Polres Jaksel 7 celeb Tertangkap, Fachri Albar Sudah Dinasihati Netizen Ini Sejak Desember Lalu celeb Tertangkap, Fachri Albar Sudah Dinasihati Netizen Ini Sejak Desember Lalu celeb Tertangkap, Fachri Albar Sudah Dinasihati Netizen Ini Sejak Desember Lalu celeb Tertangkap, Fachri Albar Sudah Dinasihati Netizen Ini Sejak Desember Lalu celeb Tertangkap, Fachri Albar Sudah Dinasihati Netizen Ini Sejak Desember Lalu celeb Tertangkap, Fachri Albar Sudah Dinasihati Netizen Ini Sejak Desember Lalu celeb Tertangkap, Fachri Albar Sudah Dinasihati Netizen Ini Sejak Desember Lalu 8 celeb Lelah Mencoba Segala Cara, Tsania Marwa Polisikan Atalarik Syah celeb Lelah Mencoba Segala Cara, Tsania Marwa Polisikan Atalarik Syah celeb Lelah Mencoba Segala Cara, Tsania Marwa Polisikan Atalarik Syah celeb Lelah Mencoba Segala Cara, Tsania Marwa Polisikan Atalarik Syah celeb Lelah Mencoba Segala Cara, Tsania Marwa Polisikan Atalarik Syah celeb Lelah Mencoba Segala Cara, Tsania Marwa Polisikan Atalarik Syah celeb Lelah Mencoba Segala Cara, Tsania Marwa Polisikan Atalarik Syah 9 celeb Tak Ceria Seperti Kemarin, Kenapa Jennifer Dunn? celeb Tak Ceria Seperti Kemarin, Kenapa Jennifer Dunn? celeb Tak Ceria Seperti Kemarin, Kenapa Jennifer Dunn? celeb Tak Ceria Seperti Kemarin, Kenapa Jennifer Dunn? celeb Tak Ceria Seperti Kemarin, Kenapa Jennifer Dunn? celeb Tak Ceria Seperti Kemarin, Kenapa Jennifer Dunn? celeb Tak Ceria Seperti Kemarin, Kenapa Jennifer Dunn? 10 celeb Tertangkap karena Narkoba, Jennifer Dunn Tertawa celeb Tertangkap karena Narkoba, Jennifer Dunn Tertawa celeb Tertangkap karena Narkoba, Jennifer Dunn Tertawa celeb Tertangkap karena Narkoba, Jennifer Dunn Tertawa celeb Tertangkap karena Narkoba, Jennifer Dunn Tertawa celeb Tertangkap karena Narkoba, Jennifer Dunn Tertawa 11 celeb Curhat soal Anak, Tsania Marwa Datangi Komnas Perlindungan Anak celeb Curhat soal Anak, Tsania Marwa Datangi Komnas Perlindungan Anak celeb Curhat soal Anak, Tsania Marwa Datangi Komnas Perlindungan Anak celeb Curhat soal Anak, Tsania Marwa Datangi Komnas Perlindungan Anak celeb Curhat soal Anak, Tsania Marwa Datangi Komnas Perlindungan Anak celeb Curhat soal Anak, Tsania Marwa Datangi Komnas Perlindungan Anak celeb Curhat soal Anak, Tsania Marwa Datangi Komnas Perlindungan Anak 12 celeb Pesan Narkoba, Ini Penampakan Artis FTV dan Pacar di Kantor Polisi celeb Pesan Narkoba, Ini Penampakan Artis FTV dan Pacar di Kantor Polisi celeb Pesan Narkoba, Ini Penampakan Artis FTV dan Pacar di Kantor Polisi celeb Pesan Narkoba, Ini Penampakan Artis FTV dan Pacar di Kantor Polisi celeb Pesan Narkoba, Ini Penampakan Artis FTV dan Pacar di Kantor Polisi celeb Pesan Narkoba, Ini Penampakan Artis FTV dan Pacar di Kantor Polisi 13 celeb Atalarik Lihat Deh, Tsania Marwa Makin Menawan celeb Atalarik Lihat Deh, Tsania Marwa Makin Menawan celeb Atalarik Lihat Deh, Tsania Marwa Makin Menawan celeb Atalarik Lihat Deh, Tsania Marwa Makin Menawan celeb Atalarik Lihat Deh, Tsania Marwa Makin Menawan celeb Atalarik Lihat Deh, Tsania Marwa Makin Menawan 14 celeb Adik Tsania Marwa yang Jadi Paskibraka Cantik Banget Juga Lho! celeb Adik Tsania Marwa yang Jadi Paskibraka Cantik Banget Juga Lho! celeb Adik Tsania Marwa yang Jadi Paskibraka Cantik Banget Juga Lho! celeb Adik Tsania Marwa yang Jadi Paskibraka Cantik Banget Juga Lho! celeb Adik Tsania Marwa yang Jadi Paskibraka Cantik Banget Juga Lho! 15 celeb Resmi Cerai, Tsania Marwa Kurusan? celeb Resmi Cerai, Tsania Marwa Kurusan? celeb Resmi Cerai, Tsania Marwa Kurusan? celeb Resmi Cerai, Tsania Marwa Kurusan? celeb Resmi Cerai, Tsania Marwa Kurusan? celeb Resmi Cerai, Tsania Marwa Kurusan? 16 celeb Dipukul Serda Wira, Ini Pose Gagah Bripda Yoga yang Pernah Main Sinetron GGS celeb Dipukul Serda Wira, Ini Pose Gagah Bripda Yoga yang Pernah Main Sinetron GGS celeb Dipukul Serda Wira, Ini Pose Gagah Bripda Yoga yang Pernah Main Sinetron GGS celeb Dipukul Serda Wira, Ini Pose Gagah Bripda Yoga yang Pernah Main Sinetron GGS celeb Dipukul Serda Wira, Ini Pose Gagah Bripda Yoga yang Pernah Main Sinetron GGS celeb Dipukul Serda Wira, Ini Pose Gagah Bripda Yoga yang Pernah Main Sinetron GGS 17 celeb Bicara Soal Anak di KPAI, Tsania Marwa Menangis celeb Bicara Soal Anak di KPAI, Tsania Marwa Menangis celeb Bicara Soal Anak di KPAI, Tsania Marwa Menangis celeb Bicara Soal Anak di KPAI, Tsania Marwa Menangis celeb Bicara Soal Anak di KPAI, Tsania Marwa Menangis celeb Bicara Soal Anak di KPAI, Tsania Marwa Menangis 18 celeb Ketemu di KPAI, Tsania Marwa dan Atalarik Syah Berdamai? celeb Ketemu di KPAI, Tsania Marwa dan Atalarik Syah Berdamai? celeb Ketemu di KPAI, Tsania Marwa dan Atalarik Syah Berdamai? celeb Ketemu di KPAI, Tsania Marwa dan Atalarik Syah Berdamai? celeb Ketemu di KPAI, Tsania Marwa dan Atalarik Syah Berdamai? celeb Ketemu di KPAI, Tsania Marwa dan Atalarik Syah Berdamai? celeb Ketemu di KPAI, Tsania Marwa dan Atalarik Syah Berdamai? 19 celeb Mesranya Putra Ustad Arifin Ilham dan Istrinya, Tsania Marwa Tetap Tegar celeb Mesranya Putra Ustad Arifin Ilham dan Istrinya, Tsania Marwa Tetap Tegar celeb Mesranya Putra Ustad Arifin Ilham dan Istrinya, Tsania Marwa Tetap Tegar celeb Mesranya Putra Ustad Arifin Ilham dan Istrinya, Tsania Marwa Tetap Tegar celeb Mesranya Putra Ustad Arifin Ilham dan Istrinya, Tsania Marwa Tetap Tegar celeb Mesranya Putra Ustad Arifin Ilham dan Istrinya, Tsania Marwa Tetap Tegar 20 1","Berapi-api, Tsania Marwa Beberkan Kronologi Kekerasan dari Atalarik Syah"
"dict","finance","Jakarta - Direktur Utama Garuda Indonesia, I Gusti Ngurah Askhara Danadiputra mengatakan bahwa pihaknya akan bertemu Boeing dalam waktu dekat. Hal tersebut terkait dengan sikap Garuda yang melakukan pembatalan pada pemesanan unit pesawat Boeing 737 MAX 8.Menurut pria yang biasa dipanggil Ari Akshara ini, pihak Boeing akan mendatangi kantornya untuk menegosiasikan kelanjutan surat penghentian pesanan dari Garuda ke pihak Boeing.""Untuk negosiasi, mereka (Boeing) dengan pemimpin barunya akan datang tanggal 28 Maret (2019) di Kantor Garuda. Jadi kita sudah mulai mendiskusikan, memang jawabannya standar mereka mau mempertimbangkan dan negosiasi, tapi negosiasi ini bisa panjang,"" ungkap Ari saat ditemui di Plaza Indonesia, Jakarta, Kamis (21/3/2019). googletag.cmd.push(function() { googletag.display('div-gpt-ad-1535944306169-0'); }); Baca juga: Garuda Batalkan Pemesanan 49 Unit Boeing 737 MAX 8Dalam negosiasi tersebut menurut Ari, pihaknya memprioritaskan untuk mencari alternatif jenis pesawat lain dibanding dengan menolak mentah-mentah permintaan negosiasi. Dia menegaskan pihaknya sudah memposisikan diri untuk membatalkan jenis 737 MAX 8, hanya saja kalau ada alternarif jenis pesawat lain pihaknya tetap membuka diri.""Prinsipnya kami bukannya mau ganti Boeing tapi akan cari tipe lain, jadi mungkin mereka tawarkan Boeing 737 MAX 10, itu (pesawat) yang baru, saingannya mungkin Airbus 321,"" ungkap Ari.Pihak Garuda, menurut Ari, sudah mengeluarkan dana awalan untuk pemesanan Boeing 737 MAX 8. Agar tidak membuat dana itu sia-sia menghilang, maka dari itu pihaknya ingin bernegosiasi dengan Boeing.""Kita sudah bayar ke Boeing sebesar US$ 26 juta untuk 50 unit yang masuk kan baru satu. Pasti Boeing juga tidak akan kembalikan begitu saja, makanya mereka akan negosiasi,"" ungkap Ari.Baca juga: Alasan Garuda Batalkan Pesanan Boeing 737 MAX 8Dengan penuh kepercayaan diri Ari menyebutkan bahwa pasti Boeing akan memberikan jalan tengah dengan Garuda. Pasalnya, menurut Ari Garuda menjadi salah satu maskapai yang banyak menggunakan pesawat pabrikan Amerika Serikat itu.""Kalau sesuai kontrak kita nggak bisa narik, itu merupakan risiko kalau (uang) nggak balik ya. Nggak mungkin mereka ignore Garuda, kita kan salah satu leader of market mereka nggak mungkin mereka ignore,"" sebut Ari.Sebelumnya, buntut dari pelarangan terbang Boeing 737 MAX 8 membuat Garuda Indonesia telah melakukan pembatalan pada pemesanan unit pesawat tersebut. Ari juga mengatakan bahwa pihaknya pun sudah menyurati pihak Boeing dalam melanjutkan sikapnya. (dna/dna) boeing boeing 737 boeing 737 max 8 garuda indonesia","Pesanan Pesawatnya Dibatalkan Garuda, Bos Boeing Mau ke Indonesia"
"dict","finance","Jakarta - Rencana Cawapres nomor urut 02 Sandiaga Uno untuk membeli kembali (buyback) saham Indosat benar adanya. Hal tersebut disampaikan oleh anggota Dewan Pakar BPN Prabowo-Sandi, Drajad Wibowo.Drajad bilang, Indosat strategis bagi Indonesia. Prabowo-Sandi berniat menunaikan janji tersebut. ""Peluangnya ada. Pertama, kinerja keuangan dan harga saham Indosat belum sesuai harapan. Jadi bisa saja pihak Qatar (Ooredoo Asia / Qtel) sebagai pemegang 65% saham ISAT ingin cut loss atau risk sharing,"" katanya kepada detikFinance dalam keterangan tertulis, Kamis (21/3/2019). googletag.cmd.push(function() { googletag.display('div-gpt-ad-1535944306169-0'); }); Kedua, dia bilang negara bisa melakukan barter di bidang lain yang sesuai dengan kepentingan nasional Indonesia dan kepentingan komersial Ooredoo Asia. Baca juga: Timses Sebut Sandiaga Mau Beli Saham Indosat Pakai Uang Negara""Ketiga, dalam aksi korporasi seperti M&A dan lain-lain, sering kali faktor non-korporasi berperan penting. Entah itu hubungan baik, kepentingan strategis dan sebagainya. Qatar sekarang sedang diisolasi oleh negara-negara Teluk lainnya. Ini peluang strategis yang bisa dimanfaatkan Indonesia,"" jelas Drajad.Lebih lanjut, politikus Partai Amanat Nasional (PAN) tersebut tak merasa buyback saham Indosat akan jadi beban negara. Dia membandingkan dengan kasus divestasi Freeport, di mana saham hasil konversi hak partisipasi Rio Tinto yang dibeli Inalum sebesar 40% lebih mahal dari saham eks Indocopper. ""Nilai kemahalannya sekitar Rp 14 triliun. Beli Freeport kemahalan Rp 14 triliun tidak disebut beban atau kerugian negara. Buyback Indosat yang mungkin harganya di bawah 'nilai kemahalan' Freeport yang Rp 14 triliun, dibilang beban negara. Aneh kan?"" tutupnya.Baca juga: Sandi Mau Buyback Saham Indosat, TKN: Jangan Jadi Beban Negara (fdl/fdl) sandiaga sandiaga uno bpn indosat","Sandiaga Bisa Rebut Saham Indosat, Begini Hitung-hitungan BPN"
