"_type","category","isi","judul"
"dict","finance","","Melihat Dari Dekat Operasional PLTGU Grati"
"dict","finance","Jakarta - Peneliti Institute for Development of Economics and Finance (INDEF) memproyeksi Indonesia dalam 20 tahun ke depan akan kehabisan minyak sebagai sumber energi. Hal itu dikarenakan kebutuhan yang semakin meningkat.Peneliti INDEF Imaduddin Abdullah mengatakan pemerintah memiliki dua pilihan untuk mencegah kekurangan minyak di dalam negeri. Hal itu dilakukan dengan meningkatkan produksi energi baru dan terbarukan (EBT).Dengan adanya EBT, diharapkan ketergantungan terhadap minyak dapat menurun. Kemudian, pilihan selanjutnya adalah impor minyak. googletag.cmd.push(function() { googletag.display('div-gpt-ad-1535944306169-0'); }); ""Opsinya itu meningkatkan produksi EBT-nya atau kalau punya duit banyak dari sektor lain ya untuk impor. Konsumsi sulit ditekan tapi bisa dikurangi (terhadap minyak),"" ujar dia dalam diskusi media di Tjikini Lima, Jakarta, Kamis (21/3/2019).Baca juga: Cadangan Migas RI Disebut akan Habis 20 Tahun Lagi, Kok Bisa?Lebih lanjut, ia juga mengatakan pemerintah dapat juga mendorong penggunaan transportasi publik hingga percepatan revisi undang-undang (RUU) migas agar investasi bisa terus berjalan.""Public transportation bagus. Sistem diperkuat untuk investasi juga baik dari UU migas dan dorong EBT migas nggak cukup. Jadi kombinasi supply side dan manajemen side,"" tutup dia.Sebagai informasi, produksi minyak dalam negeri yang berkurang dikarenakan saat ini 99% transportasi di Indonesia masih bergantung pada migas. Padahal, ada banyak sumber daya alam lain yang bisa dimanfaatkan.Baca juga: 2020, Jonan Targetkan Bangun Jargas 1 Juta Sambungan Per TahunTransportasi tergantung minyakMenurut Imaduddin, saat ini transportasi masih memegang kendali utama yang bergantung pada produksi minyak. Bahkan, transportasi di Indonesia 99% menggunakan minyak sebagai bahan bakarnya.""Hampir 99% disumbangkan dari bensin atau produk olahan minyak,"" kata dia dalam diskusi media di Tjikini Lima, Jakarta, Kamis (21/3/2019).""Rasio cadangan kita miliki dengan produksi yang kita lakukan. Semakin kecil ratio ini semakin cepat kita akan kehabisan energi tersebut. Jadi kita bisa lihat kalau kecil dalam beberapa tahun datang akan habis,"" terangnya.Senada dengan Imaduddin, peneliti INDEF Berly Martawardaya dalam kesempatan yang sama juga memprediksi cadangan minyak Indonesia akan habis dalam 20 tahun ke depan. Hal ini dikarenakan besarnya kebutuhan dibanding angka produksi.""Dengan cadangan yang ada dan tren konsumsi di masa mendatang itu juga kurang dari 20 tahun akan habis,"" tutup Berly. (fdl/fdl) ekonom migas energi bbm minyak","Saran untuk Pemerintah Agar RI Tak Kekurangan Minyak"
"dict","hot","","Sempat Bikin Heboh, Kok Ussy Sulistiawaty Nggak Pamer Ketiak Lagi?"
"dict","finance","Banyuwangi - Beras organik produksi Banyuwangi go internasional. Setelah diekspor ke sejumlah negara kini beras unggulan Banyuwangi ini resmi diekspor ke Italia. Italia adalah pasar terbaru dari beras organik Banyuwangi setelah sebelumnya diekspor ke sejumlah negara.Beras yang diekspor itu adalah produksi PT Sirtanio, perusahaan agribisnis Banyuwangi yang digerakkan anak-anak muda. Beras organik yang diekspor adalah Beras Merah Varietas Segobang A3, Beras Hitam Melik A3, dan Beras Sunrise of Java. Varietas-varietas itu telah didaftarkan sebagai padi asli Banyuwangi oleh Dinas Pertanian di Kementerian Pertanian.Prosesi ekspor perdana tersebut berlangsung di Padepokan Pusat Pendidikan dan Pelatihan Pertanian Swadaya (P4S) Sirtanio, Kecamatan Singojuruh, Kamis (21/3/2019). googletag.cmd.push(function() { googletag.display('div-gpt-ad-1535944306169-0'); }); Produksi beras organik Sirtanio bersama petani mitranya mencapai 30 ton per bulan di lahan 70 hektar.""Kami mengambil segmen terkecil, yaitu Italia. Kami kirim ke sana 2,8 ton per bulan. Ada tim yang memantau pengelolaan lahan organik khusus ekspor, sembari terus kami tingkatkan lahan organik lainnya agar bisa standar ekspor,"" terang Samanhudi, ketua Kelompok Tani Mendo Sampurno yang memproduksi beras ekspor itu.Dia mengatakan, permintaan luar negeri terhadap beras organik Banyuwangi sangat besar. Dari China, misalnya, sebesar 60 ton per bulan. Belum lagi dari Amerika Serikat.""Kapasitas kami terbatas. Jadi ini dipenuhi bertahap. Ke depan, kami terus merangkul petani-petani lainnya,"" ujarnya.Baca juga: Ekskavator Made in Bandung Siap Dikirim ke Vietnam dan MyanmarPara petani tersebut awalnya adalah kelompok yang mendapatkan pendidikan dan pelatihan pertanian organik Dinas Pertanian Banyuwangi. Bersama PT Sirtanio yang dikomandoi Ahmad Tessario, mereka berkolaborasi menjadi badan usaha yang kini menaungi 200 petani organik lokal. Produk mereka juga dibeli berbagai perusahaan makanan raksasa. Tak hanya itu, para petani itu merupakan kluster binaan Bank Indonesia (BI) dan Pemkab Banyuwangi. ""Kami bangga dengan ekspor perdana ini. Ini prestasi petani Banyuwangi. BI mendukung pertanian organik di beberapa daerah, namun yang berhasil tembus ekspor baru Banyuwangi,"" kata Difi kepada wartawan. ""Banyuwangi menjadi contoh bagi pertanian organik yang sukses. Pasar Eropa itu susah ditembus, namun berkat kegigihan kelompok tani di sini, mereka bisa masuk pasar Eropa,"" imbuh Difi.Bupati Banyuwangi Abdullah Azwar Anas mengatakan, ekspor perdana ke Italia adalah bukti bahwa beras organik Banyuwangi telah memiliki standar mutu dan kualitas internasional.""Dengan beras organik, petani punya nilai tambah, dapat harga lebih baik dibanding beras biasa,"" ujarnya.Saat ini pengembangan beras organik Banyuwangi dilakukan di 9 kecamatan seluas 81,49 hektar dengan produksi 515,5 ton per tahun. Sebanyak tujuh kecamatan telah mendapatkan sertifikat pertanian organik Standar Nasional Indonesia (SNI). Tahun ini dua kecamatan dalam proses mendapat SNI pertanian organik.""Lewat APBD, kita akan kembangkan tambahan sekitar 120 hektar lahan padi organik bersama petani, sehingga pertengahan tahun depan sudah ada 200 hektar lahan padi organik untuk memenuhi permintaan ekspor yang tinggi,"" ujarnya.Untuk pengembangan pertanian organik, Pemkab Banyuwangi melakukan pelatihan agen hayati, pengembangan laboratorium mini agen hayati, hingga fasilitasi sertifikasi nasional dan internasional organik.Baca juga: Seharga Rp 2,5 Miliar, Ini Spek Bus yang Diekspor ke Bangladesh (fdl/fdl) beras banyuwangi italia","Beras Organik Made in Banyuwangi Diekspor ke Italia"
"dict","sport","Hanoi - Indra Sjafri menjelaskan alasannya membawa Egy Maulana Vikri meski jarang bermain dengan tim. Egy dianggap sangat penting untuk Timnas Indonesia.Egy terbilang telat gabung ke pemusatan latihan Timnas Indonesia U-23. Pemain Lechia Gdansk itu baru ikut berlatih pada 13 Maret, setelah semua pemain lebih dulu latihan pada awal Maret.Pemain asal Medan baru tampil saat Indonesia menjalankan laga uji coba melawan Bali United. Egy masuk di babak kedua dalam pertandingan yang dimenangi Skuat Garuda Muda dengan skor 3-0.Baca juga: 'Ganjalan untuk Ezra Walian Terlalu Mengada-ada' googletag.cmd.push(function() { googletag.display('div-gpt-ad-1535945694694-0'); }); ""Saya tidak suka pertanyaan yang sifatnya individu pemain karena ini tim sepakbola dan ada 11 pemain dari total 23 pemain. Yang harus saya kontrol,"" kata Indra dalam konferensi pers jelang Kualifikasi Piala Asia U-23 2020 di Hanoi, Vietnam.""Saya perlu Egy, dari sekian pemain di Indonesia potensi sepakbolanya banyak. Egy adalah salah satunya. Saya ajak dia karena kualitasnya saya anggap bisa memenuhi kebutuhan game plan. Jadi gak tergantung menit dia bermain,"" sambungnya.Indonesia tergabung di Grup K dalam babak Kualifikasi Piala Asia U-23. Tim Merah-Putih akan melawan Thailand lebih dulu di Stadion My Dinh, Jumat (22/3/2019). Selanjutnya bakal menantang Vietnam dan Brunei.Baca juga: Perkiraan Formasi Timnas U-23 dengan Egy dan Saddil (ran/mrp) egy maulana vikri indra sjafri timnas indonesia u-23 kualifikasi piala asia u-23 2020 kualifikasi piala afc u-23 2020","Karena Egy Sangat Penting untuk Timnas Indonesia"
"dict","hot","","Jennifer Coppen yang Makin Dewasa"
"dict","finance","Jakarta - Direktur Utama Garuda Indonesia I Gusti Ngurah Askhara Danadiputra mengatakan bahwa bisa saja pihaknya mencari pabrikan pesawat selain Boeing. Dia menyatakan kalau Garuda telah mengambil posisi untuk menghentikan pemesanan Boeing 737 Max 8.Dengan penghentian pemesanan itu pihak Boeing ingin menindaklanjutinya dengan bertemu pihak Garuda. Menurut pria yang biasa disapa Ari Ashkara ini, membuka opsi untuk menggunakan pabrikan pesawat lain apabila negosiasi dengan Boeing berakhir buntu.""Kalau beralih (pabrikan pesawat), mungkin saja, kalau negonya stuck. Pastinya kita akan resiko kehilangan pre down payment (PDP),"" kata Ari saat ditemui di Plaza Indonesia, Kamis (21/3/2019). googletag.cmd.push(function() { googletag.display('div-gpt-ad-1535944306169-0'); }); Baca juga: Batalkan Boeing 737 MAX 8, Garuda Sudah Bayar Tanda Jadi Rp 3,6 MDia mengatakan pihaknya tidak menutup kemungkinan untuk mencari pabrikan lain. Terlebih lagi kalau ada pabrikan lain memberikan penawaran yang menarik dan tepat kepadanya.""Kalau kita lihat deal dengan pabrikan lain itu bagus dan bisa diabsorb, kami memang terbuka untuk opsi itu,"" ungkap Ari.Namun, Ari optimis negosiasi dengan Boeing akan berjalan dengan baik. ""Tapi saya confidence sama Boeing karena mereka pabrikan kita sejak lama tahun 80-an,"" ungkapnya.Sebelumnya, buntut dari pelarangan terbang Boeing 737 Max 8 membuat Garuda Indonesia telah melakukan pembatalan pada pemesanan unit pesawat tersebut. Ari juga mengatakan bahwa pihaknya pun sudah menyurati pihak Boeing, dan mendapatkan balasan untuk melakukan negosiasi.Baca juga: Pesanan Pesawatnya Dibatalkan Garuda, Bos Boeing Mau ke Indonesia (fdl/fdl) garuda pesawat boeing airbus garuda indonesia boeing 737 max 8","Batalkan Pesanan Boeing 737 Max 8, Garuda Mau Pindah ke Lain Hati?"
"dict","sport","Jakarta - Timnas Indonesia menggelar sesi latihan terakhir sebelum berangkat ke Myanmar. Pelatih Simon McMenemy hanya memberikan menu latihan ringan.Indonesia telah menyelesaikan pemusatan latihan di Australia dan Bali. Andik Vermansah dkk akan bersiap menghadapi FIFA match day melawan Myanmar pada 25 Maret mendatang.Sebelum ke Jakarta, Indonesia sempat melakukan uji coba melawan Bali United. Ketika itu kedua tim bermain imbang 1-1. googletag.cmd.push(function() { googletag.display('div-gpt-ad-1535945694694-0'); }); Dalam sesi latihan di Stadion Madya, Senayan, Jakarta, Kamis (21/3/2019), para pemain terlihat latihan ringan dengan suasana lebih rileks. Simon ingin pemainnya pemainnya tak terlalu tegang.Baca juga: Timnas Indonesia Seri 1-1 Lawan Bali United""Latihan hari ini kami recovery karena kemarin berat lawan Bali United dan hampir semua pemain main. Jadi hari ini kami mau latihan sesinya yang lebih ringan. Kami lihat tadi ada sedikit ketawa-ketawa karena kami mau anak-anak itu bisa menyatu,"" ujar Simon usai latihan.Eks pelatih Bhayangkara FC itu mengaku sangat senang karena pemain sudah mulai paham dengan apa yang diinginkannya. Hal itu sudah diperlihatkan pemain sejak TC di Australia.""TC di Australia sangat bagus. Saya respek dengan pekerjaan teman-teman (media), tapi saya rasa sesekali kami boleh bawa anak-anak jauh dari Indonesia untuk latihan tanpa mereka harus memikirkan apa yang dipikirkan orang lain, kapan harus di wawancara dan sebagainya. Disana kami latihan teknik taktik sangat bagus jadi saya sangat puas dengan TC di Australia,"" sambungnya.Baca juga: Ini 22 Pemain Timnas Indonesia Kontra Myanmar (ads/mrp) simon mcmenemy timnas indonesia timnas myanmar","Sebelum Berangkat ke Myanmar, Timnas Latihan Lebih Santai"
"dict","sport","Milan - Mauro Icardi semakin dekat dengan comeback-nya setelah absen selama enam pekan. Striker asal Argentina itu sudah kembali berlatih bersama Inter Milan.Icardi sudah absen membela Inter sejak ban kaptennya dicabut pada 13 Februari. Cedera lutut kemudian juga disebut sebagai penyebab Icardi harus menepi.Kamis (21/3/2019), kantor berita Italia, ANSA, melaporkan bahwa Icardi sudah berlatih bersama teman-teman setimnya di Appiano Gentile. Striker 26 tahun itu berlatih bersama para pemain yang tak dipanggil ke timnas. googletag.cmd.push(function() { googletag.display('div-gpt-ad-1535945694694-0'); }); Baca juga: Icardi, Masihkah Cinta dengan Inter Milan?Sejumlah petinggi Inter, termasuk Manajer Umum Beppe Marotta, juga hadir dalam sesi latihan tersebut. Demikian seperti dikutip dari Football Italia.Icardi dilaporkan sudah menuntaskan proses pemulihan cedera lututnya. Ia berpeluang kembali masuk ke skuat Inter untuk laga berikutnya melawan Lazio saat Serie A kembali bergulir pada 31 Maret usai jeda internasional.Icardi sejauh ini sudah tampil 28 kali di semua kompetisi. Mantan pemain Sampdoria itu mengemas 15 gol, sembilan di antaranya dibuat di Serie A.Baca juga: Bravo Inter, Bravo Lautaro (nds/rin) mauro icardi inter milan","Icardi Sudah Kembali Berlatih"
"dict","finance","Labuan Bajo - Alat-alat elektronik milik warga Desa Pasir Putih Pulau Messah rusak karena listrik dari diesel sewaan sering byarpet. Niat para nelayan untuk membuat es sendiri harus diurungkan ketimbang kulkas yang dibeli dengan susah payah rusak oleh listrik yang tak stabil.Desa Pasir Putih Pulau Messah Kecamatan Komodo berjarak sekitar sejam dari Labuan Bajo, Nusa Tenggara Timur. Pulau ini dihuni oleh 1.969 jiwa dan 484 kepala keluarga. Hanya sekitar 200 kepala keluarga saja yang menyewa listrik dari diesel yang dimiliki sejumlah warga di sini. Listrik itu menyala dari pukul 18.00 WITa hingga 06.00 WITa, namun sering mati dan hidup lagi alias byarpet.""Bayangkan saja, bayar listrik Rp 10 ribu per malam. Kadang nyalanya kecil tapi mati-hidup mati-hidup. Televisi-televisi warga banyak yang rusak, layarnya jadi garis-garis, banyak sekali yang mengalami itu,"" kata Sekretaris Desa Pasir Putih, Jufri Aburairah, kepada detikcom sambil menanti orang PLN yang kabarnya mau datang, Kamis (28/2/2019) siang. googletag.cmd.push(function() { googletag.display('div-gpt-ad-1535944306169-0'); }); Baca juga: Warga Taman Nasional Komodo Ingin Listrik 24 Jam hingga Air BersihSetengah dari jumlah rumah warganya bahkan tidak berlistrik. Mereka memanfaatkan lampu minyak sebagai penerang gulita. Padahal di zaman ini, akses informasi dan teknologi dibutuhkan masyarakat. Sulit dibayangkan bagaimana mengakses teknologi tanpa ada listrik. Selain itu, nelayan juga butuh listrik untuk menunjang hidup mereka.""Masyarakat di sini adalah masyarakat nelayan, jadi mereka butuh es. Mereka ingin bikin es batu supaya tidak perlu ke Labuan Bajo menghabiskan ongkos ojek kapal Rp 20 ribu hanya untuk beli es yang satu plastik seharga Rp 2 ribu,"" tutur Jufri.Biaya membayar listrik dan membeli es masih harus ditambah biaya membeli air. Di Pulau Messah, warga membeli air per jeriken isi 20 liter seharga Rp 2.500,00. Biasanya, satu rumah menghabiskan empat jeriken sehari. Air bersih itu digunakan untuk minum, memasak, dan mandi dengan cara khusus. ""Masyarakat di sini mandi cepur, yaitu mandi dulu di laut kemudian dibilas pakai air tawar,"" kata dia.Baca juga: Listrik Langka, Mesin Diesel Jadi Andalan Sumber ListrikSiang hari, tim PLN dari Wilah NTT yang sudah ditunggu Jufri ternyata benar-benar datang. Mereka adalah tim Upaya Pengelolaan Lingkungan Hidup/Upaya Pemantauan Lingkungan Hidup (UKL/UPL) dari Fakultas Sains dan Teknik Universitas Nusa Cendana Kupang yang digandeng PLN NTT. ""PLN mengatakan listrik akan menyala sebelum lebaran. Ini yang kami tunggu-tunggu,"" kata Jufri sembari berdiri melangkah menyalami para utusan PLN itu.Para petugas PLN itu kemudian naik ke atas bukit belakang permukiman di siang hari yang terik ini. Dari titik yang memungkinkan seseorang memandang 360 derajat ke lautan yang mengelilingi pulau, PLN akan membangun Pembangkit Listrik Tenaga Surya (PLTS). Ada dua orang tim UKL/UPL yang mengaktifkan alat pengambil sampel udara (Air Sampling Pump) untuk melihat kondisi udara kawasan ini sebelum dipasangi PLTS. Utusan PLN Wilayah NTT dari UNDANA sedang memeriksa calon PLTS di Pulau Messah, Kecamatan Komodo, NTT. (Moch Prima Fauzi/detikcom)Tahap yang kini dilakukan adalah tahap penelitian dan sosialisasi. Terlihat di balai warga, bapak-bapak yang berkumpul sudah tidak sabar menyambut listrik yang lebih baik di desanya. ""Jadi ini pertama sosialisasi berkaitan dengan upaya pemantauan lingkungan hidup sebelum ada pembangunan PLTS. Kami dipercaya PLN Wilayah NTT untuk memastikan dokumen lingkungan hidupnya,"" kata Ketua TIM UKL/UPL dari Universitas Undana, Frans Likaja.Baca berita lainnya mengenai Teras BRI Kapal Bahtera Seva di Ekspedisi Bahtera Seva. (dnu/hns) bahteraseva bahteraseva-bajo manggarai barat pulau komodo pulau messah listrik","PLN, Warga Pulau Messah Komodo Nantikan Pasokan Listrik"
"dict","sport","Nyon - Cristiano Ronaldo menerima konsekuensi atas selebrasi selangkangan saat Juventus mendepak Atletico Madrid. Ronaldo didenda sebesar 20 ribu euro (Rp 320 juta).Pada awal pekan ini, UEFA mendakwa superstar sepakbola Portugal itu dengan tindakan tidak senonoh. Selebrasi tersebut dilakukan Ronaldo saat mencetak gol ketiganya ke gawang Atletico dalam kemenangan Juve 3-0 di leg II babak 16 besar Liga Champions. Meski mendapatkan denda besar, superstar sepakbola Portugal itu bisa bernapas lega karena lolos dari ancaman hukuman skorsing. Dengan begini, Ronaldo bebas untuk tampil membela Bianconeri saat menghadapi Ajax Amsterdam di perempatfinal. googletag.cmd.push(function() { googletag.display('div-gpt-ad-1535945694694-0'); }); Baca juga: Buntut Selebrasi Selangkangan, Ronaldo Didakwa UEFAHukuman yang diterima Ronaldo sesungguhnya tidak mengejutkan. Sanksi tersebut sama persis dengan yang diterima pelatih Atletico Diego Simeone. Demikian dilansir Football Italia.Baca juga: Bernardeschi: Gila Kalau Ronaldo Sampai Diskors!Simeone lebih dahulu melakukan selebrasi gol provokatif dengan memegang selangkangannya ketika Atletico menang 2-0 atas Juventus di leg pertama. Ronaldo diduga membalas kubu Atletico dengan perayaan gol serupa.Ronaldo tidak dibawa Juventus ketika dikalahkan Genoa dalam laga terakhir Liga Italia sebelum jeda internasional. Kekalahan tersebut mengakhiri rekor tidak terkalahkan Si Nyonya Tua dalam 27 pertandingan di musim 2018/19.Pemain terbaik dunia lima kali itu akan memimpin timnas Portugal memulai perjuangannya lolos ke Piala Eropa 2020. Selecao das Quinas akan menghadapi Ukraina dan Serbia di dua laga kualifikasi pertama. (rin/nds) cristiano ronaldo juventus liga champions atletico madrid","Ronaldo Didenda Rp 320 Juta karena Selebrasi Selangkangan"
"dict","finance","Jakarta - Cawapres nomor 02 Sandiaga Uno mengaku telah mempunyai skema matang untuk membeli kembali (buyback) saham Indosat. Dia mengaku dapat dukungan dari pemodal Indonesia yang bersedia membantunya untuk merebut kembali saham Indosat.""Saya sudah langsung ditelepon oleh pemodal-pemodal besar yang siap mendanai, dan nggak akan membebani keuangan negara,"" ujar Sandiaga di Djakarta Theater, Jakarta Pusat, Kamis (21/3/2019).Baca juga: Sandiaga Bisa Rebut Saham Indosat, Begini Hitung-hitungan BPNSandi juga menyinggung Tim Kampanye Nasional (TKN) Jokowi-Ma'ruf yang menyebut Indosat sudah rugi dan tidak perlu direbut kembali sahamnya. Menurutnya, untung rugi itu tidak perlu asalkan Indosat dapat mendukung sistem Single Identification Number (SIN) yang akan dijalankan Prabowo-Sandi jika terpilih. googletag.cmd.push(function() { googletag.display('div-gpt-ad-1535944306169-0'); }); ""Tentunya kita bukan lihat untung rugi yang sekarang, tapi kedaulatan data, kan kita mau launching big data nasional dan kita perlu ditopang perusahaan milik negara yang mengelola banyak sekali data,"" terang pria yang beken disapa Sandi itu.Baca juga: Sandi Mau Buyback Saham Indosat, TKN: Jangan Jadi Beban Negara""Saya yakin saya bisa kelola Indosat dengan baik, dan kita sama-sama dapat keuntungan berlipat ganda karena mengelola data banyak dengan integrasi single identification number kita, kita ada Telkomsel, Indosat akan luar biasa ke depan,"" imbuhnya.Sebelumnya, Juru bicara Tim Kampanye Nasional (TKN) Jokowi-Ma'ruf Amin, Ace Hasan Syadzily, mengatakan niat Sandi mengembalikan kekuasaan pemerintah di Indosat dianggap perlu kajian yang lebih jelas. Pasalnya saat ini kondisi perusahaan telekomunikasi yang mempelopori GPRS tersebut tengah merugi.""Kalau kita mau ambil kembali Indosat, kita kan juga harus lihat kondisi Indosat sekarang ini. Kalau kita lihat kondisi Indosat saat ini kan tidak sehat. Buat apa juga kita membeli,"" katanya kepada detikFinance, Kamis (21/3). (zap/hns) indosat indosat ooredoo buyback saham sandiaga uno sandi uno","Mau Buyback Saham Indosat, Sandi: Pemodal Besar Siap Mendanai"
"dict","finance","Jakarta - Tingkat pengangguran terbuka (TPT) di Indonesia masih terbilang tinggi meskipun trennya terus menurun. Dilihat dari pendidikan, lulusan sekolah menengah kejuruan (SMK) yang paling tinggi persentasenya.Ada persoalan yang membuat lulusan SMK secara persentase paling besar tingkat penganggurannya. Padahal, SMK merupakan pendidikan yang seharusnya mudah terserap oleh dunia industri.Menteri Koordinato Bidang Perekonomian Darmin Nasution mengungkapkan penyebab besarnya persentase pengangguran para lulusan SMK.Apa saja penyebabnya? Simak selengkapnya di sini: (hek/ang) pengangguran smk darmin nasution Sebelumnya Adu Jurus Ma'ruf Amin Vs Sandi Berantas Pengangguran 1 / 4 Selanjutnya Kurikulum yang Pas-pasan","Banyak Lulusan SMK Menganggur, Akibat Pilih-pilih Kerja?"
"dict","sport","Naples - Juventus unggul amat jauh atas Napoli di klasemen Liga Italia. Meski demikian, Napoli tidak akan menyerah begitu saja.Juventus berlari sangat kencang di Liga Italia musim ini. Tim arahan Massimiliano Allegri itu sudah mengumpulkan 75 poin setelah 28 pertandingan.Dari 28 laga yang sudah dijalani, Juventus mencatat 24 kemenangan, tiga hasil imbang, dan satu kali kalah. Satu-satunya kekalahan baru didapat pada pekan lalu ketika mereka ditumbangkan Genoa 0-2. googletag.cmd.push(function() { googletag.display('div-gpt-ad-1535945694694-0'); }); Napoli menjadi pesaing terdekat Juventus sejauh ini. Meski demikian, Partenopei yang menempati peringkat kedua tertinggal 15 angka dari Juventus.Baca juga: Sempat Kolaps karena Cedera Kepala, Kondisi David Ospina Kini MembaikSecara matematis, Napoli masih punya peluang untuk mengejar Juventus. Karena itu, meski selisih poin yang harus dikejar begitu besar, Napoli tidak akan menyerah.""Juve adalah tim yang sangat kuat,"" ujar penyerang Napoli Jose Callejon kepada Sky Sport Italia.""Mereka sudah kuat selama bertahun-tahun dan dengan Cristiano Ronaldo, mereka makin meningkat. Tapi kami juga tim hebat, kami menjalankan tugas dan kami memberi perlawanan di dua pertandingan di liga.""""Sayangnya dua laga itu tidak berjalan baik, tapi kami selalu ada di posisi kedua. Tapi ini belum berakhir, kami tidak boleh menyerah terhadap apapun dan kami harus terus melangkah sampai akhir,"" katanya.Baca juga: Sarri Berharap Jumpa Napoli di Final Saja (nds/yna) napoli juventus liga italia","Tertinggal 15 Poin dari Juventus, Napoli Menolak Menyerah"
"dict","sport","Jakarta - Stapac Jakarta tampil agresif di game pertama final Indonesian Basketball League (IBL) 2019. Mereka pun mengalahkan Satria Muda dengan skor 79-68.Dalam game pertama final IBL di Britama Arena, Kelapa Gading, Kamis (21/3/2019), kedua tim tampil sengit sejak kuarter pertama. Selisih poin tak lebih dari dua sampai tiga poin hingga jeda kuarter dua.Tapi memasuki kuarter tiga, Stapac berupaya untuk memperlebar poin yang mereka raih. Tim asuhan Giedrius Zibenas itu berhasil menutup kuarter tiga dengan keunggulan 54-41. googletag.cmd.push(function() { googletag.display('div-gpt-ad-1535945783791-0'); }); Memasuki kuarter keempat, Oki Wira Sanjaya dkk semakin agresif. Tapi Satria Muda mampu meladeni mereka dan mendekati selisih poin menjadi 51-66. Meski demikian, Stapac mampu mempertahankan keunggulannya dan menutup laga dengan kemenangan 79-68.Baca juga: Tanpa Jamarr, Bagaimana Peluang Satria Muda di Final IBL?Meski timnya menang, Zibenas tak terlalu bahagia dengan hasil hari ini meski. Dia kecewa dengan penampilan Stapac di awal laga.""Kecewa dengan start, tadi sempat selebrasi terlalu awal. Beruntung bisa kembali lagi disiplin dan rebounds kami bagus,"" kata Zibenas, usai laga.""Masih ada game selanjutnya dan kami belum selesai. Kami akan buktikan bisa menang,"" ujarnya lagi.Dua pemain asing Stapac, center Savon Rafriyq Goodman dan point guard Kendal Yancy, menjadi pahlawan di laga pertama Stapac dengan Satria Muda. Goodman mengemas 21 poin, disusul Yancy dengan 18 poin.""Senang bisa menang. Tim bisa menyatu walau sempat menurun kami bisa bangkit lagi. Tadi kami bermain dengan startegi yang kurang bagus,"" kata Goodman menyoal perfoma dia dan timnya hari ini.""Ini game eliminasi, kami tidak mau merasa menang dulu, harus fight setiap permainan. Sebab, kedua tim berupaya mencuri poin,"" timpal small forward Kaleb Ramot Gemilang. (nds/nds) ibl final ibl stapac stapac jakarta satria muda jakarta","Stapac Kalahkan Satria Muda di Game Pertama Final IBL"
