"_type","category","isi","judul"
"dict","entertainment","Jari Bengkak, Cincin Pernikahan Tasya Kamila Dipotong  - Di tengah masa-masa kehamilannya, penyanyi    harus mengalami kejadian yang tak mengenakkan. Melalui   akun Instagram miliknya, mantan artis cilik ini mengabarkan bahwa    dan cincin pernikahannya dipotong. Bukan karena tindak kriminal, melainkan pemotongan itu atas persetujuan Tasya sendiri. Gara-garanya dua cincinnya itu tak muat lagi lantaran jari-jarinya bengkak karena pengaruh kehamilan. ""Update cincin. Terasa sakit karena luka dan bengkak. Terus temenku yang punya toko perhiasan, dia mau bantu potong cincinnya,"" kata Tasya dalam video   sambil menunjukkan jarinya yang membengkak, seperti dikutip Kompas.com, Senin (25/3/2019). Berikutnya, petugas toko perhiasan menggunakan sebuah tang dan secara hati-hati memotong    Tasya terlebih dahulu. "" ,"" tulis Tasya masih pada -nya. Awalnya petugas toko perhiasan mencoba mengeluarkan cincin tersebut menggunakan lotion, namun gagal. Alhasil, cincin pertunangan Tasya ikut dipotong menggunakan tang. "" ,"" tulis Tasya. ""Inilah hasil jari bengkak pasca operasi cincin. Sedih banget, tapi enggak apa-apa daripada jari aku yang busuk,"" kata Tasya lagi dalam video Insta Story lainnya. Beruntung cincin pernikahannya bisa segera disambung lagi. Namun, Tasya harus menunggu sekitar tiga bulan untuk cincin pertunangannya lantaran produsen cincin tersebut berasal dari luar negeri.","Jari Bengkak, Cincin Pernikahan Tasya Kamila Dipotong"
"dict","sains","Mari Belajar Cara Menuju Ekonomi Sirkular dari Denmark Duta Besar   , H.E. Mr Rasmus Abildgaard Kristensen, bercerita bahwa pada saat ini, hanya 3-4 persen    di Denmark yang ditimbun di Tempat Pembuangan Akhir (TPA), sementara 69 persen didaur ulang. Kondisi ini jauh berbeda dengan 30 tahun lalu. Pada 1985, menimbun sampah di TPA merupakan metode yang paling sering digunakan di Denmark (39 persen). Lalu, proporsi sampah yang didaur ulang hanya 35 persen dan yang dibakar 26 persen. Kunci dari perubahan ini adalah memberikan nilai atau valuasi pada sampah. Ada dua kebijakan penting yang ditekankan oleh Kristensen. Pertama adalah penetapan pajak untuk penimbunan dan pembakaran sampah sejak 1987. Pajak ini memberikan insentif finansial untuk mendaur ulang sampah. “Kami menetapkan pajak besar untuk sampah yang masuk ke TPA, pajak menengah untuk pembakaran sampah dan tidak menetapkan pajak untuk mendaur ulang sampah,” kata Kristensen dalam diskusi bersama media di Jakarta pada Kamis (21/3/2019). Ketika pertama kali dilaksanakan, sebagian besar dari pemasukan pajak ini digunakan oleh pemerintah Denmark untuk mendorong    dan mengembangkan teknologi yang lebih bersih Selain itu, industri ritel Denmark sendiri juga berinisiatif menerapkan sistem deposit untuk minuman seperti bir dan  . Kristensen memberikan contoh, jika harga sebuah minuman adalah Rp 10.000, maka pembeli juga harus membayar tambahan Rp 2.000 sebagai deposit. Uang Rp 2.000 ini bisa didapatkan kembali bila mereka mengembalikan botolnya ke mesin khusus yang akan menerima semua jenis botol, tanpa memedulikan mereknya. “Jadi tidak ada orang yang membuang botol. Kalau pun botol dibuang, akan diambil oleh orang lain karena bisa dijadikan uang,” katanya. “Ini juga deposit bukan pajak, jadi konsumen tidak keberatan,” imbuhnya lagi. Lantas sampah yang menjadi bernilai diperjualbelikan dan dikelola sebagai sumber daya baru dalam sistem ekonomi sirkular. Kristen memberikan contoh bahwa di Denmark sudah ada perusahaan karpet yang membeli sampah plastik dari perusahan lain untuk diolah kembali menjadi produknya. Lalu, sebuah  online juga telah diciptakan untuk menghubungkan perusahaan-perusahaan yang ingin membeli dan menjual sampah. Indonesia memproduksi lebih dari 65 juta sampah setiap hari. Dari jumlah yang luar biasa tersebut, hanya setengah yang dikelola menggunakan sistem yang ada saat ini. 7,5 persennya didaur ulang, sedangkan sisanya ditimbun di TPA. Padahal, metode ini bukan tanpa kekurangan. Penimbunan sampah bisa menghasilkan gas berbahaya dan menyebabkan pencemaran lingkungan. Denmark dan Indonesia tengah bekerja sama untuk menuju ekonomi sirkular di mana sampah tidak menjadi akhir dari konsumsi, tetapi juga dapat digunakan sebagai sumber daya yang baru. Dengan demikian, sumber daya yang ada dapat dimaksimalkan. Ekonomi sirkular ini diyakini cocok bagi Indonesia yang sedang mencari alternatif dari penimbunan sampah, dan belum berinvestasi dalam sistem pembakaran pada skala nasional. Selain itu, Indonesia sendiri juga telah memiliki informasi, pengetahuan dan pengalaman ekonomi sirkular yang belum digali sepenuhnya. Tentunya menciptakan ekonomi sirkular tidak hanya soal menciptakan sistem konsumsi dan pembuangan sampah yang lebih baik, melainkan juga mendorong rancangan dan produksi yang lebih baik. Morten Holm Van Donk yang merupakan Head of Environmental Sector Cooperation at Danish Embassy di Jakarta berkata bahwa kita perlu mendorong perusahaan-perusahaan di Indonesia untuk merancang produknya dengan lebih berkelanjutan. Hal ini tidak hanya ditujukan kepada perusahaan-perusahaan minuman saja, tetapi juga perusahaan pakaian, bangunan, dan lainnya.","Mari Belajar Cara Menuju Ekonomi Sirkular dari Denmark"
"dict","sains","Kontroversi Monster Laut 520 Juta Tahun yang Punya 8 Tentakel di Mulut Sebuah penemuan fosil    laut di    diklaim menjadi kunci jawaban dari misteri asal-usul    sisir.    yang dijuluki  tersebut dianggap memiliki banyak kemiripan karakteristik anatomi dengan makhluk laut modern yang menggunakan sisir silianya untuk berenang di lautan. Peneliti utama Jakob Vinther dari Bristol University bahkan berkata bahwa spesies baru ini bisa jadi adalah saudara jauh dari ubur-ubur sisir. “Dengan fosil-fosil ini, kami dapat mencari tahu dari mana asal ubur-ubur sisir. Walaupun kini kita tahu asal mereka yang masuk akal, bukan berarti ubur-ubur sisir menjadi lebih tidak aneh,” ujarnya. Vinther pertama kali bertemu dengan  ketika berkunjung ke Yunnan University di China. Dia ditunjuki sekumpulan fosil yang telah mereka temukan, termasuk monster laut yang misterius ini. Namun, yang menarik perhatian Vinther adalah kemiripannya dengan ubur-ubur sisir. Salah satunya adalah rambut silia besar pada tentakel  . Perlu untuk diketahui, silia juga merupakan salah satu karakteristik utama bagi ubur-ubur sisir. Makhluk tersebut menggerakkan silianya yang kemudian menyala terang dalam air. Selain itu,  juga memiliki 18 tentakel di mulutnya sehingga menyerupai bunga. Karakteristik ini mirip dengan Xianguangia, Dinomischus dan Siphusauctum. “Secara singkatnya, kami berhasil merekonstruksi garis awal ubur-ubur sisir dengan membuat perbandingan anatomi,” kata Vinther. Dalam rekonstruksi baru ini, para peneliti mengklaim bahwa nenek moyang ubur-ubur sisir memiliki kerangka dan tentakel. Tentakel ini kemudian berevolusi menjadi sisir dengan silia. Vinther lanjut berkata bahwa temuan ini sangat penting di dunia ilmiah karena menunjukkan bahwa ubur-ubur tersebut telah mengalami evolusi panjang, dan bukan hewan purba yang pertama kali muncul di bumi seperti diyakini oleh beberapa peneliti. Analisis Vinther dan kolega juga mengungkapkan letak sebenarnya dari hewan-hewan ini di pohon kehidupan.  Sebagai contoh, Xianguangia ternyata merupakan bagian dari cabang ubur-ubur sisir; sementara ubur-ubur sisir sendiri ditemukan memiliki kaitan dengan terumbu karang, anemon laut dan ubur-ubur. Sayangnya, tidak semua orang setuju dengan analisis baru ini. Casey Dunn yang merupakan profesor ekologi dan biologi evolusioner dari Yale University, misalnya, mengkritisi metode yang digunakan oleh Vinther. Dia berkata bahwa meskipun penemuan  sangat luar biasa, sulit untuk menentukan apakah makhluk tersebut ada hubungannya dengan ubur-ubur sisir. “Ini adalah hewan-hewan yang sangat menarik, tanpa memedulikan kaitannya satu sama lain. Meskipun saya merasa skeptis bahwa tentakel dan sisir terhubung secara evolusioner, saya merasa bahwa semakin kita dapat mendeskripsikan keragaman deposit ini, semakin kita dapat mempelajari lebih banyak tentang evolusi hewan,” katanya.","Kontroversi Monster Laut 520 Juta Tahun yang Punya 8 Tentakel di Mulut"
"dict","entertainment","Mahkamah Agung Perpanjang Hukuman Ridho Rhoma  -   mengabulkan kasasi yang diajukan oleh jaksa penuntut umum Pengadilan Negeri Jakarta Barat atas vonis kasus penyalahgunaan    penyanyi dangdut   .  Putusan itu dijatuhkan oleh Hakim Agung Andi Samsan Nganro dengan anggota majelis yaitu, Hakim Agung Margono dan Eddy Army. Hakim Agung juga memutuskan untuk memperbaiki tingkatan kejahatan yang dilakukan oleh Ridho Rhoma menjadi Penyalahguna Narkotika Golongan I Bagi Diri Sendiri.  ""Iya benar itu ada kasasi tolak dengan perbaikan. Ada tolak perbaikan pidananya jadi satu tahun enam bulan,"" ungkap Kepala Biro Hukum dan Humas Mahkamah Agung, Abdullah, saat dihubungi wartawan, Senin (25/3/2019). Namun, Abdullah belum bisa memastikan mekanisme yang harus Ridho jalani untuk menyelesaikan hukuman yang ada. Sebagai informasi, kini putra Raja Dangdut Rhoma Irama itu telah menghirup udara bebas. Satu hal yang pasti, Abdullah menegaskan bahwa dengan putusan ini Ridho harus melanjutkan sisa hukumannya.   ""Saya enggak tahu nanti, yang penting satu tahun enam bulan. Kemarin kan rehab habis, masih ada enam bulan, ya diselesaikan lagi,"" ujar Abdullah.   Nantinya, kata Abdullah, pihak jaksa penuntut umumlah yang akan melakukan eksekusi terhadap Ridho.   ""Itu sudah kewenangan jaksa selaku eksekutor, hakim cuma memutus aja,"" kata Abdullah lagi.   Sebelumnya, Ridho Rhoma divonis 10 bulan penjara dalam sidang di Pengadilan Negeri Jakarta Barat, Selasa (19/9/2017). Majelis hakim mengharuskan Ridho Rhoma menjalani rehabilitasi medis atau sosial Rumah Sakit Ketergantungan Obat (RSKO) Cibubur, Jakarta Timur, selama enam bulan 10 hari.  Atas putusan ini jaksa penuntut umum lantas mengajukan banding ke tingkat Pengadilan Tinggi Negeri, namun ditolak. Barulah pada tingkat kasasi, Mahkamah Agung memutuskan untuk menambah hukuman Ridho menjadi satu tahun enam bulan.","Mahkamah Agung Perpanjang Hukuman Ridho Rhoma"
"dict","entertainment","Ambruk Saat Pentas, Butet Kertaredjasa Akhirnya Pasang 4 Ring Jantung  - Kondisi kesehatan seniman    kian membaik setelah ia ambruk saat memainkan pementasan teater berjudul Kanjeng Sepuh di Graha Bhakti Budaya, Taman Ismail Marzuki, Jumat (23/3/2019). Sutradara Agus Noor mengungkapkan bahwa seusai pementasan, Butet langsung dibawa ke Rumah Sakit Saint Carolus, Jakarta Pusat. ""Ya, Butet Kartaredjasa baru saja diwisuda dengan cara operasi pasang empat ring di pembuluh jantungnya. Selamat, Jenderal Butet.  ,"" demikian pesan singkat dari Agus, Minggu (24/3/2019). Sebelumnya, Agus melalui akun Instagram Agus Noor menuturkan bahwa Butet ambruk saat pementasan berjalan di menit 60-an. Tubuh Butet lemas, dingin, dan pucat. Dia mengalami serangan jantung ketika itu. Sejumlah kru medis sibuk menangani Butet yang tengah mengalami serangan jantung. Di atas panggung, pementasan masih berjalan. Kondisi Butet berangsung membaik. Butet bersikukuh untuk tampil kembali, namun Agus mencoba menahannya. "" ,"" tulis Agus. "" ,"" tulis Agus lagi.","Ambruk Saat Pentas, Butet Kertaredjasa Akhirnya Pasang 4 Ring Jantung"
"dict","sains","Penemuan yang Mengubah Dunia: Bantal, Paling Awal Dibuat dari Batu  Tidur merupakan salah satu kebutuhan pokok manusia yang sering kali diabaikan. Bahkan, beberapa penelitian mencatat bahwa masalah tidur ini bisa mengancam kesehatan dan kualitas hidup manusia. Tingginya angka masalah tidur di seluruh dunia ini membuat Organisasi Tidur Dunia (World Sleep Society) mencetuskan Hari Tidur Sedunia pada 2008. Hari khusus ini bukan terletak pada tanggal, tapi setiap Jumat sebelum musim semi dimulai setiap tahunnya. Tahun 2019, Hari Tidur Sedunia jatuh pada hari ini, 15 Maret. Membincang soal tidur, tentu akan berbicara tentang benda pendukung kenyamanan seperti kasur, sofa, hingga selimut. Tapi salah satu benda yang tidak bisa dihilangkan untuk tidur adalah   . Meski tak beralas, kita sering kali mencari benda untuk menopang kepala dan leher sebagai bantalan. Ini menunjukkan pentingnya bantal untuk manusia. Namun, tahukah Anda, bantal paling awal jauh berbeda dengan yang kita ketahui saat ini? Bantal paling awal dimulai sekitar tahun 7000 sebelum masehi (SM) di Mesopotamia kuno, atau kini dikenal sebagai negara Irak. Jangan bayangkan bantal pada masa itu empuk dan lembut seperti yang Anda gunakan sekarang. Dulu, bantal terbuat dari batu. Apakah itu berarti bantal dulu jauh dari kata nyaman? Ya, dulu bantal memang bukan untuk mencari kenyamanan. Sebaliknya, fungsi bantal batu adalah mencegah serangga merangkak ke dalam mulut, hidung, dan telinga. Seperti kelas sosial lainnya, bantal juga menandakan status pemakainnya. Semakin tinggi bantal yang digunakan maka kian kaya pula orang tersebut. Dengan kata lain, semakin kaya maka makin sulit serangga ""menggerayangi"" tubuh seseorang. Konsep pencegahan serangga dalam penggunaan bantal juga dianut oleh warga   . Tapi di samping itu, mereka juga meyakini bahwa kepala adalah kursi kehidupan spiritual yang harus dihargai. Bantal pada masa itu dibuat dari berbagai bahan berbeda seperti marmer, gading, keramik, batu, dan kayu. Semakin bagus bahan yang digunakan menandakan semakin religius dan kaya seseorang. Untuk menambah makna religius, bantal juga diukir dengan gambar para dewa. Tujuannya adalah untuk mengusir roh jahat. Masa    Kuno juga memiliki gagasan serupa. Material bahan untuk bantal juga bermacam-macam benda keras seperti porselen, batu giok, perunggu, bambu, atau kayu. Selain itu, mitologi China mempercayai bahan keras pada bantal membantu sirkulasi darah serta menjauhkan dari roh jahat. Mereka percaya bahwa setiap bahan pembuat bantal memiliki manfaat kesehatan berbeda. Seperti masyarakat Mesir Kuno, warga China Kuno juga menghiasi bantal mereka dengan ukiran. Tapi ukiran yang digunakan adalah gambar manusia, hewan, dan tanaman. Semakin rumit ukiran yang dibuat harganya akan makin mahal. Gagasan kenyamanan saat tidur tercetuskan oleh orang Yunani dan Romawi. Mereka meninggalkan ide bantal keras dan beralih pada bantal empuk. Mereka mulai membuat bantal dari kain bekas yang diisi dengan bahan empuk seperti kapas, kapuk, alang-alang, dan jerami. Namun, seperti penanda kelas sosial lain, orang kaya menggunakan bahan pengisi bulu lembut. Inilah awal mula bantal yang kita ketahui dan gunakan sekarang. Meski begitu, pada abad pertengahan di Eropa, bantal tidak terlalu populer. Masalahnya lagi-lagi adalah bantal menjadi simbol status sosial. Hanya orang kaya yang bisa tidur menggunakan bantal. Bahkan, Raja Henry VIII melarang penggunaan bantal bagi siapa pun selain wanita hamil dan keluarga kerajaan. Revolusi industri merupakan masa di mana banyak orang mulai menggunakan bantal. Selama masa ini, harga bantal lebih terjangkau karena diproduksi massal oleh perusahaan tekstil. Bahkan, di masa kepemimpinan Ratu Victoria, bantal juga digunakan untuk fungsi dekoratif di sofa atau kursi. Seiring berjalannya waktu, kini bantal dibuat dari berbagai macam bahan alami maupun sintetis.","Penemuan yang Mengubah Dunia: Bantal, Paling Awal Dibuat dari Batu"
"dict","entertainment","Yayan Ruhian dan Cecep A Rahman Hajar Keanu Reeves dalam Trailer John Wick 3","Yayan Ruhian dan Cecep A Rahman Hajar Keanu Reeves dalam Trailer John Wick 3"
"dict","entertainment","Gara-gara Gading Marten, Lagu Daur Ulang DMASIV Naik 5 Juta Views    - Beberapa waku lalu, sebuah video viral memperlihatkan artis peran    menangis ketika menyanyikan lagu ""Pergilah Kasih"", lagu yang dipopulerkan mendiang Chrisye dan didaur ulang oleh band   .  Vokalis Rian Ekky Pradita mengatakan bahwa jumlah   pada lagu tersebut di channel YouTube D'MASIV ikut terkena dampaknya.  ""Memang lucu. Dari 24 juta   sebelumnya, dalam dua hari langsung naik jadi 29 juta. Mereka di kolom komentar banyak yang komentar 'Papa Gading yang membawaku ke sini',"" kata Rian di sela mengisi acara peresmian MRT fase 1 di kawasan Bundaran Hotel Indonesia (HI), Jakarta Pusat, Minggu (24/3/2019).  Akibat viralnya video tersebut, Rian langsung mengirimkan pesan singkat kepada putra artis senior Roy Marten. Ternyata bagi Gading, kata Rian, lagu itu sedang mewakili perasaan hatinya saat ini.  ""Gading bilang 'Lagu itu dalam banget  '.   tertawa   sih, ya, mungkin itu salah satu cara ekspresi dirinya dia saja sih. Kalau seniman, kan, gitu. Gading musisi juga, dia  ,"" kata Rian.  Jika ada kesempatan berjumpa bareng dalam acara musik, Rian ingin mengajak Gading untuk bernyanyi bersama khusus untuk lagu ""Pergilah Kasih"".  ""  bilang ' , kapan-kapan nyanyi barenglah'. Kalau dia di Jakarta  akan ajak dia nyanyi tadi (dalam acara peresmian MRT). Tapi, dia lagi di luar kota,"" kata Rian.","Gara-gara Gading Marten, Lagu Daur Ulang D'MASIV Naik 5 Juta Views"
"dict","sains","Spesies Ular Baru Ditemukan, Dapat Menusuk Musuh Tanpa Membuka Mulut  Tim peneliti Internasional baru saja menemukan    di Afrika Barat yang memiliki metode unik untuk melumpuhkan musuh.    ini memiliki    istimewa dan dapat menusuk musuh saat mulut tertutup. Dalam laporan yang terbit di jurnal  , tiga spesimen      ditemukan di hutan hujan Guinea tenggara dan Liberia barat laut.  masih satu keluarga dengan  . Mereka kerap dijuluki dengan nama ular mola, ular aspal atau ular stiletto. Keunikan yang dimiliki   adalah anatomi tengkorak dan taring yang dapat memutar kepala untuk menikam mangsa dari samping. Meski sebagian besar kasus menunjukkan racun  tidak cukup kuat membunuh manusia, tapi kita tetap harus hati-hati. Menurut catatan African Snakebite Institute,    ular stiletto dapat menimbulkan kerusakan serius yang menyebabkan rasa sakit parah, pembengkakan, kulit melepuh dan rusaknya jaringan. Karena sistem pengiriman racun yang unik, ular stiletto hampir tidak mungkin ditangkap dengan cara biasa (tangan di belakang kepala) tanpa digigit. Menariknya lagi, ular ini tetap bisa menusuk musuhnya meski mulut tertutup. Hal ini karena dia memiliki taring yang sedikit menonjol keluar dari mulut. Melansir  , Selasa (12/3/2019), saat ini diperkirakan ada lebih dari 20 spesies ular stiletto. Saat ini diperkirakan ada lebih dari 20 spesies ular stiletto yang sebagian besar ditemukan di Afrika sub-Sahara dan dua di antaranya endemik di Timur Tengah. Mereka bisa tinggal di berbagai tempat, mulai dari semi gurun pasir hingga hutan hujan. Untuk spesies baru, mereka ditemukan di wilayah hutan hujan atau tepi hutan hujan dan endemik di kawasan hutan Upper Guinea, sebuah kawasan dengan kekayaan hayati yang sedang bertarung dengan banyaknya ancaman buatan manusia. Tim peneliti menemukan spesimen itu saat melakukan ekspedisi di wilayah tersebut. Spesimen pertama ditemukan pada malam hari di tepi sungai kecil berbatu di hutan hujan dataran rendah Liberia. Saat tim mencoba menangkapnya, ular itu justru melompat ke jarak yang hampir sepanjang tubuhnya. Sementara dua spesimen lain ditemukan di perkebunan pisang, singkong dan kopi di Guinea. ""Survei lebih lanjut masih diperlukan untuk memperkirakan jumlah spesies ular baru dan mengumpulkan lebih banyak informasi untuk kebutuhan ekologis dan sifat biologisnya,"" tulis para ahli dalam penelitian ini.  merupakan nama yang diberikan untuk menghormati Profesor William Roy Branch, seorang ahli reptil dari Afrika Selatan yang meninggal pada Oktober 2018.","Spesies Ular Baru Ditemukan, Dapat Menusuk Musuh Tanpa Membuka Mulut"
"dict","entertainment","Aziz Jamrud: Mumpung Belum Dilarang, Mari Kita Nyanyikan Lagu Ini  - Alunan musik rock menggema di pagelaran The Sounds Projects Vol.4 dengan lantang.   Dalam acara yang digelar di Ballroom Kuningan City, Jakarta Selatan, Sabtu (23/3/2019) ini,    sukses menghipnotis penonton untuk menyanyikan lagu-lagu mereka dengan lirik yang nakal dan sarkas.  ""Mumpung lagu ini belum dilarang mari kita nyanyikan, kalau sudah dilarang   gue dipenjara,"" ucap Aziz MS gitaris Jamrud. Tak lama berselang, grup musik yang berdiri sejak tahun 1989 ini langsung menyanyikan lagu fenomenal mereka berjudul ""Surti dan Tejo"".  Teriakan penonton langsung terdengar begitu lagu tersebut saat dinyanyikan.   Jamrud masih dengan ciri khasnya, bernyanyi lepas tanpa rasa malu dengan karya-karyanya yang dianggap sebagian orang tak senonoh.  Malam ini Jamrud membawakan beberapa lagu andalan mereka, yakni ""Selamat Ulang Tahun"", ""Pelangi di Matamu"", dan ""Waktuku Mandi"".","Aziz Jamrud: Mumpung Belum Dilarang, Mari Kita Nyanyikan Lagu Ini"
"dict","entertainment","Widi MALIQ & DEssentials Beri Wejangan kepada Pemenang Go Ahead Challange  - Pemain drum grup band MALIQ & D'Essentials Widi Puradiredja memberi wejangan kepada seniman visual art Gabriela Fernandez ketika mereka berada di Abbey Road Studios, London, Inggris. Saat itu, Gabriela berstatus sebagai pemenang Go Ahead Challange 2018. Dia mendapatkan Aspirational Reward berupa perjalanan pengalaman industri kreatif di London. Perjalanan perempuan yang akrab disapa Gaby itu bertepatan dengan kegiatan proses rekaman materi album MALIQ & D'Essentials pada 13 Februari 2019 di studio legendaris yang pernah mencetak karya-karya bermusik band kenamaan The Beatles, Pink Floyd, hingga, Red Hot Chili Peppers. Kepada Gaby, Widi menekankan bahwa kemampuan, perilaku dan profesionalisme seorang pegiat seni harus selalu dijaga dan dipupuk agar karier di industri kreatif bisa langgeng. ""Ada satu hal yang gue tekankan buat anak-anak. Sikap profesional, attitude, sangat penting di dunia kreatif. Bagaimana kita memposisikan diri kita di industri, skill, professionalism itu penting,"" ujar Widi saat berbincang di sela talk show Go Ahead Challange di kawasan SCBD, Jakarta, Senin (25/3/2019). Menurut Widi, pengalaman yang didapat Gaby selama mencicipi Aspirational Reward di Abbey Road Studios sangat berharga dan menjadi modal penting ketika kembali ke Tanah Air. ""Jadi ketika balik ke Indonesia, bekerjalah kamu seperti standar yang kemarin di London,"" pesan Widi. Widi menambahkan bahwa pesan yang dia sampaikan kepada Gaby bukan tanpa alasan. Dari pengalamannya sebagai penggawa MALIQ & D'Essentials, profesionalisme sangat dibutuhkan sebagai modal utama dalam berkarier dan memperluas jaringan. Modal itu pula yang akhirnya membuat MALIQ & D'Essentials mendapatkan kesempatan menjajal rekaman album baru mereka di Abbey Road Studios. ""Kalau dipikir-pikir enggak sembarangan yang bisa rekaman di sana. Terus sekarang kami anak Tangerang Selatan bisa rekaman di sana ha-ha-ha... ya itu dia tadi, kami berusaha untuk selalu profesional sehingga kami dapat kesempatan ini,"" ungkap Widi.    ","Widi MALIQ & D'Essentials Beri Wejangan kepada Pemenang Go Ahead Challange"
