"_type","category","isi","judul"
"dict","sport","Jakarta - Timnas Indonesia U-23 akan memulai perburuan tiket Piala Asia U-23 2020 hari ini. Thailand akan menjadi rintangan pertama skuat Garuda Muda.Ajang Piala Asia U-23 selanjutnya baru akan digelar 2020, namun kualifikasinya sudah digeber sejak tahun ini. Indonesia akan memulai perburuan tiket putaran final pada sore nanti.Di babak kualifikasi Piala Asia U-23 2020, Indonesia tergabung di Grup K, bersama Vietnam, Thailand, dan Brunei. Laga perdana Indonesia adalah menghadapi Thailand di Stadion My Dinh, Hanoi, Jumat (22/3/2019), sebelum kemudian menghadapi Vietnam (24/3) dan Brunei (26/3). googletag.cmd.push(function() { googletag.display('div-gpt-ad-1535945694694-0'); }); Menghadapi Thailand, Indonesia punya modal bagus dari segi catatan pertemuan. Terakhir, skuat Merah Putih mengalahkan Thailand 2-1 di final Piala AFF U-22 bulan lalu, dan memastikan keluar sebagai juara turnamen.Skuat Timnas Indonesia U-23 kali ini tak jauh berbeda dengan skuat juara di Piala AFF U-22 2019. Pelatih Indra Sjafri hanya menambahkan Egy Maulana Vikri dan Saddil Ramdani, serta mencoret beberapa pemain.Indra Sjafri sendiri sudah memboyong 24 pemain ke Hanoi. Nantinya, satu pemain akan dicoret karena aturannya setiap negara harus mendaftarkan 23 pemain.Baca juga: Rekor Indra Sjafri Vs ThailandNamun siapa yang akan dibawa, Indonesia masih mendapat sedikit kendala. Nama striker Ezra Walian sedang dipermasalahkan AFC karena persoalan administrasi.Penyerang naturalisasi itu dipermasalahkan karena sudah sempat membela Timnas Belanda U-17. Saat ini, PSSI masih menunggu keputusan FIFA terkait status Ezra, yang sudah dinaturalisasi dan menjadi Warga Negara Indonesia (WNI) sejak 2017.Adapun selain Ezra, Indonesia masih punya banyak pemain andalan. Ada Egy Maulana Vikri, Saddil Ramdani, Witan Sulaeman, dan Marinus Wanewar yang bisa diandalkan di lini depan.Sementara di lini tengah, duet Muhammad Luthfi dan Gian Zola diharapkan menjadi penyeimbang permainan tim, sekaligus menyokong Egy.Baca juga: Dengan atau Tanpa Ezra, Timnas U-23 RelaksDan di lini belakang, kuartet Asnnawi Mangkualam, Firza Andhika, Andy Setyo dan Bagas Adi Nugroho diharapkan menjadi tembok tebal menggalang pertahanan Indonesia. Terakhir, posisi kiper kemungkinan besar dipercayakan kepada Awan Setho.Menghadapi Thailand, Indonesia tentu diharapkan bisa meraih hasil positif. Jadi, ayo dukung Timnas Indonesia merebut satu tiket ke putaran final Piala Asia U-23 2020.Baca juga: Perkiraan Formasi Timnas U-23 dengan Egy dan Saddil (yna/rin) kualifikasi piala asia u-23 kualifikasi piala asia u-23 2020 timnas indonesia u-23 timnas u-23","Hari Ini, Timnas Indonesia U-23 Mulai Berburu Tiket Piala Asia"
"dict","sport","Paris - Masa depan Raphael Varane di Real Madrid jadi spekulasi usai bek Prancis itu dikabarkan ingin hengkang. Ditanya soal hal itu, Varane enggan membahasnya.L'Equipe melaporkan bahwa Varane mulai mempertimbangkan masa depannya di Madrid. Bek berusia 25 tahun itu diklaim memikirkan opsi untuk hengkang pada musim panas nanti.Varane dikabarkan ingin mencari tantangan baru. Manchester United disebut-sebut sebagai klub yang tertarik kepada pemain yang ikut mengantar Prancis menjuarai Piala Dunia 2018 itu. googletag.cmd.push(function() { googletag.display('div-gpt-ad-1535945694694-0'); }); Baca juga: Varane Diklaim Ingin Hengkang dari Real Madrid, Mau Gabung MU?Ditanya soal masa depannya, Varane enggan membahasnya lebih jauh. Ia tak mamu membicarakannya di depan publik.""Saya tidak mau bicara soal masa depan saya,"" ujar Varane kepada Le Parisien seperti dikutip Marca.""Saya bukan orang yang membicarakan masa depan saya secara terbuka,"" katanya menegaskan.Varane masih terikat kontrak dengan Madrid sampai 2022. Ia dipagari dengan klausul rilis sebesar 200 juta euro (Rp 3,2 triliun).Baca juga: Vinicius: Cara Zidane Bicara Saja Sudah Berbeda (nds/nds) raphael varane real madrid","Varane Ogah Bicara soal Masa Depannya di Madrid"
"dict","sport","Jakarta - Winger veteran Greg Nwokolo menegaskan, dia masih bisa tampil maksimal bersama Timnas Indonesia. Menurut Greg, sepakbola tak sekadar mengandalkan fisik.Sebanyak 22 pemain dipanggil pelatih timnas Simon McMenemy untuk melakoni laga uji coba melawan Myanmar, Senin (25/3/2019). Dalam skuatnya, beberapa pemain yang dipanggil sudah di atas usia 30 tahun seperti Ruben Sanadi, Yustinus Pae, dan Greg.Greg yang kini berusia 33 tahun menolak jika usia dijadikan patokan pemain untuk membela Timnas Indonesia. Pemain Madura United itu pun bertekad menunjukkan bahwa kualitasnya bahwa dia tak kalah dengan pemain muda. googletag.cmd.push(function() { googletag.display('div-gpt-ad-1535945694694-0'); }); Baca juga: McMenemy Ingin Perbaiki Rekor Indonesia di Laga Tandang""Hanya di Indonesia yang mempermasalahkan umur-umur. Di Eropa tidak ada yang begitu. Di Eropa 40 tahun masih pemain timnas. Masa di Indonesia orang 33 tahun masih kuat bermain di sayap. Of course, masih. Masih kuat. Bermain sepakbola itu pakai otak bukan lari,"" ujar Greg usai latihan di Stadion Madya, Senayan, Jakarta, Kamis (21/3/2019).""Ya kalau cuma lari di lapangan cuma buat jadi pemain marathon saja bukan pemain sepakbola. Bermain sepakbola itu pakai otak dan kaki. Bukan hanya lari. Ya itu,"" katanya.Di posisi sayap, timnas senior juga memiliki beberapa pemain yang usianya lebih muda seperti Riko Simanjutak dan Andik Vermansah.Baca juga: Sebelum Berangkat ke Myanmar, Timnas Latihan Lebih Santai (ads/rin) greg nwokolo timnas indonesia simon mcmenemy","Tolak Keraguan, Greg: Main Sepakbola Itu Bukan Hanya Lari"
"dict","sport","Jakarta - Timnas Indonesia U-23 akan memulai laga perdana Kualifikasi Piala Asia U-23 2020 dengan menghadapi Thailand sore nanti. Berikut jadwal siaran langsungnya.Timnas Indonesia U-23 saat ini sedang berada di Hanoi, Vietnam, untuk melakoni pertandingan Kualifikasi Piala Asia U-23 2020. Skuat Garuda Muda tergabung di Grup K bersama Vietnam, Thailand, dan Brunei.Timnas Indonesia U-23 datang ke Kualifikasi Piala Asia U-23 dengan kekuatan inti. Selain memboyong mayoritas skuat juara di Piala AFF U-22 2019, pelatih Indra Sjafri kini menyertakan Egy Maulana Vikri dan Saddil Ramdani. Adapun Ezra Walian masih menunggu masalah administrasinya beres. googletag.cmd.push(function() { googletag.display('div-gpt-ad-1535945694694-0'); }); Baca juga: Hari Ini, Timnas Indonesia U-23 Mulai Berburu Tiket Piala AsiaDi laga perdana kualifikasi, Indonesia akan menghadapi Thailand di Stadion My Dinh, Jumat (22/3/2019). Terakhir, Indonesia mampu mengalahkan Thailand 2-1 di final Piala AFF U-22 bulan lalu.Kick off pertandingan Thailand vs Indonesia akan dimulai pukul 17.00 WIB. RCTI selaku pemegang hak siar, akan menyiarkannya secara langsung.Baca juga: Perkiraan Formasi Timnas U-23 dengan Egy dan Saddil (yna/nds) timnas indonesia u-23 timnas u-23 kualifikasi piala asia u-23 kualifikasi piala asia u-23 2020 jadwal siaran langsung timnas indonesia u-23","Jadwal Siaran Langsung Kualifikasi Piala Asia U-23: Thailand vs Indonesia"
"dict","sport","Jakarta - Manchester United berpotensi kehilangan Ander Herrera di akhir musim. Di tengah kontraknya yang segera habis, Herrera menjadi pemain buruan Paris St. Germain.Setelah Jose Mourinho dipecat MU, pemain tengah Spanyol itu kembali bersinar lagi di bawah arahan Ole Gunnar Solskjaer. Herrera hampir selalu dimainkan sebagai starter dalam 13 pertandingan dan telah mencetak dua gol serta dua assist.Sementara itu kontrak Herrera di Old Trafford tinggal tersisa sampai musim panas 2019. PSG dikabarkan memantau situasi Herrera dan telah mengajukan tawaran. googletag.cmd.push(function() { googletag.display('div-gpt-ad-1535945694694-0'); }); Baca juga: Pogba 'Si Pelayan' Rashford dan MbappeMarca mengonfirmasi bahwa Les Parisiens menawari eks pemain Athletic Bilbao itu dengan bayaran sebesar 173 ribu euro per pekan (sekitar Rp 2,7 miliar). Jumlah itu nyaris dua kali lipat dari yang diterima Herrera sekarang di MU.Baca juga: Sudah Dapat Manajer yang Cocok, MU Tak Usah Coba-Coba LagiDisebutkan pula Herrera akan sulit menolak tawaran menggiurkan itu.Dengan demikian, Setan Merah tak punya banyak waktu untuk memperpanjang kontrak Herrera. Pasalnya, sekali kontraknya habis Herrera akan bisa pergi secara cuma-cuma alias gratis.Meski begitu, kabar lain menyebutkan bahwa Herrera tidak akan hengkang. Pesepakbola berusia 29 tahun itu diyakini akan menyepakati perpanjangan kontrak sampai tiga tahun ke depan. (rin/nds) ander herrera manchester united psg","Ander Herrera Diburu PSG"
"dict","sport","Milan - Bek Inter Milan, Milan Skriniar, kabarnya jadi incaran Real Madrid dan Barcelona. Dua raksasa Spanyol itu diklaim tertarik merekrut Skriniar musim panas ini.Skriniar merupakan salah satu pilar penting di lini belakang Inter. Musim ini, bek asal Slovakia itu sudah main 36 kali di semua kompetisi.Performa Skriniar tak luput dari perhatian klub besar Eropa, terutama Madrid. Los Blancos diklaim memantau Skriniar, apalagi dengan spekulasi masa depan Raphael Varane yang belakangan mencuat. googletag.cmd.push(function() { googletag.display('div-gpt-ad-1535945694694-0'); }); Agen Skriniar, Mithat Halis, mengklaim Madrid dan Barcelona ingin merekrut kliennya pada bursa musim panas nanti. Menurutnya, siapa pun yang bisa meyakinkan Inter bakal mendapatkan pemain berusia 24 tahun itu.Baca juga: Icardi Sudah Kembali Berlatih""Real Madrid ingin merekrutnya, begitu juga Barcelona. Tim yang bisa meyakinkan Inter akan mendapatkannya musim panas ini,"" ujar Mithat Halis seperti dilansir Marca.""Skriniar punya sikap profesional. Kalau Real Madrid ingin merekrutnya, mereka bisa, ada banyak agen yang punya kepentingan pribadi dengan membawa pemain ke mana mereka mau.""Meski demikian, mengingat reputasi dan usia yang masih muda, Skriniar disebut tak akan didapat dengan harga murah.""Inter membayar 28 juta euro kepada Sampdoria (pada 2017) dan, enam bulan kemudian, Manchester City menawarkan 55 juta euro. Sekarang dia bernilai sekitar 100 juta euro. Kesepakatan akan rumit dengan campur tangan perantara,"" kata Halis.Baca juga: Bravo Inter, Bravo Lautaro (nds/yna) milan skriniar inter milan real madrid barcelona","Agen: Madrid dan Barcelona Inginkan Milan Skriniar"
"dict","sport","Madrid - Lionel Messi kembali memperkuat timnas Argentina. Pelatih Argentina Lionel Scaloni berharap kehadiran Messi membuat para pemain lain meningkatkan performanya.Setelah hampir sembilan bulan absen di laga internasional, Messi akhirnya kembali ke timnas Argentina. Bintang Barcelona ini rehat dari ajang internasional sejak kegagalan Albiceleste di 16 besar Piala Dunia 2018.Pertandingan uji coba melawan Venezuela di Stadion Wanda Metropolitano, Sabtu (23/3/2018) dini hari WIB, bakal menjadi laga perdana Messi sejak memutuskan kembali ke timnas. Messi direncanakan akan main sejak menit pertama. googletag.cmd.push(function() { googletag.display('div-gpt-ad-1535945694694-0'); }); Menjelang laga ini, Scaloni berharap kehadiran La Pulga bisa memotivasi para pemain Argentina yang lain tampil lebih baik.Baca juga: Messi Comeback, Timnas Argentina Luncurkan Jersey Baru""Kami berharap Messi dapat membuat rekan-rekanya menunjukkan penampilan terbaik mereka. Kami membutuhkan mereka untuk memberikan sesuatu yang lebih sehingga kami bisa menjadi tim yang hebat,"" tutur Scaloni seperti dikutip dari Sportskeeda.""Kami ingin mereka menyadari bahwa mereka adalah pemain hebat dan bahwa mereka perlu menaikkan level agar Argentina dapat kembali ke level yang dulu mereka miliki di masa lampau. Bukan Messi yang harus meningkatkan permainan,"" ujarnya.Argentina banyak melakukan perubahan pada skuatnya usai Piala Dunia 2018. Scaloni pun sadar Messi bakal perlu beradaptasi.""Ketika kami memutuskan untuk membawanya kembali, dia tahu telah terjadi perubahan yang besar. Dia belum merasakan bersama banyak pemain di skuat Argentina saat ini,"" ujar Scaloni tentang Messi.Argentina di bawah Scaloni meraih hasil cukup positif meski tanpa Messi. Mereka hanya sekali kalah dalam enam laga dengan mencatat empat kemenangan. Satu-satunya kekalahan tim Tango terjadi saat mereka takluk 0-1 di markas Brasil.Baca juga: Faktor Umur, Messi Tak Seharusnya Kembali Cepat-cepat ke Timnas Argentina (nds/rin) lionel messi timnas argentina","Menanti Efek Kembalinya Messi ke Timnas Argentina"
"dict","sport","","Awal Meyakinkan Belanda"
"dict","sport","Jakarta - FIFA melarang Ezra Walian berlaga di Kualifikasi Piala Asia U-23 2020. Pemain kelahiran Belanda itu pun tidak membela Timnas Indonesia.""Ya, Ezra sudah dipastikan tidak bisa main, karena deadline-nya juga udah lewat,"" kata Direktur Media PSSI Gatot Widakdo kepada detikSport.Sebelumnya santer diberitakan Ezra terkendala masalah administrasi, saat Timnas Indonesia U-23 hendak mendaftarkan 23 pemain yang dibawa ke Kualifikasi Piala Asia U-23. Padahal, pemain asal Belanda itu sudah diboyong ke Vietnam. googletag.cmd.push(function() { googletag.display('div-gpt-ad-1535945694694-0'); }); Baca juga: Hari Ini, Timnas Indonesia U-23 Mulai Berburu Tiket Piala AsiaYang dipermasalahkan FIFA adalah status Ezra yang pernah membela Timnas Belanda U-17, sebelum dinaturalisasi oleh Indonesia pada 2017. Status Ezra yang pernah membela Belanda itu, membuat dirinya terganjal Statuta FIFA untuk kini bisa berlaga di Kualifikasi Piala Asia U-23 bersama Indonesia.Terakhir, FIFA pun sudah menyurati PSSI terkait keputusan tidak boleh memainkan Ezra. PSSI mengakui sudah menerima suratnya.""Iya, kami sudah menerima suratnya,"" jelas Gatot.Indonesia akan berlaga melawan Thailand di Stadion My Dinh, Vietnam, Jumat (22/3/2019) sore nanti, dalam laga perdana Grup K Kualifikasi Piala Asia U-23 2020.Baca juga: 'Ganjalan untuk Ezra Walian Terlalu Mengada-ada' (yna/din) pssi ezra walian kualifikasi piala asia u-23 kualifikasi piala asia u-23 2020 fifa","Dilarang FIFA, Ezra Walian Tidak Tampil di Kualifikasi Piala Asia U-23"
"dict","sport","Rotterdam - Memphis Depay bertekad melanjutkan performa apiknya di laga melawan Belarusia. Depay kini menggincar mencatatkan hat-trick di laga Belanda berikutnya.Depay tampil luar biasa saat Belanda mengalahkan Belarusia 4-0 dalam ajang Kualifikasi Piala Eropa 2020 Grup C, Jumat (22/3/2019). Penyerang Lyon itu mampu terlibat dalam semua gol yang bersarang ke gawang lan dengan torehan dua gol dan dua assist.Depay mengejutkan Belarusia dengan menciptakan gol kilat, saat pertandingan baru berjalan 50 detik. Giorginio Wijnaldum kemudian menggandakan skor De Oranje untuk menandai babak pertama dengan keunggulan 2-0. googletag.cmd.push(function() { googletag.display('div-gpt-ad-1535945694694-0'); }); Baca juga: Kualifikasi Piala Eropa: Depay Gemilang, Belanda Gebuk Belarusia 4-0Setelah turun minum, Belanda menambah keunggulannya lewat gol penalti Depay di menit ke-55. Virgil van Dijk melengkapi pesta gol Belanda dengan golnya di menit-menit terakhir waktu pertandingan.Baca juga: Awal Meyakinkan BelandaBelanda masih akan melakoni lebih banyak pertandingan internasional di depan. Salah satu yang terdekat adalah laga kandang menghadapi Jerman di lanjutan kualifikasi Piala Eropa, Senin (25/3). ""Kami memulai laga dengan bagus, jika Anda memulai seperti ini, Secara alami malam kami akan menjadi lebih mudah. Kami juga mengatakannya satu sama lain sebelum melakoni laga ini: sepuluh menit pertama kami segera ingin mencari gol. Kemudian Anda juga harus beruntung,"" tutur Depay kepada NOS seperti dikutip dari Football-Oranje.""Jika Anda mencetak dua gol, Anda selalu menginginkan untuk mencetak gol yang ketiga. Asumsi saya memang tidak sepenuhnya benar. Saya akan menyimpan hat-trick ini untuk laga di lain waktu,"" kata mantan pemain Manchester United itu. (rin/yna) memphis depay timnas belanda kualifikasi piala eropa 2020 timnas belarusia","Menunggu Hat-trick Memphis Depay"
"dict","sport","Liverpool - Liverpool sukses melakukan negosiasi terkait harga tiket untuk suporter yang akan melawat ke Porto untuk menyaksikan laga perempatfinal Liga Champions. Harga tiket untuk suporter Liverpool pun dikorting.Liverpool akan menghadapi Porto di babak perempatfinal Liga Champions. Setelah jadi tuan rumah di leg pertama pada 9 April, The Reds akan gantian tandang ke markas Porto pada 17 April.Untuk pertandingan leg kedua di Estadio do Dragao, Porto awalnya memasang harga tiket 85 euro (Rp 1,3 juta) untuk suporter Liverpool. Namun, setelah kedua klub melakukan pembicaraan, harga tiket diturunkan menjadi 60 euro (Rp 965 ribu). googletag.cmd.push(function() { googletag.display('div-gpt-ad-1535945694694-0'); }); Baca juga: Ketemu Porto Lagi, Liverpool Antisipasi Laga yang Alot""LFC ingin berterima kasih kepada FC Porto karena bekerja dengan kami dalam struktur harga,"" demikian pernyataan Liverpool seperti dikutip dari Sky Sports.""Tim-tim Liga Champions lain juga terus bekerja bersama UEFA untuk menegosiasikan harga tiket paling adil untuk fans di sepanjang kompetisi.""""Dialog terkait batas harga tiket untuk fans tim tamu juga akan terus berlanjut. Sampai batasan itu disepakati, LFC akan terus bekerja dengan lawan dan UEFA untuk mendiskusikan cara yang paling masuk akal untuk mengurangi biaya suporter tim tamu.""Kesepakatan ini tercapai setelah sempat ada masalah soal harga tiket di Estadio do Dragao dari duel kedua tim di babak 16 besar Liga Champions musim lalu. Kala itu, suporter Liverpool harus membayar tiket sebesar 75 euro, sedangkan fans Porto pemilik tiket musiman hanya harus membayar 25 euro.Jika Liverpool sukses melobi Porto untuk menurunkan harga tiket di Estadio do Dragao, Manchester United memutuskan untuk menyubsidi suporternya yang akan menyaksikan laga di markas Barcelona. Setan Merah akan memberi subsidi sebesar 27 pound sterling (sekitar Rp 502 ribu) dari harga tiket 102 pound sterling (sekitar Rp 1,9 juta).Baca juga: Harga Tiket di Camp Nou Rp 1,9 Juta, MU Protes ke Barcelona (nds/rin) liga champions liverpool porto","Liverpool Sukses Nego, Porto Turunkan Harga Tiket"
"dict","sport","","Tiga Gol Cantik Luka Jovic, Pemain Incaran Barcelona"
"dict","sport","","Girangnya Argentina Menyambut Kembalinya Messi"
"dict","sport","","Gol Cuma-cuma Courtois untuk Rusia"
"dict","sport","","Ahsan/Hendra Satu-satunya Harapan Indonesia di All England"
"dict","hot","","Perjalanan Steve Emmanuel, Mualaf hingga Terjerat Narkoba"
"dict","hot","","Jessica Iskandar, Aura Kasih, Marion Jola, Cita Citata hingga Steve Emmanuel"
"dict","sport","","Apa Kabar Liem Swie King?"
"dict","sport","","Cerita Sigit Budiarto Menembus Juara All England 2003"
"dict","sport","","Balapan Seru di Losail, Salip-salipan Dovizioso dan Marquez"
"dict","hot","","Senyum Semringah Siti Badriah Dilamar Pacar"
"dict","hot","Jakarta - Shezy Idris akhirnya mengakui dirinya sempat mempersulit sang suami, Krishna Adhyata Pratama, untuk bertemu kedua buah hatinya. Namun, perempuan 37 tahun itu punya alasan di balik keputusannya tersebut.""Mempersulit, iya saya akuin. Akhirnya saya mempersulit ketemu anak, karena saya kecewa anak saya dijadikan barang bukti di persidangan satu,"" ujar Shezy Idris saat ditemui di Gedung Trans Tv, Jalan Kapten Tendean, Mampang Prapatan, Jakarta Selatan, Rabu (30/1). Gerah karena proses perceraiannya tak kunjung usai, Shezy Idris akhirnya mengizinkan Krishna Adhyata untuk bertemu sang anak. Izin tersebut dikeluarkan dengan satu syarat. googletag.cmd.push(function() { googletag.display('div-gpt-ad-1535944650921-0'); }); Baca juga: Sidang Cerai Shezy Idris Sempat Telat karena Salah PahamShezy Idris mengaku tak akan mengizinkan Krishna Adhyata Pratama bertemu anak-anak jika ia terus menerus mempersulit proses perceraian. Selama keduanya masih berstatus suami istri, selama itu pula Shezy akan menghalangi pertemuan anak dengan ayahnya.""Kedua akhirnya saya bilang sama dia 'boleh kamu ketemu ama anak tapi selesaikan dulu sidang ini'. Selama sidang ini tidak selesai ya selama itu kamu tidak ketemu anak,"" kata Shezy Idris.""Karena awalnya saya tidak mempersulit kok, saya fleksible, saya kasih kapanpun dia mau. Hanya mungkin pertukaran waktu dari Senin ke Rabu atau Sabtu ke Minggu gitu. Saya fleksible kok,"" sambungnya lagi. Shezy Idris tampaknya memang sudah lelah dengan proses perceraian dengan Krishna Adhyata Pratama yang terasa berlarut-larut. Sayangnya, perebutan hak asuh anak dan isu perselingkuhan yang membuat semua kendala itu terjadi.Tonton video: Dituduh Selingkuh, Shezy Idris: Lelaki Nggak Bijaksana! [Gambas:Video 20detik] (hnh/kmb) shezy idris shezy idris gugat cerai Photo Gallery 1 celeb Cerita Sheza Idris Soal Ngidam di Amerika dan Perceraian Kakaknya celeb Cerita Sheza Idris Soal Ngidam di Amerika dan Perceraian Kakaknya celeb Cerita Sheza Idris Soal Ngidam di Amerika dan Perceraian Kakaknya celeb Cerita Sheza Idris Soal Ngidam di Amerika dan Perceraian Kakaknya celeb Cerita Sheza Idris Soal Ngidam di Amerika dan Perceraian Kakaknya celeb Cerita Sheza Idris Soal Ngidam di Amerika dan Perceraian Kakaknya 1 celeb Kebekuan Antara Shezy Idris dan Suami di Ruang Sidang celeb Kebekuan Antara Shezy Idris dan Suami di Ruang Sidang celeb Kebekuan Antara Shezy Idris dan Suami di Ruang Sidang celeb Kebekuan Antara Shezy Idris dan Suami di Ruang Sidang celeb Kebekuan Antara Shezy Idris dan Suami di Ruang Sidang celeb Kebekuan Antara Shezy Idris dan Suami di Ruang Sidang celeb Kebekuan Antara Shezy Idris dan Suami di Ruang Sidang 2 celeb Nikah Lewat Ta'aruf, Shezy Idris dan Suami Cekcok Sejak Awal celeb Nikah Lewat Ta'aruf, Shezy Idris dan Suami Cekcok Sejak Awal celeb Nikah Lewat Ta'aruf, Shezy Idris dan Suami Cekcok Sejak Awal celeb Nikah Lewat Ta'aruf, Shezy Idris dan Suami Cekcok Sejak Awal celeb Nikah Lewat Ta'aruf, Shezy Idris dan Suami Cekcok Sejak Awal celeb Nikah Lewat Ta'aruf, Shezy Idris dan Suami Cekcok Sejak Awal 3 celeb Mau Cerai Dari 6 Tahun Lalu, Ingat Momen Ini Shezy Idris dan Suami? celeb Mau Cerai Dari 6 Tahun Lalu, Ingat Momen Ini Shezy Idris dan Suami? celeb Mau Cerai Dari 6 Tahun Lalu, Ingat Momen Ini Shezy Idris dan Suami? celeb Mau Cerai Dari 6 Tahun Lalu, Ingat Momen Ini Shezy Idris dan Suami? celeb Mau Cerai Dari 6 Tahun Lalu, Ingat Momen Ini Shezy Idris dan Suami? celeb Mau Cerai Dari 6 Tahun Lalu, Ingat Momen Ini Shezy Idris dan Suami? celeb Mau Cerai Dari 6 Tahun Lalu, Ingat Momen Ini Shezy Idris dan Suami? celeb Mau Cerai Dari 6 Tahun Lalu, Ingat Momen Ini Shezy Idris dan Suami? 4 photo Duh, Lucunya anak Shezy Idris 5 1","Shezy Idris Akui Persulit Suami Bertemu Anak-anak"
