"_type","category","isi","judul"
"dict","lifestyle","Jangan Pernah Sepelekan Sembelit...  Pernahkan merasakan   ?    Apa pun jawabannya, yang perlu diingat adalah jangan pernah menyepeleken kondisi sembelit tersebut. Sebab bisa jadi, sembelit yang dirasakan adalah tanda-tanda penyakit serius, seperti   . Misalnya penyakit kanker serviks (rahim) atau kanker kolorektal, jenis kanker yang tumbuh di daerah usus. Namun persoalannya, orang Indonesia banyak yang menganggap sembelit adalah sesuatu yang biasa. Penyakit yang bisa sembuh dengan sendirinya, atau cukup diobati dengan istirahat. “Padahal bisa jadi, saat sembelit dua hari, itu 20 tahun sebelum kanker.    empat hari, itu 10 tahun menuju kanker. enam hari sembelit, lima tahun menuju kanker.” Demikian diungkapkan dokter    saat berbincang dengan   di Bandung, Senin (25/3/2019) kemarin. David menjelaskan, biasanya pasien tidak mempedulikan kondisi itu. Mereka baru akan pergi ke dokter ketika darah sudah keluar, atau mengalami sakit yang luar biasa. Begitu diperiksa, ternyata pasien menderita kanker, dan sudah memasuki stadium IV. Itulah mengapa jarang terdengar dokter yang menjatuhkan vonis pasien di stadium I. “Orang kita , kalau masih bisa merokok dan jalan, akan terus merokok. Baru kalau sudah sulit bernapas, mereka ke UGD,” ungkap dia. Padahal, ada beberapa upaya pencegahan yang bisa dilakukan. Misalnya dengan   kanker untuk melihat potensi kanker sejak dini. Begitu pun pemeriksaan DNA untuk melihat potensi berbagai penyakit dalam tubuh seseorang. Ketika hasil tes sudah di tangan, akan lebih mudah bagi orang tersebut mencegah suatu penyakit. Misalnya dengan perubahan gaya hidup menjadi jauh lebih sehat. ""Gaya hidup sehat itu tidak mahal,” ucapnya. Misal, tidak perlu mencari sayur organik yang mahal, tapi menggantinya dengan    yang ada bekas gigitan ulat. Ulat tersebut membuktikan, sayuran tersebut bebas pestisida. Sebab ada kebiasaan buruk dari petani Indonesia yang menyemprotkan pestisida, sebulan sebelum panen. Tujuannya agar saat panen, sayuran yang dihasilkan berpenampilan mulus. “Biasanya sayuran yang mengandung pestisida ada rasa pedasnya sedikit,” tutur dia. Begitu pun dengan olahraga. Bagi yang ingin olahraga murah, banyak sekali pilihan yang bisa dilakukan. “Atau   di rumah. Enggak akan ada yang minta bayaran   di rumah,” kata David. Hal terakhir yang tak kalah penting adalah manajemen stres. Seseorang harus berupaya hidup seimbang, dan menghindari hal-hal yang bisa membuat stres berat. Misalnya, berhenti memikirkan pekerjaan di rumah. Begitu memasuki rumah, simpanlah semua pekerjaan di luar, dan biarkan itu dilanjutkan esok hari.","Jangan Pernah Sepelekan Sembelit..."
"dict","lifestyle","Hobi Lanjut Kerja di Rumah Bikin Sulit Tidur Nyenyak  - Pernah mendapat sindiran halus dari orang terdekat yang mengatakan, “Pekerjaan kantor jangan dibawa ke rumah!” atau “Sampai rumah itu harusnya istirahat, jangan lanjut kerja terus!”, atau justru kamu sendiri yang sering melontarkannya ke orang-orang di sekitar? Meski terdengar bawel, sebenarnya teguran seperti itu adalah tanda perhatian lho. Nyatanya,   malah semakin membuat kita susah tidur nyenyak. Tidak percaya? Untuk lebih meyakinkan agar kita menghentikan kebiasaan lembur, simak apa kata penelitian asal University of Zürich yang diterbitkan dalam Journal of Business and Psychology. Setelah meng-kroscek data dan kebiasaan kerja dari hampir 2 ribu karyawan dari negara-negara berbahasa Jerman, ditemukan bahwa sekitar 50 persennya bekerja lebih dari 40 jam per minggu. Setiap karyawan diminta mengisi survei online untuk menilai seberapa baik mereka mampu memisahkan hal-hal yang berbau pekerjaan dan kantor dari kehidupan pribadi mereka. Misalnya, mereka ditanya apakah pernah memikirkan pekerjaan di akhir pekan, dan seberapa sering mereka bekerja di akhir pekan. Mereka juga ditanya apakah mereka memberi waktu bagi diri sendiri untuk bersantai dan menikmati hobi atau bersosialisasi ketika tidak sedang kerja. Hasilnya, orang-orang yang tidak mampu memisahkan antara waktu kerja dan kehidupan pribadi tampak lebih sering kelelahan dan lebih cepat stres. Sebaliknya, orang-orang yang mampu memberi batasan tegas dan jelas antara pekerjaan dan kehidupan pribadi mereka bisa hidup lebih sejahtera. Kenapa? Ketika kita tidak mengabaikan email atau telepon yang masuk di luar jam kerja, atau ketika tengah malam menyalakan laptop di rumah untuk memastikan pekerjaan bisa selesai hari ini juga, artinya kita tidak memberikan waktu cukup bagi tubuh dan pikiran untuk pulih sejenak dari tekanan kerja sebelum masuk kerja lagi keesokan harinya. Begitu terus selanjutnya. Artinya, baik tubuh maupun pikiran selalu dalam mode siap kerja 24 jam setiap hari. Jika dari awal kamu sudah terbiasa memiliki jadwal tidur yang berantakan, kamu tidak akan merasa bugar dan semangat untuk beraktivitas keesokan harinya. Badan yang terasa “berat” karena kurang tidur bisa membuat gampang kecapekan. Akumulasi dari kombinasi stres fisik karena badan yang kecapekan dan stres emosional dari aktivitas harian yang ditambah dengan stres karena merasa tidak kunjung bisa tidur yang kemudian membuat waktu tidur makin berkurang, bisa menyebabkan sulit tidur malam. Lambat laun tanpa disadari, kombinasi stres fisik dan mental ini akan memengaruhi kesehatan tubuh hingga bertahun-tahun yang akan datang, kata para peneliti. Sebuah kelompok peneliti dari tiga lembaga independen terkemuka, yakni Oakland University, Portland State University, dan USDA (Dinas Kehutanan dan Perkebunan di Amerika) melaporkan bahwa efek susah tidur nyenyak akibat lembur tidak hanya berasal dari banyaknya tumpukan pekerjaan saja. Namun juga dari beban mental yang kita pikul sebagai hasil dari interaksi dengan rekan kerja yang menyebalkan dan pengalaman di kantor yang tidak mengenakkan, misalnya kena omel bos atau bermasalah dengan klien. Kepala peneliti, Caitlin Demsky dari Oakland University, menegaskan bahwa bahwa orang-orang yang mengalami kejadian buruk di tempat kerja, misalnya disepelekan oleh supervisor atau dikucilkan rekan kerjanya, lebih cenderung mudah mengalami insomnia yang ditandai dengan sulit mulai tidur hingga mudah terbangun tengah malam. Hasil penelitian tersebut dimuat dalam Journal of Occupational Health Psychology. Tidur adalah salah satu aktivitas pemulihan diri yang sangat penting, ungkap Demsky. Mendapatkan waktu tidur yang cukup adalah kunci dari produktivitas dan fokus kerja yang tinggi. Tidur cukup juga memainkan peran penting dalam menentukan kesuksesan di tempat kerja. Efek lembur sudah lama dikaitkan dengan penurunan fokus, kewaspadaan, dan daya ingat otak. Dijelaskan lebih lanjut oleh para peneliti dari Brigham and Women’s Hospital, ini karena kemampuan dan kecepatan otak dalam mencerna informasi akan semakin menurun seiring banyaknya waktu yang dihabiskan tubuh untuk tetap terjaga. Pada akhirnya, lembur justru akan memperlambat produktivitas di kantor. Semakin sering lembur, semakin sedikit waktu tidur yang didapat. Semakin jarang tidur nyenyak, semakin meningkatnya stres karena jam kerja yang makin panjang. Dilansir dari laman Huffington Post, kurang tidur biasanya akan menghambat kerja otak yang menyebabkan orang menjadi sulit berpikir kreatif, menciptakan inovasi untuk hal-hal baru, hingga sering dikaitkan dengan penurunan kemampuan berpikir jernih atau logis. Jadi ketika kurang tidur, tidak hanya rasa ngantuk seharian yang akan kita alami, tapi juga berbagai efek negatif yang bisa berpengaruh terhadap produktivitas kerja. Memang, melepaskan pekerjaan untuk bisa bersantai sejenak bisa jadi hal yang sulit bagi sebagian orang. Apalagi bagi yang mudah dihantui oleh pekerjaan yang belum tuntas. Yang jadi pertanyaan selanjutnya adalah bagaimana caranya menyingkirkan kecenderungan lembur yang bisa jadi pemicu stres? Sederhana saja, coba temukan kegiatan ringan yang akan membuat kamu merasa rileks dan santai usai bekerja. Entah itu hanya sekadar berjalan-jalan di taman, melukis, membaca buku, atau nonton film bersama orang terdekat. Intinya, lakukan aktivitas yang bisa membantu menyingkirkan pikiran negatif tentang pekerjaan, yang pada akhirnya bisa membuat tidur tak nyenyak. Pastikan tidak membawa beban dari pekerjaan di kantor hingga ke rumah dan biarkan dirimu menikmati waktu luang di rumah setelah disibukkan dengan setumpuk pekerjaan kantor.","Hobi Lanjut Kerja di Rumah Bikin Sulit Tidur Nyenyak"
"dict","lifestyle","Stres dan Begadang, 2 dari 8 Kebiasaan yang Bikin Cepat Tua  Menjadi tua itu memang hal mutlak yang terjadi pada setiap manusia. Namun, menua sebelum waktunya, tentu hal yang tak diinginkan semua orang. Tanpa disadari, beberapa    justru membuat kita mengalami    dini. Demi menghindari kondisi itu, tak ada cara lain selain mengubah pola makan dan gaya hidup kita. Berikut ini beberapa kebiasaan yang menyebabkan penuaan dini. Menonton film atau televisi berlebihan sangat mempengaruhi otak. Riset 2016 yang diterbitkan dalam  membuktikan, kurang aktivitas fisik selama usia paruh baya dapat mengurangi fungsi otak. ""Kami menemukan korelasi langsung dalam penelitian kami antara kebugaran yang buruk dan volume otak di kemudian hari, yang menunjukkan percepatan penuaan otak."" Demikian dikatakan Nicole Spartano, selaku pemimpin riset. Riset serupa yang diterbitkan di   menemukan, menonton televisi terlalu sering dan aktivitas fisik yang rendah di awal masa dewasa, terkait dengan penurunan fungsi kognitif selama usia paruh baya. Riset dari   telah membuktikan manfaat dari tidur. Riset dilakukan dengan meneliti 60 wanita berusia 30-49 tahun. Setengah dari peserta dalam riset ini memiliki kualitas tidur yang buruk. Hasilnya, mereka yang kurang tidur menunjukkan tanda-tanda penuaan    yang meningkat, termasuk garis-garis halus, pigmentasi yang tidak merata, kulit kendur, dan elastisitas yang berkurang. ""Studi kami adalah yang pertama menunjukkan kurang tidur berkorelasi dengan berkurangnya kesehatan kulit dan percepatan penuaan kulit."" Begitu kata pemimpin riset, Elma Baron, Profesor dermatologi di Case Western Reserve University School of Medicine. Riset besar di Austalia telah menganalisis gaya hidup lebih dari 230.000 peserta. Periset menyimpulkan tidur lebih dari sembilan jam dan duduk terlalu banyak atau lebih dari tujuh jam sehari, serta kurang olahraga dapat meningkatkan risiko kematian dini. ""Studi kami menunjukkan kita harus benar-benar menganggap perilaku ini sama seriusnya dengan kita melakukan faktor risiko lain."" ""Misalnya mengonsumsi alkohol dan pola makan yang tidak sehat,"" kata dokter Melody Ding, peneliti senior di School of Public Health dari University of Sydney. Menurut psikoterapis Robi Ludwig, hal utama yang membuat orang mengalami penuaan dini adalah merasa tua. “Ketika kita merasa lebih muda, memiliki harapan lebih, memiliki lebih banyak latihan yang produktif, dan kita lebih berhubungan dengan kemungkinan yang ditawarkan kehidupan, yang membuat kita lebih optimistis,"" ucapnya. Riset di tahun 2016 yang diterbitkan dalam   menyimpulkan, orang yang merasa lebih tua dari usia mereka yang sebenarnya lebih mungkin dirawat di rumah sakit. “Semakin muda berpikir muda, semakin baik bagi kita,” tambah Ludwig. Tidur dengan posisi menyamping atau posisi lateral dipercaya dapat menurunkan risiko alzheimer dan parkinson. Riset yang dilakukan ilmuwan internasional lewat seekor tikus membuktikan, tikus yang tidur dengan posisi menyamping mengalami pengurangan bahan kimia limbah di otak, yang membuat otak bekerja lebih efektif. Penumpukan bahan kimia berlebih di otak dapat berkontribusi pada kesehatan neurologis yang buruk. Postur tubuh yang buruk dapat mendatangkan rasa sakit yang berlangsung sampai usia tua. Postur tubuh membungkuk yang kerap kita lakukan, baik saat berada di belakang meja atau menulis pesan, dapat menyebabkan tubuh tegang. Lalu, terjadi stres di bagian otot dan menyebabkan sakit punggung. leher, atau pinggul. ""Tulang belakang memiliki kelengkungan berbentuk S yang seimbang untuk menstabilkan dan mendukung postur tubuh kita."" Demikian dikatakan Jeremy Smith, ahli bedah tulang ortopedi di Hoag Orthopedic Institute di California. Menurut dia, postur tubuh yang buruk atau bungkuk membuat tulang belakang menyimpang dari posisi normal. Kondisi ini membuat otot, cakram, dan tulang menjadi stres secara tidak normal. Oleh karena itu, selalu periksa postur yang tepat secara berkala sepanjang hari dengan memastikan bahwa telinga, bahu, dan pinggul membentuk garis lurus dalam posisi duduk. Stres dapat membuat kita sakit secara fisik. Riset di tahun 2012 menunjukkan, stres yang berhubungan dengan pekerjaan dapat merusak DNA kita. Riset yang dilakukan di Finlandia membuktikan, mereka yang mengalami stres terkait pekerjaan memiliki telomere terpendek. Telomere merupakan bagian DNA yang bila diperpendek dapat menyebabkan sel mati atau menjadi rusak. ""Kita tahu telomere berkurang seiring waktu, tetapi mungkin kecemasan dan stres dapat mempercepat itu,"" ucap Vivian Diller, seorang psikolog di New York. Inilah yang membuat stres dapat memicu penuaan dini. Stres juga dapat menekan sistem kekebalan tubuh, merusak kualitas tidur, meningkatkan tekanan darah. Selain itu, stres juga membuat fungsi otak tidak optimal, yang pada dasarnya membuat kita mengalami penuaan baik dari dalam atau luar. Untuk mengantasinya, sebaiknya kita rutin berolahraga, melakukan yoga, atau membaca buku untuk mendekompresi dan menenangkan pikiran. Molekul gula biasanya menempel pada protein dan lemak, yang membuatnya berubah menjadi AGEs (produk akhir glikasi) selama proses glikasi. AGEs dapat merusak kolagen dan elastin, dua protein di kulit yang membuat kulit menjadi halus, kencang, dan kenyal. Riset juga membuktikan, AGEs yang diturunkan dari makanan dapat berkontribusi pada penyempitan pembuluh darah, penyakit hari, dan alzheimer. ""Bagi kebanyakan orang dengan kadar glukosa normal, proses glikasi adalah sesuatu yang terjadi secara bertahap sepanjang hidup,"" kata Greg Hillebrand, ahli biokimia. Menurut dia, hal ini memang bukan masalah besar. Namun, pilihat diet dan gaya hiudp dapat mempengaruhi seberapa cepat efeknya pada kulit. Oleh karena itu, hindari konsumsi gula putih, sirup jagung fruktosa tinggi, dan karbohidrat sederhana, seperti pasta, untuk memperlambat proses glikasi dan mencegah penuaan dini.","Stres dan Begadang, 2 dari 8 Kebiasaan yang Bikin Cepat Tua"
"dict","foto","Sensasi Menyantap ''Sher Wagyu'', Daging Australia Bercita Rasa Jepang","Sensasi Menyantap ''Sher Wagyu'', Daging Australia Bercita Rasa Jepang"
"dict","lifestyle","Putus Cinta Lewat Pesan Singkat Tak Selalu Salah, Apa Alasannya?  - Perpisahan terkadang menjadi hal yang tidak terhindarkan dari sepasang kekasih yang sudah tidak memiliki kecocokan.  Ada berbagai cara yang bisa dilakukan untuk menyampaikannya. Salah satunya melalui pesan singkat.  Beberapa orang menganggap memutuskan kekasih lewat pesan singkat sebagai pilihan yang tidak pantas. Tapi, ternyata ada beberapa kondisi yang membuatnya masih boleh dilakukan. Apa saja?    Poin besar dari putus cinta adalah membuka dialog, mengapa kalian berdua tidak lagi cocok.  Memutuskan hubungan dengan pertemuan tatap muka sangat membantu bagi kedua belah pihak. Sebab dari pertemuan itu, kamu bisa mendapatkan masukan tentang perilakumu dan kamu bisa memperbaiki diri pada hubunganmu di masa depan.  Namun, ketika kamu dan kekasih baru berkencan beberapa kali, misalnya dua atau tiga kali, kalian mungkin belum saling mengenal dan belum mampu memberikan masukan berharga tentang karakter masing-masing.  Yang kamu tahu mungkin hanyalah ketertarikanmu dengan orang tersebut yang masih ada atau tidak ada. Sehingga diskusi mendalam tentang karakter pribadi akan menjadi pembicaraan yang tidak konstruktif bagi kedua belah pihak.  Untuk bisa memutuskan hubungan lewat pesan singkat, kamu perlu bisa melakukan sedikit alasan. Misalnya, alasan mantan kekasih yang kembali hadir, sekadar mengatakan sedang tak ingin berkencan saat ini, atau mau berpindah tempat tinggal   Kencan yang tidak sampai empat kali mungkin tidak akan membuat kalian terikat secara emosional dan pasanganmu itu juga kemungkinan tidak membaca lebih jauh tentang apa yang terjadi padamu.  Kamu tak perlu jujur sepenuhnya, kamu hanya perlu menjadi konklusif.    Salah satu efek yang biasanya terjadi setelah mengirimkan kata putus lewat pesan singkat adalah penerima pesan kemungkinan tidak akan memaafkanmu.  Mei lalu, sebuah studi menemukan bahwa perasaan negatif terhadap mantan pasangan berkaitan dengan masa pemulihan setelah putus hubungan. Hal ini akan membantu untuk mengurangi perasaan cinta jika memang ingin melupakan sang mantan.  ""Jika kamu tidak peduli tentang membina hubungan baik dengan orang yang kamu putuskan, kamu mungkin perlu melakukannya (memutuskan lewat pesan singkat). Ini memberikan kesan terakhir yang buruk tentang dirimu,"" tulis studi tersebut.    Studi lainnya di 2017 menemukan bahwa cara terbaik memutuskan hubungan dengan seseorang adalah secara langsung dan menjadi sedikit dingin.  Studi tersebut menunjukkan, ketika mereka yang memutuskan hubungan memilih cara lambat dan memutuskan hubungan dengan obrolan ringan terlebih dahulu, mereka yang diputuskan cenderung lebih bisa menerima.  Misalnya, dengan pembuka seperti: ""kita perlu bicara"".  Obrolan awalan melalui pesan singkat juga memberi kesempatan bagi mereka yang diputuskan untuk menguatkan diri mereka sebagai antisipasi percakapan yang akan terjadi.  Jika kamu ingin bertemu pasanganmu untuk memutuskan hubungan, tentu kamu tidak ingin membuatnya tidak tahu menahu tentang apa yang terjadi. Kamu ingin ia menghadapimu dengan lebih tenang, bukan?    Mungkin kita pernah mendengar beberapa orang yang mengalami ditinggal kekasih meskipun hubungan sudah dijalin selama beberapa tahun. Kekasih mereka pergi begitu saja tanpa memberi kabar atau istilah populernya ""ghosting"".  Perilaku tersebut tentu akan sulit dilupakan.  Jika kamu mempertimbangkan untuk melakukan ""ghosting"", kamu mungkin bisa memutuskan hubungan lewat pesan singkat.  Meskipun, memutuskan hubungan lewat pesan singkat tidak seburuk ""ghosting"".","Putus Cinta Lewat Pesan Singkat Tak Selalu Salah, Apa Alasannya?"
"dict","lifestyle","Tips Pakai Batik dengan Gaya Modern  Tak sedikit orang enggan menggunakan       karena menganggapnya sebagai busana yang formal, atau malah membuat tampilan menjadi terlihat tua. Padahal, ada beragam cara dalam mengenakan batik yang bisa kita terapkan demi menghasilkan tampilan yang muda dan segar. Founder    Kultur,   menyebutkan, salah satunya adalah dari pemilihan motif. Kamu bisa mengakalinya dengan memilih busana dengan batik sebagai aksen kecilnya, misalnya, pada saku atau area lainnya. ""Tergantung  , tapi kalau tidak diharuskan mengenakan baju berkerah atau lengan panjang, bisa diakali dengan   leher atau   pasti terlihat lebih santai."" Hal itu disampaikan Dea seusai   dan   Batik Kultur di Jakarta, beberapa waktu lalu. Potongan pinggang yang pas dengan badan juga akan membuat pemakainya tampak lebih muda. Sebab, seringkali tampilan muda dapat dicapai dengan mencoba gaya yang lebih ramping. Untuk memberi kesan pinggang yang lebih ramping, selain lewat potongan baju, juga bisa menggunakan aksen tambahan, misalnya tali ikat. ""Jadi seperti ada tali di tengah, bisa ikat sesuai selera."" ""Orang kan biasanya mencoba untuk mendapatkan tampilan pinggang yang lebih ramping,"" kata perempuan yang mengawali pemasaran produknya lewat media sosial itu. Pada kesempatan yang sama, pengusaha muda    juga menyampaikan tips khusus soal memilih pakaian batik, demi menghasilkan tampilan   . Dia menganggap batik kurang mendukung tampilan modern yang disukainya. Namun, dalam tiga tahun terakhir ia mulai gemar mengoleksi batik dalam berbagai bentuk. Bahkan, kini ia mengaku memiliki sekitar 40 busana batik. Cara paling sederhana untuk tampil modern dengan batik adalah memadukannya dengan celana jins. Untuk menambah kesan kasual, kita bisa menggunakan sendal jepit atau sepatu hak tinggi bagi perempuan. Pemilihan jenis pakaian juga penting. Dita -misalnya, senang mengenakan   di keseharian. Maka dalam memilih batik, ia juga kerap memilih  ""Enggak usah yang kayak kebaya atau yang terlalu tertutup,"" ucap dia.  demi menyiasati bentuk tubuh, Dita menyarankan penggunaan batik dengan satu   warna saja. Posisi pola pada pakaian juga dianggap sebagai hal penting ketika memilih busana. Pilihlah busana yang memiliki pola batik di area yang ingin ditonjolkan. ""Misal, kalau suka bagian dada,  nya besar di bagian situ, karena itu yang orang akan lihat."" ""Atau kayak temenku badannya  -nya di   untuk menunjukkan badannya, walau kelihatan  ."" ""Jadi kita bisa menonjolkan figur kita melalui batik,"" kata pemilik label es krim ternama itu.","Tips Pakai Batik dengan Gaya Modern"
"dict","lifestyle","Cegah Penyakit dengan Lari 30 Menit Sehari  Ada saja alasan untuk tidak berolahraga, salah satu yang paling sering menghambat adalah rasa malas. Padahal, malas beraktivitas fisik bisa memicu sejumlah masalah kesehatan, selain kegemukan.  Salah satu cabang olahraga yang mudah, murah dan bisa dilakukan hampir semua orang adalah lari. “Yang dibutuhkan cuma sepatu lari saja dan mungkin kaus dry-fit,” kata dr. Sandi Perutama Gani, Medical Expert Comiphar dalam acara workshop di Bogor (23/3/2019). Ada beberapa manfaat lain yang didapat dengan berlari secara rutin, yaitu membantu tidur lebih nyenyak, menjaga kesehatan sendi, jantung, dan paru-paru, meningkatkan fokus, dan membangun ketahanan fisik untuk olahraga lebih berat. Sandi menyarakankan untuk berolahraga sekitar 30 menit setiap harinya. “Tidak perlu terlalu berat, berjalan cepat atau berlari rutin 30 menit setiap harinya dapat menjadi opsi untuk mendapatkan kesehatan yang prima,” katanya. Model Agustin Ramli, Combiphar Corporate Ambassador, menyarankan untuk berolahraga bersama agar aktivitas ini tidak hanya menjadi wacana. “Kalo kamu malas olahraga, coba ajak temen atau keluarga buat olahraga bareng” kata Agustin yang mulai aktif olahraga lari sejak awal tahun ini. Menurutnya, berolahraga yang dilakukan secara bersama-sama lebih memberikan dampak positif. Tidak hanya sehatnya, tetapi juga senangnya. Combiphar nyelenggarakan Combi Run Academy (CRA) untuk menyebarkan manfaat dan cara berlari yang benar. “Kita juga ingin para remaja mengenal dan bangga dengan olahraga ini. Bahwa lari itu juga sama kerennya dengan futsal dan basket” kata B. Dewinta Hutagaol, Head of Corporate Communications & Community Development Combiphar. CRA diikuti oleh 60 siswa-siswi kelas 10 dan 11 terpilih dari 15 SMA di Jakarta. Acara yang dilakukan di Bogor pada akhir pekan lalu ini tidak hanya memberi edukasi tentang cara berlari untuk mengurangi cidera, tapi juga pola makan yang tepat. Bekerjasama dengan komunitas lari Indo Runner, bootcamp tersebut tidak hanya mengedukasi para peserta tetapi juga para pelatih.","Cegah Penyakit dengan Lari 30 Menit Sehari"
