"_type","category","isi","judul"
"dict","properti","Pakuwon Raup Laba Rp 2,85 Triliun   - PT Pakuwon Jati (PWON) membukukan    bersih pada 2018 sebesar Rp 7,081 triliun atau meningkat 23 persen dari tahun sebelumnya yakni Rp 5,75 triliun. Sementara    komprehensif tercatat Rp 2,85 triliun atau naik 42 persen dari tahun lalu sebesar Rp 2,002 triliun. Dalam keterangan tertulis yang diterima  , Selasa (26/3/2019, komposisi pendapatan pada 2018 terdiri dari 49 persen   dan 51 persen  . Lebih lanjut, jumlah   perusahaan pada 2018 mencapai Rp 3,468 triliun atau naik 16,1 persen dibanding tahun 2017 sebesar Rp 2,986 triliun. ""Kenaikan ini ditunjang pendapataan pusat perbelanjaan Pakuwon Mall tahap 2 dan 3 serta Tunjangan Plaza Mall tahap 6 yang telah beroperasi secara penuh,"" kata Direktur Keuangan dan Sekretaris Perusahaan Pakuwon Jati Minarto Basuki. Sedangkan   perusahaan mencapai Rp 3,613 triliun atau naik 30,8 persen dibanding tahun 2017 sebesar Rp 2,763 triliun. Angka itu didapat dari pengakuan pendapatan apartemen Anderson Pakuwon Mall Phase 4 serta penjualan rumah di Pakuwon City, Surabaya. Adapun mengenai belanja modal tahun 2018, PWON telah mengucurkan dana hingga Rp 1,955 triliun. Dana ini digunakan untuk membiayai proyek-proyek konstruksi Kota Kasablanka tahap 2, Tunjangan Plaza 6, Pakuwon Mall extension, dan EastCoast Mansion, serta pembebasan tanah. Untuk proyeksi tahun 2019,   perseroan terutama dari pusat perbelanjaan ritel masih akan memberikan tambahan organik. Sedangkan   perusahaan akan terus tumbuh dengan pengakuan pendapatan atas penjualan apartemen baru di Superblok Pakuwon Mall (Anderson, Benson, serta La Viz), serta apartemen baru di EastCoast Mansion yaitu Amor.","Pakuwon Raup Laba Rp 2,85 Triliun "
"dict","bola","Timnas U-23 Indonesia Berterima Kasih kepada Ezra Walian   Bek tim nasional U-23 Indonesia, Asnawi Mangkualam Bahar, berterima kasih atas dukungan dari rekannya    yang baru dinyatakan dilarang memperkuat timnas Indonesia oleh FIFA. ""Kami berterima kasih kepada Ezra yang selalu mendukung kami di sini meski dia tidak bermain,"" ujar Asnawi. Menurut pemain asal Makassar itu, apa yang dilakukan oleh Ezra memberikan semangat untuk skuat asuhan pelatih Indra Sjafri. Ezra Walian, pemain naturalisasi dari Belanda, tidak diperkenankan tampil untuk tim nasional Indonesia sejak Kamis (21/3/2019) atau sebelum laga perdana kualifikasi Piala Asia U-23 2020 AFC di Vietnam oleh Federasi Sepak Bola Internasional (FIFA). FIFA menganggap Ezra melanggar aturan terkait perpindahan status kewarganegaraan. Pangkalnya, Ezra yang dinaturalisasi pada tahun 2017 itu pernah bermain di timnas U-17 Belanda di kualifikasi Piala Eropa U-17 pada tahun 2013. Ezra memutuskan untuk tetap tinggal di Vietnam demi memberikan dukungan kepada rekan-rekannya sampai kualifikasi Piala Asia U-23 AFC 2020 usai pada Selasa (26/3/2019). Dia tampak bersama sang ayah Glenn Arthur di bangku penonton saat timnas U-23 berlaga kontra Thailand di laga perdana Grup K Kualifikasi Piala Asia U-23 AFC 2020, Jumat (22/3/2019), yang berakhir dengan skor 4-0 untuk kemenangan Thailand. Pemain berusia 21 tahun tersebut sempat mengunggah momen itu di akun media sosial Instagram pribadinya. Ezra mengaku sedih dengan keputusan FIFA dan menuliskan kalimat, ""Saya sebenarnya sangat sedih. Tapi, saya memutuskan untuk tetap setia dan tinggal bersama tim di Vietnam hingga kualifikasi selesai. Saya akan menjadi pemain ke-12 di tribun, dan berteriak menyemangati kalian. Semangat Timnas! Kalahkan mereka semua, Aku yakin kita bisa dan lolos. Garuda di dadaku!""","Timnas U-23 Indonesia Berterima Kasih kepada Ezra Walian "
"dict","properti","Indonesia di Mata Raksasa Properti Singapura  ""   adalah negara besar dengan penduduk ratusan juta orang. Kami memandang Indonesia sangat potensial, terlebih dengan pembangunan infrastruktur yang gencar dilakukan pemerintahan sekarang. Peluang yang ditawarkan sangat menjanjikan"". Demikian  GuocoLand Singapura merupakan anak usaha dari GuocoLand Limited Group yang juga bagian dari HongLeong Group yang didirikan di Malaysia pada 1963 silam.  Sementara GuocoLand Group terdaftar di Bursa Efek Singapura dengan anak usaha andalannya GuocoLand Singapura. Dalam sejarah panjangnya selama 27 tahun, GuocoLand Singapura telah berhasil mengembangkan 35 proyek hunian yang mencakup 10.000 unit apartemen dan rumah. Produk andalannya, tentu saja Tanjong Pagar Vertical City atau Tanjong Pagar Center. Proyek kelas atas ini meliputi perkantoran Guoco Tower, Wallich Residence, ruang ritel, hotel bisnis bintang 5 yang dioperasikan Sofitel, dan taman kota. Proyek ini menelan dana 3,2 miliar dollar Singapura atau setara Rp 33,2 triliun.  Tak hanya berkiprah di negeri dengan luas wilayah 721 kilometer persegi, GuocoLand Limited juga beroperasi dan berinvetasi di China. Mereka menanamkan investasi senilai Rp 42,5 triliun di area seluas 25 hektar yang tersebar di Beijing, Shanghai, Nanjing, dan Tianjin. Sementara di Malaysia, perusahaan sudah melantai di Bursa efek negeri jiran ini pada 2006, dengan proyek andalan Menara HLA, dan HP Towers di Kuala Lumpur.  Adapun proyek mereka di Vietnam berupa   bernama The Canary, dengan luas total sekitar 17,5 hektar yang terletak di Provinsi Binh Duong. Bahkan, belum lama ini, menurut Cheng, mereka juga tengah merambah pasar properti Inggris, dan Australia. ""GuocoLand akan terus mengkaji peluang-peluang yang ada, terutama di Asia Tenggara seperti Indonesia,"" tuntas Cheng.  ","Indonesia di Mata Raksasa Properti Singapura "
"dict","foto","Melihat Penampakan Super Snow Moon di Berbagai Belahan Dunia","Melihat Penampakan Super Snow Moon di Berbagai Belahan Dunia"
"dict","bola","Belanda Vs Jerman, Gol Menit Akhir Menangkan Tim Panser Gol menit akhir menjadi pembeda hasil laga Belanda vs Jerman pada    Grup C yang berlangsung di Johan Cruyff Arena, Amsterdam, Minggu (24/3/2019) atau Senin dini hari WIB. Jerman menang 3-2 atas Belanda berkat gol Nico Schulz pada menit akhir laga. Dua gol Tim Panser lainnya pada laga tersebut dicetak Leroy Sane (15') dan Serge Gnabry (34'), adapun gol Belanda dicetak Matthijs de Ligt (48') dan Memphis Depay (63').  Hasil ini mengakhiri catatan tak pernah menang    seusai Piala Dunia 2018. Mereka juga sukses membalas kekalahan dari    pada UEFA Nations League. Pada babak pertama, Jerman sempat unggul dua gol lebih dulu. Tim Panser, julukan Jerman, membuka keunggulan melalui Leroy Sane pada menit ke-15. Memanfaatkan umpan silang dari Nico Schulz, Sane berhasil menaklukan Virgil van Dijk sebelum melepaskan sepakan kaki kiri yang gagal dihalau kiper Belanda, Jasper Cillessen. GOOOOOOOOOAL. Leroy Sane scores the goal with a nice finish past the Dutch GK.     Jerman menggadakan keunggulan melalui Serge Gnabry pada menit ke-34. Menerima umpan panjang dari lini belakang, Gnabry berhasil melewati hadangan dua pemain belakang Belanda sebelum melepaskan tendangan yang bersarang di pojok kanan gawang Cillessen. Arsenal loanee Serge Gnabry “is not at the required level” to feature for relegation-battling West Bromwich Albion, according to boss Tony Pulis.  Serge Gnabry:  Skor 2-0 untuk tim Panser bertahan hingga turun minum. Memasuki babak kedua, Belanda mulai bangkit. Matthijs de Ligt memperkecil kedudukan melalui golnya pada menit ke-48. Belanda kemudian menyamakan kedudukan melalui Memphis Depay pada menit ke-63. Memphis Depay goal against Germany making it 2 v2          Saat laga tampak akan berakhir imbang,  Belanda: 1-Jasper Cillessen; 17-Daley Blind, 4-Virgil van Dijk, 22-Denzel Dumfries, 3-Matthijs de Ligt; 8-Georginio Wijnaldum, 15-Marten de Roon, 21-Frenkie de Jong; 9-Ryan Babel (Steven Bergwijn 46'), 10-Memphis Depay, 11-Quincy Promes Pelatih: Ronald Koeman Jerman: 1-Manuel Neuer; 16-Antonio Ruediger, 15-Niklas Suele, 4-Matthias Ginter; 6-Joshua Kimmich, 2-Thilo Kehrer, 8-Toni Kroos, 14-Nico Schulz, 18-Leon Goretzka (Ilkay Guendogan 70'); 20-Serge Gnabry (Marco Reus 88'), 19-Leroy Sane Pelatih: Joachim Loew","Belanda Vs Jerman, Gol Menit Akhir Menangkan Tim Panser"
"dict","lifestyle","PERHATIAN : Cerita ini hanya fiktif belaka, bila ada persamaan nama, tempat, kejadian dan lain-hal lain itu hanya kebetulan belaka..... Salam Messlaip!		","Si Quvroy - Beli Bintang"
"dict","properti","2024, Fase 2 MRT Jakarta Ditargetkan Rampung  - Pembangunan Fase 2 Moda Raya Terpadu (MRT) telah dicanangkan Presiden Joko Widodo (Jokowi). Nantinya, pembangunan trase ini akan dilanjutkan dari Bundaran HI hingga Kampung Bandan. Direktur Utama PT MRT Jakarta William Sabandar mengatakan, pembangunan fase kedua ditargetkan rampung dalam lima tahun. ""Kita pastikan akan selesai 2024,"" ucap dia di Bundaran HI, Minggu (24/3/2019). Setidaknya, dibutuhkan anggaran Rp 22,5 triliun untuk menyelesaikan pembangunan fase kedua sepanjang delapan kilometer ini. Dana tersebut telah dikantongi PT MRT Jakarta dari pinjaman Pemerintah Jepang melalui Japan International Cooperation Agency (JICA). ""Dananya sudah tersedia tinggal kita kerjakan,"" sebut William. Nantinya, trase fase kedua ini bakal dilengkapi delapan stasiun, mulai dari Sarinah, Monumen Nasional, Harmoni, Sawah Besar, Glodok dan Kota Adapun untuk Kampung Bandan, selain sebagai stasiun juga akan bertindak sebagai depo layaknya Stasiun Lebak Bulus.","2024, Fase 2 MRT Jakarta Ditargetkan Rampung"
"dict","money","Kompas.com Sabet Penghargaan Berita Online Terpercaya dari Superbrands  -   mendapat penghargaan    untuk kategori Berita Online Terpercaya (Trusted Online News). Penghargaan diberikan pada Gala Awards Night 2018 yang digelar di Hotel JW Marriot, Jakarta, Jumat (27/7/2018) malam. Mewakili  , Pemimpin Redaksi  Wisnu Nugroho menerima secara simbolik penghargaan tersebut dari CEO Superbrands Indonesia Grandtyana Mayasari.   Saat ditemui di sela-sela acara, Wisnu menyampaikan terima kasih kepada para pembaca   yang menaruh kepercayaan pada berita-berita yang diproduksi jurnalis dan tim redaksi  .   ""Ini adalah bonus atas upaya   menjaga kepercayaan pembaca kepada kami,"" ujar Wisnu Nugroho, usai menerima penghargaan.  Wisnu menilai penghargaan tersebut akan memacu   untuk bekerja lebih baik lagi, terutama untuk menjadi referensi berita terpercaya di tengah banjirnya informasi akhir-akhir ini.  ""  akan terus berusaha menjadi sumber berita terpercaya di tengah banjir informasi,"" sebutnya. Menurut Wisnu, dengan menjadi sumber berita terpercaya, berita   diharapkan dapat membantu pembaca menemukan kepastian di tengah ketidakpastian karena banjir informasi yang munculkan disinformasi (hoaks). Dalam acara ini, ada puluhan produk yang mendapat penghargaan sebagai yang terbaik di kategorinya masing-masing. Grandtyana Mayasari menyatakan, pemberian penghargaan tersebut merupakan bentuk apresiasi Superbrands Indonesia kepada pelaku industri. Menurut dia, keberhasilan mencipatkan produk dan menerapkan strategi marketing yang tepat berdampak signifikan terhadap merk masing-masing.   ""Superbrands terus berupaya untuk menaikkan nilai jual logo Superbrands sehingga merk yang membawanya juga akan meningkat nilainya di mata konsumen,"" kata Grandtyana. ","Kompas.com Sabet Penghargaan Berita Online Terpercaya dari Superbrands"
"dict","otomotif","",""
"dict","travel","7 Etika Berwisata, Berlaku di Mana Saja  Informasi yang kian mudah didukung penerbangan berbiaya rendah membuat wisata kini jadi aktivitas yang lumrah. Sayangnya masalah kerap terjadi ketika    tidak mematuhi aturan dan tidak memiliki   . Padahal ketika seorang wisatawan berbuat onar di sebuah destinasi, ada nama negara atau daerah yang tersemat sebagai identitasnya. Yuk, tetap mematuhi aturan dan menjaga perkataan serta perilaku selama berwisata, seperti berikut ini: Sebelum pergi, carilah informasi yang banyak. Dari buku, internet, atau bertanya pada orang yang sudah pernah ke sana. Sebab masing-masing daerah punya budaya yang berbeda. Hal yang Anda anggap biasa bisa jadi tidak biasa di destinasi tujuan. Jangan pernah sekalipun merasa superior, karena Anda    atau karena Anda mampu membiayain perjalanan sendiri. Justru karena Anda turis harus tetap menghormati warga lokal dan sebisa mungkin berbaur. Isu agama dan politik terbilang sensitif, berlaku di mana saja. Jika ingin bertanya mengenai demografi agama atau ideologi politik di destinasi tersebut sebagai pengetahuan, boleh saja. Namun baiknya simpan opini Anda tentang agama dan politik. Sangat disarankan untuk belajar basaha dan bahasa tubuh destinasi tujuan Anda. Sebab di beberapa negara, ada acungan jari, gerakan kepala, atau kalimat yang biasa di negara lain, ternyata dianggap kasar dan mencemooh. Peraturan di obyek wisata dibuat demi kelestarian obyek wisata dan keamanan wisatawan. Banyak wisatawan yang merasa sudah bayar atau sudah datang jauh-jauh sehingga melanggar aturan.   atau foto untuk media sosial juga sering membuat wisatawan melanggar aturan. Orang Indonesia mungkin belum begitu mengenal budaya memberi uang tip. Namun di beberapa negara, memberi uang tip ternyata menjadi sebuah etika. Pelajari budaya memberi tip dan besaran uang tip yang harus diberikan sebelum berkunjung ke sebuah destinasi. Berpikir terbuka terhadap segala pengalaman yang terjadi saat berwisata. Namun harus tetap waspada dengan segala motif atau gerakan yang mencurigakan dari orang-orang yang ditemui selama berwisata. Jangan lupa nikmati pengalaman berwisata Anda.","7 Etika Berwisata, Berlaku di Mana Saja"
"dict","lifestyle","G-Shock MT-G Andalkan Desain Gradasi Warna dan Fitur Anyar  -   Casio dan anak perusahaannya, G-Shock, merilis sejumlah arloji khusus pada gelaran Baselword, ajang pameran jam terbesar di dunia, tahun ini. Salah satu yang mencuri perhatian adalah MTGB10000RB-2A.  Dilansir laman  , arloji tersebut memiliki efek  di mana memunculkan gradasi berbagai warna, seperti merah muda, biru, hijau dan emas. Soal teknologi, dalam keterangan pers, arloji yang disebut MT-G ini memuat ""daleman"" Triple G Resist dan struktur pelindung inti untuk kekuatan dan kekerasan maksimal.  Tampilan ramping plus keringanan tetap dipertahankan. Ada pun kristal safir yang membuat arloji ini tahan gores, serta lapisan non-reflektif memberikan visibilitas maksimum dalam kondisi pencahayaan paling sulit. Secara teknis, arloji ini dilengkapi fitur   dan teknologi Bluetooth yang memungkinkan akurasi, serta pengaturan waktu Multi-Band 6 yang dapat disesuaikan sendiri. Terakhir, spesifikasi standar G-Shock mencakup 200M air dan  ,   dan pengaturan waktu dunia dengan 39 zona waktu dan 27 kota. Hasilnya adalah arloji yang tidak hanya sangat fungsional dan andal, juga dengan nuansa mewah dan desain yang menarik. Soal harga, G-Shock tak main-main membanderol harga arloji premium ini, yakni 1.000 dollar AS atau Rp 14 juta. ","G-Shock MT-G Andalkan Desain Gradasi Warna dan Fitur Anyar"
"dict","otomotif","",""
"dict","sains","Berhenti Makan Daging Tidak Selamatkan Lingkungan, Ini Penjelasannya  dampak perubahan iklim semakin mengkhawatirkan, gerakan mengurangi makan    menjadi gerakan yang populer. Para aktivis lingkungan mendesak masyarakat untuk mengurangi makan daging untuk menyelamatkan lingkungan. Beberapa aktivis telah menyerukan pemberlakuan pajak atas daging untuk mengurangi konsumsi daging. Klaim yang mendasari argumen ini menyatakan bahwa secara global, produksi daging menghasilkan lebih banyak gas rumah kaca dibanding yang dihasilkan seluruh sektor transportasi. Namun, klaim ini terbukti salah, seperti yang akan saya tunjukkan dalam artikel ini. Dan klaim yang salah ini telah menyebabkan asumsi yang salah tentang keterkaitan antara daging dan perubahan iklim. Penelitian saya fokus pada cara-cara peternakan mempengaruhi kualitas udara dan perubahan iklim. Dalam pandangan saya, ada banyak alasan untuk memilih protein hewani atau protein nabati. Namun, tidak memilih daging dan produk daging bukanlah ‘obat mujarab’ bagi lingkungan sebagaimana dipercayai para aktivis. Dan jika dilakukan secara ekstrem, itu juga bisa memiliki konsekuensi gizi yang berbahaya. Banyak orang menduga bahwa ternak adalah sumber terbesar gas rumah kaca (GRK) di seluruh dunia. Sebagai contoh, sebuah analisis tahun 2009yang diterbitkan oleh organisasi Worldwatch Institute yang berbasis di Washington D.C., Amerika Serikat menyatakan bahwa 51% emisi GRK global berasal dari pemeliharaan dan pengolahan ternak. Menurut Badan Perlindungan Lingkungan Amerika Serikat, sumber terbesar emisi GRK Amerika pada tahun 2016 adalah produksi listrik (28% dari total emisi), transportasi (28%) dan industri (22%). Sektor pertanian secara keseluruhan menyumbang hanya sebesar 9%. Dari sektor peternakan hewan secara keseluruhan menyumbang kurang dari setengah jumlah ini, yaitu 3,9% dari total emisi gas rumah kaca AS. Angka tersebut sangat berbeda dari klaim yang mengatakan ternak memberikan sumbangan GRK lebih banyak dari sektor transportasi. Mengapa kesalahpahman ini terjadi? Pada tahun 2006, Organisasi Pangan dan Pertanian Perserikatan Bangsa-Bangsa (FAO) menerbitkan sebuah penelitian berjudul “Bayangan Panjang Peternakan ( ),” yang mendapat perhatian luas secara global. Disebutkan bahwa ternak memberikan kontribusi sebesar 18% emisi gas rumah kaca dunia. FAO menarik kesimpulan yang mengejutkan: Peternakan memberikan kontribusi yang lebih banyak dalam kerusakan lingkungan dibanding semua moda transportasi digabung. Klaim terakhir ini salah, dan telah dikoreksi oleh Henning Steinfeld, salah seorang penulis senior laporan tersebut. Masalah dari laporan tersebut ada pada metodologi analisis. Analis FAO menggunakan penilaian atas siklus hidup yang komprehensif untuk mempelajari dampak iklim dari ternak, tetapi menggunakan metode yang berbeda ketika mereka menganalisis transportasi. Untuk ternak, mereka mempertimbangkan setiap faktor yang terkait dengan produksi daging. Ini termasuk emisi dari produksi pupuk, mengubah lahan dari hutan menjadi padang rumput, menanam pakan, dan emisi langsung dari hewan (bersendawa dan pupuk kandang) dari lahir hingga mati. Namun, ketika mereka melihat jejak karbon transportasi, mereka mengabaikan dampak pada iklim proses pembuatan bahan baku dan bagian-bagian kendaraan, perakitan kendaraan dan pemeliharaan jalan, jembatan, dan bandara. Sebaliknya, mereka hanya mempertimbangkan emisi yang dikeluarkan oleh knalpot mobil, truk, kereta api, dan pesawat terbang. Akibatnya, perbandingan FAO tentang emisi gas rumah kaca dari sektor peternakan dengan sektor transportasi menjadi sangat terdistorsi. Saya menunjukkan kesalahan ini dalam sebuah pidato kepada sesama ilmuwan di San Francisco pada 22 Maret 2010, yang menyebabkan membanjirnya liputan media. Sebagai catatan, FAO segera mengakui kesalahannya. Sayangnya, klaim awal agensi tersebut bahwa ternak bertanggung jawab atas bagian terbesar dari emisi gas rumah kaca dunia telah menerima pemberitaan luas. Hingga hari ini, kami berjuang untuk merevisi pemberitaan tersebut. Dalam laporan penilaian terbarunya, FAO memperkirakan bahwa ternak menghasilkan 14,5% dari emisi GRK global yang berasal dari kegiatan manusia. Tidak ada penilaian lengkap yang sebanding untuk sektor transportasi secara keseluruhan. Namun, seperti yang telah ditunjukkan oleh Steinfeld, emisi langsung dari transportasi versus ternak bisa dibandingkan, dan hasilnya 14% dari emisi transportasi berbanding 5% dari peternakan. Banyak orang masih mempercayai bahwa mengurangi konsumsi daging menjadi satu kali seminggu akan membuat perbedaan yang signifikan terhadap lingkungan. Tetapi menurut sebuah studi baru-baru ini, bahkan jika orang Amerika menghilangkan semua protein hewani dari diet mereka, mereka hanya akan mengurangi emisi gas rumah kaca sebesar 2,6%. Menurut penelitian kami di University of California, Davis, jika praktik Senin Tanpa    diadopsi oleh semua orang Amerika, kita hanya akan melihat pengurangan emisi GRK sebesar 0,5%. Selain itu, perubahan teknologi, genetik, dan manajemen yang telah terjadi di pertanian Amerika selama 70 tahun terakhir telah membuat produksi ternak lebih efisien dan menghasilkan lebih sedikit gas rumah kaca. Menurut basis data statistik FAO, total emisi gas rumah kaca langsung dari peternakan AS telah menurun 11,3% sejak 1961, sementara produksi daging ternak meningkat lebih dari dua kali lipat. Permintaan atas daging meningkat di negara-negara berkembang, dengan tingginya permintaan dari kawasan Timur Tengah, Afrika Utara dan Asia Tenggara. Tetapi konsumsi daging per kapita di wilayah ini masih tertinggal apabila dibandingkan dengan negara maju. Pada tahun 2015, rata-rata konsumsi daging per kapita tahunan di negara-negara maju adalah 92 kilogram, bandingkan dengan 24 kilogram di Timur Tengah dan Afrika Utara dan 18 kilogram di Asia Tenggara. Namun, mengingat pertumbuhan populasi yang diperkirakan akan tumbuh pesat di negara berkembang, tentu akan ada peluang bagi negara-negara seperti Amerika Serikat untuk membawa praktik pemeliharaan ternak berkelanjutan mereka ke negara berkembang. Menghapus peternakan dari sektor pertanian Amerika Serikat akan menurunkan sedikit emisi gas rumah kaca, tetapi juga akan membuat lebih sulit untuk memenuhi kebutuhan gizi. Banyak kritik mengatakan jika petani hanya memelihara tanaman, mereka dapat menghasilkan lebih banyak makanan dan lebih banyak kalori per orang. Tetapi manusia juga membutuhkan banyak nutrisi mikro dan makro yang penting untuk kesehatan. Sulit untuk membuat argumen yang meyakinkan bahwa Amerika Serikat memiliki defisit kalori, mengingat tingginya angka nasional obesitas orang dewasa dan anak. Selain itu, tidak semua bagian tanaman dapat dimakan atau diinginkan. Memelihara ternak adalah cara untuk menambah nilai gizi dan nilai ekonomis pada tanaman pertanian. Sebagai salah satu contoh, energi pada tanaman yang dikonsumsi ternak paling sering terkandung dalam selulosa, yang tidak dapat dicerna manusia dan banyak mamalia lainnya. Tetapi sapi, domba, dan hewan lainnya dapat memecah selulosa dan melepaskan energi matahari yang terkandung dalam sumber daya yang luas ini. Menurut FAO, sebanyak 70% dari semua lahan pertanian secara global adalah tanah yang hanya dapat digunakan sebagai lahan penggembalaan untuk ternak. Populasi dunia saat ini diproyeksikan mencapai 9,8 miliar orang pada tahun 2050. Memberi makan orang sebanyak ini akan menimbulkan tantangan besar. Daging lebih padat nutrisi per sajian daripada pilihan vegetarian, dan hewannya sebagian besar mengkonsumsi makanan yang tidak cocok untuk manusia. Memelihara ternak juga menawarkan penghasilan yang sangat dibutuhkan bagi petani skala kecil di negara berkembang. Di seluruh dunia, ternak menyediakan mata pencaharian bagi 1 miliar orang. Perubahan iklim menuntut perhatian cepat, dan industri peternakan meninggalkan jejak lingkungan besar secara keseluruhan yang mempengaruhi udara, air, dan tanah. Hal ini, dikombinasikan dengan populasi dunia yang meningkat pesat, mendorong kita untuk terus bekerja demi efisiensi yang lebih besar dari industri peternakan. Saya percaya tempat untuk memulai semua itu adalah dengan fakta berbasis sains. Professor of Animal Science and Air Quality Extension Specialist, University of California, Davis","Berhenti Makan Daging Tidak Selamatkan Lingkungan, Ini Penjelasannya"
"dict","entertainment","Boyzone: Kami Ingin Mengucapkan Selamat Tinggal dengan Pantas  -   fenomenal asal Irlandia,    akan menggelar konser album perpisahan ""Thank You & Goodnight"" untuk kali terakhir di Indonesia, pada Minggu (24/3/2019) malam ini.     beranggotakan Keith Duffy, Mikey Graham, Ronan Keating, dan Shane Lynch ini memilih Tennis Indoor, Senayan, Jakarta Pusat untuk menjadi saksi momen spesial tersebut digelar.   Boyzone menganggap konser ini merupakan testimoni terakhir mereka kepada para penggemar yang akan mereka lakukan dengan sepantasnya.  Indonesia menjadi salah satu negara yang dipilih Boyzone untuk menyampaikan salam perpisahan, sebelum mereka benar-benar membubarkan diri.   Karena hal itu pula, Ronan Keating dan kawan-kawan memutuskan untuk berlabuh sejenak menyapa penggemar di Indonesia.   Hal tersebut disampaikan oleh Ronan dalam wawancara eksklusif dengan Kompas.com di Hotel DoubleTree by Hilton, kawasan Cikini, Jakarta Pusat, Sabtu (23/3/2019) malam. ""Jadi kami ingin kembali ke sini (Indonesia) dalam tur perpisahan kami dan mengucapkan selamat tinggal secara pantas. Kami sangat bersemangat dengan pertunjukan besok malam (malam ini),"" ucap Ronan.   Ronan mengatakan bahwa ia dan personel lainnya memiliki hubungan yang spesial dengan para penggemar di Indonesia, sejak mereka pertama kali tiba di sini pada 1995 lalu.   Sejak saat itu,   yang terkenal lewat lagu ""I Love the Way You Love Me"" ini telah mengunjungi beberapa kota di Indonesia, seperti Bandung, Surabaya, dan Yogyakarta.  ""Indonesia selalu menjadi negara yang penting. Boyzone memiliki hubungan yang fantastis dengan orang-orang di Indonesia,"" ucap Ronan.  ""Selalu ada cinta yang banyak untuk Boyzone, generasi 90an di Indonesia sangat spesial,"" sambungnya.   Bahkan, Ronan mengaku bahwa ia dan rekan-rekannya kembali merasakan suasana hangat tersebut saat tiba di bandara Soekarno-Hatta, Sabtu (23/3/2019) sore.   ""Ini seperti ketika kami tiba di bandara, kami ingat namanya, dengan wajah-wajah yang familiar, dan sambutan yang sangat terbuka. Beberapa memiliki kenangan yang pantas dikenang,"" ucap dia.   Dalam konser album perpisahan ini juga nantinya Isyana Sarasvati akan tampil sebagai pembuka dan turut berkolaborasi dalam satu atau dua lagu.","Boyzone: Kami Ingin Mengucapkan Selamat Tinggal dengan Pantas"
