"_type","category","isi","judul"
"dict","edukasi","Lewat Video Conference, Wagub Kandouw Buka UNBK SMK se-Sulut  Wakil Gubernur Sulawesi Utara (Sulut) Steven O.E. Kandouw membuka secara resmi pelaksanaan Ujian Nasional Berbasis Komputer (  ) tingkat SMK melalui Video Conference Online se-Sulawesi Utara, di SMK N 1 Manado, Senin (25/3/2019) pagi. Pembukaan ujian secara simbolis ditandai dengan penekanan tombol sirine oleh Wagub Kandouw tanda dimulainya UNBK. Adapun UNBK kali ini dibagi menjadi 3 sesi, sesuai mata pelajaran. Ujian sendiri berlangsung selama empat hari. Diketahui, jumlah sekolah yang mengikuti UNBK tersebut ada 183 sekolah negeri dan swasta dengan kuota sekira 14.764 siswa se-Sulut. Kandouw pun turut memberi dukungan kepada para siswa agar percaya diri dalam mengerjakan soal ujian. ""Tidak ada joki dan tolong-tolongan. Semua soal harus dijawab dengan kemampuan sendiri. Jangan lupa berdoa supaya hasilnya bagus,"" kata Kandouw. Pada kesempatan itu, Kandouw mengecek pelaksanaan UNBK di kabupaten dan kota di Sulut, dengan melakukan video conference dengan para Bupati dan Wali Kota. Kandouw meminta para kepala daerah serta dinas pendidikan di kabupaten dan kota mendukung pelaksanaan ujian, supaya berjalan lancar. “Pelaksanaan UNBK tingkat SMK ini harus berjalan baik, lancar dan sukses,” beber Kandouw. Turut hadir dalam pembukaan UNBK tersebut, ketua DPRD Sulut Andrei Angouw, Sekdaprov Edwin Silangen, dan Kadisdikda Grace Punuh. ","Lewat Video Conference, Wagub Kandouw Buka UNBK SMK se-Sulut "
"dict","otomotif","Komentar Pebalap MotoGP soal Rencana GP Lombok","Komentar Pebalap MotoGP soal Rencana GP Lombok"
"dict","edukasi","HUT 45 Gramedia Pustaka Utama: Sinyal Positif Industri Buku Penerbit    (  ) merayakan    ke-45 pada hari ini, 25 Maret 2019. Tahun ini, peringatan ulang tahun GPU ditandai dengan peluncuran    kumpulan cerita pendek (cerpen) ""  di mana seluruh cerita di dalamnya ditulis tim redaksi GPU. “Semesta Cerita Kita juga menjadi landasan tema pada seluruh kegiatan ulang tahun ke-45 Gramedia Pustaka Utama tahun ini,"" tambahnya. Lebih jauh Gretiani menjelaskan, ""Dengan mengambil tema ini, kami ingin terus optimistis untuk menghimpun berbagai cerita dan meneruskannya kembali kepada masyarakat lewat buku, agar cerita-cerita yang kami sampaikan selalu menjadi pemantik cerita-cerita baru yang punya dampak positif di masyarakat."" Sejak didirikan pada tahun 1974, Gramedia Pustaka Utama telah menjadi salah satu penerbit terkemuka di Indonesia; rumah bagi banyak buku dan penulis pemenang penghargaan selama 44 tahun. Dengan fokus terbitan pada buku-buku fiksi, nonfiksi, buku anak, dan buku masak, jumlah buku yang diterbitkan Gramedia Pustaka Utama telah mencapai lebih dari 1.500 judul per tahun, dan banyak di antaranya berhasil menjadi   serta menerima penghargaan nasional dan internasional. ","HUT 45 Gramedia Pustaka Utama: Sinyal Positif Industri Buku"
"dict","otomotif","Ini Satu-satunya Mobil yang Harganya Masih di Bawah Rp 100 Juta","Ini Satu-satunya Mobil yang Harganya Masih di Bawah Rp 100 Juta"
"dict","edukasi","Pemenang DSC 2018, Memikat dengan ""Piawai"", ""Paham"" dan ""Persona""       Indonesia, Diplomat Success Challenge (DSC) yang diinisiasi       telah mengumumkan para pemenang    untuk tahun 2018 di Jakarta (24/3/2019). Para dewan juri/komisioner terdiri dari Surjanto Yasaputera, Helmy Yahya dan Antarina S.F Amir mengumumkan Ryan Adham, dengan    Snazzy Boom (jajanan arumanis) terpilih sebagai juara pertama dengan predikat "" Ryan Adham dianggap unggul dibanding finalis lain karena dinilai paling menguasai konsep 3P “Paham” atas produk bisnis, “Piawai” menjalankan bisnis dan memiliki “Persona"" mampu beradaptasi dengan lingkungan sosialnya dan menguasai  saat menjadi ketua tim di tahap  . Selain Ryan, satu nama yang juga meraih prestasi dalam ajang itu Alvon Yulius Harianto yang memproduksi Avara Custom Indonesia. Avara merupakan   yang dicetak 100 persen sesuai dengan bentuk telinga pemiliknya. Alvon berhasil menjadi satu-satunya produsen   di negeri ini yang mampu bersaing dengan produk serupa dari Amerika dan Eropa. Selain kedua nama di atas, finalis DSC adalah Donatus Dayu Pratama (Kedai Kopi Keliling - Koling), Triana Rahmawati (SOLVE Souvenir), AA Ayu Sri Utami Linggih (Rosalie Cheese), Rangga Warsita Aji (Pupuk Cair Mikroalga), Bayu Mahendra Saubig (Tumbas.in). Ada pula Imam Buhari Muslim (Aneka Olahan Salak), dan Meybi Agnesya Lomanledo (Timor Moringga). Ide bisnis mereka dari beragam sektor seperti kuliner, agro industri, industri kreatif, dan teknologi digital.  Dua peserta finalis yaitu Triana Rahmawati dan Donatus Dayu Pratama memperoleh penghargaan khusus  dan penghargaan  . Ronald Walla selaku Direktur Utama PT Wismilak Inti Makmur Tbk memberikan hibah modal usaha dan apresiasi total Rp 2 miliar kepada sembilan wirausaha muda pemenang DSC 2018.  Tahun ini, para finalis mendapat tantangan dewan komisioner berupa  . Kegiatan itu berisi simulasi saat menjalankan proses bisnis. Para finalis diberi tugas yang harus diselesaikan bersama dalam kelompok untuk menunjukkan karakter dan keahlian peserta. ”  akan menguji finalis terhadap aspek strategi dan operasional bisnis (paham), solusi teknis dan inovasi (piawai), dan kepribadian sebagai pengusaha tangguh (persona),” kata Surjanto. Helmy Yahya berpendapat konsep kompetisi DSC telah mampu menarik perhatian kaum milenial  Hal ini terlihat dari banyaknya proposal yang masuk. Tahun ini jumlah kepesertaan DSC diinisiasi Wismilak Foundation ini mencapai 8.000 proposal. Dewan komisioner lain yang juga Direktur Pengelola HighScope Indonesia Antarina S.F Amir menyampaikan, ”Melalui konsep 3P (paham, piawai, dan persona) DSC melahirkan wirausahawan muda berkarakter. Mereka akan mampu   daripada ","Pemenang DSC 2018, Memikat dengan ""Piawai"", ""Paham"" dan ""Persona"""
"dict","otomotif","Sebentar Lagi Bayar Tol Enggak Perlu Berhenti  — PT    (Persero) Tbk mulai mengenalkan transaksi    baru dengan menggunakan metode Single Lane Free Flow (SLFF). Sistem ini bekerja menggunakan Radio-Frequency Identification (RFID) yang memungkinkan pengendara tak perlu lagi berhenti melakukan  . Menurut Menteri Badan Usaha Milik Negara (BUMN) Rini M Soemarno yang ikut dalam proses uji coba SLFF di Gerbang    Cengkareng dan Kapuk, hadirnya layanan ini nanti akan meningkatkan kenyamanan para pengguna jalan tol. ""Kita uji coba dulu agar masyarakat nanti nyaman memakai sistem ini. Untuk awal, internal BUMN dulu, kita uji coba dengan Damri dan mobil Garuda. Saya menyambut baik inovasi dan upaya yang dilakukan Jasa Marga dalam memberikan pelayanan. Harapannya tahun ini bisa dikomersialkan,"" ujar Rini dari keterangan resmi Jasa Marga, Sabtu (23/3/2019). Sistem transaksi tol tanpa harus berhenti ini sebelumnya juga sudah diadopsi oleh beberapa negara. Tujuannya untuk menjamin kelancaran transaksi dan mengendalikan antrean pada gerbang tol karena dengan sistem ini pengendara tidak perlu menghentikan laju mobilnya untuk melakukan transaksi. Menurut Direktur Utama PT Jasa Marga Desi Arryani, SLFF yang sedang di uji coba ini merupakan teknologi yang digagas oleh PT Jasa Marga Tollroad Operator (JMTO) bersama tim konsorsium. Sistem ini pada 2018 juga sudah pernah diterapkan secara terbatas di Bali dengan menggandeng taksi Blue Bird. ""Sistem pembayaran tanpa henti ini merupakan pengembangan dari teknologi Electronic Toll Collection (ETC) melalui sistem Multi Lane Free Flow (MLFF) untuk mendukung sistem transaksi ini. Kami bekerja sama dengan aplikasi penyedia saldo LinkAja untuk memudahkan masyarakat melakukan pengisian ulang,"" ucap Desi.","Sebentar Lagi Bayar Tol Enggak Perlu Berhenti"
"dict","edukasi","Dies Natalis Universitas Pasundan dan Reformasi Pendidikan Tinggi  - Menteri Riset, Teknologi dan Pendidikan Tinggi (Menristekdikti) Mohamad Nasir menghadiri peringatan    Universitas Pasundan (Unpas) ke-59 di Gedung Auditorium Sabuga, Bandung (23/03/2019). Dalam orasi Ilmiahnya Menristekdikti Mohamad Nasir mengatakan memasuki era   , era disrupsi teknologi, diperkirakan 75 -375 juta orang di dunia akan beralih profesi. Menristekdikti juga menyampaikan akan muncul profesi baru karena dampak pertumbuhan teknologi yang begitu cepat. Hal ini membuat perguruan tinggi dituntut siap menghadapi perubahan teknologi. “Mau tidak mau, suka atau tidak suka, teknologi akan hadir dalam kehidupan kita,"" ujar Menteri Nasir dilansir dari rilis resmi Kemenristekdikti. Menteri Nasir meminta pimpinan perguruan tinggi untuk terus meningkatkan kualitas dosen agar memiliki kompetensi inti yang akan dibutuhkan revolusi industri 4.0.   Lulusan perguruan tinggi sangat bergantung dengan kualitas sistem pembelajaran di kampus dan kualitas dosen yang mengampu mata kuliah. ”Realitanya di perkembangan teknologi saat ini masih banyak lulusan tidak memiliki kompetensi sesuai dengan apa yang diambil dalam bidangnya,” tutur Nasir. Perguruan tinggi akan semakin dituntut untuk mempersiapkan para mahasiswanya atas pekerjaan yang belum ada, selain menciptakan iptek yang inovatif, adaptif, kompetitif sebagai konsep utama daya saing dan pembangunan bangsa. Menristekdikti menambahkan menghadapi tantangan tersebut Kemenristekdiki bersama perguruan tinggi harus mereformasi penyelenggaraan pendidikan tinggi. Beberapa hal yang menjadi fokus   antara lain: deregulasi, penyediaan pendidikan yang fleksibel dan berorientasi pada    serta pangsa pasar, penajaman kurikulum, orientasi pada keterampilan yang teruji dan berdaya saing. Selain itu, pengembangan bidang ilmu strategis, revitalisasi kelembagaan, kemampuan   untuk menghasilkan riset dan inovasi yang kompetitif, sampai pada peningkatan keskolaran, kreativitas, dan kegiatan entrepreneurial juga perlu menjadi titik perubahan reformasi pendidikan tinggi.  Menristekdikti juga mengucapkan selamat dan sukses atas keberhasilan capaian Unpas selama 59 tahun telah banyak menghasilkan lulusan sesuai dengan harapan dunia kerja.  Dies Natalis ke-59 Unpas turut dihadiri Agum Gumelar, Rektor Universitas Pasundan Eddy Jusuf, pimpinan dan anggota senat akademik, dekan fakultas, Guru Besar dan sivitas akademika Unpas.","Dies Natalis Universitas Pasundan dan Reformasi Pendidikan Tinggi"
"dict","sso","",""
"dict","otomotif","BMW C 400 GT Meluncur Tanpa Harga  - PT Maxindo Moto Nusantara selaku pemegang merek    di Indonesia resmi mengenalkan BMW C 400 GT. Skutik bongsor yang bermain di segmen premium ini meluncur dalam ajang BMW Motorrad Days Indonesia yang berlangsung di Ubud, Bali. BMW C 400 GT hadir untuk melengkpai C 400 X yang sudah lebih dulu meluncur pada Februari 2019 lalu. Dari segi perfroma, tidak ada yang berbeda, keduanya tetap mengusung mesin berkubikasi 350 cc satu silinder dengan sistem transmisi CVT. Hal yang membedakan adalah tampilan bodinya. Secara karekater, C 400 GT lebih diperkuat dengan nuansa Tourer yang dirancang bagi para pengendara yang gemar melakukan perjalanan jarak jauh. Empat buah lampu LED disematkan dan dipasang sejajar dengan kaca depan yang dibuat lebih lebar dan tinggi. Sementara desain jok, sedikit dibuat lebih naik guna memberikan kenyamanan punggung pengendara,   juga lebih lebar yang diiringin dengan   lebih panjang. Pada bagian belakang,  sudah mengaplikasi LED yang dibuat menyatu dengan bodi lebarnya. ""Dengan karakter  C 400 GT bisa menjadi sahabat padar   yang senang dengan perjalanan jarak jauh, tapi masih ingin kenyamanan tinggi. Ditambah dengan teknologi BMW Motorrad Connectivity dan layar TFT yang bisa terkoneksi   Bluetooth,"" ucap CEO Maxindo Motor Nusantara Joe Frans, dalam keterangan resminya, Minggu (24/3/2019). Seragam dengan C 400 X, model GT juga dibekali BMW Flex Case untuk menambah kapasitas bagasi, sistem  , dan layar 6.5 inci serta multi   ala teknologi BMW Connectivity. Fitur ini mempu dioperasikan dengan melalui aplikasi yang bisa diunduh dari App Store dan Google Play. BMW C 400 GT meluncur dengan tiga pilihan warna, yakni Moonwalk Grey Merallic, Alpine White, dan Black Strom Metallic. Untuk harga, BMW akan mengumumkannya lebih lanjut, karena motor ini baru akan tersedia pada Mei 2019 mendatang.","BMW C 400 GT Meluncur Tanpa Harga"
"dict","edukasi","PLTSa, Mengubah Sampah jadi Komoditi lewat Teknologi  -    Tenaga    (PLTSa) Merah Putih Bantargebang resmi beroperasi. Peresmian dilakukan Menteri Koordinator Bidang Kemaritiman Luhut Luhut Binsar Pandjaitan bersama Menteri Riset Teknologi dan Pendidikan Tinggi Mohamad Nasir dan Badan Pengkajian dan Penerapan Teknologi (BPPT) Hammam Riza di PLTSa Bantargebang, Kota Bekasi, Senin (25/3/2019). Menristekdikti Mohamad Nasir mengatakan PLTSa diharapkan dapat menjadi solusi pengelolaan    nasional terutama di kota besar Indonesia. Mohamad Nasir menjelaskan dalam sehari, DKI Jakarta memproduksi 8.000 ton sampah, sedangkan Kota Bekasi mencapai 1.800 ton. Adanya PLTSa ini diharapkan dapat menyelesaikan masalah sampah, baik di DKI Jakarta maupun di Kota Bekasi. “PLTSa Merah Putih Bantargebang ini merupakan   sehingga baru mampu mengolah100 ton/hari, kita dorong BPPT untuk menghasilkan teknologi yang mampu mengolah 2.000 hingga 5.000 ton per hari, “ ujar Menristekdikti dilansir dari rilis resmi Kemenristekdikti. Menteri Nasir mengajak semua pihak merubah paradigma agar tidak hanya menjadikan sampah sebagai sumber masalah yang harus dibuang, namun menjadikan sampah sebagai sebuah komoditi. Sampah yang dikelola dengan baik akan menghasilkan nilai tambah seperti listrik yang akan dihasilkan oleh PLTSa Merah Putih. “Sampah dianggap menjadi komoditi. Tahun 2021 jika pengelolaan sampah tidak dilakukan dengan serius dan sistematis, beberapa kota di Indonesia akan mengalami situasi    sampah. Oleh karena itu perlu ada teknologi pengelolaan sampah agar Indonesia bersih dari sampah,"" ujar Nasir. Menristekdikti mengharapkan kehadiran PLTSa inidapat menjadikan DKI Jakarta dan Bekasi bersih dari sampah. PLTSa ini merupakan program rintisan yang kemudian dapat dikembangkan untuk pengelolaan sampah baik di kota maupun dapat dikembangkan skala lebih kecil untuk pedesaan. Menko Maritim Luhut Binsar Pandjaitan menyambut baik keberadaan PLTSa Bantargebang. Luhut mengatakan, saat ini Indonesia sedang darurat sampah, kehadiran PLTSa ini adalah langkah pemerintah mengatasi masalah sampah yang saat ini telah menjadi masalah nasional. Menko Luhut berharap BPPT dapat membangun PLTSa dengan kapasitas pengelolaan sampah yang lebih besar, yakni 1.500 ton sampah per hari. ""Saya tanya ke kepala BPPT, bisa nggak bikin 1.500 ton per hari, bisa nggak Pak? Kalau bisa buatan dalam negeri ya nggak apa-apa didukung. Kita 'kan bisa dalam negeri, ngapain mesti impor? Yang model 150 (ton sampah per hari) itu bisa di kampung-kampung di Labuan Bajo, atau di kampung saya."" ujar Luhut. Menko Luhut berharap agar budaya hidup bersih harus ditumbuhkan mulai dari level keluarga. Dengan demikian dapat menghasilkan masyarakat yang cinta akan kebersihan dan sadar akan pengelolaan sampah yang baik. “Semua aturan sudah ada tinggal mengintegrasi aturan ini supaya jalan. Bayangkan kita udah pakai MRT, tapi ada sampah, “ tutur Menko Luhut. Kepala BPPT Hammam Riza mengungkapkan   PLTSa Merah putih ini dibangun dengan kapasitas pengolahan sampah mencapai 100 ton per hari dan akan menghasilkan listrik sebagai bonus sebanyak 700 kilowatt hour Diungkap oleh Hammam bahwa pembangunan Pilot project ini berlangsung dalam waktu cepat yakni satu tahun, dan merupakan PLTSa pertama di Indonesia yang menggunakan teknologi termal yang sudah proven. ""Pilot Project ini merupakan hasil kajian desain Tim BPPT, Saat ini plant masih dalam kondisi commissioning, yang tentunya masih ada beberapa komponen atau proses yang perlu disempurnakan untuk PLTSa ini berjalan dengan lancar,"" ujarnya.","PLTSa, Mengubah Sampah jadi Komoditi lewat Teknologi"
"dict","otomotif","Efek Tahan Harga, Bikin Harga Mobil Bekas Turun  - Kemunculan    baru pada awal 2019 ternyata tak memberikan efek bagi penjualan unit bekasnya. Hingga saat ini, rata-rata penjualan unit    seken masih tetap kurang bergairah seperti tahun lalu. Kondisi ini diutarakan oleh Senior Marketing Manager WTC Mangga Dua Herjanto Kosasih. Menurut Herjanto, hingga mendekati akhir Maret 2019, penjualan    terbilang masih sepi peminat, salah satu faktor besarnya karena efek dari tahan harga. ""Avanza-Xenia meluncur dia tahan harga pakai model lawas, enggak berubah, sama seperti    juga begitu. Kondisi ini bikin konsumen mikir, lebih baik ambil model baru karena harga lama, apalagi kalau pembeliannya kredit. Pedagang putar otak, ujung-ujungnya   harga sekitar Rp 5 juta - Rp 8 juta, tergantung kondisi mobil,"" ucap Herjanto beberapa waktu lalu. Seperti diketahui, Toyota, Daihatsu, dan Honda meluncurkan versi pembaruan pada unitnya tanpa menaikkan harga jual. Dengan beragam fitur baru yang disematkan, konsumen bisa mendapatkan Avanza, Xenia, dan Mobilio lasiran 2019 dengan harga yang sama dengan produksi 2018. Namun, meski sudah mengalami penurunan, menurut Herjanto memang pasar LMPV masih belum bergairah. Pasalnya, sejak awal tahun penjualan mobil bekas masih didominiasi jenis   dan  ""Mobilio RS 2018 itu turun, harganya sekarang sekitar Rp 190 jutaan dari biasanya di Rp 200 jutaan, Veloz juga di sekitaran itu, tapi lebih murah Rp 6-8 juta karena belum CVT. Untuk saat ini LMPV itu memang belum kelihatan, masih mobil kecil, tapi mungkin Mei mulai naik karena mau Lebaran,"" ucap Herjanto. Presiden Direktur Mobil88 Halomoan Fischer Lumbantoruan, juga mengungkapkan hal senada. Namun Fischer beranggapan turunnya LMPV dikarenakan unit penjualan barunya juga tidak begitu agresif di awal tahun. ""Memang turun penjualannya, tapi belum signifikan. Kalau mobil seken itu tergantung gimana mobil barunya, kalau mobil baru banyak yang beli, otomatis bikin perputaran juga di pasar mobil bekas, kalau tidak yang tidak bergerak pasarnya. Untuk Lebaran, harusnya dari April nanti sudah terlihat, karena kalau Mei itu terlalu mepet kan waktunya,"" ucap Fischer.","Efek Tahan Harga, Bikin Harga Mobil Bekas Turun"
"dict","edukasi","Tahun Ini 18 Staf Kemenkumham Terima Beasiswa Studi di Belanda  - Sebanyak 18 staf Kementerian    dan Hak Asasi Manusia (  ) menerima      (Studi di   ). Mereka akan mengikuti   atau    tentang Pengembangan Program Diklat Penyuluh Hukum di Bogor.    tersebut Direktur  , Peter van Tuijl, kepada Sekretaris Badan Pengembangan Sumber Daya Manusia (BPSDM) Kemenkumham, Hantor Situmorang, di Bogor, Senin (25/3/2019). Hadir pada acara tersebut Roy Spijkerboer, Staf Politik Kedutaan Besar Kerajaan Belanda dan Lieselotte Heederik, pelatih dari Center for International Legal Cooperation (CILC) Belanda. Badan Pembinaan Penyuluh Hukum (BPHN) Kemenkumham, sebagai lembaga yang menaungi para penyuluh   , memprediksi jumlah penyuluh akan bertambah terus. BPSDM yang bertanggungjawab terhadap pengembangan kompetensi penyuluh hukum telah menyiapkan rencana pendidikan dan pelatihan secara terstruktur melalui pelatihan berjenjang dari tingkat dasar, menengah, dan lanjut.     Kepala BPSDM mengatakan saat ini sudah banyak kegiatan kerja sama antara Indonesia dan Belanda di bidang hukum. Adapun dalam kaitannya dengan beasiswa StuNed ini, CILC akan membantu meningkatkan kapasitas BPSDM dan BPHN dalam penyelenggaraan pelatihan penyuluh hukum, mulai analisa kebutuhan pelatihan sampai penyusunan kurikulum pelatihan. ""Kami menargetkan kurikulum pelatihan per masing-masing pada jenjang kompetensi penyuluh hukum selesai sebagai hasil pelatihan,"" ujar Sekretaris Badan Pengembangan Sumber Daya Manusia (BPSDM) Kemenkumham, Hantor Situmorang.      Pada kesempatan tersebut Staf Politik Kedutaan Besar Kerajaan Belanda, Roy Spijkerboer, menambahkan bahwa beasiswa StuNed untuk pelatihan ini memang merupakan bagian dari kerjasama bilateral antara Belanda dan Indonesia di bidang keamanan dan penegakan hukum. ""Selain StuNed, masih ada program peningkatan kapasitas lainnya yang didanai pemerintah Belanda, termasuk beasiswa   dan program studi banding,"" jelas Roy. Adapun total durasi pelatihan ini dilaksanakan selama dua pekan. Pekan pertama diselenggarakan pada akhir Maret ini dengan topik analisa kebutuhan diklat. Adapun satu minggu pelatihan sisanya lagi akan dilaksanakan pada akhir Juli mendatang untuk menyusun disain kurikulum diklat yang merupakan kerja sama BPSDM dan BPHN. Lebih lanjut, Direktur Nuffic Neso Indonesia, Peter van Tuijl, menjelaskan bahwa pelatihan ini diharapkan bisa sangat efisien dilaksanakan di Indonesia. Hal itu karena Indonesia dan Belanda memiliki dasar sistem hukum yang mirip. ""Mirip, baik secara struktur hukum, teori hukum, dan cara pandang hukum. Ini membuat kita mudah untuk bertukar pengalaman dan gagasan,"" kata Peter.","Tahun Ini 18 Staf Kemenkumham Terima Beasiswa Studi di Belanda"
"dict","edukasi","Rhenald Kasali: Negara Perlu Memperkuat Pendidikan Swasta Guru Besar UI Prof    melihat laporan bank Dunia tentang indeks Modal Insani 2018 menguatkan dugaan saatnya Indonesia berfokus pada penguatan SDM dengan memberikan dukungan yang lebih besar kepada pihak    dan para siswa/mahasiswa. Ia menyampaikan hadirnya kartu Indonesia Pintar, Kartu Kuliah perlu diimbangi stimulus untuk lebih memajukan swasta. Ia juga menyambut baik gagasan presiden Jokowidodo yang akan memperkuat SDM ke depan. Pendapatnya itu diutarakan dalam seminar Peluang dan Tantangan Ekonomi Indonesia yang diselenggarakan Kantor Staf Presiden RI di Surabaya (25/3/2019). Dia mengatakan, laporan itu menunjukkan baru 68 persen dari kaum muda di seluruh dunia yang potensinya telah dikembangkan dengan baik. Sementara itu di Indonesia, skornya 0.53, masih lebih baik dari India yaitu 0.44. Namun kita masih ketinggalan dengan Malaysia (0.62). Artinya, produktivitas tenaga kerja kita masih punya ruang besar untuk ditingkatkan. Apakah melalui    maupun asupan gizi pada ibu hamil untuk mengurangi jumlah stunting. Pelibatan swasta, seperti yang dilakukan oleh lembaga-lembaga keagamaan maupun non-keagamaan menjadi penting karena mereka memiliki akses dan aset yang cukup besar. Mengutip data Kemenristekdikti, Rhenald Menyebutkan pada 2017 dari total 6,9 juta mahasiswa, 68 persen atau 4,7 juta kuliah di perguruan tinggi swasta (  ). Sehingga menurutnya peningkatan kualitas pendidikan di PTS menjadi sangat penting karena menentukan kualitas mayoritas sarjana di Indonesia. Perguruan tinggi dan sekolah-sekolah swasta tidak pernah membebankan negara dalam soal pembiayaan. Namun belakangan agak terganggu menyusul kenaikan gaji guru sekolah negeri yang progresif sementara sekolah swasta harus membiayai sendiri. Akibatnya sekolah swasta harus meningkatkan pendapatannya, atau kehilangan guru muda yang bagus-bagus. Keadaan keuangan banyak sekolah swasta yang melayani masyarakat berpendapatan rendah kini memang agak memperihatinkan. Namun tak sedikit PTS yang kualitas dan inovasinya melebihi perguruan-perguruan negeri. Tak sedikit juga yang gurunya mempunyai etos kerja melebihi guru negeri dan tak pernah menuntut diangkat sebagai PNS atau mendapat status pegawai tetap. Bahkan disiplin pendidikan sekolah swasta dan kemampuan beradaptasinya terhadap kebaharuan sudah lama diakui. Lulusan-lulusan sekolah swasta lolos di PTN rata-rata memiliki   tinggi. Oleh karena itu stimulus negara untuk memperkuat sekolah-sekolah swasta perlu diberikan negara. ""Apalagi ke depan janji presiden adalah penguatan mutu SDM,"" lanjutnya. Ada baiknya, dukungan beasiswa dari BUMN/swasta bisa menjadi pengurang pajak, seperti pembayaran zakat, tambahnya. Ia juga menyampaikan apa yang dibutuhkan pendidikan swasta sesungguhnya amat beragam. Ada yang hanya membutuhkan fasilitasi dukungan dan tidak diganggu dengan proses regulasi yang menyulitkan. Namun juga ada yang tentu masih membutuhkan dukungan fasilitas lab, insentif untuk pengembangan, dan tentu saja beasiswa untuk guru.","Rhenald Kasali: Negara Perlu Memperkuat Pendidikan Swasta"
