"_type","category","isi","judul"
"dict","finance","Jakarta - Para petinggi produsen pesawat Boeing akan mendatangi kantor PT Garuda Indonesia (Persero) Tbk besok, Kamis (28/3/2019) di Cengkareng, Banten. Kedatangan mereka untuk membahas pesanan pesawat Boeing.""Yes,"" kata Direktur Utama Garuda Indonesia IGN Askhara Danadiputra kepada detikFinance, Rabu (27/3/2019).Sebelumnya diberitakan, Garuda Indonesia telah membatalkan pemesanan unit pesawat Boeing 737 MAX 8. Jumlahnya mencapai 49 unit. Ari mengatakan kedatangan para petinggi Boeing salah satunya membahas hal tersebut. googletag.cmd.push(function() { googletag.display('div-gpt-ad-1535944306169-0'); }); Baca juga: Demi Penumpang, Garuda Batalkan Pesanan Boeing 737 Max 8""Salah satu di antaranya,"" tambah pria yang akrab disapa Ari.Sebelumnya, Direktur Utama Garuda Indonesia, I Gusti Ngurah Askhara Danadiputra mengatakan bahwa pihaknya telah melakukan pembatalan pada pemesanan unit pesawat Boeing 737 MAX 8.Baca juga: 2017 Garuda Rugi Rp 3 T, Rini: 2018 Untung Hampir Rp 100 MPria yang juga akrab disapa Ari Ashkara mengatakan bahwa pihaknya pun sudah menyurati pihak Boeing untuk menghentikan pemesanan Boeing 737 MAX 8.""Kami sendiri sudah kirim surat ke McAllister (bos Boeing) kalau kami nyatakan untuk cancel 49 unit,"" ungkap Ari saat ditemui di Plaza Indonesia, Jakarta, Kamis (21/3/2019). (ara/hns) garuda indonesia boeing garuda ari ashkara dirut garuda boeing 737 max 8","Besok, Petinggi Boeing Sambangi Garuda Indonesia"
"dict","finance","Jakarta - Deputi Gubernur Senior Bank Indonesia (BI) Mirza Adityaswara menyebut mengunduh alias download game berbayar buatan asing bisa bikin neraca pembayaran Indonesia (NPI) defisit. Pasalnya tiap transaksi pembelian game tersebut akan membawa aliran uang dari Indonesia keluar.""Kalau main game itu keliatan nggak di neraca pembayaran Indonesia? mudah-mudahan kelihatan. Yang pasti itu uang Indonesia yang keluar,"" katanya pada diskusi dalam acara Peluncuran Buku Laporan Perekonomian Indonesia 2018 di Gedung BI, Jakarta Pusat, Rabu (27/3/2019).Harga game yang dijual secara online mungkin memang tidak terlalu mahal. Mirza mencontohkan harga game di kisaran US$ 0,5 alias setengah dolar. googletag.cmd.push(function() { googletag.display('div-gpt-ad-1535944306169-0'); }); Namun yang perlu diingat, berapa banyak orang yang melakukan pembelian game yang diproduksi oleh negara lain itu. Jika yang mengunduh game berbayar itu mencapai jutaan orang, tentu secara total jumlahnya tidak sedikit uang yang mengalir ke luar negeri.""Untuk gamenya setengah dolar, tapi kalau yang main 2 juta orang, ya itu uang keluar untuk games itu,"" paparnya.Baca juga: GoPay dan OVO Kian Melesat, BI: Perbankan KalahTerkait hal tersebut, diharapkan game-game buatan anak bangsa bisa diproduksi sehingga Indonesia tak bergantung pada game buatan asing.""Bisa nggak kita bikin game Indonesia, teman-teman di ITB, ITS, UGM buat game yang diproduksi anak-anak Indonesia. Jadi kalau itu bisa maka perlu skill, kalau mau lompat ke situ perlu skill,"" tambahnya.Sebagai informasi saja, neraca pembayaran Indonesia sepanjang 2018 tercatat mengalami defisit US$ 7,1 miliar. Padahal dari data Bank Indonesia (BI) periode 2017 NPI mencatatkan surplus US$ 11,6 miliar. Sejak 2015, NPI sudah defisit sebanyak 2 kali. Yakni pada 2015 NPI defisit sebesar US$ 1,1 miliar. Penyebab defisitnya NPI terjadi karena defisit transaksi berjalan yang lebih tinggi dibanding surplus transaksi modal dan finansial.Baca juga: RI Masih Tarik Utang Luar Negeri, BI: Dana Dalam Negeri Tak Cukup (fdl/fdl) bank indonesia bi game neraca dagang mirza adityaswara","Unduh Game Asing Berbayar Bisa Bikin Neraca Dagang Tekor"
"dict","sport","Jakarta - Conor McGregor memutuskan pensiun dari dunia tarung bebas setelah 11 tahun berkarier di UFC. Total 21 kemenangan dan uang lebih dari Rp 1 T berhasil dikumpulkannya.McGregor secara mengejutkan memutuskan berhenti dari kariernya sebagai petarung Mixed Martial Arts (MMA). Pria 30 tahun itu menyudahi sedekade lebih perjalanan kariernya di sana.Sebagai petarung, McGregor memang dikenal kontroversial dengan segala aksinya di dalam maupun luar ring. Tapi, tak ada yang menyanggah bahwa UFC menjadi tenar karena kehebatan McGregor. googletag.cmd.push(function() { googletag.display('div-gpt-ad-1535945783791-0'); }); Berikut data dan fakta terkait karier McGregor di atas ring UFC seperti disarikan tim detikSport dalam infografis.Foto: Infografis Detiksport (mrp/mrp) conor mcgregor pensiun conor mcgregor infografis","Setelah 11 Tahun dan 21 Kemenangan, McGregor Undur Diri"
"dict","finance","Jakarta - Maskapai Sriwijaya Air terpaksa melayani check-in penumpang secara manual. Hal ini terjadi karena pengelola Bandara Soekarno Hatta memadamkan aliran listrik.""Saat ini listrik khusus untuk check in, tiba-tiba dimatikan dan tentunya pelayanan kepada penumpang sangat terhambat,"" kata Direktur Utama Sriwijaya Air Joseph Saul kepada detikFinance, Rabu (27/3/2019)Joseph menambahkan, pelayanan penumpang semuanya dilakukan secara manual termasuk bagasi. Hal ini menyebabkan sejumlah penerbangan Sriwijaya Air mengalami keterlambatan. googletag.cmd.push(function() { googletag.display('div-gpt-ad-1535944306169-0'); }); Sriwijaya Air layani check-in manual karena listrik dipadamkan pengelola Bandara Soetta Foto: Dok. Sriwijaya Air""Semua flight kami melakukan check-in manual. Bahkan timbangan bagasi juga manual sehingga banyak flight yang terlambat bahkan bisa dibatalkan,"" kata Joseph.Joseph menambahkan, hal ini terjadi karena masih adanya kewajiban dari maskapai yang belum dipenuhi kepada pengelola Bandara Soetta, PT Angkasa Pura II (AP II) sebesar Rp 38 miliar. Sriwijaya Air sedang berupaya memenuhi kewajiban tersebut.""Utang kami ke AP II Rp 38 miliar dan saat kami sedang berusaha memperbaiki keuangan Sriwijaya Air Group,"" tutur Joseph.Sriwijaya Air layani check-in manual karena listrik dipadamkan pengelola Bandara Soetta Foto: Dok. Sriwijaya AirPerseroan mengaku mengalami kesulitan keuangan. Terlebih lagi ada rencana penurunan tiket pesawat.""Kami kesulitan sekali, apalagi rencana pemerintah akan menurunkan harga tiket,"" tambah Joseph.Sriwijaya Air layani check-in manual karena listrik dipadamkan pengelola Bandara Soetta Foto: Dok. Sriwijaya Air (ara/hns) sriwijaya air bandara soekarno hatta angkasa pura ii listrik padam","Sriwijaya Air Masih Ngutang Rp 38 M, Listrik Layanan Check-in Diputus"
"dict","hot","","Sophie Turner Bicara Pengalaman Seksnya Sebelum Tunangan dengan Joe Jonas"
"dict","sport","Bekasi - Kalteng Putra menghadapi Persija Jakarta di babak delapan besar Piala Presiden 2019. Pelatih Gomes de Oliviera melemparkan pujian kepada Macan Kemayooran. Kalteng menghadapi Persija di Stadion Patriot Candrabhaga, Bekasi, Kamis (28/3/2019). Laga itu menjadi laga hidup mati bagi kedua tim. Pelatih Kalteng Putra, Gomes de Oliviera, melemparkan bebas kepada Persija, yang tampil sebagai juara bertahan. Persija juga lolos ke babak delapan besar sebagai juara grup. Dia memprediksi pertandingan bakal sangat menyulitkan. googletag.cmd.push(function() { googletag.display('div-gpt-ad-1535945694694-0'); }); Baca juga: Ladeni Kalteng Putra, Persija Tanpa Novri dan Sandi Sute""Saya sangat bangga berada disini. Untuk pertandingan lawan Persija, tidak ada lawan lebih baik melawan Persija, mereka tim besar yang juara kemarin, dan punya suporter yang istimewa, nah itu tentu istimewa,"" ujar Gomes di Stadion Patriot, Rabu (27/3/2019).Gomes pun sudah menyiapkan cara untuk bisa meladeni pemainan Persija. Meski lawan lebih diunggulkan, Kalteng bertekad tak mau mengecewakan masyarakat di Palangkaraya.""Kami akan main maksimal, melakukan yang terbaik dari masing masing pemain, dan kolektivitas yang diandalkan membangun tim baru tidak gampang tapi juga tidak susah,"" kata Gomes. ""Bekerja sama dengan orang yang mau, pemain mau saya pun siap, itu yang gampang. Saya lihat di Kalteng itu mereka mau, dan kami berjuang bersama-sama,"" ujar dia. ""Dan besok kami akan sekali lagi tunjukkan ke masyarakat kalau kita ini akan berjuang untuk jadi kebanggaan masyarakat Palangkaraya,"" dia menambahkan.Baca juga: Jadwal Perempatfinal Piala Presiden 2019: Dibuka Persija Vs Kalteng Putra (ads/fem) kalteng putra persija jakarta piala presiden 2019 delapan besar piala presiden 2019","Duel di Delapan Besar Piala Presiden, Kalteng Putra Lempar Beban Kepada Persija"
"dict","hot","","Tsania Marwa Pasrah Atalarik Syah Tak Hadiri Sidang Mediasi"
"dict","finance","","Bor Raksasa Kelar Dirakit, Terowongan Kereta Cepat Dibangun"
"dict","sport","Jakarta - Rencana mendatangkan Khabib Nurmagomedov di acara Fesitival Silat Dunia dipastikan batal. Juara kelas ringan Ultimate Fighting Championship (UFC) itu berhalangan hadir.Sebelumnya, muncul kabar Khabib dijadwalkan hadir dalam acara yang digelar di Padepokan Pencak Silat Taman Mini Indonesia Indah, 30 Maret mendatang. Khabib rencananya akan menggelar coaching clinic bersama pencak silat muda.Tapi Ketua Panitia Penyelenggara Festival Silat Dunia, Arko Murjoko baru mendapatkan kabar Khabib tak bisa memenuhi undangan tersebut. googletag.cmd.push(function() { googletag.display('div-gpt-ad-1535945783791-0'); }); Baca juga: McGregor Pensiun, Khabib: Hanya Ada Satu Raja""Update terkini Khabib batal datang,"" ujar Arko kepada detikSport, Rabu (27/3/2019).Pamor Nurmagomedo belakangan meningkat drastis. Itu setelah dia mengalahkan Conor McGregor yang jadi rivalnya Oktober lalu. Khabib sendiri memegang rekor tak pernah kalah dalam 27 laga.""Awalnya Nurmagomedov akan datang ke Indonesia untuk meramaikan Festival Silat Dunia. Kami mengundangnya karena Nurmagomedov merupakan sosok yang sedang diidolakan oleh anak-anak muda,"" sambung Arko.Baca juga: Pensiun, Kekayaan McGregor Beda Tipis dengan Ronaldo (ads/mrp) khabib nurmagomedov ufc pencak silat","Khabib Nurmagomedov Batal Datang ke Indonesia"
"dict","finance","Jakarta - Sriwijaya Air meminta maaf atas pemadaman listrik yang dilakukan oleh pengelola Bandara Soekarno-Hatta. Dengan pemadaman ini, semua pelayanan dilakukan secara manual. Vice President Corporate Secretary Sriwijaya Air Retri Maya menjelaskan, pemadaman ini diduga terkait adanya kewajiban Sriwijaya Air kepada PT Angkasa Pura II (Persero) selaku pengelola bandara. ""Sriwijaya Air Group memang memiliki kewajiban kepada AP II. Dan hingga saat ini kami sedang berupaya keras memperbaiki keuangan perusahaan serta dapat memenuhi seluruh kewajibannya,"" kata Maya dalam keterangan tertulis, Rabu (27/3/2019).Baca juga: Masih Ngutang Rp 38 M, Listrik Layanan Check-in Sriwijaya Air Diputus Maya menambahkan hingga saat ini kondisi keuangan Sriwijaya Air Group dinilai masih belum sehat. Hal tersebut diyakini karena tingginya biaya operasional dalam bisnis penerbangan saat ini. ""Kerjasama Operasi atau management dengan Garuda Indonesia Group menjadi poin penting untuk melakukan negosiasi dan re-strukturisasi kewajiban Sriwijaya Air Group pada pihak BUMN. Namun demikian hal ini tentu juga masih membutuhkan bantuan dari yang lainnya termasuk para pengelola bandara,"" terang Maya. ""Apalagi pemerintah berencana akan menurunkan harga tiket kembali. Hal tersebut tentu akan semakin menyulitkan kami,"" lanjutnya.Baca juga: Bantah Jadi Kartel Tiket Pesawat, Ini Penjelasan Bos Garuda Terkait pemadaman listrik ini, maka seluruh proses penerbangan Sriwijaya Air Group malam ini diyakini akan mengalami keterlambatan karena terjadi penumpukan di counter check in. Namun demikian pihak Sriwijaya Air Group berkomitmen untuk tetap melayani seluruh pelanggannya meski melalui proses manual. ""Untuk saat ini seluruh proses kita layani secara manual. Sekali lagi kami atas nama Sriwijaya Air Group mohon maaf kepada seluruh pelanggan kami,"" tutup Maya. googletag.cmd.push(function() { googletag.display('div-gpt-ad-1535944306169-0'); }); (hns/hns) sriwijaya air bandara soekarno hatta soekarno hatta check-in","Listrik Layanan Check-in Diputus, Ini Penjelasan Sriwijaya Air"
"dict","finance","Jakarta - Kementerian Perhubungan (Kemenhub) tengah menggodok aturan baru tarif pesawat. Demikian disampaikan Kepala Biro Komunikasi dan Informasi Publik Kementerian Perhubungan Hengki Angkasawan dalam keterangan tertulis, Rabu (27/3).""Saat ini masih disusun oleh Biro Hukum Kemenhub bersama dengan jajaran Ditjen Perhubungan Udara Kemenhub. Kami belum bisa menjelaskan secara detail karena masih dalam proses penyusunan,"" jelas Hengki.Baca juga: Minta Maskapai Turunkan Tiket Pesawat, Luhut Ungkit Harga AvturHengki menjelaskan aturan yang tengah dalam tahap finalisasi ini disusun dengan melibatkan pihak maskapai. Sebelum aturan tersebut digodok, sudah tercapai kesepahaman dengan pihak maskapai. googletag.cmd.push(function() { googletag.display('div-gpt-ad-1535944306169-0'); }); Aturan ini diharapkan dapat mengatasi permasalahan tarif atau harga tiket pesawat yang banyak dikeluhkan masyarakat.""Tentunya dalam membuat regulasi, Pemerintah berada di tengah-tengah antara kepentingan masyarakat banyak dengan keberlangsungan industri penerbangan nasional,"" terang Hengki. Baca juga: Menhub Sebut Tiket Pesawat Mahal, Garuda: Itu Ranah Korporasi!Hengki menambahkan Kemenhub segera mengumumkan aturan baru ini setelah proses penyusunan aturan tersebut selesai dilakukan.""Kami akan segera rilis aturan tersebut dalam waktu dekat ini,"" pungkasnya.Sebelumnya Menteri Perhubungan Budi Karya Sumadi akan mengumumkan keputusan tentang tarif pesawat pada Rabu (27/3), namun batal. Persoalan tarif mahal ini mencuat setelah beredar notulen rapat yang berisi permintaan dari Menteri Koordinator Kemaritiman, Luhut Pandjaitan dan Menteri Perhubungan Budi Karya Sumadi kepada pihak maskapai segera memangkas tarif pesawat hingga 20%. (hns/knv) tarif pesawat tiket pesawat tiket pesawat mahal kementerian perhubungan","Aturan Baru Tarif Pesawat Lagi Disusun Kemenhub"
"dict","hot","","Pernah Disebut Terlalu Seksi, Aaliyah Massaid Jadi Hati-hati?"
"dict","finance","Jakarta - Calon wakil presiden nomor urut 02 Sandiaga Uno mengumbar janji kepada para nelayan di Kabupaten Lamongan. Mantan Wagub DKI Jakarta ini berjanji akan mengizinkan para nelayan mencari ikan menggunakan cantrang.Janji itu disampaikan Sandi saat berkampanye di Desa Sedayu Lawas, Kecamatan Brondong, Lamongan.Wacana Sandi pun menimbulkan reaksi pemerintah. Seperti apa respons pemerintah? Apa pembelaan kubu 02? Baca berita selengkapnya. (ang/ang) cantrang sandiaga uno luhut pandjaitan susi pudjiastuti Sebelumnya Sandi Terkini: Beda Pandangan soal Cantrang dan Duit Kampanye Rp 1,4 T 1 / 4 Selanjutnya Susi ke Sandi: Kasihan","Sandiaga Mau Legalkan Cantrang, Luhut dan Susi Kritik Keras"
"dict","hot","","Dua Lipa, Aaliyah Massaid, Nicole Scherzinger hingga Heidi Klum"
"dict","finance","Jakarta - Tampaknya bukan perkara mudah bagi pasangan Capres-Cawapres nomor urut 02 untuk bisa mengalahkan petahana dalam ajang pemilihan presiden (Pilpres) pada 17 April 2019.Butuh modal yang cukup besar untuk bisa maju mencalonkan diri di ajang ini, terlebih bagi Sandiaga Salahuddin Uno yang merupakan Cawapres pasangan Prabowo Subianto.Sandiaga disebut-sebut menjadi pihak penyokong dana kampanye terbesar untuk Paslon nomor urut 02. Mengutip laporan Bloomberg, Sandiaga bahkan dikatakan sudah merogoh kocek hingga lebih dari Rp 1 triliun untuk kampanye.Simak berita selengkapnya: (fdl/ang) sandiaga uno dana kampanye Sebelumnya Sandi Terkini: Beda Pandangan soal Cantrang dan Duit Kampanye Rp 1,4 T 1 / 4 Selanjutnya Sandiaga Habiskan Rp 1,4 T","Kocek Sandi Terkuras Rp 1,4 T Demi Jadi Cawapres"
"dict","finance","Jakarta - Bandara Kulon Progo/New Yogyakarta International Airport (NYIA) beroperasi pada April 2019. Bandara tersebut melayani penerbangan internasional yang dialihkan dari Bandara Internasional Adisutjipto. Kehadiran Bandara Kulon Progo menjadi jawaban atas melubernya penumpang di Adisutjipto yang jauh melebihi kapasitas semestinya. Dari kapasitas 1,3 juta penumpang per tahun, Bandara Adisujipto melayani hampir 8 juta penumpang setiap tahunnya.Apakah Bandara Adisutjipto nantinya akan berhenti beroperasi atau justru sebagai pelengkap? Simak berita selengkapnya dirangkum detikFinance, Kamis (28/3/2019). (ara/ang) bandara kulon progo bandara adisutjipto Sebelumnya Melihat Kesiapan Operasi Bandara Kulon Progo 1 / 4 Selanjutnya Layani Penerbangan Domestik","Menerawang Nasib Bandara Adisutjipto Setelah Kulon Progo Beroperasi"
"dict","finance","Jakarta - Kementerian Keuangan (Kemenkeu) menganggarkan Rp 25,59 triliun untuk kegiatan pemilihan umum (Pemilu) serentak pada 17 April 2019. Angka ini naik 61% dibanding anggaran untuk Pemilu 2014 yang sebesar Rp 15,62 triliun.Foto: Fuad Hasim/Tim InfografisBaca juga: Sandiaga Sudah Habiskan Rp 1,4 T untuk Dana KampanyeBaca juga: Anggaran Pemilu 2019 Capai Rp 25 T, Kok Bisa? (dna/ang)","Anggaran Pemilu 2019 Melonjak 61%, Ini Daftarnya"
"dict","hot","","Perjalanan 12 Ribu Km Jadi Lagu Baru Andien"
"dict","sport","Bekasi - Peluang Persija Jakarta mempertahankan gelar juara Piala Presiden 2019 terbuka. Pelatih Ivan Kolev optimistis gelar juara bisa kembali didapatkan asalkan timnya kerja keras.Untuk bisa menjadi juara, Persija harus melewati babak delapan besar terlebih dulu. Di laga tersebut, Macan Kemayoran akan menghadapi Kalteng Putra di Stadion Patriot Candrabhaga, Bekasi, Kamis (28/3/2019).Jika Persija menang, mereka akan lolos ke babak semifinal yang akan digelar pada 2-6 April 2019 dengan sistem kandang dan tandang. googletag.cmd.push(function() { googletag.display('div-gpt-ad-1535945694694-0'); }); Baca juga: Duel di Delapan Besar Piala Presiden, Kalteng Putra Lempar Beban Kepada PersijaKolev tidak bisa memprediksi peluang tersebut. Persija harus fokus satu demi satu pertandingan lebih dulu. Kini, Macan Kemayoran menghadapi babak delapan besar.""Untuk statistik saya bisa bicara apa, ini statistik ya, semua itu tergantung dari Tuhan, besok kami kerja keras, kalau kami bisa menang kenapa tidak jadi juara. Tapi kalau kami tidak bisa menang, tidak juara, tentu itu statistik,"" ujar Kolev.Tapi keinginan Persija mempertahankan gelar juara Piala Presiden tak akan mudah. Sebab, Persija juga dihadapkan pada pertandingan Piala AFC di waktu bersamaan dengan partai semifinal Piala Presiden.Ismed Sofyan dkk harus terbang ke Filipina untuk melawan Ceres Negros pada laga lanjutan Grup G Piala AFC 2019 di Stadion Panaad Park, Bacolod, Rabu (3/4/2019).Oleh karena itu, Kolev meminta Persija menjaga konsentrasi di tengah jadwal padat. Pelatih asal Bulgaria itu harus pintar-pintar mengatur timnya.""Kami harus bermain kalau mau lolos ke semifinal, klub ini sangat serius dan sudah memiliki program apa yang harus kami lakukan ke depan,"" kata Ivan menambahkan.Persija menjadi juara Piala Presiden 2018 setelah mengalahkan Bali United di babak final dengan skor 3-0 di Stadion Utama Gelora Bung Karno (SUGBK), Senayan, Jakarta.Baca juga: Hadapi Kalteng Putra, Persija Bisa Andalkan Lagi 3 Pilarnya di Timnas (ads/fem) persija jakarta piala presiden 2019 ivan kolev","Kolev Bicara tentang Kans Persija Pertahankan Gelar Juara Piala Presiden"
"dict","finance","Jakarta - Diskusi di artikel terakhir kita membahas tentang utang, apakah utang itu baik atau buruk? Bila tidak dikelola dengan baik, utang akan menjadi sebuah masalah besar bagi anda. Apalagi, utang yang anda ambil adalah utang yang bersifat konsumtif. Utang jenis ini adalah utang yang sangat mudah untuk cair, tanpa jaminan, namun membebankan bunga yang cukup besar.Sehingga, ketika Anda mengambil utang ini dan ingin membayarnya di bulan depan, Anda akan membayar pokok pinjaman dan juga bunga atas pinjaman yang telah anda ambil. Ingat, bila bunganya cukup besar, tentu ini akan membebani cashflow bulanan Anda di bulan depan. Bayangkan, cicilannya sudah besar, belum lagi ditambah dengan bunga-nya. googletag.cmd.push(function() { googletag.display('div-gpt-ad-1535944306169-0'); }); Tidak aneh, bila akhirnya Anda akan kesulitan untuk melunasi utang karena setelah dijumlahkan, nominal dari pokok dan bunganya cukup besar. Tapi bila Anda lunasi, maka Anda akan kesulitan dana untuk menutupi biaya bulanan dan akhirnya anda terpaksa untuk berutang lagi. Maka, ketika Anda ingin mengambil utang, selalu tanya diri anda: Apakah anda siap membayar cicilannya? Siap dengan bunga dan denda dari utangnya? Jangan sampai, kejadian-kejadian karena terbebani oleh utang seperti didatangi debt collector, kehilangan aset, dan sampai dengan kehilangan harapan terjadi kepada Anda.Tidak Punya Tujuan KeuanganSetiap tujuan keuangan pastinya membutuhkan sejumlah dana untuk diwujudkan. Makanya, bila seseorang memiliki tujuan keuangan, orang tersebut akan bersemangat untuk berhemat. Contohnya, bila seseorang ingin memiliki gadget baru, maka dia akan memiliki kemauan untuk menabung dan mengumpulkan uang demi mencapai tujuannya tersebut.Berbeda dengan orang yang tidak (atau belum) memiliki tujuan keuangan. Orang yang seperti ini biasanya tidak memiliki motivasi dalam mengumpulkan uang, apalagi berinvestasi. Sehingga uang yang telah dikumpulkan akan habis begitu saja untuk sesuatu yang sifatnya konsumtif.Oleh karenanya, penting bagi anda untuk memiliki tujuan keuangan. Karena bisa jadi, anda bisa mengelola keuangan bulanan, dan juga anda bisa menolak untuk mengambil utang yang sifatnya konsumtif tetapi kondisi keuangan anda masih berantakan hanya karena anda tidak memiliki tujuan keuangan.Namun demikian, membuat sebuah tujuan keuangan tidak sesederhana memimpikannya saja. Setelah anda menentukan apa tujuan keuangan anda, anda perlu persiapan, rencana dan anda juga perlu sebuah strategi untuk mencapai semua tujuan keuangan anda.Baca juga: 4 Hal yang Membuat Keuangan Bulanan Berantakan (2)Strategi itu bisa dipelajari dan dipersiapkan melalui pembahasan d kelas atau workshop yang dilaksanakan oleh tim IARFC Indonesia atau tim AAM & Associates.Di Jakarta dibuka workshop sehari tentang bagaimana cara Mengelola Gaji dan Mengatur Uang bulanan dan Belajar dan Teknik Menjadi Kaya Raya dan juga workshop sehari tentang Reksadana. Ada juga workshop khusus tentang Asuransi membahas Keuntungan dan Kerugian dari Unitlink yang sudah anda beli. Karena banyak permintaan, dibuka lagi workshop Komunikasi yang memukau lawan bicara anda (menghipnotis), cocok untuk anda orang sales & marketing, untuk komunikasi ke pasangan, anak, boss, anak buah, ke siapapun, info.Untuk ilmu yang lebih lengkap lagi, anda bisa belajar tentang perencanaan keuangan komplit, bahkan bisa jadi konsultannya dengan sertifikat Internasional bisa ikutan workshop Basic Financial Planning dan workshop Intermediate dan Advance Financial Planning di Pertengahan Info lainnya bisa dilihat di www.IARFCIndonesia.com (jangan lupa tanyakan DISKON paket)Anda bisa diskusi tanya jawab dengan cara bergabung di akun telegram group kami ""Seputar Keuangan"" atau klik di sini.Ingat, Tanpa sebuah persiapan matang, tanpa adanya rencana, dan tanpa memikirkan strategi yang bisa mengurangi risiko serta menampung semua peluang, tentunya mencapai tujuan keuangan yang anda impi-impikan hanya akan menjadi sebuah mimpi saja, bukan?Chao!Baca juga: Beli Rumah Nanti dengan Harga Sekarang (1)Disclaimer: artikel ini merupakan kiriman dari mitra yang bekerja sama dengan detikcom. Redaksi detikcom tidak bertanggung jawab atas isi artikel yang dikirim oleh mitra. Tanggung jawab sepenuhnya ada di penulis artikel. (ang/ang) aidil akbar tips keuangan","4 Hal yang Membuat Keuangan Bulanan Berantakan (3)"
"dict","finance","Jakarta - Menteri Koordinator Bidang Kemaritiman Luhut Binsar Pandjaitan dan Menteri Perhubungan Budi Karya Sumadi menilai harga tiket masih mahal. Pada pertemuan keduanya dengan Persatuan Hotel Republik Indonesia (PHRI) mereka sepakat menyebutkan bahwa maskapai masih belum menurunkan tarifnya.Dalam notulensi rapat yang beredar di kalangan media, terungkap bahwa Luhut sangat menyesali harga tiket pesawat yang tidak pernah turun. Padahal pemerintah sudah sering menyampaikan imbauan kepada operator, dalam hal ini maskapai.Salah satu yang ditekankan dalam pertemuan tersebut adalah instruksi kepada Garuda Indonesia sebagia leading airline untuk menurunkan tarifnya. Lalu bagaimana respon Garuda? Simak informasi yang dirangkum detikFinance klik halaman berikutnya. (ang/ang) Sebelumnya Tiket Pesawat Masih Mahal Lho, Pak Menhub 1 / 4 Selanjutnya Bos Garuda: Itu Ranah Korporasi","Luhut Minta Harga Tiket Turun, Apa Kata Maskapai?"
"dict","sport","Jakarta - Krzysztof Piatek langsung nyetel dengan AC Milan. Striker Polandia itu menjadi solusi Rossoneri untuk penyerang yang tajam.Piatek sudah membukukan enam gol dalam delapan pertandingan bersama Milan. Kedatangannya langsung menyingkirkan Gonzalo Higuain dari pos lini depan tim Merah-Hitam.Dengan catatan itu, Piatek sudah menjadi pencetak gol terbanyak kedua Milan di Liga Italia. Dia masih kalah dari Patrick Cutrone yang sudah membukukan sembilan gol. googletag.cmd.push(function() { googletag.display('div-gpt-ad-1535945694694-0'); }); Baca juga: 'Paqueta Bukan Kaka Baru'Kendati tajam, Piatek disebut tak sesuai dengan profil striker legendaris Milan seperti Andriy Shevchenko dan Filippo Inzaghi. Eks pemain Milan, Manuel Rui Costa, yang bilang itu. ""Piatek bukan Sheva atau yang lainnya, tapi dia membawa solusi berbeda di lini serang Milan dan menyelesaikan banyak masalah,"" kata Rui Costa di Football Italia.""Saya beruntung untuk bermain dengan para striker hebat dan saya bisa bilang bajwa bermain dengan mereka bisa menenangkan.""""Anda tahu bahwa dalam Sheva, Kaka, atau Inzaghi, anda mempunyai rekan setim yang capat atau lambat akan memastikan kemenangan karena salah satu dari mereka akan mencetak gol,"" dia menambahkan.Baca juga: Bisa Langsung Bikin Gol di Derby Milan, Piatek? (cas/fem) krzysztof piatek ac milan rui costa","Rui Costa: Piatek Solusi Milan untuk Striker Tajam"
