"_type","category","isi","judul"
"dict","hot","Jakarta - Lucinta Luna kembali menghebohkan publik. Kali ini beredar pengakuan pria yang diakui sebagai suaminya, Bigham, soal masa lalu Lucinta.Lucinta mengaku telah dengan Bigham, pria asal Filipina, belum lama ini. Bigham bahkan mengaku telah mengetahui sosok asli istrinya yang shemale. Shemale istilah populer untuk waria.Bigham mengatakan kalau Lucinta Luna dulunya seorang shemale. Namun saat ini, Lucinta disebut sudah berubah jadi wanita sepenuhnya.Baca juga: Setelah Diakui Shemale, Aktivitas Ranjang Lucinta Digunjingkan Teman Dekat""Aku nanya dia beneran mau nikah sama Lucinta Luna, kan dia cowok dan dia jawab ini,"" buka Clara dalam akun Twitternya. googletag.cmd.push(function() { googletag.display('div-gpt-ad-1535944650921-0'); }); ""But you know she man before?"" tanya Clara.""Yes i know she's a shemale before, She's girl now,"" jawab Bigham yang sukses mengejutkan netizen.Pernikahan Lucinta Luna sendiri banyak dipenuhi tanda tanya. Sebab, dia tak pernah menunjukkan foto buku nikah dan prosesi ijab kabul.Namun sahabatnya, Barbie Kumalasari, mengatakan pernikahan Lucinta Luna benar terjadi. Dia mengaku diundang oleh Lucinta untuk datang ke sebuah hotel berbintang.Baca juga: Barbie Kumalasari Pastikan Pernikahan Lucinta Luna Betulan""Beneran menikah. Kemarin itu aku kan diundang, aku nggak tahu kalau dia married, karena kan biasalah Lucinta Luna itu penuh dengan kejutan-kejutan, jadi dia cuma bilang 'kakak ke sini dong, aku lagi di Royal Kuningan Hotel',"" kata Barbie Kumalasari usia 'Brownis' Trans TV, Gedung Trans TV, Jalan Mampang Prapatan, Jakarta Selatan, Senin (25/3/2019).Video: Lucinta Luna: Ngaku Hamil, Nikah hingga Diakui ''Shemale''[Gambas:Video 20detik]Barbie juga mengatakan Lucinta Luna adalah wanita sepenuhnya. Dia sudah melihat 'dalamannya' Lucinta.Lucinta Luna mulai muncul di dunia hiburan setelah foto mesra dengan Mike Lewis. Dikira wanita seksi, ternyata dia seorang transgender yang dulunya pria bernama Muhammad Fattah. (mau/ken) lucinta luna lucinta luna dulunya pria lucinta luna dan suami filipina lucinta luna before lucinta luna asli Photo Gallery 1 celeb Disebut Shemale oleh 'Suami', Ini Foto Jadul Lucinta Luna celeb Disebut Shemale oleh 'Suami', Ini Foto Jadul Lucinta Luna celeb Disebut Shemale oleh 'Suami', Ini Foto Jadul Lucinta Luna celeb Disebut Shemale oleh 'Suami', Ini Foto Jadul Lucinta Luna celeb Disebut Shemale oleh 'Suami', Ini Foto Jadul Lucinta Luna celeb Disebut Shemale oleh 'Suami', Ini Foto Jadul Lucinta Luna celeb Disebut Shemale oleh 'Suami', Ini Foto Jadul Lucinta Luna 1 celeb Komentar Lucu Netizen saat Lihat Video Lucinta Luna Jadi Pengantin celeb Komentar Lucu Netizen saat Lihat Video Lucinta Luna Jadi Pengantin celeb Komentar Lucu Netizen saat Lihat Video Lucinta Luna Jadi Pengantin celeb Komentar Lucu Netizen saat Lihat Video Lucinta Luna Jadi Pengantin celeb Komentar Lucu Netizen saat Lihat Video Lucinta Luna Jadi Pengantin celeb Komentar Lucu Netizen saat Lihat Video Lucinta Luna Jadi Pengantin 2 celeb Melihat Lagi Gaya Lucinta Luna saat Masih Jadi Muhammad Fatah celeb Melihat Lagi Gaya Lucinta Luna saat Masih Jadi Muhammad Fatah celeb Melihat Lagi Gaya Lucinta Luna saat Masih Jadi Muhammad Fatah celeb Melihat Lagi Gaya Lucinta Luna saat Masih Jadi Muhammad Fatah celeb Melihat Lagi Gaya Lucinta Luna saat Masih Jadi Muhammad Fatah celeb Melihat Lagi Gaya Lucinta Luna saat Masih Jadi Muhammad Fatah celeb Melihat Lagi Gaya Lucinta Luna saat Masih Jadi Muhammad Fatah celeb Melihat Lagi Gaya Lucinta Luna saat Masih Jadi Muhammad Fatah celeb Melihat Lagi Gaya Lucinta Luna saat Masih Jadi Muhammad Fatah 3 celeb Ini Levana yang Disebut Mirip Lucinta Luna celeb Ini Levana yang Disebut Mirip Lucinta Luna celeb Ini Levana yang Disebut Mirip Lucinta Luna celeb Ini Levana yang Disebut Mirip Lucinta Luna celeb Ini Levana yang Disebut Mirip Lucinta Luna celeb Ini Levana yang Disebut Mirip Lucinta Luna celeb Ini Levana yang Disebut Mirip Lucinta Luna 4 celeb Lucinta Luna, Kok Tangannya di Dagu Terus? celeb Lucinta Luna, Kok Tangannya di Dagu Terus? celeb Lucinta Luna, Kok Tangannya di Dagu Terus? celeb Lucinta Luna, Kok Tangannya di Dagu Terus? celeb Lucinta Luna, Kok Tangannya di Dagu Terus? celeb Lucinta Luna, Kok Tangannya di Dagu Terus? 5 celeb Makin Di-Bully Lucinta Luna Tambah Tajir? celeb Makin Di-Bully Lucinta Luna Tambah Tajir? celeb Makin Di-Bully Lucinta Luna Tambah Tajir? celeb Makin Di-Bully Lucinta Luna Tambah Tajir? celeb Makin Di-Bully Lucinta Luna Tambah Tajir? celeb Makin Di-Bully Lucinta Luna Tambah Tajir? celeb Makin Di-Bully Lucinta Luna Tambah Tajir? celeb Makin Di-Bully Lucinta Luna Tambah Tajir? celeb Makin Di-Bully Lucinta Luna Tambah Tajir? celeb Makin Di-Bully Lucinta Luna Tambah Tajir? 6 celeb Geger Lucinta, DJ Butterfly Bantah Dirinya Juga Transgender celeb Geger Lucinta, DJ Butterfly Bantah Dirinya Juga Transgender celeb Geger Lucinta, DJ Butterfly Bantah Dirinya Juga Transgender celeb Geger Lucinta, DJ Butterfly Bantah Dirinya Juga Transgender celeb Geger Lucinta, DJ Butterfly Bantah Dirinya Juga Transgender celeb Geger Lucinta, DJ Butterfly Bantah Dirinya Juga Transgender celeb Geger Lucinta, DJ Butterfly Bantah Dirinya Juga Transgender celeb Geger Lucinta, DJ Butterfly Bantah Dirinya Juga Transgender celeb Geger Lucinta, DJ Butterfly Bantah Dirinya Juga Transgender 7 celeb Soal Lucinta Luna, Melly Bradley Sebut Komunitas Waria Bakal Turun Tangan celeb Soal Lucinta Luna, Melly Bradley Sebut Komunitas Waria Bakal Turun Tangan celeb Soal Lucinta Luna, Melly Bradley Sebut Komunitas Waria Bakal Turun Tangan celeb Soal Lucinta Luna, Melly Bradley Sebut Komunitas Waria Bakal Turun Tangan celeb Soal Lucinta Luna, Melly Bradley Sebut Komunitas Waria Bakal Turun Tangan celeb Soal Lucinta Luna, Melly Bradley Sebut Komunitas Waria Bakal Turun Tangan 8 celeb Deretan Aktor yang Lengket dengan Lucinta Luna, Tyas Mirasih Datangi Polda celeb Deretan Aktor yang Lengket dengan Lucinta Luna, Tyas Mirasih Datangi Polda celeb Deretan Aktor yang Lengket dengan Lucinta Luna, Tyas Mirasih Datangi Polda celeb Deretan Aktor yang Lengket dengan Lucinta Luna, Tyas Mirasih Datangi Polda celeb Deretan Aktor yang Lengket dengan Lucinta Luna, Tyas Mirasih Datangi Polda celeb Deretan Aktor yang Lengket dengan Lucinta Luna, Tyas Mirasih Datangi Polda celeb Deretan Aktor yang Lengket dengan Lucinta Luna, Tyas Mirasih Datangi Polda celeb Deretan Aktor yang Lengket dengan Lucinta Luna, Tyas Mirasih Datangi Polda 9 celeb Sederet Aktor Tampan yang Kepergok Lengket dengan Lucinta Luna celeb Sederet Aktor Tampan yang Kepergok Lengket dengan Lucinta Luna celeb Sederet Aktor Tampan yang Kepergok Lengket dengan Lucinta Luna celeb Sederet Aktor Tampan yang Kepergok Lengket dengan Lucinta Luna celeb Sederet Aktor Tampan yang Kepergok Lengket dengan Lucinta Luna celeb Sederet Aktor Tampan yang Kepergok Lengket dengan Lucinta Luna celeb Sederet Aktor Tampan yang Kepergok Lengket dengan Lucinta Luna celeb Sederet Aktor Tampan yang Kepergok Lengket dengan Lucinta Luna 10 celeb Melly, Transgender yang Bongkar Lucinta Luna Ternyata M. Fatah celeb Melly, Transgender yang Bongkar Lucinta Luna Ternyata M. Fatah celeb Melly, Transgender yang Bongkar Lucinta Luna Ternyata M. Fatah celeb Melly, Transgender yang Bongkar Lucinta Luna Ternyata M. Fatah celeb Melly, Transgender yang Bongkar Lucinta Luna Ternyata M. Fatah celeb Melly, Transgender yang Bongkar Lucinta Luna Ternyata M. Fatah celeb Melly, Transgender yang Bongkar Lucinta Luna Ternyata M. Fatah celeb Melly, Transgender yang Bongkar Lucinta Luna Ternyata M. Fatah celeb Melly, Transgender yang Bongkar Lucinta Luna Ternyata M. Fatah celeb Melly, Transgender yang Bongkar Lucinta Luna Ternyata M. Fatah 11 celeb Jennifer Dunn, Kalina Oktarani, hingga Meriahnya Ultah Dian Sastro celeb Jennifer Dunn, Kalina Oktarani, hingga Meriahnya Ultah Dian Sastro celeb Jennifer Dunn, Kalina Oktarani, hingga Meriahnya Ultah Dian Sastro celeb Jennifer Dunn, Kalina Oktarani, hingga Meriahnya Ultah Dian Sastro celeb Jennifer Dunn, Kalina Oktarani, hingga Meriahnya Ultah Dian Sastro celeb Jennifer Dunn, Kalina Oktarani, hingga Meriahnya Ultah Dian Sastro celeb Jennifer Dunn, Kalina Oktarani, hingga Meriahnya Ultah Dian Sastro celeb Jennifer Dunn, Kalina Oktarani, hingga Meriahnya Ultah Dian Sastro celeb Jennifer Dunn, Kalina Oktarani, hingga Meriahnya Ultah Dian Sastro celeb Jennifer Dunn, Kalina Oktarani, hingga Meriahnya Ultah Dian Sastro celeb Jennifer Dunn, Kalina Oktarani, hingga Meriahnya Ultah Dian Sastro celeb Jennifer Dunn, Kalina Oktarani, hingga Meriahnya Ultah Dian Sastro 12 celeb Masa Lalunya Makin Terungkap, Ini Transformasi Lucinta Luna celeb Masa Lalunya Makin Terungkap, Ini Transformasi Lucinta Luna celeb Masa Lalunya Makin Terungkap, Ini Transformasi Lucinta Luna celeb Masa Lalunya Makin Terungkap, Ini Transformasi Lucinta Luna celeb Masa Lalunya Makin Terungkap, Ini Transformasi Lucinta Luna celeb Masa Lalunya Makin Terungkap, Ini Transformasi Lucinta Luna celeb Masa Lalunya Makin Terungkap, Ini Transformasi Lucinta Luna celeb Masa Lalunya Makin Terungkap, Ini Transformasi Lucinta Luna celeb Masa Lalunya Makin Terungkap, Ini Transformasi Lucinta Luna celeb Masa Lalunya Makin Terungkap, Ini Transformasi Lucinta Luna 13 celeb Mike Lewis Doakan Lucinta Luna Sukses, Terkabul? celeb Mike Lewis Doakan Lucinta Luna Sukses, Terkabul? celeb Mike Lewis Doakan Lucinta Luna Sukses, Terkabul? celeb Mike Lewis Doakan Lucinta Luna Sukses, Terkabul? celeb Mike Lewis Doakan Lucinta Luna Sukses, Terkabul? celeb Mike Lewis Doakan Lucinta Luna Sukses, Terkabul? celeb Mike Lewis Doakan Lucinta Luna Sukses, Terkabul? celeb Mike Lewis Doakan Lucinta Luna Sukses, Terkabul? celeb Mike Lewis Doakan Lucinta Luna Sukses, Terkabul? celeb Mike Lewis Doakan Lucinta Luna Sukses, Terkabul? celeb Mike Lewis Doakan Lucinta Luna Sukses, Terkabul? 14 celeb Kemesraan Awkarin dengan Anak Wakil Ketua MPR, Lucinta Luna Pamer Body Seksi celeb Kemesraan Awkarin dengan Anak Wakil Ketua MPR, Lucinta Luna Pamer Body Seksi celeb Kemesraan Awkarin dengan Anak Wakil Ketua MPR, Lucinta Luna Pamer Body Seksi celeb Kemesraan Awkarin dengan Anak Wakil Ketua MPR, Lucinta Luna Pamer Body Seksi celeb Kemesraan Awkarin dengan Anak Wakil Ketua MPR, Lucinta Luna Pamer Body Seksi celeb Kemesraan Awkarin dengan Anak Wakil Ketua MPR, Lucinta Luna Pamer Body Seksi celeb Kemesraan Awkarin dengan Anak Wakil Ketua MPR, Lucinta Luna Pamer Body Seksi celeb Kemesraan Awkarin dengan Anak Wakil Ketua MPR, Lucinta Luna Pamer Body Seksi celeb Kemesraan Awkarin dengan Anak Wakil Ketua MPR, Lucinta Luna Pamer Body Seksi 15 celeb Ngaku Cewek Asli, Lucinta Luna Pamer Body Seksi celeb Ngaku Cewek Asli, Lucinta Luna Pamer Body Seksi celeb Ngaku Cewek Asli, Lucinta Luna Pamer Body Seksi celeb Ngaku Cewek Asli, Lucinta Luna Pamer Body Seksi celeb Ngaku Cewek Asli, Lucinta Luna Pamer Body Seksi 16 celeb Pose 'Nyender Manja' Lucinta Luna celeb Pose 'Nyender Manja' Lucinta Luna celeb Pose 'Nyender Manja' Lucinta Luna celeb Pose 'Nyender Manja' Lucinta Luna celeb Pose 'Nyender Manja' Lucinta Luna celeb Pose 'Nyender Manja' Lucinta Luna celeb Pose 'Nyender Manja' Lucinta Luna 17 celeb Bantah Disebut Transgender, Ini Foto Dulu Lucinta Luna di 'Be a Man' celeb Bantah Disebut Transgender, Ini Foto Dulu Lucinta Luna di 'Be a Man' celeb Bantah Disebut Transgender, Ini Foto Dulu Lucinta Luna di 'Be a Man' celeb Bantah Disebut Transgender, Ini Foto Dulu Lucinta Luna di 'Be a Man' celeb Bantah Disebut Transgender, Ini Foto Dulu Lucinta Luna di 'Be a Man' celeb Bantah Disebut Transgender, Ini Foto Dulu Lucinta Luna di 'Be a Man' celeb Bantah Disebut Transgender, Ini Foto Dulu Lucinta Luna di 'Be a Man' celeb Bantah Disebut Transgender, Ini Foto Dulu Lucinta Luna di 'Be a Man' celeb Bantah Disebut Transgender, Ini Foto Dulu Lucinta Luna di 'Be a Man' 18 1","Lucinta Luna dan Pengakuan 'Shemale' dari Suaminya"
"dict","finance","Jakarta - Bandara Kulon Progo/New Yogyakarta International Airport (NYIA) beroperasi pada April 2019. Bandara tersebut melayani penerbangan internasional yang dialihkan dari Bandara Internasional Adisutjipto. Nantinya, Bandara Adisutjipto hanya akan melayani penerbangan domestik. Sedangkan Bandara Kulon Progo akan melayani penerbangan internasional.Direktur Utama PT Angkasa Pura I (Persero) Faik Fahmi mengatakan, jika pembangunan Bandara Kulon Progo sudah selesai 100% tahun ini, maka semua penerbangan akan pindah ke sana. Sedangkan Bandara Adisutjipto akan tetap beroperasi melayani penerbangan jarak pendek. Baca juga: Melihat Kesiapan Operasi Bandara Kulon Progo""Jadi misalnya kan sekarang ada rute Kertajati dari atau mungkin dari Bandung dari Cirebon, dari kota-kota yang terdekat yang menggunakan pesawat propeller, jadi dua sisi tetap kita layani,"" kata Faik kepada detikFinance di kantornya, Kemayoran, Jakarta seperti ditulis Rabu (27/3/2019).""Tapi untuk yang domestik secara keseluruhan yang menggunakan pesawat Boeing itu semuanya nanti kita operasikan di Kulon Progo,"" tambahnya.Meski demikian, dalam waktu dekat ini Bandara Adisutjipto masih akan melayani penerbangan domestik dan kapasitasnya bisa ditambah karena penerbangan internasional dialihkan melalui Bandara Kulon Progo. Jumlah penerbangan domestik di Bandara Adisutjipto juga bisa ditambah saat mudik Lebaran mendatang.Baca juga: Beroperasi April 2019, Bandara Kulon Progo Baru Kelar Sebagian""Jadi harapannya kalau internasional nggak ada jadi kapasitas di Adisutjipto itu bisa dimanfaatkan untuk yang domestik,"" tutur Faik.Pembangunan dan pengoperasian Bandara Kulon Progo bukan tanpa soal, pasalnya penumpang Bandara Adisutjipto sudah melebihi kapasitas seharusnya dari 1,3 juta kini harus melayani 8 juta penumpang per tahunnya.Tonton juga video Target Kelar April, Bandara Kulon Progo Dikebut Ala Bandung Bondowoso:[Gambas:Video 20detik] (ara/zlf) bandara kulon progo bandara kulon progo bandara adisutjipto","Nasib Adisutjipto Setelah Bandara Kulon Progo Beroperasi"
"dict","hot","Jakarta - Deddy Corbuzier sempat memposting foto yang menghebohkan netizen. Presenter berkepala plontos itu mengangkat sebuah mobil Mini Cooper.Netizen pun langsung tercengang melihat foto Deddy tersebut. Mereka tak percaya ayahanda Azka Corbuzier itu bisa mengangkat mobil Mini Cooper.""Ga mgkin!!!"" kata Ria Ricis. googletag.cmd.push(function() { googletag.display('div-gpt-ad-1535944650921-0'); }); ""Waduuuuu,"" timpal Atta Halilintar.""Kuat Amirr,"" sahut akun @tungdesemwaringi**tdw.Baca juga: Deddy Corbuzier Berencana Nikah, Kalina Doakan yang TerbaikNamun ternyata foto itu hanya editan saja. Hal tersebut diketahui dari konten di channel YouTube Deddy Corbuzier.Deddy diminta cameraman-nya untuk pura-pura mengangat mobil Mini Cooper saja. Tak lupa dia juga diminta untuk berekspresi sekeren mungkin.""Ini buat thumbnail, om. Angkat Mini Cooper,"" kata cameraman itu dalam video.""Luar biasa gitu dong pintar,"" timpal Deddy Corbuzier.[Gambas:Instagram] (mau/ken) deddy corbuzier mobil mini cooper instagram youtube presenter Photo Gallery 1 celeb Sempat Bikin Heboh, Kok Ussy Sulistiawaty Nggak Pamer Ketiak Lagi? celeb Sempat Bikin Heboh, Kok Ussy Sulistiawaty Nggak Pamer Ketiak Lagi? celeb Sempat Bikin Heboh, Kok Ussy Sulistiawaty Nggak Pamer Ketiak Lagi? celeb Sempat Bikin Heboh, Kok Ussy Sulistiawaty Nggak Pamer Ketiak Lagi? celeb Sempat Bikin Heboh, Kok Ussy Sulistiawaty Nggak Pamer Ketiak Lagi? celeb Sempat Bikin Heboh, Kok Ussy Sulistiawaty Nggak Pamer Ketiak Lagi? 1 on-stage Kolaborasi Marion Jola dan Near di Album 'Karna Su Sayang' on-stage Kolaborasi Marion Jola dan Near di Album 'Karna Su Sayang' on-stage Kolaborasi Marion Jola dan Near di Album 'Karna Su Sayang' on-stage Kolaborasi Marion Jola dan Near di Album 'Karna Su Sayang' on-stage Kolaborasi Marion Jola dan Near di Album 'Karna Su Sayang' on-stage Kolaborasi Marion Jola dan Near di Album 'Karna Su Sayang' 2 kpop Ini Angelababy, Aktris Cantik yang Diprotes Netizen saat Wakili Cina kpop Ini Angelababy, Aktris Cantik yang Diprotes Netizen saat Wakili Cina kpop Ini Angelababy, Aktris Cantik yang Diprotes Netizen saat Wakili Cina kpop Ini Angelababy, Aktris Cantik yang Diprotes Netizen saat Wakili Cina kpop Ini Angelababy, Aktris Cantik yang Diprotes Netizen saat Wakili Cina kpop Ini Angelababy, Aktris Cantik yang Diprotes Netizen saat Wakili Cina kpop Ini Angelababy, Aktris Cantik yang Diprotes Netizen saat Wakili Cina 3 celeb Komentar Lucu Netizen saat Lihat Video Lucinta Luna Jadi Pengantin celeb Komentar Lucu Netizen saat Lihat Video Lucinta Luna Jadi Pengantin celeb Komentar Lucu Netizen saat Lihat Video Lucinta Luna Jadi Pengantin celeb Komentar Lucu Netizen saat Lihat Video Lucinta Luna Jadi Pengantin celeb Komentar Lucu Netizen saat Lihat Video Lucinta Luna Jadi Pengantin celeb Komentar Lucu Netizen saat Lihat Video Lucinta Luna Jadi Pengantin 4 celeb Ini Deretan Selebriti yang Pamer Ketiak Sebelum Ussy Sulistiawaty celeb Ini Deretan Selebriti yang Pamer Ketiak Sebelum Ussy Sulistiawaty celeb Ini Deretan Selebriti yang Pamer Ketiak Sebelum Ussy Sulistiawaty celeb Ini Deretan Selebriti yang Pamer Ketiak Sebelum Ussy Sulistiawaty celeb Ini Deretan Selebriti yang Pamer Ketiak Sebelum Ussy Sulistiawaty celeb Ini Deretan Selebriti yang Pamer Ketiak Sebelum Ussy Sulistiawaty celeb Ini Deretan Selebriti yang Pamer Ketiak Sebelum Ussy Sulistiawaty celeb Ini Deretan Selebriti yang Pamer Ketiak Sebelum Ussy Sulistiawaty 5 celeb Raffi Ahmad Reunian dengan Luna Maya celeb Raffi Ahmad Reunian dengan Luna Maya celeb Raffi Ahmad Reunian dengan Luna Maya celeb Raffi Ahmad Reunian dengan Luna Maya celeb Raffi Ahmad Reunian dengan Luna Maya celeb Raffi Ahmad Reunian dengan Luna Maya 6 celeb Sukses Jadi YouTuber, Baim Wong Balik ke Film celeb Sukses Jadi YouTuber, Baim Wong Balik ke Film celeb Sukses Jadi YouTuber, Baim Wong Balik ke Film celeb Sukses Jadi YouTuber, Baim Wong Balik ke Film celeb Sukses Jadi YouTuber, Baim Wong Balik ke Film celeb Sukses Jadi YouTuber, Baim Wong Balik ke Film 7 celeb Ariana Grande, Sang Ratu Instagram celeb Ariana Grande, Sang Ratu Instagram celeb Ariana Grande, Sang Ratu Instagram celeb Ariana Grande, Sang Ratu Instagram celeb Ariana Grande, Sang Ratu Instagram celeb Ariana Grande, Sang Ratu Instagram celeb Ariana Grande, Sang Ratu Instagram 8 celeb Ingin Lebih Dekat dengan Tuhan, Cita-cita Augie Fantinus Usai Bebas celeb Ingin Lebih Dekat dengan Tuhan, Cita-cita Augie Fantinus Usai Bebas celeb Ingin Lebih Dekat dengan Tuhan, Cita-cita Augie Fantinus Usai Bebas celeb Ingin Lebih Dekat dengan Tuhan, Cita-cita Augie Fantinus Usai Bebas celeb Ingin Lebih Dekat dengan Tuhan, Cita-cita Augie Fantinus Usai Bebas celeb Ingin Lebih Dekat dengan Tuhan, Cita-cita Augie Fantinus Usai Bebas celeb Ingin Lebih Dekat dengan Tuhan, Cita-cita Augie Fantinus Usai Bebas celeb Ingin Lebih Dekat dengan Tuhan, Cita-cita Augie Fantinus Usai Bebas 9 celeb Teman Sejati! Persahabatan Denny Cagur dan Raffi Ahmad celeb Teman Sejati! Persahabatan Denny Cagur dan Raffi Ahmad celeb Teman Sejati! Persahabatan Denny Cagur dan Raffi Ahmad celeb Teman Sejati! Persahabatan Denny Cagur dan Raffi Ahmad celeb Teman Sejati! Persahabatan Denny Cagur dan Raffi Ahmad celeb Teman Sejati! Persahabatan Denny Cagur dan Raffi Ahmad celeb Teman Sejati! Persahabatan Denny Cagur dan Raffi Ahmad 10 celeb Sandra Olga, Pernah Viral hingga Nikah Diam-diam celeb Sandra Olga, Pernah Viral hingga Nikah Diam-diam celeb Sandra Olga, Pernah Viral hingga Nikah Diam-diam celeb Sandra Olga, Pernah Viral hingga Nikah Diam-diam celeb Sandra Olga, Pernah Viral hingga Nikah Diam-diam celeb Sandra Olga, Pernah Viral hingga Nikah Diam-diam celeb Sandra Olga, Pernah Viral hingga Nikah Diam-diam 11 celeb Yanet Garcia, Presenter Paling Seksi di Tahun 2018 celeb Yanet Garcia, Presenter Paling Seksi di Tahun 2018 celeb Yanet Garcia, Presenter Paling Seksi di Tahun 2018 celeb Yanet Garcia, Presenter Paling Seksi di Tahun 2018 celeb Yanet Garcia, Presenter Paling Seksi di Tahun 2018 celeb Yanet Garcia, Presenter Paling Seksi di Tahun 2018 celeb Yanet Garcia, Presenter Paling Seksi di Tahun 2018 12 celeb Raditya Dika dan Deddy Corbuzier Hidup Minimalis, Tiru Chow Yun Fat? celeb Raditya Dika dan Deddy Corbuzier Hidup Minimalis, Tiru Chow Yun Fat? celeb Raditya Dika dan Deddy Corbuzier Hidup Minimalis, Tiru Chow Yun Fat? celeb Raditya Dika dan Deddy Corbuzier Hidup Minimalis, Tiru Chow Yun Fat? celeb Raditya Dika dan Deddy Corbuzier Hidup Minimalis, Tiru Chow Yun Fat? celeb Raditya Dika dan Deddy Corbuzier Hidup Minimalis, Tiru Chow Yun Fat? celeb Raditya Dika dan Deddy Corbuzier Hidup Minimalis, Tiru Chow Yun Fat? celeb Raditya Dika dan Deddy Corbuzier Hidup Minimalis, Tiru Chow Yun Fat? celeb Raditya Dika dan Deddy Corbuzier Hidup Minimalis, Tiru Chow Yun Fat? celeb Raditya Dika dan Deddy Corbuzier Hidup Minimalis, Tiru Chow Yun Fat? 13 celeb Duga Rekayasa, Artis ini Benci Penggerebekan Vicky ke Angel Lelga celeb Duga Rekayasa, Artis ini Benci Penggerebekan Vicky ke Angel Lelga celeb Duga Rekayasa, Artis ini Benci Penggerebekan Vicky ke Angel Lelga celeb Duga Rekayasa, Artis ini Benci Penggerebekan Vicky ke Angel Lelga celeb Duga Rekayasa, Artis ini Benci Penggerebekan Vicky ke Angel Lelga celeb Duga Rekayasa, Artis ini Benci Penggerebekan Vicky ke Angel Lelga 14 celeb Cristiano Ronaldo Lengserkan Tahta Selena Gomez di Instagram celeb Cristiano Ronaldo Lengserkan Tahta Selena Gomez di Instagram celeb Cristiano Ronaldo Lengserkan Tahta Selena Gomez di Instagram celeb Cristiano Ronaldo Lengserkan Tahta Selena Gomez di Instagram celeb Cristiano Ronaldo Lengserkan Tahta Selena Gomez di Instagram celeb Cristiano Ronaldo Lengserkan Tahta Selena Gomez di Instagram celeb Cristiano Ronaldo Lengserkan Tahta Selena Gomez di Instagram celeb Cristiano Ronaldo Lengserkan Tahta Selena Gomez di Instagram 15 celeb Duh, Yanet Garcia si Presenter Tercantik di Dunia Lagi Patah Hati celeb Duh, Yanet Garcia si Presenter Tercantik di Dunia Lagi Patah Hati celeb Duh, Yanet Garcia si Presenter Tercantik di Dunia Lagi Patah Hati celeb Duh, Yanet Garcia si Presenter Tercantik di Dunia Lagi Patah Hati celeb Duh, Yanet Garcia si Presenter Tercantik di Dunia Lagi Patah Hati celeb Duh, Yanet Garcia si Presenter Tercantik di Dunia Lagi Patah Hati celeb Duh, Yanet Garcia si Presenter Tercantik di Dunia Lagi Patah Hati celeb Duh, Yanet Garcia si Presenter Tercantik di Dunia Lagi Patah Hati 16 celeb Ini Sabrina Chairunnisa, Kekasih Deddy Corbuzier celeb Ini Sabrina Chairunnisa, Kekasih Deddy Corbuzier celeb Ini Sabrina Chairunnisa, Kekasih Deddy Corbuzier celeb Ini Sabrina Chairunnisa, Kekasih Deddy Corbuzier celeb Ini Sabrina Chairunnisa, Kekasih Deddy Corbuzier celeb Ini Sabrina Chairunnisa, Kekasih Deddy Corbuzier celeb Ini Sabrina Chairunnisa, Kekasih Deddy Corbuzier celeb Ini Sabrina Chairunnisa, Kekasih Deddy Corbuzier celeb Ini Sabrina Chairunnisa, Kekasih Deddy Corbuzier 17 celeb Happy Engagement Lolita Agustine dan Kekasih! celeb Happy Engagement Lolita Agustine dan Kekasih! celeb Happy Engagement Lolita Agustine dan Kekasih! celeb Happy Engagement Lolita Agustine dan Kekasih! celeb Happy Engagement Lolita Agustine dan Kekasih! celeb Happy Engagement Lolita Agustine dan Kekasih! celeb Happy Engagement Lolita Agustine dan Kekasih! 18 celeb Krisjiana Baharudin, Teman Dekat Siti Badriah yang 'Lagi Syantik' celeb Krisjiana Baharudin, Teman Dekat Siti Badriah yang 'Lagi Syantik' celeb Krisjiana Baharudin, Teman Dekat Siti Badriah yang 'Lagi Syantik' celeb Krisjiana Baharudin, Teman Dekat Siti Badriah yang 'Lagi Syantik' celeb Krisjiana Baharudin, Teman Dekat Siti Badriah yang 'Lagi Syantik' celeb Krisjiana Baharudin, Teman Dekat Siti Badriah yang 'Lagi Syantik' celeb Krisjiana Baharudin, Teman Dekat Siti Badriah yang 'Lagi Syantik' celeb Krisjiana Baharudin, Teman Dekat Siti Badriah yang 'Lagi Syantik' 19 celeb Selamat! Tasya Kamila Resmi Dilamar Sang Kekasih celeb Selamat! Tasya Kamila Resmi Dilamar Sang Kekasih celeb Selamat! Tasya Kamila Resmi Dilamar Sang Kekasih celeb Selamat! Tasya Kamila Resmi Dilamar Sang Kekasih celeb Selamat! Tasya Kamila Resmi Dilamar Sang Kekasih celeb Selamat! Tasya Kamila Resmi Dilamar Sang Kekasih celeb Selamat! Tasya Kamila Resmi Dilamar Sang Kekasih celeb Selamat! Tasya Kamila Resmi Dilamar Sang Kekasih celeb Selamat! Tasya Kamila Resmi Dilamar Sang Kekasih 20 1","Foto Deddy Corbuzier Angkat Mini Cooper Jadi Heboh, Ternyata Ini Faktanya"
