"_type","category","isi","judul"
"dict","sport","Jakarta - Valentino Rossi tampil gemilang di MotoGP Argentina, dengan merebut podium kedua. Hasil itu membuatnya dijagokan rumah taruhan lagi untuk jadi juara dunia.Rossi merebut podium kedua MotoGP Argentina di Autodromo Termas de Rio Hondo, Senin (1/4/2019) dini hari WIB. Itu membuat Rossi mengakhiri puasa podium sejak MotoGP Jerman 2018.Di Argentina, Rossi tampil gemilang dengan mengalahkan Andrea Dovizioso. Di lap terakhir, pebalap Monster Energy Yamaha itu menyalip sang rival dan mengunci posisi kedua di akhir race, hanya kalah dari rider Repsol Honda Marc Marquez yang keluar menjadi pemenang. googletag.cmd.push(function() { googletag.display('div-gpt-ad-1535945783791-0'); }); Baca juga: Setelah Dua Kali Ditolak, Marquez Senang Akhirnya Disalami RossiPenampilan itu rupanya membuat rumah judi mulai menjagoknnya lagi untuk menjadi juara MotoGP 2019. Dilansir Tuttomotoriweb, The Doctor masuk bursa lagi untuk bersaing dengan Marc Marquez dan Dovizioso.Rumah judi Snai Betting misalnya, menaruh Rossi di koefisien 10 untuk menjadi juara, di bawah Marquez (1.25) dan Dovizioso (6.50).Selain Snai, William-Hill juga menempatkan Rossi di peringkat tiga dengan 13/2, di bawah Marquez (2/9) dan Dovizioso (4/1).Sementara bwin juga menempatkan Rossi di posisi ketiga dengan koefisien 8.00, di bawah Marquez (1.20) dan Dovizioso (5.50).Saat ini Rossi masih di peringkat ketiga klasemen MotoGP 2019 dengan 31 poin, di bawah Marquez (45) dan Dovizioso (41). Selanjutnya, MotoGP akan digelar di Amerika Serikat.Baca juga: Tak Lihat Marquez di MotoGP Argentina, Rossi: Memangnya Dia Ikut Balapan? (yna/mrp) valentino rossi motogp argentina 2019 marc marquez andrea dovizioso motogp 2019","Gemilang di MotoGP Argentina, Rossi Dijagokan Rumah Taruhan Lagi"
"dict","finance","Jakarta - Bisnis fashion sedang banyak dilirik masyarakat. Banyak yang menyebutkan industri ini potensi ekonominya besar di Indonesia.Melihat potensi besar tersebut pasti banyak yang ingin mencoba berbisnis di dunia fashion. Tapi, sebelum itu mari simak Malinda Amalia Co Founder Linean, sebuah perusahaan fashion yang ramah lingkungan, berbagi tips dan trik untuk terjun ke dunia fashion.Pesan pertama dari Malinda bagi yang ingin menggeluti dunia bisnis fashion hal pertama yang mesti dilakukan adalah paham dengan model bisnis. Salah satu caranya adalah dengan berkerja pada bisnis atau perusahaan orang lain terlebih dahulu. googletag.cmd.push(function() { googletag.display('div-gpt-ad-1535944306169-0'); }); ""Kalau menurut aku adalah walaupun nggak tau business model seperti apa coba kalian itu bekerja dulu dengan orang gitu kalian mempelajari dulu bagaimana sih cara atasan ngetreat pegawainya gimana sih cara membangun kantor sendiri perusahaan sendiri,"" kata Malinda kepada detikFinance saat ditemui di sela acara Indonesia Future Fest 2019, di FX Sudirman, Minggu (31/3/2019).Malinda juga menyarankan agar tidak ragu meskipun bekerja di perusahaan kecil yang masih merintis karirnya. Menurutnya justru pengalaman akan lebih banyak muncul di perusahaan tersebut.Baca juga: Tips Sukses Pengusaha Muda Malinda Amalia: Kolaborasi""Nah kalau perusahaan kecil itu kan visi misi mimpinya besar kan lagi menggebu-gebu kalau kita misalnya kerja di perusahaan besar pastinya kita cuma ikuti regulasi yang atas kan kita nggak bisa terlalu involve, ketika kita kerja di start up (kecil) itu banyak banget pengalamannya,"" kata Malinda.""Jadi kalau menurut aku nggak ada salahnya kerja dulu sama orang pelajari bisnis model dari segi FnB, Fashion atau apapun. Kalau ada yang cocok baru kita trial and error gitu ibaratnya,"" tambahnya.Lebih lanjut menurut Malinda apabila sudah mengetahui model bisnis seperti apa, barulah bisa memulai sebuah usaha. Dalam memulai usaha di dunia fashion sendiri Malinda mengatakan untuk tetap cek ombak alias cek pasar saat pertama kali memproduksi barang.Maksudnya, saat pertama kali melakukan produksi Malinda menyarankan jangan terlalu banyak kuantitasnya. Hal tersebut dilakukan agar produksi bisa berjalan dengan fleksibel tanpa menunggu produk yang pertama dibuat habis.Baca juga: Ide Cemerlang Pengusaha Belia Bikin Fashion Ramah Lingkungan""Di awal itu kuantitas nggak usah terlalu banyak dulu agar fleksibel dan mudah move on ke hal lain. Gitu makanya Linean terus jalan karena kita evaluasi terus dan kulik lagi (setiap melakukan produksi),"" ungkap Malinda.Malinda mencontohkan apa yang terjadi pada bisnisnya, dalam perusahaannya saat dia memulai Linean. Dia hanya memproduksi sedikit barang, sehingga apabila barang pada produksi pertama tidak terjual bisa fleksibel ke produksi selanjutnya.""Aku bilang mulai dari Linean buka kita cuma punya barang sedikit, sekitar 100 quantity. Tapi masing-masing sekitar 8 model, lalu kita jual nih beberapa nggak laku kan, tapi yang laku kita jual kita repeating buat lagi, produksi lagi,"" kata Malinda.""Lalu kita move on pertiga bulan, setelah season pertama nggak laku, kita evaluasi kenapa sih nggak laku apakah terlalu basic atau apa, atau harganya nggak cocok,"" tambahnya.Terakhir, Malinda berpesan apabila ingin merintis usaha, tidak boleh ada kata segan untuk terjun langsung ke lapangan. Mulai dari berburu bahan, mengukur, bahkan hingga menjahit sebagai pengusaha harus mengetahui semua hal tersebut.""Menurut aku pertama kali bikin bisnis itu harus bener-bener terjun ke lapangan sih ke tempat paling bawah sekalipun. Harus terjun cari bahan, cari penjahit, harus tau ngukur-ngukur bahannya atau misalnya gimana marketingnya dan lain-lain,"" ungkap Malinda. (zlf/zlf) malinda amalia pengusaha muda tips usaha tips bisnis","Mau Terjun ke Bisnis Fashion? Simak Hal Ini Dulu"
"dict","sport","Sao Paulo - Marc Marquez membicarakan lagi momen bersalaman dengan Valentino Rossi di MotoGP Argentina. Marquez juga mengaku tak bisa berteman dengan rivalnya di lintasan.Rider Repsol Honda itu berhasil memenangi balapan di Termas de Rio Hondo (31/3/2019) dengan mudah. Marquez terdepan dengan keunggulan nyaris 10 detik dari Rossi di belakangnya, dan 10,5 detik lebih cepat dari Andrea Dovizioso di urutan ketiga.Sebuah peristiwa yang menyedot perhatian terjadi ketika pebalap hendak naik ke podium. Marquez dan Rossi berjabat tangan, di balapan yang sama ketika kedua pebalap bersitegang setahun silam. Insiden itu mengakibatkan hubungan mereka memanas bahkan Rossi tidak mau menerima permintaan maaf Marquez yang datang ke garasi tim Yamaha, dan tidak mau bersalaman di MotoGP San Marino. googletag.cmd.push(function() { googletag.display('div-gpt-ad-1535945783791-0'); }); Baca juga: Setelah Dua Kali Ditolak, Marquez Senang Akhirnya Disalami RossiNamun, hubungan mereka tampak mulai adem yang ditandai dengan jabat tangan di akhir pekan lalu. ""Apapun yang terjadi dengan Valentino di media, akan selalu menjadi besar karena dia adalah pebalap terpopuler di atas lintasan,"" Marquez mengatakan pada EFE, yang dikutip MotoGP.com.""Aku tidak punya masalah untuk mengakui bahwa ketika itu memang salahku dan itulah mengapa aku pergi untuk minta maaf. Yang penting adalah tahu kalau Anda sudah berbuat satu kesalahan, tapi tahun ini ceritanya telah berubah cukup banyak. Waktu menyelesaikan segalanya.""Baca juga: Rossi dan Marquez Jabat Tangan di MotoGP Argentina, Sudah Berdamai?Dengan Rossi, Marquez punya sejarah rivalitas yang panjang. Sedangkan sensasi Dovizioso sejak 2017 membuktikan bahwa kini pebalap Italia itu layak diperhitungkan dalam kandidat juara dunia. Sementara rekan setim Marquez, Jorge Lorenzo, punya reputasi mentereng sekalipun di awal musim ini belum memberikan hasil optimal.""Menjadi teman dengan salah satu rival Anda, apakah itu Valentino atau yang lain, sangatlah sulit, hampir tidak mungkin. Soalnya, di atas lintasan ada sebuah persaingan.""""Tapi di luar lintasan Anda memang harus menaruh rasa hormat.""Seri ketiga MotoGP 2019 akan digelar di Austin, Amerika Serikat pada 14 April. (rin/cas) marc marquez valentino rossi andrea dovizioso jorge lorenzo motogp motogp argentina","Marquez Akui Hampir Mustahil Berteman dengan Rival"
"dict","finance","Jakarta - PT Pelindo III (Persero) memperbesar ekspansinya di bisnis layanan terminal pendukung industri minyak dan gas (migas). Setelah mengoperasikan terminal LNG terapung di Pelabuhan Benoa Bali, kemudian belum lama ini juga bersinergi dengan sesama BUMN, yakni PGN, untuk memulai pembangunan terminal LNG di Terminal Teluk Lamong, Pelabuhan Tanjung Perak, Surabaya. ""Infrastruktur pelabuhan sangat penting untuk disinergikan untuk melayani kebutuhan logistik energi nasional. Karena pelabuhan merupakan pintu masuk yang dapat berkontribusi untuk menekan cost recovery dari industri migas di Indonesia,"" kata Direktur Transformasi dan Pengembangan Bisnis Pelindo III Toto Nugroho dalam worskhop migas bersama antara Pelindo III dengan Satuan Kerja Khusus Pelaksana Kegiatan Usaha Hulu Minyak dan Gas Bumi (SKK Migas) dikutip dari keterangannya, Rabu (3/4/2019).Toto menambahkan, kerja sama pengembangan fasilitas pelabuhan untuk mendukung operasional di hulu industri migas potensinya sangat besar, karena banyak lahan konsesi Pelindo III yang berada di waterfront atau berbatasan langsung dengan laut. Pelindo III bahkan sudah menyiapkan lini usaha khusus, yaitu Pelindo Energi Logistik (PEL), yang akan fokus mengembangkan integrated services shorebase terminal atau terminal pelabuhan dengan sejumlah layanan yang siap mendukung logistik pelaku industri migas. googletag.cmd.push(function() { googletag.display('div-gpt-ad-1535944306169-0'); }); ""Terminal Gresik di Jawa Timur sudah siap dengan dedicated area untuk memberikan layanan terintegrasi dari kegiatan di laut, seperti kapal sandar, hingga kegiatan di darat, untuk lokasi penyimpanan misalnya,"" ujar mantan Direktur Pertagas tersebut.Melalui konsep integrated services shorebase terminal tersebut, layanan PEL akan di-back up oleh lini usaha Pelindo III Group lainnya. Mulai dari layanan armada kapal offshore, transportasi truk, mooring-unmooring(penambatan), loading-unloading (bongkar muat), penyediaan alat berat, perawatan dan suku cadang peralatan. Baca juga: Kapal 'Raksasa' Angkut Kopi hingga Nanas Lampung ke MancanegaraTermasuk penyediaan tenaga kerja professional operasional, pengamanan, kebersihan, dan transportasi. Bahkan hingga jasa klinik kesehatan dan catering untuk pekerja di lokasi khusus. Dengan lengkapnya layanan dalam satu kawasan yang terdedikasi untuk kegiatan industri migas yang menuntut standar keselamatan yang tinggi, maka potensi efisiensi yang dicapai cukup besar.Kepala Divisi Penunjang Operasi dan Keselamatan Migas, SKK Migas, Bagus Edvantoro, pada kesempatan tersebut membenarkan bahwa penurunan cost recovery merupakan isu penting. Menurutnya ada beberapa faktor yang mempengaruhi seperti kehandalan operasional, personel yang professional, kualitas layanan, keselamatan dan kesehatan kerja (K3/HSSE). ""Kemudian juga faktor ketepatan waktu penyediaan jasa dan harga yang kompetitif. Integrasi faktor-faktor tadi dibutuhkan untuk mencapai penurunan cost recovery dalam industri migas,"" ujarnya.""Kami juga mengapresiasi diadakannya workshop migas bersama seperti ini, karena bisa menjadi sarana komunikasi dua arah. Para calon mitra kerja dan masyarakat jadi bisa memahami minimum requirementyang dibutuhkan untuk berkerjasama di industri migas. SKK Migas terbuka untuk kerja sama bila memang tujuannya untuk meningkatkan efisiensi,"" ungkapnya.Ketua DPW Asosiasi Logistik dan Forwarder Indonesia (ALFI) Jatim Henky Pratoko, yang juga hadir, menyebutkan dengan berdiskusi langsung dengan SKK Migas dan Pelindo III, para pelaku bisnis logistik di asosiasinya menjadi bisa mencari peluang bisnis di jasa logistik industri migas. ""Di tengah bisnis yang semakin menantang, peluang baru menjadi penting bagi kami. Agar bisa turut bekerja sama dengan pemerintah untuk meningkatkan efisien logistik di Indonesia,"" katanya.Baca juga: Kapal 'Raksasa' Perdana Bersandar di Pelabuhan Panjang Lampung (ara/fdl) pelindo ekspansi bisnis migas pelindo iii","Pelindo III Layani Terminal Industri Migas di Pelabuhan"
"dict","sport","Sao Paulo - Bukan rahasia lagi kalau ada rivalitas panas antara Marc Marquez dengan Valentino Rossi. Lantas apakah ada peluang Marquez dan Rossi menjadi rekan setim?Sejak terjun ke kelas MotoGP pada 2013 bersama Repsol Honda, Marquez telah menghabiskan enam tahun pertama dengan Dani Pedrosa. Kini, Marquez bertandem dengan Jorge Lorenzo setidaknya sampai 2020. Di sisi lain, Rossi akan terikat kontrak untuk terus membalap Monster Energy Yamaha hingga berusia 41 tahun. Belum bisa diketahui apakah itu akan menjadi kontrak terakhir the Doctor atau tidak. googletag.cmd.push(function() { googletag.display('div-gpt-ad-1535945783791-0'); }); Baca juga: Marquez Akui Hampir Mustahil Berteman dengan RivalSementara itu hubungan Marquez dan Rossi selama ini naik turun. Permusuhan antara kedua pebalap tercipta setelah insiden di MotoGP Malaysia 2015 silam. Namun, momen jabat tangan yang dilakukan Marquez dan Rossi usai balapan di MotoGP Argentina akhir pekan lalu mengisyaratkan hubungan keduanya mulai adem lagi.Baca juga: Gemilang di MotoGP Argentina, Rossi Dijagokan Rumah Taruhan LagiMarquez sadar bahwa untuk kesempatan untuk bertandem dengan Rossi di tim yang sama akan sulit. Mengingat karier Rossi yang mungkin saja tidak akan lama lagi. Bagaimanapun, Marquez memuji motivasi dan daya saing yang masih terus dimiliki rivalnya itu.""Bung, kalau dia membalap sampai dia berusia 50... Anda tidak akan pernah tahu,"" kata Marquez saat diwawancara EFE, yang dikutip MotoGP.com.""Apa yang dilakukan Valentino saat berusia 40 tahun itu luar biasa, sebagian besar karena bagaimana dia terus termotivasi dan menjaga semangat dia. Akan sulit berbagi sebuah tim selama bertahun-tahun."" (rin/nds) marc marquez valentino motogp","Marquez: Setim dengan Rossi? Kalau Dia Balapan Sampai Usia 50 Tahun..."
"dict","finance","Jakarta - Petinggi Amerika Serikat (AS) dan China yang melakukan negosiasi kesepakatan perdagangan telah menyelesaikan sebagian besar masalah yang belum terselesaikan. Namun masih ada beberapa proses tawar menawar yang belum selesai.Melansir CNBC, Rabu (3/4/2019), pihak kedua negara masih menawar tentang bagaimana menerapkan dan menegakkan perjanjian. Kedua negara belum menyepakati sejumlah masalah penting.Beijing menginginkan Washington untuk menghapus tarif AS yang ada pada barang-barang Tiongkok. Sementara Amerika Serikat menginginkan China untuk menyetujui persyaratan mekanisme penegakan hukum yang memastikannya mematuhi perjanjian. googletag.cmd.push(function() { googletag.display('div-gpt-ad-1535944306169-0'); }); Baca juga: Curhat Gubernur BI: Ketidakramahan Dunia Makin Menjadi-jadiMyron Brilliant, Wakil Presiden Eksekutif untuk urusan internasional Kamar Dagang AS, mengatakan bahwa 90% dari kesepakatan itu telah dicapai, tetapi 10% terakhir tetap menjadi bagian tersulit dari negosiasi dan akan membutuhkan pertukaran di kedua sisi.AS dan China telah memungut tarif barang miliaran dolar dari barang satu sama lain sejak tahun lalu, yang mengganggu rantai pasokan dan menaikkan biaya bagi perusahaan.Perwakilan Dagang AS Robert Lighthizer dan Menteri Keuangan AS Steven Munchin akan memulai pembicaraan dengan Wakil Perdana Menteri China Liu He pada hari Rabu, beberapa hari setelah kedua belah pihak melaporkan kemajuan dalam pembicaraan yang berlangsung di Beijing.Baca juga: Melihat Ancaman Resesi yang Mengintai ASJika diskusi terbukti bermanfaat, mungkin Presiden AS Donald Trump akan bertemu dengan Presiden China Xi Jinping untuk secara resmi dan menandatangani perjanjian. Jika kedua ekonomi terbesar dunia itu tidak dapat segera mencapai kesepakatan perdagangan, beberapa analis telah memperingatkan bahwa resesi global dapat terjadi. (das/zlf) perang dagang perang dagang as perang dagang as-china","Soal Perang Dagang, AS-China bakal Segera Rujuk?"
"dict","sport","Buenos Aires - Franco Morbidelli dan Maverick Vinales terlibat tabrakan di MotoGP Argentina. Rider Italia itu bersyukur semuanya baik-baik saja.Morbidelli dan Vinales sama-sama gagal finis saat membalap di Autodromo Termas de Rio Hondo, Senin (1/4/2019) dini hari WIB. Keduanya terlibat tabrakan di tikungan 7 saat lap terakhir.Dalam perebutan peringkat keenam, Vinales dan Morbidelli bersaing dengan Danilo Petrucci. Rider Yamaha itu dilewati oleh Petrucci, hingga berupaya untuk memotong jalur balapan. Sial baginya, Morbidelli melaju kencang dari belakang. googletag.cmd.push(function() { googletag.display('div-gpt-ad-1535945783791-0'); }); Morbidelli tampak kesakitan, dibantu Vinales untuk bediri. Rider Italia itu mengaku salah karena melaju terlalu kencang.Baca juga: Selain Rossi vs Dovizioso, Ada Juga Insiden Vinales dan Morbidelli""Aku terlalu cepat. Aku mencoba untuk menggapai peringkat keenam. Aku tak ingin menyalip siapapun di tikungan itu. Aku hanya sampai di tikungan ketujuh dengan slipstream ganda,"" kata Morbibdelli di Crash.""Aku mencoba untuk berhenti, tapi aku melaju dengan kecepatan slipstream ganda dan Maverick, yang dilewati Petrucci dan mencoba memotong jalur balapan untuk menyalipnya lagi.""""Aku sedikit terlalu cepat. Dia melambat untuk mencoba dan memotong jalur balapan. Dua hal ini tak berjalan baik. Tapi, merupakan keberuntungan besar bahwa kami berdua baik-baik saja,"" pebalap Petronas Yamaha SRT itu menambahkan.Baca juga: Marquez Superior di MotoGP Argentina, Rossi Asapi Dovizioso (cas/raw) motogp argentina franco morbidelli maverick vinales motogp","Morbidelli: Untungnya Aku dan Vinales Baik-baik Saja"
"dict","sport","Jakarta - Marc Marquez tampil luar biasa dominan di MotoGP Argentina. Valentino Rossi saja sampai tak melihat rivalnya itu ada di atas lintasan.Marquez memang tampil istimewa pada balapan tersebut. Memulai balapan dari pole position, rider Honda itu langsung melesat selepas melewati tikungan pertama. Saat selesai memutari satu lap, Marquez sudah menciptakan selisih waktu satu detik lebih. Jarak waktunya terus bertambah dari lap ke lap. googletag.cmd.push(function() { googletag.display('div-gpt-ad-1535945783791-0'); }); Baca juga: Tawa Bahagia Marquez Lihat Rossi Kalahkan DoviziosoSaat menyentuh garis finis, sang juara dunia unggul 9 detik lebih dari Rossi di posisi dua. Itu pun Marquez sudah bermain aman di lap-lap terakhir dan melambatkan motornya jelang finis untuk merayakan bersama kru Tim Repsol Honda.""Memangnya Marquez ada di sana (MotoGP Argentina) juga? Saya tidak melihatnya. Mungkin karena itulah saya tidak menang,"" ucap Rossi sambil tertawa usai balapan MotoGP Argentina.Finis kedua adalah capaian terbaik Rossi dalam 10 race terakhir. Meski puas dengan hasil tersebut, dia tak menyangkal kalau jarak dengan Marquez masih sangat lebar.Baca juga: Terus Membalap, Rossi Tak Mau Cuma Pandangi Koleksi Piala di Rumahnya""Kami bekerja keras, tapi tantangannya masih sangat sulit. Marquez dan (Andrea) Dovizioso masih jadi favorit.""""Kami masih harus terus berjuang untuk bisa mendekat dengan Marc. Saya memilih berjarak 3 detik ketimbang 10 detik....Atau paling tidak saya bisa melihat dia,"" seloroh Rossi dikutip dari GPOne.Tonton video Marquez Sempurna di MotoGP Argentina:[Gambas:Video 20detik] (din/mrp) marc marquez valentino rossi motogp argentina motogp","Tak Lihat Marquez di MotoGP Argentina, Rossi: Memangnya Dia Ikut Balapan?"
"dict","sport","Buenos Aires - Maverick Vinales mulai mengeluh karena tak kunjung tampil bagus bersama Yamaha. Dia menyebutnya sebagai suatu hal yang masuk tak akal.Vinales memperkuat Yamaha sejak 2017. Selama dua musim, dia cuma membukukan empat kali kemenangan. Secara keseluruhan, ada 12 podium yang berhasil diraih pebalap 24 tahun itu.Pada awal 2019, Vinales sebenarnya sudah mengawali dengan cukup oke. Merebut pole position saat membalap di MotoGP Qatar, eks pebalap Suzuki itu finis di urutan ketujuh. googletag.cmd.push(function() { googletag.display('div-gpt-ad-1535945783791-0'); }); Baca juga: Morbidelli: Untungnya Aku dan Vinales Baik-baik SajaVinales belum juga membaik saat di MotoGP Argentina. Dia gagal finis setelah bertabrakan dengan Franco Morbidelli.""Itu merupakan suatu hal yang tak masuk akal. Sangat-sangat aneh. Hanya dengan Yamaha kami sangat kesulitan. Itu tak pernah terjadi pada saya bahkan saat saya di Suzuki dan tidak pada bagian awal musim 2017,"" kata Vinales di Crash.""Sejujurnya, sudah 2,5 tahun saya mengalami masalah ini. Australia (2018, satu-satunya seri yang dia menangi) satu-satunya saat saya mempunyai grip itu,"" dia menambahkan.Baca juga: Selain Rossi vs Dovizioso, Ada Juga Insiden Vinales dan Morbidelli (cas/nds) maverick vinales yamaha motogp","Terus Alami Masalah di Yamaha, Vinales Mengeluh"
"dict","finance","Jakarta - Pemanfaatan teknologi terus berkembang termasuk di antaranya di sektor industri jasa pengiriman kargo udara. PT Garuda Indonesia dalam waktu dekat berencana memanfaatkan teknologi drone atau pesawat tanpa awak untuk jasa pengiriman kargo.Penggunaan drone, kata Direktur Utama Garuda Indonesia IGN Askhara Danadiputra, lebih efisien dalam hal konsumsi bahan bakar dan penggunaan tenaga kerja. Drone hanya memerlukan seorang pilot yang mengoperasikannya dari jarak jauh. Berbeda dengan pesawat konvensional yang butuh satu set lengkap awak pesawat dalam sekali penerbangan. googletag.cmd.push(function() { googletag.display('div-gpt-ad-1535944306169-0'); }); ""Kami akan masuk ke bisnis cargo drone, supaya lebih efisien,"" tutur pria yang akrab disapa Ari Askhara itu saat berbincang dengan awak media akhir pekan lalu.Selain itu, faktor keselamatan juga menjadi pertimbangan perusahaan.Baca juga: Pesanan B 737 MAX Batal, Bagaimana Rencana Peremajaan Armada Garuda?""Drone akan digunakan kirim barang ke daerah pelosok seperti Papua yang bergunung-gunung dan berbukit-bukit. Risiko penerbangannya sangat tinggi. Kalau pakai drone kan lebih aman,"" sebut Ari.Direktur Kargo dan Pengembangan Usaha M Iqbal dalam kesempatan yang sama menjelaskan, drone produksi pabrikan Beihang asal China itu bisa mengangkut kargo dengan beban total 5 ton.""Saat ini mereka punya yang 1,2 ton dan itu sudah digunakan militer Amerika Serikat. Beihang ini satu-satunya yang punya drone seperti ini. Nah, mereka sedang kembangkan yang bisa 5 ton,"" beber dia.Untuk tahap awal, bakal ada 3 unit drone yang akan dioperasikan.Baca juga: Boeing 737 MAX 8 Dilarang Terbang, Garuda Rugi Rp 42 M/Bulan (dna/fdl) garuda indonesia garuda drone kargo","Garuda Bidik Bisnis Angkutan Kargo Pakai Drone"
"dict","finance","Sragen - Presiden Joko Widodo (Jokowi) berbicara tentang pentingnya pembaruan peralatan pertanian di era modern. Menurutnya, saat ini masih banyak petani yang menjemur padi di jalan usai panen.""Sekarang sudah zaman modern. Dari saya kecil di desa sampai sekarang saya lihat kalau habis panen pasti dijereng di jalan-jalan. Nggih mboten?"" kata Jokowi saat bersilaturahmi dengan pelaku usaha pertanian Jawa Tengah di Sragen, Rabu (3/4/2019).Jokowi mengatakan bahwa setiap tempat penggilingan padi haruslah memiliki mesin pengering atau dryer. Hal tersebut dinilai membuat kualitas produksi meningkat. googletag.cmd.push(function() { googletag.display('div-gpt-ad-1535944306169-0'); }); ""Dryer itu penting sekali. Bukan hanya untuk urusan padi, tapi juga jagung bermasalah, kualitas turun gara-gara apa? Hanya dijemur, tidak masuk ke dryer,"" ujarnya.Dia kemudian berencana mengumpulkan para pelaku usaha pertanian, seperti Perkumpulan Penggilingan Padi dan Pengusaha Beras Indonesia (Perpadi) di istana untuk membahas hal tersebut. Jokowi juga akan mengundang perbankan hingga Bulog.Baca juga: Jokowi Setuju Kebijakan Afirmatif Pemberdayaan Ekonomi Kerakyatan""Saya ingin menawarkan kepada Perpadi, ini kan kita sudah berpuluh-puluh tahun menjemur padi di jalan, di pelataran, itu sudah berpuluh-puluh tahun, masa kita tidak berubah sih,"" katanya.""Maka akan kita atur setelah 17 April untuk bertemu bank agar seluruh penggilingan itu memiliki dryer,"" kata Jokowi melanjutkan.Presiden mengaku tidak ingin tertinggal dengan negara-negara tetangga di bidang pertanian dan bidang lainnya. Dia mengajak petani meninggalkan pola-pola lama.""Kita ini negara besar, masa kita kalah dengan tetangga kita urusan ekspor, urusan investasi, kalah dengan Malaysia, kalah dengan Singapura, Filipina, kalah dengan Thailand, kalah dengan Vietnam. Kalau kita diam tidak mau mengubah, bisa kalah dengan Laos, kalah dengan Kamboja,"" tutupnya.Adapun acara silaturahmi tersebut diikuti oleh Perpadi, Gabungan Kelompok Tani (Gapoktan), penjual pupuk dan pelaku usaha pertanian lainnya. Hadir bersama Jokowi, Ibu Negara Iriana Jokowi, Gubernur Jawa Tengah Ganjar Pranowo dan Bupati Sragen, Kusdinar Untung Yuni Sukowati.Baca juga: Tiga Negara Ngerem Ekspor, Harga Karet Bisa Naik Segini (fdl/fdl) jokowi petani presiden jokowi pertanian","Jokowi ke Petani: Usai 17 April Kita Atur Penggilingan Punya Dryer"
