"_type","category","isi","judul"
"dict","hot","Jakarta - Luna Maya kembali mendapat penghargaan. Kali ini dirinya dinobatkan sebagai satu dari 99 wanita yang paling menginspirasi.Penghargaan itu diberikan oleh majalah Globe Asia. '99 Most Inspiring Women' menghadirkan wanita yang menginspirasi dan selalu menelurkan karya-karya terbaiknya.Baca juga: Dibilang Baper Nyanyi Lagu Nike Ardila, Luna Maya Merasa Biasa Saja googletag.cmd.push(function() { googletag.display('div-gpt-ad-1535944650921-0'); }); Luna Maya yang turut hadir membagikan momen saat dirinya menghadiri acara tersebut di The Sultan Hotel. Tidak sendiri, Luna terlihat foto bersama dengan Menteri Kelautan dan Perikanan, Susi Pudjiastuti.Mantan pacar Reino Barack itu pun memuji Susi Pudjiastuti adalah pribadi yang rendah hati dan lucu. Di samping itu dia juga sangat cerdas dan bisa memberikan inspirasi untuknya.""Such an honor to meet you in person, she's so humble and funny yet so smart and I'm inspired by her. keep up the good work bu @susipudjiastuti115 semangat terus untuk membangun negri kita, INDONESIA! #proudindonesian #99mostinspiringwomen #lunamaya @globe.asia,"" tulis Luna Maya dilihat detikHOT, Kamis (28/3/2019).Baca juga: Luna Maya Selamatkan Kucing, Kehadiran Reino Barack Bikin Salah FokusTidak hanya Luna Maya, ada juga penyanyi Yura Yunita, Dian Sastrowardoyo, dan Marsha Timothy, sebagai wanita-wanita paling menginspirasi dalam bidang seni.Selain Susi Pudjiastuti, ada juga nama-nama besar diantaranya Sakdiah Ma'ruf yang merupakan komika, Rasa Boenard, Veronica Sari Utami yang merupakan Head of Marketing Google Indonesia, dan banyak lainnya.[Gambas:Instagram] (pus/doc) luna maya luna maya bahagia luna maya wanita paling menginspirasi susi pudjiastuti menteri susi pujiastuti Photo Gallery 1 celeb Raffi Ahmad Reunian dengan Luna Maya celeb Raffi Ahmad Reunian dengan Luna Maya celeb Raffi Ahmad Reunian dengan Luna Maya celeb Raffi Ahmad Reunian dengan Luna Maya celeb Raffi Ahmad Reunian dengan Luna Maya celeb Raffi Ahmad Reunian dengan Luna Maya 1 celeb Luna Maya Menenangkan Diri di Tanah Suci celeb Luna Maya Menenangkan Diri di Tanah Suci celeb Luna Maya Menenangkan Diri di Tanah Suci celeb Luna Maya Menenangkan Diri di Tanah Suci celeb Luna Maya Menenangkan Diri di Tanah Suci celeb Luna Maya Menenangkan Diri di Tanah Suci celeb Luna Maya Menenangkan Diri di Tanah Suci 2 celeb Pujian Melaney Ricardo untuk Luna Maya celeb Pujian Melaney Ricardo untuk Luna Maya celeb Pujian Melaney Ricardo untuk Luna Maya celeb Pujian Melaney Ricardo untuk Luna Maya celeb Pujian Melaney Ricardo untuk Luna Maya celeb Pujian Melaney Ricardo untuk Luna Maya celeb Pujian Melaney Ricardo untuk Luna Maya 3 celeb Luna Maya, Don't Worry Be Happy! celeb Luna Maya, Don't Worry Be Happy! celeb Luna Maya, Don't Worry Be Happy! celeb Luna Maya, Don't Worry Be Happy! celeb Luna Maya, Don't Worry Be Happy! celeb Luna Maya, Don't Worry Be Happy! celeb Luna Maya, Don't Worry Be Happy! celeb Luna Maya, Don't Worry Be Happy! celeb Luna Maya, Don't Worry Be Happy! 4 celeb Pesona Luna Maya dengan Dress Floral celeb Pesona Luna Maya dengan Dress Floral celeb Pesona Luna Maya dengan Dress Floral celeb Pesona Luna Maya dengan Dress Floral celeb Pesona Luna Maya dengan Dress Floral celeb Pesona Luna Maya dengan Dress Floral celeb Pesona Luna Maya dengan Dress Floral celeb Pesona Luna Maya dengan Dress Floral 5 photo Luna Maya-Gading Marten, Si Penguasa Piala Maya photo Luna Maya-Gading Marten, Si Penguasa Piala Maya photo Luna Maya-Gading Marten, Si Penguasa Piala Maya photo Luna Maya-Gading Marten, Si Penguasa Piala Maya photo Luna Maya-Gading Marten, Si Penguasa Piala Maya photo Luna Maya-Gading Marten, Si Penguasa Piala Maya photo Luna Maya-Gading Marten, Si Penguasa Piala Maya 6 celeb Luna Maya Mendadak Cengeng Lihat Orang Nikah, Baper? celeb Luna Maya Mendadak Cengeng Lihat Orang Nikah, Baper? celeb Luna Maya Mendadak Cengeng Lihat Orang Nikah, Baper? celeb Luna Maya Mendadak Cengeng Lihat Orang Nikah, Baper? celeb Luna Maya Mendadak Cengeng Lihat Orang Nikah, Baper? celeb Luna Maya Mendadak Cengeng Lihat Orang Nikah, Baper? celeb Luna Maya Mendadak Cengeng Lihat Orang Nikah, Baper? 7 celeb Persahabatan Ayu Dewi, Luna Maya dan Melaney Ricardo celeb Persahabatan Ayu Dewi, Luna Maya dan Melaney Ricardo celeb Persahabatan Ayu Dewi, Luna Maya dan Melaney Ricardo celeb Persahabatan Ayu Dewi, Luna Maya dan Melaney Ricardo celeb Persahabatan Ayu Dewi, Luna Maya dan Melaney Ricardo celeb Persahabatan Ayu Dewi, Luna Maya dan Melaney Ricardo celeb Persahabatan Ayu Dewi, Luna Maya dan Melaney Ricardo celeb Persahabatan Ayu Dewi, Luna Maya dan Melaney Ricardo 8 celeb Bisakah Ariel kembali Bersama Luna Maya? celeb Bisakah Ariel kembali Bersama Luna Maya? celeb Bisakah Ariel kembali Bersama Luna Maya? celeb Bisakah Ariel kembali Bersama Luna Maya? celeb Bisakah Ariel kembali Bersama Luna Maya? celeb Bisakah Ariel kembali Bersama Luna Maya? celeb Bisakah Ariel kembali Bersama Luna Maya? 9 celeb Dewi Perssik, Maria Ozawa, Claudio Martinez hingga Luna Maya celeb Dewi Perssik, Maria Ozawa, Claudio Martinez hingga Luna Maya celeb Dewi Perssik, Maria Ozawa, Claudio Martinez hingga Luna Maya celeb Dewi Perssik, Maria Ozawa, Claudio Martinez hingga Luna Maya celeb Dewi Perssik, Maria Ozawa, Claudio Martinez hingga Luna Maya celeb Dewi Perssik, Maria Ozawa, Claudio Martinez hingga Luna Maya celeb Dewi Perssik, Maria Ozawa, Claudio Martinez hingga Luna Maya celeb Dewi Perssik, Maria Ozawa, Claudio Martinez hingga Luna Maya celeb Dewi Perssik, Maria Ozawa, Claudio Martinez hingga Luna Maya celeb Dewi Perssik, Maria Ozawa, Claudio Martinez hingga Luna Maya celeb Dewi Perssik, Maria Ozawa, Claudio Martinez hingga Luna Maya celeb Dewi Perssik, Maria Ozawa, Claudio Martinez hingga Luna Maya 10 celeb Luna Maya Makin Mirip Suzanna celeb Luna Maya Makin Mirip Suzanna celeb Luna Maya Makin Mirip Suzanna celeb Luna Maya Makin Mirip Suzanna celeb Luna Maya Makin Mirip Suzanna celeb Luna Maya Makin Mirip Suzanna 11 celeb Namaste...Lihat Luna Maya Jalan-jalan di Nepal celeb Namaste...Lihat Luna Maya Jalan-jalan di Nepal celeb Namaste...Lihat Luna Maya Jalan-jalan di Nepal celeb Namaste...Lihat Luna Maya Jalan-jalan di Nepal celeb Namaste...Lihat Luna Maya Jalan-jalan di Nepal 12 celeb Luna Maya Sang Ratu Horor, Marsha Aruan hingga Catherine Wilson celeb Luna Maya Sang Ratu Horor, Marsha Aruan hingga Catherine Wilson celeb Luna Maya Sang Ratu Horor, Marsha Aruan hingga Catherine Wilson celeb Luna Maya Sang Ratu Horor, Marsha Aruan hingga Catherine Wilson celeb Luna Maya Sang Ratu Horor, Marsha Aruan hingga Catherine Wilson celeb Luna Maya Sang Ratu Horor, Marsha Aruan hingga Catherine Wilson celeb Luna Maya Sang Ratu Horor, Marsha Aruan hingga Catherine Wilson celeb Luna Maya Sang Ratu Horor, Marsha Aruan hingga Catherine Wilson 13 celeb Luna Maya, Sang Ratu Horor Baru? celeb Luna Maya, Sang Ratu Horor Baru? celeb Luna Maya, Sang Ratu Horor Baru? celeb Luna Maya, Sang Ratu Horor Baru? celeb Luna Maya, Sang Ratu Horor Baru? celeb Luna Maya, Sang Ratu Horor Baru? celeb Luna Maya, Sang Ratu Horor Baru? celeb Luna Maya, Sang Ratu Horor Baru? 14 celeb Luna Maya Bahas Apa Saja di d'Happening? celeb Luna Maya Bahas Apa Saja di d'Happening? celeb Luna Maya Bahas Apa Saja di d'Happening? celeb Luna Maya Bahas Apa Saja di d'Happening? celeb Luna Maya Bahas Apa Saja di d'Happening? celeb Luna Maya Bahas Apa Saja di d'Happening? celeb Luna Maya Bahas Apa Saja di d'Happening? 15 celeb Ketika Luna Maya Ziarah ke Makam Suzzana celeb Ketika Luna Maya Ziarah ke Makam Suzzana celeb Ketika Luna Maya Ziarah ke Makam Suzzana celeb Ketika Luna Maya Ziarah ke Makam Suzzana celeb Ketika Luna Maya Ziarah ke Makam Suzzana celeb Ketika Luna Maya Ziarah ke Makam Suzzana 16 celeb Aura Kasih Makin Seksi, Luna Maya Foto Bareng 'Sundel Bolong' celeb Aura Kasih Makin Seksi, Luna Maya Foto Bareng 'Sundel Bolong' celeb Aura Kasih Makin Seksi, Luna Maya Foto Bareng 'Sundel Bolong' celeb Aura Kasih Makin Seksi, Luna Maya Foto Bareng 'Sundel Bolong' celeb Aura Kasih Makin Seksi, Luna Maya Foto Bareng 'Sundel Bolong' celeb Aura Kasih Makin Seksi, Luna Maya Foto Bareng 'Sundel Bolong' celeb Aura Kasih Makin Seksi, Luna Maya Foto Bareng 'Sundel Bolong' celeb Aura Kasih Makin Seksi, Luna Maya Foto Bareng 'Sundel Bolong' celeb Aura Kasih Makin Seksi, Luna Maya Foto Bareng 'Sundel Bolong' celeb Aura Kasih Makin Seksi, Luna Maya Foto Bareng 'Sundel Bolong' celeb Aura Kasih Makin Seksi, Luna Maya Foto Bareng 'Sundel Bolong' 17 screenshoot-movie Serem! Luna Maya Foto Bareng 'Sundel Bolong' screenshoot-movie Serem! Luna Maya Foto Bareng 'Sundel Bolong' screenshoot-movie Serem! Luna Maya Foto Bareng 'Sundel Bolong' screenshoot-movie Serem! Luna Maya Foto Bareng 'Sundel Bolong' screenshoot-movie Serem! Luna Maya Foto Bareng 'Sundel Bolong' 18 celeb Kisah Luna Maya, Si Jegeg Bali celeb Kisah Luna Maya, Si Jegeg Bali celeb Kisah Luna Maya, Si Jegeg Bali celeb Kisah Luna Maya, Si Jegeg Bali celeb Kisah Luna Maya, Si Jegeg Bali celeb Kisah Luna Maya, Si Jegeg Bali celeb Kisah Luna Maya, Si Jegeg Bali celeb Kisah Luna Maya, Si Jegeg Bali celeb Kisah Luna Maya, Si Jegeg Bali celeb Kisah Luna Maya, Si Jegeg Bali 19 celeb Resmi Putus, Luna Maya Pamer Momen Romantis dengan Reino celeb Resmi Putus, Luna Maya Pamer Momen Romantis dengan Reino celeb Resmi Putus, Luna Maya Pamer Momen Romantis dengan Reino celeb Resmi Putus, Luna Maya Pamer Momen Romantis dengan Reino celeb Resmi Putus, Luna Maya Pamer Momen Romantis dengan Reino celeb Resmi Putus, Luna Maya Pamer Momen Romantis dengan Reino celeb Resmi Putus, Luna Maya Pamer Momen Romantis dengan Reino 20 1","Jadi '99 Wanita Menginspirasi', Luna Maya Bersanding dengan Susi Pudjiastuti"
"dict","sport","Jakarta - Liga Italia akan kickoff lagi pasca jeda internasional. Pada pekan ke-29 ini, duel serunya menyajikan AS Roma melawan Napoli, juga misi bangkit Juventus.Pertandingan pertama yang dihelat pekan ini antara Chievo melawan Cagliari. Duel yang berlangsung, Sabtu (30/3/2019), dihelat di Stadio Marc'Antonio Bentegodi.Juventus akan menjamu tim papan bawah, Empoli. Laga itu dipentaskan di Allianz Stadium, Minggu (31/3) dinihari WIB. Setelah itu, AC Milan akan melawat ke kandang Sampdoria. googletag.cmd.push(function() { googletag.display('div-gpt-ad-1535945694694-0'); }); Duel panas antara Giallorossi dengan Partenopei akan berlangsung di Stadio Olimpico pada Minggu malam. Inter Milan akan menjamu Lazio di Stadio Giuseppe Meazza, Senin (1/4) dinihari WIB.Baca juga: Misi Bangkit Juventus Tanpa Cristiano RonaldoJadwal Liga Italia Pekan ke-30Sabtu (30/3)Chievo vs Cagliari - Pukul 2.30 WIBUdinese vs Genoa - Pukul 21.00 WIBBaca juga: Cristiano Ronaldo ke Barcelona, Mau Apa?Minggu (31/3)Juventus vs Empoli - Pukul 0.00 WIBSampdoria vs AC Milan - Pukul 2.30 WIBParma vs Atalanta - Pukul 17.30 WIBAS Roma vs Napoli - Pukul 20.00 WIBForsinone vs SPALFiorentina vs TorinoBologna vs Sassupol - Pukul 23.00 WIBSenin (1/4)Inter Milan vs Lazio - Pukul 1.30 WIB (cas/mrp) as roma napoli liga italia juventus jadwal liga italia","Jadwal Liga Italia Pekan Ini"
"dict","sport","Jakarta - Manchester City berpeluang mengkudeta puncak klasemen Liga Inggris yang diduduki Liverpool karena bertanding paling awal. Sedangkan Arsenal bermain terakhir.Game week ke-32 dibuka oleh partai antara Fulham vs City di Craven Cottage, Sabtu (30/3/2019) pukul 19.30 WIB. Manchester United juga akan bermain setelahnya di hari yang sama.Tiga tim enam besar akan berduel di hari Minggu (31/3). Termasuk big match antara Liverpool vs Tottenham Hotspur, yang didahului pertandingan tandang Chelsea di markas Cardiff City. googletag.cmd.push(function() { googletag.display('div-gpt-ad-1535945694694-0'); }); Arsenal menjadi penutup kompetisi akhir pekan ini. Tim arahan Unai Emery tersebut akan ditantang Newcastle United di Stadion Emirates, Selasa (2/4) dinihari WIB.Baca juga: Liverpool Vs Tottenham di Anfield, City Hadapi Tim Papan BawahJadwal Lengkap Liga Inggris pekan ini:Sabtu (30/3/2019)19.30 WIB Fulham vs Manchester City22.00 WIB Brighton vs Southampton22.00 WIB Burnley vs Wolverhampton22.00 WIB Crystal Palace vs Huddersfield Town22.00 WIB Leicester City vs Bournemouth22.00 WIB Manchester United vs WatfordMinggu (31/3/2019)00.30 WIB West Ham vs Everton20.05 WIB Cardiff City vs Chelsea22.30 WIB Liverpool vs Tottenham HotspurSelasa (2/4/2019)02.00 WIB Arsenal vs Newcastle United (rin/mrp) liga inggris manchester city liverpool","Jadwal Liga Inggris Pekan Ini"
"dict","sport","Jakarta - Liga Spanyol akhir pekan ini akan menghadirkan derby Catalan antara Barcelona dan Espanyol. Sementara itu, Real Madrid berpeluang melanjutkan tren positifnya.Barcelona akan menjamu Espanyol pada pertandingan pekan ke-29 LaLiga, Sabtu (30/3/2019) malam WIB. Laga ini akan jadi pemanasan untuk Barcelona sebelum memasuki April yang krusial.Usai menghadapi Espanyol, Blaugrana ditunggu delapan laga di sepanjang April. Dua di antaranya adalah pertandingan perempatfinal Liga Champions melawan Manchester United. googletag.cmd.push(function() { googletag.display('div-gpt-ad-1535945694694-0'); }); Pertandingan melawan Espanyol juga krusial dalam upaya Barcelona mendekatkan diri dengan gelar juara LaLiga. Saat ini, tim arahan Ernesto Valverde itu nyaman di puncak klasemen dengan 66 poin dari 28 laga, unggul 10 angka atas Atletico Madrid yang ada di urutan kedua.Baca juga: Sempat Cedera di Timnas, Messi Sudah Tersenyum Lagi di BarcelonaJelang lawan Espanyol, Lionel Messi sudah ikut berlatih bersama rekan-rekannya pada Rabu (27/3/2019) waktu setempat usai menarik diri dari timnas Argentina. Ia sempat mengalami masalah pada pangkal pahanya.Sementara itu, Luis Suarez belum fit sepenuhnya setelah mengalami cedera pada pergelangan kaki di laga melawan Real Betis sebelum jeda internasoinal. Kondisinya akan terus dipantau sebelum diputuskan akan main atau tidak di derby Catalan.Dari pertandingan lainnya, Madrid akan menjamu Huesca di Santiago Bernabeu, Senin (1/4/2019) dini hari WIB. Ini akan jadi laga kedua Madrid bersama Zinedine Zidane setelah pria Prancis itu kembali melatih.Baca juga: Bale Mesti Lebih Egois untuk Sukses di MadridDi atas kertas, Madrid seharusnya tak kesulitan meraih poin penuh. Huesca terbenam di dasar klasemen dengan 22 poin dari 28 pertandingan.Meski peluang juara LaLiga tipis, tiga poin tetap bakal berarti penting untuk Madrid. Los Blancos berpeluang besar mengambil alih posisi runner-up dari tangan Atletico Madrid.Madrid saat ini ada di peringkat ketiga dengan 54 poin. Mereka cuma berjarak dua angka dari Atletico setelah tim arahan Diego Simeone itu kalah dari Athletic Bilbao di laga terakhir.Sementara itu, Atletico sendiri akan menghadapi laga tricky di markas Deportivo Alaves. Deportivo Alaves, yang kini menempati peringkat kelima klasemen dengan 44 poin, punya kans menembus empat besar karena cuma selisih dua angka dari Getafe. (nds/din) barcelona real madrid espanyol liga spanyol","Derby Catalan dan Kesempatan Madrid Lanjutkan Momentum Positif"
"dict","sport","","Servis Aneh Petenis Ini Bikin Penonton Terpana"
"dict","sport","","Seberapa Dekat 'The Daddies' dengan Anaknya"
"dict","sport","","Datangkan Lucas Hernandez, Bayern Habiskan Rp 1,2 Triliun"
"dict","sport","","Water Run Peringati Hari Air Sedunia"
"dict","hot","Jakarta - Gisella Anastasia masih menjadi bahan perbincangan netizen. Kali ini soal penampilannya di atas panggung saat sedang bernyanyi.Di akun gosip igtainmentt, ada postingan video Gisel yang sedang manggung di tempat hiburan Golden Crown, Mangga Besar, Jakarta Barat. Di situ, pakaian yang dikenakan ibunda Gempita Nora Marten tersebut begitu seksi.Gisel memakai mini dress ketat dengan belahan dada yang rendah. Dia asyik menyanyikan lagu 'Havana' dari Camilla Cabello. googletag.cmd.push(function() { googletag.display('div-gpt-ad-1535944650921-0'); }); Saat membawakan lagu itu, eks istri Gading Marten tersebut begitu asyik berjoget. Bahkan pakaian yang dikenakan itu hampir melorot, sebelum berusaha dibetulkan olehnya.""Uwoowww mama isel seksehh bingits sih mam,"" tulis akun gosip dalam postingan itu, saat dikutip detikHOT, Kamis (28/3/2019).Gisel. Foto: Instagram IgtainmenttBaca juga: Cerita Antara Gading, Gisel, dan WijinNetizen yang melihat aksi Gisel dengan pakaian seksi itu pun merasa tak habis pikir.""Kok jadi semakin gini yah,"" komen akun @tantri**njung.""Itu sambil benerin biar gak melorot,"" timpal @dee**mr.""Duh makin liarr,"" sahut @_kira**aaa_. (mau/doc) gisel gisella anastasia seksi baju seksi gempita nora marten gading marten Photo Gallery 1 on-stage 18 Jam di Jakarta, Lihat Aksi Dua Lipa Semalam Yuk! on-stage 18 Jam di Jakarta, Lihat Aksi Dua Lipa Semalam Yuk! on-stage 18 Jam di Jakarta, Lihat Aksi Dua Lipa Semalam Yuk! on-stage 18 Jam di Jakarta, Lihat Aksi Dua Lipa Semalam Yuk! on-stage 18 Jam di Jakarta, Lihat Aksi Dua Lipa Semalam Yuk! on-stage 18 Jam di Jakarta, Lihat Aksi Dua Lipa Semalam Yuk! on-stage 18 Jam di Jakarta, Lihat Aksi Dua Lipa Semalam Yuk! on-stage 18 Jam di Jakarta, Lihat Aksi Dua Lipa Semalam Yuk! on-stage 18 Jam di Jakarta, Lihat Aksi Dua Lipa Semalam Yuk! 1 celeb Penampilan Seksi Cinta Laura dengan Dress Hitam celeb Penampilan Seksi Cinta Laura dengan Dress Hitam celeb Penampilan Seksi Cinta Laura dengan Dress Hitam celeb Penampilan Seksi Cinta Laura dengan Dress Hitam celeb Penampilan Seksi Cinta Laura dengan Dress Hitam celeb Penampilan Seksi Cinta Laura dengan Dress Hitam 2 celeb 'Rumput Tetangga' Jadi Film Terakhir Kirana Larasati? celeb 'Rumput Tetangga' Jadi Film Terakhir Kirana Larasati? celeb 'Rumput Tetangga' Jadi Film Terakhir Kirana Larasati? celeb 'Rumput Tetangga' Jadi Film Terakhir Kirana Larasati? celeb 'Rumput Tetangga' Jadi Film Terakhir Kirana Larasati? celeb 'Rumput Tetangga' Jadi Film Terakhir Kirana Larasati? celeb 'Rumput Tetangga' Jadi Film Terakhir Kirana Larasati? 3 on-stage Pesona Pianis Seksi Idola Donald Trump on-stage Pesona Pianis Seksi Idola Donald Trump on-stage Pesona Pianis Seksi Idola Donald Trump on-stage Pesona Pianis Seksi Idola Donald Trump on-stage Pesona Pianis Seksi Idola Donald Trump on-stage Pesona Pianis Seksi Idola Donald Trump on-stage Pesona Pianis Seksi Idola Donald Trump on-stage Pesona Pianis Seksi Idola Donald Trump 4 celeb Jennifer Coppen yang Makin Dewasa celeb Jennifer Coppen yang Makin Dewasa celeb Jennifer Coppen yang Makin Dewasa celeb Jennifer Coppen yang Makin Dewasa celeb Jennifer Coppen yang Makin Dewasa celeb Jennifer Coppen yang Makin Dewasa 5 celeb Gaya Seksi Jessica Iskandar di Insert Fashion Awards 2019 celeb Gaya Seksi Jessica Iskandar di Insert Fashion Awards 2019 celeb Gaya Seksi Jessica Iskandar di Insert Fashion Awards 2019 celeb Gaya Seksi Jessica Iskandar di Insert Fashion Awards 2019 celeb Gaya Seksi Jessica Iskandar di Insert Fashion Awards 2019 celeb Gaya Seksi Jessica Iskandar di Insert Fashion Awards 2019 6 celeb Seksinya Bella Thorne dengan Mini Dress Hitam celeb Seksinya Bella Thorne dengan Mini Dress Hitam celeb Seksinya Bella Thorne dengan Mini Dress Hitam celeb Seksinya Bella Thorne dengan Mini Dress Hitam celeb Seksinya Bella Thorne dengan Mini Dress Hitam celeb Seksinya Bella Thorne dengan Mini Dress Hitam 7 celeb Melihat Pesona Model Seksi yang di-DM Vicky Prasetyo celeb Melihat Pesona Model Seksi yang di-DM Vicky Prasetyo celeb Melihat Pesona Model Seksi yang di-DM Vicky Prasetyo celeb Melihat Pesona Model Seksi yang di-DM Vicky Prasetyo celeb Melihat Pesona Model Seksi yang di-DM Vicky Prasetyo 8 celeb Ini Model Seksi yang Dikirimi Pesan Nakal oleh Cristiano Ronaldo celeb Ini Model Seksi yang Dikirimi Pesan Nakal oleh Cristiano Ronaldo celeb Ini Model Seksi yang Dikirimi Pesan Nakal oleh Cristiano Ronaldo celeb Ini Model Seksi yang Dikirimi Pesan Nakal oleh Cristiano Ronaldo celeb Ini Model Seksi yang Dikirimi Pesan Nakal oleh Cristiano Ronaldo celeb Ini Model Seksi yang Dikirimi Pesan Nakal oleh Cristiano Ronaldo celeb Ini Model Seksi yang Dikirimi Pesan Nakal oleh Cristiano Ronaldo 9 celeb Penampilan Menggoda Candice Swanepoel celeb Penampilan Menggoda Candice Swanepoel celeb Penampilan Menggoda Candice Swanepoel celeb Penampilan Menggoda Candice Swanepoel celeb Penampilan Menggoda Candice Swanepoel 10 on-stage Penampilan Menggoda Taylor Swift di iHeartRadio Awards 2019 on-stage Penampilan Menggoda Taylor Swift di iHeartRadio Awards 2019 on-stage Penampilan Menggoda Taylor Swift di iHeartRadio Awards 2019 on-stage Penampilan Menggoda Taylor Swift di iHeartRadio Awards 2019 on-stage Penampilan Menggoda Taylor Swift di iHeartRadio Awards 2019 on-stage Penampilan Menggoda Taylor Swift di iHeartRadio Awards 2019 11 celeb Wulan Guritno, Nggak Bosen Cantik Terus? celeb Wulan Guritno, Nggak Bosen Cantik Terus? celeb Wulan Guritno, Nggak Bosen Cantik Terus? celeb Wulan Guritno, Nggak Bosen Cantik Terus? celeb Wulan Guritno, Nggak Bosen Cantik Terus? celeb Wulan Guritno, Nggak Bosen Cantik Terus? celeb Wulan Guritno, Nggak Bosen Cantik Terus? 12 celeb Disebut Dekat dengan Jerinx SID, Kenalan dengan Nora Alexander Yuk! celeb Disebut Dekat dengan Jerinx SID, Kenalan dengan Nora Alexander Yuk! celeb Disebut Dekat dengan Jerinx SID, Kenalan dengan Nora Alexander Yuk! celeb Disebut Dekat dengan Jerinx SID, Kenalan dengan Nora Alexander Yuk! celeb Disebut Dekat dengan Jerinx SID, Kenalan dengan Nora Alexander Yuk! celeb Disebut Dekat dengan Jerinx SID, Kenalan dengan Nora Alexander Yuk! celeb Disebut Dekat dengan Jerinx SID, Kenalan dengan Nora Alexander Yuk! 13 celeb Nia Ramadhani dan Jessica Iskandar, Dua Host Kece nan Seksi celeb Nia Ramadhani dan Jessica Iskandar, Dua Host Kece nan Seksi celeb Nia Ramadhani dan Jessica Iskandar, Dua Host Kece nan Seksi celeb Nia Ramadhani dan Jessica Iskandar, Dua Host Kece nan Seksi celeb Nia Ramadhani dan Jessica Iskandar, Dua Host Kece nan Seksi celeb Nia Ramadhani dan Jessica Iskandar, Dua Host Kece nan Seksi 14 celeb Penampilan Gigi Hadid di Paris Fashion Week Usai Bikin Heboh celeb Penampilan Gigi Hadid di Paris Fashion Week Usai Bikin Heboh celeb Penampilan Gigi Hadid di Paris Fashion Week Usai Bikin Heboh celeb Penampilan Gigi Hadid di Paris Fashion Week Usai Bikin Heboh celeb Penampilan Gigi Hadid di Paris Fashion Week Usai Bikin Heboh celeb Penampilan Gigi Hadid di Paris Fashion Week Usai Bikin Heboh celeb Penampilan Gigi Hadid di Paris Fashion Week Usai Bikin Heboh 15 celeb Astrid Tiar Bicara soal Bahagia dan Tambah Anak celeb Astrid Tiar Bicara soal Bahagia dan Tambah Anak celeb Astrid Tiar Bicara soal Bahagia dan Tambah Anak celeb Astrid Tiar Bicara soal Bahagia dan Tambah Anak celeb Astrid Tiar Bicara soal Bahagia dan Tambah Anak celeb Astrid Tiar Bicara soal Bahagia dan Tambah Anak 16 red-carpet Sexy In Black! Pesona Rita Ora dengan Gown Semi Transparan red-carpet Sexy In Black! Pesona Rita Ora dengan Gown Semi Transparan red-carpet Sexy In Black! Pesona Rita Ora dengan Gown Semi Transparan red-carpet Sexy In Black! Pesona Rita Ora dengan Gown Semi Transparan red-carpet Sexy In Black! Pesona Rita Ora dengan Gown Semi Transparan 17 red-carpet Gaya Seksi Emma Roberts dengan Dress Menerawang red-carpet Gaya Seksi Emma Roberts dengan Dress Menerawang red-carpet Gaya Seksi Emma Roberts dengan Dress Menerawang red-carpet Gaya Seksi Emma Roberts dengan Dress Menerawang red-carpet Gaya Seksi Emma Roberts dengan Dress Menerawang 18 celeb Berusia 53 Tahun, Cindy Crawford Masih Layak Disebut Hot Mom? celeb Berusia 53 Tahun, Cindy Crawford Masih Layak Disebut Hot Mom? celeb Berusia 53 Tahun, Cindy Crawford Masih Layak Disebut Hot Mom? celeb Berusia 53 Tahun, Cindy Crawford Masih Layak Disebut Hot Mom? celeb Berusia 53 Tahun, Cindy Crawford Masih Layak Disebut Hot Mom? celeb Berusia 53 Tahun, Cindy Crawford Masih Layak Disebut Hot Mom? celeb Berusia 53 Tahun, Cindy Crawford Masih Layak Disebut Hot Mom? celeb Berusia 53 Tahun, Cindy Crawford Masih Layak Disebut Hot Mom? celeb Berusia 53 Tahun, Cindy Crawford Masih Layak Disebut Hot Mom? 19 red-carpet Saat si Seksi Dua Lipa tampil dengan Plunging Dress red-carpet Saat si Seksi Dua Lipa tampil dengan Plunging Dress red-carpet Saat si Seksi Dua Lipa tampil dengan Plunging Dress red-carpet Saat si Seksi Dua Lipa tampil dengan Plunging Dress red-carpet Saat si Seksi Dua Lipa tampil dengan Plunging Dress red-carpet Saat si Seksi Dua Lipa tampil dengan Plunging Dress 20 1","Seksinya Pakaian Gisel saat Manggung, hingga Nyaris Melorot"
"dict","sport","","Perjalanan Karier Conor McGregor di Tarung MMA"
"dict","finance","Jakarta - IHSG ditutup melemah di level 6,444.73 (-0.39%). Pelemahan didorong oleh sektor Basic Ind (-1.19%) dan sektor Mining (-0.84%). Pelemahan diakibatkan oleh profit taking dimana penguatan kemarin dinilai cukup tinggi diakibatkan oleh banyaknya ketidakpastian global.Bursa Amerika Serikat ditutup Melemah. Dow Jones ditutup 25,625.29 (-0.12%), NASDAQ ditutup 7,643.38 (-0.63%), S&P 500 ditutup 2,805.37 (-0.46%). googletag.cmd.push(function() { googletag.display('div-gpt-ad-1535944306169-0'); }); Indeks-indeks acuan berguguran setelah para investor lebih memilih menempatkan dananya di obligasi pemerintah di tengah kekhawatiran akan melambatnya perekonomian. Para investor menaruh perhatian besar terhadap suku bunga obligasi setelah yield surat utang bertenor 10 tahun berada di bawah tenor 3 bulan (inversi yield) yang dipandang sebagai pertanda akan datangnya resesi. Para investor lebih memilih obligasi setelah data ekonomi yang dirilis lebih lemah dari perkiraan.IHSG diprediksi menguat. Pergerakan diperkirakan masih cukup fluktuatif dipengaruhi oleh ketidakpastian dari faktor global. Secara teknikal peluang penguatan masih terbuka dan ada potensi akan menutup gap terdekat di sekitar area 6,500. Optimisme investor diperkirakan akan semakin membaik menyambut periode pembagian dividen.Resistance 2 : 6,499Resistance 1 : 6,471Support 1 : 6,429Support 2 : 6,415 (eds/eds) ihsg","Artha Sekuritas: IHSG Intip Peluang Menguat"
