"_type","category","isi","judul"
"dict","sport","Jakarta - Anggota Komite Eksekutif (Exco) bidang Hukum PSSI, Gusti Randa mendapat perlakuan istimewa dari Pelaksana Tugas Ketua Umum PSSI Joko Driyono. Beberapa hari sebelum dirinya ditahan polisi pada Senin (25/3), dia memberi penugasan khusus kepada Gusti. Tugas dimaksud adalah untuk menjalankan roda organisasi sehari-hari dan menyiapkan Kongres Luar Biasa (KLB) PSSI.Baca juga: Gusti Randa: KLB PSSI Agustus 2019[Gambas:Video 20detik]Keputusan Joko itu mengherankan sejumlah pihak, mengingat secara struktural di PSSI masih ada posisi wakil ketua umum yang dijabat Iwan Budianto. Tapi Gusti menyebut hal itu sepenuhnya merupakan kewenangan Joko. Lagi pula, secara internal dalam kondisi seperti sekarang ini para pengurus yang lain tak mempersoalkannya. googletag.cmd.push(function() { googletag.display('div-gpt-ad-1535945694694-0'); }); ""Saya menerima saja dan mencoba menjalankan amanat ini sebaik mungkin,"" kata Gusti Randa kepada detikcom.Dia memperkirakan, KLB untuk memilih kembali ketua umum PSSI yang definitif pada Agustus mendatang. Agar pelaksanaan KLB berlangsung kredibel dan kepengurusan yang baru nantinya benar-benar legitimate, Gusti berharap semua pihak mau mematuhi segenap aturan yang ada. ""Jangan ada lagi utak-atik aturan sehingga orang baru bisa begitu saja masuk memimpin PSSI seperti di masa lalu,"" katanya.Baca juga: Jadi Ketum PSSI Enggak Bisa Disambi, Gusti Randa Tak MinatLelaki kelahiran 15 Agustus 1965 itu memastikan dirinya tahu diri dan tak punya ambisi untuk menjadi ketua umum PSSI. Gusti menyebut beberapa hal yang sebaiknya dipenuhi oleh seorang calon ketua umum, yakni tidak merangkap jabatan dan punya banyak duit.""Ibaratnya di PSSI itu kerja 36 jam sehari, dan harus punya duit karena organisasi ini tidak banyak menerima duit dari APBN,"" kata Gusti.Gusti yang namanya melambung lewat peran Samsul Bahri di sinetron Siti Nurbaya pada awal 1990-an itu mengaku dirinya rugi banyak dengan menjadi pengurus PSSI. Selain banyak waktu tersita, sejatinya dia dan para pengurus PSSI itu tak menerima gaji seperti yang diperkirakan banyak orang.""Jadi kalau ada yang bilang korupsi, apa yang dikorupsi karena aktivitas PSSI kebanyakan tak dibiayai APBN,"" kata dia tegas.Andai tak lagi menjadi pengurus PSSI, Gusti menyebut dirinya akan kembali berkonsentrasi mengelola kantor pengacara dan rumah produksinya. (erd/raw) gusti randa joko driyono pssi ketua umum pssi","Blak Blakan Gusti Randa: Banyak Rugi Jadi Pengurus PSSI"
"dict","finance","Jakarta - Amerika Serikat (AS) kini sedang terancam dilanda resesi. Hal ini ditandai dengan meningkatnya harga emas namun terjadi tekanan pada harga logam industri. Hingga obligasi pemerintah yang imbal hasilnya merangkak naik. Jika AS Resesi, apakah benar akan berdampak ke negara-negara lain termasuk Indonesia?Berikut berita selengkapnya: (ang/ang) ekonomi as resesi Sebelumnya Ini Kerugian Warga AS Karena Pemerintahan Tutup 16 Hari 1 / 4 Selanjutnya Ancaman Resesi","Ekonomi AS Terancam Resesi, Berimbas ke RI?"
"dict","sport","Jakarta - Louis van Gaal mengakui memilih menangani Manchester United mungkin bukan keputusan yang tepat. Dia menyebut Tottenham Hotspur adalah opsi yang lebih baik.Louis van Gaal telah memutuskan pensiun dari dunia sepakbola akhir bulan lalu. Ia mengakhiri perjalanan karier hampir 28 tahun sebagai pelatih.Baca juga: Van Gaal: MU-nya Solskjaer Bukan seperti Ferguson, tapi Mourinho googletag.cmd.push(function() { googletag.display('div-gpt-ad-1535945694694-0'); }); Dari seperempat abad lebih sebagai pelatih, menangani MU jadi salah satu pengalamannya. Memilih MU adalah sebuah pilihan hati, karena Tottenham juga sempat menawarinya posisi sebagai manajer. Tapi Van Gaal kini mengungkapkan, bahwa secara komposisi tim, Tottenham saat itu sebenarnya lebih baik.""Tottenham adalah pilihan yang lebih baik saat itu karena Manchester United adalah tim yang berisi pemain-pemain tua dan saya saat itu tahu bahwa saya harus mengubah mereka,"" kata Van Gaal kepada BBC.Baca juga: Herrera Enggan Bandingkan Mourinho dengan Solskjaer""Apakah itu pilihan yang salah? Mungkin, tetapi saya mengikuti kata hati saya. Saya sebelumnya bekerja di tim nomor satu di Belanda, Jerman, Spanyol dan sekarang juga di Inggris.""Van Gaal hanya bertahan dua tahun di Old Trafford, dipecat dua hari setelah memenangi Piala FA pada 2016. Posisinya kemudian digantikan oleh Jose Mourinho.Usai dipecat oleh MU, pria kelahiran Amsterdam ini menganggur selama tiga tahun sebelum akhirnya memutuskan untuk pensiun. Sementara Spurs yang ditolak oleh Van Gaal kemudian memutuskan menunjuk Mauricio Pochettino.Baca juga: MU Disebut Tertarik Sancho, Dortmund: Kabar yang Tak RelevanPochettino hanya mengantarkan Tottenham finis kelima di Premier League pada musim pertamanya, tapi kemudian selalu finis empat besar di tiga tahun berikutnya. Tren itu berlanjut hingga musim ini. (raw/yna) louis van gaal manchester united tottenham hotspur","Van Gaal: Mungkin Ku Salah Dulu Lebih Pilih MU ketimbang Tottenham"
"dict","sport","Jakarta - Kondisi Marc Marquez terus meningkat, menyusul operasi bahu pada Desember tahun lalu. Jagoan Repsol Honda itu sudah bisa beraksi lagi di lintasan motocross.Marquez mengawali MotoGP musim 2019 dengan kondisi tak optimal. Sisa-sisa operasi bahu bulan Desember lalu membuatnya belum mencapai kondisi 100 persen.Baca juga: Rossi vs Marquez Panas Lagi di MotoGP Argentina? googletag.cmd.push(function() { googletag.display('div-gpt-ad-1535945783791-0'); }); Meski begitu, Marquez menyuguhkan penampilan tangguh di MotoGP Qatar dan bertarung ketat dengan Andrea Dovizioso. Marquez memang pada akhirnya kalah dari Dovizioso dan finis kedua, tapi dia menunjukkan kondisinya tak menghalanginya untuk melesat.Menuju MotoGP Argentina pada 31 Maret ini, Marquez semakin siap tempur. Pebalap 26 tahun itu bahkan sudah kebut-kebutan di lintasan motocross untuk melatih kekuatan bahunya.Baca juga: Jadwal MotoGP ArgentinaJuara bertahan MotoGP ini optimistis memburu hasil terbaik di Argentina.""Periode antara dua balapan ini sudah berjalan bagus, saya bisa kembali berlatih dengan motor motocross dan merasa percaya diri untuk balapan ini,"" ungkapnya dilansir Crash.""Kami memulai dengan baik di Qatar dan berjuang sampai akhir untuk kemenangan. Targetnya tentu saja untuk melakukan hal yang sama di Argentina dan memetik poin sebanyak mungkin,"" imbuh Marquez.Baca juga: Satu-satunya Kecelakaan yang Bikin Marquez Takut (raw/yna) marc marquez repsol honda motogp argentina","Sudah Beraksi di Lintasan Motocross, Marc Marquez Pede Tatap Argentina"
"dict","sport","Jakarta - Pelatih Brunei Darussalam U-23 Stephen Ng Heng Seng menilai timnya dan Indonesia ada di level yang sama. Itu setelah timnas U-23 Indonesia cuma menang 2-1 atas Brunei.Brunei dan Indonesia saling berhadapan di laga terakhir Kualifikasi Piala Asia U-23. Brunei kalah 1-2 dalam laga yang berlangsung di My Dinh Stadium, Selasa (26/3/2019) sore WIB.Baca juga: Indonesia Susah Payah Kalahkan Brunei googletag.cmd.push(function() { googletag.display('div-gpt-ad-1535945694694-0'); }); Hasilnya sebenarnya bisa saja imbang. Di menit-menit akhir, Brunei sempat mendapatkan penalti namun dengan gemilang dipatahkan oleh Dimas Drajad, penyerang timnas Indonesia yang alih posisi jadi kiper.Meski demikian, apapun hasil di laga ini tak berpengaruh untuk kedua tim. Brunei dan Indonesia sudah dinyatakan gagal ke babak utama Piala Asia U-23 2020 di Thailand, setelah kalah di dua laga sebelumnya.""Sebenarnya Brunei dan Indonesia, bagi saya, sama. Indonesia cuma unggul secara individu dan pengalaman, dan Anda bisa melihat bagaimana mereka main. Tapi kami bisa menghentikan mereka, hanya membiarkan mereka mencetak dua gol. Di masa depan, kami percaya hasilnya bisa mengimbangi mereka,"" kata Stephen Ng Heng Seng.Baca juga: Susah Bobol Gawang Brunei, Indonesia Kurang SabarIndonesia datang ke babak kualifikasi dengan modal juara di Piala AFF U-22 pada Februari. Keberhasilan itu tak berarti apa-apa lantaran pelatih Indra Sjafri gagal mencapai salah satu target PSSI, yakni lolos ke Piala Asia.""Ya, kalau dilihat, AFF dan AFC itu berbeda. Jadi, saya tidak bisa komentar banyak soal performa Indonesia. Anda bisa lihat cara mereka bermain,"" Stephen Ng Heng Seng menambahkan.Baca juga: Dimas Drajad Vs Brunei: Cetak Gol, Jadi Kiper, Tepis Penalti (ran/raw) timnas indonesia u-23 timnas u-23 timnas indonesia u-23 vs brunei darussalam brunei darussalam kualifikasi piala asia u-23 2020","Pelatih Brunei: Kami dan Indonesia Selevel"
"dict","finance","",""
"dict","finance","Jakarta - Tarif moda raya terpadu (MRT) Jakarta sudah ditetapkan. Besaran tarif yang ditetapkan tersebut adalah Rp 10.000/10 km (proyeksi rata-rata perjalanan). Dengan demikian, maka jika perjalanan dilakukan dari Stasiun Lebak Bulus-Bundaran HI sebesar Rp 14.000.Berdasarkan polling yang dilakukan detikFinance, sebanyak 179 responden mengatakan bahwa besaran tarif tersebut mahal. Hadi Wijaya berkomentar bahwa seharusnya tarif terjauhnya ditetapkan sebesar Rp 10.000 agar masyarakat beralih menggunakan transportasi publik tersebut. Evaluasi tarif selanjutnya bisa dilakukan tiga tahun berikutnya. ""Untuk tarif terjauhnya yg 14 ribu mahal tuh, mestinya untuk awal2 ini maksimal 10 ribu sbg cara untuk menarik minat warga agar mau beralih ke MRT meninggalkan kendaraan pribadinya. Setelah 3 thn baru deh bisa dievaluasi lg,"" tulisnya dikutip detikFinance, Rabu (27/3/2019).Pembaca lainnya yang merasa keberatan dengan tarif MRT Jakarta, Alfan Khoir mengatakan bahwa besaran tersebut belum tepat. Pasalnya perlu upaya agar masyarakat mau beralih menggunakan transportasi umum.""Kalau menurutku mungkin harga segitu belum tepat untuk merubah beberapa pola fikir masyarakat untuk beralih menggunakan transportasi umum. Kalau bisa digratisin,"" tulisnya.Sukiswanto juga menyatakan bahwa tarif MRT Jakarta terbilang mahal bagi kelas menengah ke bawah.""Mahal untuk kalangan kelas bawah. Seharusnya d kaji ulang biar bisa mengurangi kemacetan Jakarta,"" katanya. (ara/dna) mrt mrt jakarta tarif mrt jakarta","Warga yang Sebut Tarif MRT Jakarta Mahal: Harusnya Maksimal Rp 10.000"
"dict","sport","Parma - Dengan banyak pemain muda, Italia mengawali Kualifikasi Piala Eropa 2020 dengan sempurna. Italia saat ini diyakini telah mengembalikan antusiasme suporter.Italia melewati dua pertandingan pertama di Grup J Kualifikasi Piala Eropa 2020 dengan kemenangan. Usai menang 2-0 atas Finlandia, Gli Azzurri melumat Liechtenstein di Ennio Tardini, Rabu (27/3/2019) dini hari WIB, dengan skor telak 6-0.Dalam dua pertandingan tersebut, Italia banyak diperkuat pemain muda. Sebut saja Moise Kean, Nicolo Zaniolo, Gianluca Mancini, sampai Stefano Sensi. googletag.cmd.push(function() { googletag.display('div-gpt-ad-1535945694694-0'); }); Kean, misalnya, menandai debutnya di timnas senior Italia spesial. Penyerang berusia 19 tahun itu menjadi pencetak gol termua kedua di sepanjang sejarah Italia usai menjebol gawang Finlandia. Sensi, 23 tahun, juga bikin gol di laga debutnya dalam pertandingan melawan Liechtenstein.Baca juga: Galaknya Italia Lawan Liechtenstein: 41 Shot, 12 On Target, 6 GolDua kemenangan yang diraih dengan komposisi tim yang baru itu diyakini Verratti telah membuat suporter kembali antusias menyaksikan timnas. Gelandang berusia 26 tahun itu menyebut kembalinya semangat suporter penting usai kegagalan Italia ke Piala Dunia 2018.""Ini adalah dua pertandingan berat, khususnya karena kami tidak boleh kehilangan poin di dua laga kandang pertama,"" ujar Verratti kepada Rai Sport seperti dilansir Football Italia.""Dua penampilan yang sangat bagus juga dan kami senang dengan hasilnya,"" lanjut pemain Paris Saint-Germain itu.""Kami bilang kepada diri kami sendiri bahwa setelah gagal ke Piala Dunia, hal pertama yang harus kami lakukan adalah menciptakan kembali ikatan dengan fans, mengembalikan antusiasme mereka ke timnas, dan menjadikannya sebagai tim yang didukung semua orang,"" katanya.Baca juga: Ada Peran Cristiano Ronaldo di Balik Torehan Rekor Moise Kean (nds/din) timnas italia kualifikasi piala eropa 2020","Wajah Baru Italia Mengembalikan Antusiasme Fans"
"dict","sport","Milan - Neymar diketahui sempat berkunjung ke Milan Ada urusan penyerang Paris Saint-Germain itu datang ke Italia?Tenang, kedatangan Neymar ke Milan bukan perihal transfer kok. Pesepakbola termahal di dunia itu cuma kedapatan berkunjung ke restoran milik wakil presiden Inter Milan, Javier Zanetti.Sebagaimana dilansir Calciomercato, Neymar mengunjungi Botinero, restoran yang dikelola Zanetti. Pesepakbola Brasil itu datang bersama rekan-rekannya.Baca juga: Neymar Sedang Negosiasikan Kontrak Baru dengan PSG googletag.cmd.push(function() { googletag.display('div-gpt-ad-1535945694694-0'); }); Diketahui, Neymar menghabiskan satu setengah jam di Botinero. Dalam video, ia tampak melihat-lihat restoran itu. Setelahnya, ia pun meninggalkan tempat itu.Neymar pun menyampaikan ucapan terima kasihnya kepada Zanetti atas sambutannya. ""Terima kasih untuk semuanya, ini benar-benar sebuah kenikmatan,"" kata Neymar.""Kenikmatan yang sebenarnya, sampai jumpa lagi,"" Zanetti membalas.Neymar saat ini sedang cedera. Penyerang 27 tahun itu disebut sedang berada di Milan karena urusan bisnisnya, sehingga menyempatkan berkunjung ke restoran Zanetti.[Gambas:Instagram]Baca juga: PSG Akan Buru Griezmann Jika Neymar atau Mbappe Dilego (yna/raw) neymar javier zanetti","Neymar Berkunjung ke Milan, Untuk Apa?"
"dict","sport","Dublin - Conor McGregor dikabarkan tengah tersangkut kasus hukum akibat pelecehan seksual yang dia lakukan. Masalah ini juga lah yang membuat dia tiba-tiba pensiun.Dikutip dari Bleacher Report, seorang wanita melaporkan McGregor atas kasus pelecehan seksual yang terjadi di Dublin pada Desember 2018. McGregor sempat ditanyai polisi pada Januari tahun ini, namun kemudian dibebaskan dengan jaminan.Namun begitu, sampai kini mantan petarung UFC berusia 30 tahun itu hingga kini belum menerima dakwaan resmi. googletag.cmd.push(function() { googletag.display('div-gpt-ad-1535945783791-0'); }); Baca juga: Conor McGregor Pensiun dari Tarung MMAKasus pelecehan seksual ini kemudian dikait-kaitkan dengan keputusan pensiun atlet asal Irlandia itu. Juru bicara McGregor menyangkalnya.""Cerita ini sudah berkembang beberapa waktu dan tidak jelas kenapa baru diberitakan sekarang. Asumsi bahwa Conor pensiun karena terkait rumor ini tidaklah benar,"" ungkap juru bicara McGregor, Karen Kessler.Pelecehan seksual tersebut diduga terjadi di Hotel Beacon, Dublin. Pada 8 Desember 2018 McGregor memang menginap di sana.Baca juga: McGregor Pensiun, Dendamnya pada Khabib Nurmagomedov Tak TerbalasKepolisian kabarnya sudah mengambil barang bukti dari kamar McGregor, serta mendapatkan potongan gambar dari kamera keamanan hotel. McGregor pada Selasa (26/3/2019) kemarin tiba-tiba menyatakan pensiun dari Mixed Martial Art. Dia melakoni pertandingan terakhirnya menghadapi Khabib Nurmagomedov dan menderita kekalahan. McGregor sebenarnya sempat menyatakan keinginan untuk rematch, namun dia malah memilih pensiun. (din/nds) conor mcgregor conor mcgregor pensiun pelecehan seksual","Conor McGregor Tersangkut Kasus Pelecehan Seksual"
"dict","sport","Jakarta - Pengadilan Banding MotoGP akhirnya membuat keputusan terkait winglet kontroversial milik Ducati. Komponen tersebut dinyatakan legal, alias sah.Terdiri dari tiga hakim, Pengadilan Banding MotoGP pada sidang yang dilakukan Selasa (26/3/2019) waktu setempat memutuskan winglet milik Ducati sah dan tidak menyalahi aturan. Demikian dikutip dari Crash.Tiga motor Ducati yang ditunggangi Andrea Dovizioso, Danilo Petrucci, dan Jack Miller menggunakan komponen anyar di bagian depan ban belakang. Itu kemudian memicu protes dari empat tim (Aprilia, KTM, Honda, dan Suzuki) karena menganggap winglet tersebut ilegal. googletag.cmd.push(function() { googletag.display('div-gpt-ad-1535945783791-0'); }); Baca juga: Ducati Dituding Pakai Komponen Ilegal, Kemenangan Dovizioso DigugatSetelah protes pertama yang diajukan di Panel Steward dimentahkan, tim-tim tersebut kemudian membawanya ke Pengadilan Banding MotoGP.Perdebatan utama terkait winglet itu adalah klaim Ducati bahwa perangkat tersebut hanya membantu mendinginkan ban. Sementara empat tim yang protes menilai ada potensi perangkat itu menunjang aerodinamis motor.""Tim-tim yang melakukan protes menganggap perangkat tersebut punya fungsi utama sebagai sebuah perlengkapan aerodinamis dan karenanya tidak sejalan dengan regulasi teknis MotoGP,"" demikian pernyataan Pengadilan Banding MotoGP.Baca juga: 3 Perkiraan Putusan Sidang soal Komponen Ducati yang DiprotesSementara itu, Tim Manajer Suzuki, Davide Brivio, menyangkal kalau mereka berniat mencabut kemenangan Andrea Dovizioso di Qatar. Protes yang diajukan semata ingin mendapat kejelasan aturan, regulasi, dan panduan yang pasti tentang perangkat tersebut.""Dengan mengajukan protes ini kami memaksa mereka melakukan evaluasi, untuk memberi keputusan, dan untuk mengklarifikasi prinsip aturannya, regulasinya, dan aturan mainnya. Ini adalah tujuan utama aksi kami: mendapat kejelasan kenapa kami bisa dan kami tidak bisa melakukan sesuatu,"" papar Brivio.Selain memutuskan komponen Ducati legal, Pengadilan Banding MotoGP juga menyatakan wingelt tersebut akan bisa digunakan pada seri-seri berikutnya. Sedangkan kemenangan Dovi adalah final dan tak bisa diganggu-gugat.Baca juga: Jadwal MotoGP ArgentinaMasih dikutip dari Crash, winglet di depan ban belakang Ducati bekerja sebagai sebuah kesatuan dengan komponen aero di bagian depan, yang berguna untuk mengoptimalkan aliran udara ke bagian belakang motor.Dengan menempatkan winglet tersebut di swingarm, Ducati berhasil mengakali aturan 'Aero Body', yang membatasi setiap pebalap hanya sekali melakukan update pada fairing motornya per musim. (din/rin) motogp ducati motogp qatar winglet belakang ducati winglet ducati","Winglet Ducati Diputuskan Sah, Dovizioso Tetap Juara MotoGP Qatar"
"dict","sport","Madrid - Paul Pogba tengah ramai dikaitkan dengan kepindahan ke Real Madrid dan Juventus. Pogba mematok gaji sebesar 16 juta euro per tahun (Rp 256 miliar) per tahun.Masa depan Pogba di Manchester United diragukan, setelah berkomentar bahwa Madrid adalah klub impian setiap orang. Gelandang andalan timnas Prancis itu bahkan disebut telah menolak tawaran kontrak baru dari klub, padahal kontraknya akan habis pada 2021.Baca juga: Juve Akan Saingi Madrid untuk PogbaMedia-media Spanyol mengabarkan bahwa Madrid akan menjadi opsi pertama Pogba di musim panas ini. Agen Pogba, Mino Raiola, disebut-sebut mulai mencari cara untuk mengeluarkan kliennya dari Old Trafford. googletag.cmd.push(function() { googletag.display('div-gpt-ad-1535945694694-0'); }); Namun, Madrid tidak akan sendirian berburu Pogba. Juventus, juga tertarik untuk memboyong Pogba kembali ke Turin sejak dilego ke MU pada 2016.Baca juga: Pogba Serius Ingin Bermain di MadridBianconeri dilaporkan bahwa saat ini mereka sedang memikirkan langkah-langkah untuk membiayai transfer Pogba. Agen Pogba, Mino Raiola, telah menetapkan standar gaji kliennya sebesar 16 juta euro per tahun. Dengan tujuan, klub-klub peminat Pogba tahu apa yang akan dihadapi andai melakoni duel tawaran di musim panas ini. Andai nantinya berlabuh di Santiago Bernabeu, Pogba akan memiliki gaji di atas Gareth Bale (14 juta euro) dan Sergio Ramos (11 juta euro). Demikian diwartakan Tuttosport.Puji Zidane, Pogba Mau ke Madrid? Simak Videonya:[Gambas:Video 20detik] (rin/nds) paul pogba juventus real madrid manchester united","Kepada Madrid dan Juve: Pogba Mau Gaji Rp 256 M"
"dict","sport","Jakarta - Komisaris PT Liga Indonesia Baru (LIB), Gusti Randa, kesulitan mendapatkan sponsor untuk Liga 1 2019. Sponsor utama diklaim sudah ada, namun belum klik soal angka.Kompetisi Liga 1 dijadwalkan kick off 8 Mei. Tapi, hingga enam pekan menjelang bergulirnya kompetisi kasta teratas Tanah Air itu, PT LIB belum mengantongi sponsor utama. Sulitnya PT LIB untuk mendapatkan sponsor ditengarai oleh dugaan pengaturan skor yang muncul di Liga 3 dan Liga 2. Bahkan, kasus itu menyeret petinggi PSSI, termasuk anggota komisi disiplin dan anggota komite eksekutif, serta dugaan perusakan barang bukti yang kuat mengarah kepada dugaan pengaturan skor oleh Plt Ketua umum PSSI Joko Driyono. googletag.cmd.push(function() { googletag.display('div-gpt-ad-1535945694694-0'); }); Merujuk musim 2017 dan 2018, PT LIB mendapatkan dana sekitar Rp 180 miliar untuk memutar kompetisi Liga 1. Itupun PT LIB sempat memiliki tunggakan subsidi kepada klub. Baca juga: Blak Blakan Gusti Randa: Banyak Rugi Jadi Pengurus PSSI""Pasti susah, pasti susah. Nah, kami tak tahu juga kita bicara sponsor, bicara duit. Ini kan tahun politik, jadi mungkin duit terserap ke bidang politik,"" kata Gusti dalam perbincangannya dengan detikSport, di ruang kerjanya lantai 14 FX Sudirman, Senin (25/3/2019).""Yang kedua banyak orang wait and see. Karena wait and see tentu mereka membuang untuk iklan hati-hati,"" ujar dia lagi.Namun demikian, Gusti memastikan Liga ke depan akan memiliki sponsor utama.""Enggak (Gojek). Kami lagi gagas sponsor besar perusahaan nasional. Tapi, belum masih persoalan angka. Direksi itu (yang tahu),"" kata dia.""Yang jelas rencana kick off (Liga) 8 Mei. Jadi, April kami sudah verifikasi stadion segala macam. Nah, tanggal 8 Mei itu kami mau pastikan kick off,"" ujarnya.Baca juga: Kalau Tak Urus Sepakbola Lagi, Gusti Randa ke Mana? (mcy/fem) gusti randa blak-blakan gusti randa pt lib liga 1 2019 sponsor liga 1 2019","PT LIB Kesulitan Cari Sponsor Liga 1, Gusti Randa Singgung Tahun Politik"
"dict","sport","Jakarta - Kualifikasi Piala Eropa 2020 sudah menuntaskan dua matchday pertamanya. Berikut hasil pertandingan terakhir yang melibatkan Spanyol dan Italia.Dari Grup F, tim unggulan Spanyol kembali meraih kemenangan usai mengalahkan tuan rumah Malta dengan skor 2-0. Dua gol La Furia Roja dibuat oleh Alvaro Morata.Sementara di Grup J, unggulan lainnya Italia juga menang besar atas Liechtenstein dengan skor 6-0. Mereka pun berdiri kukuh di puncak klasemen dengan enam poin. googletag.cmd.push(function() { googletag.display('div-gpt-ad-1535945694694-0'); }); Baca juga: Hasil Kualifikasi Piala Eropa: Morata Dua Gol, Spanyol Tekuk Malta 2-0Spanyol dan Italia mengikuti langkah tim-tim besar lain yang meraih kemenangan seperti Prancis dan Jerman. Sementara, Portugal langkahnya kembali tersendat dan Belanda menelan kekalahan dari Jerman.Kualifikasi Piala Eropa 2020 akan rehat selama tiga bulan sebelum menghelat dua matchday lagi di bulan Juni.Berikut hasil lengkap Kualifikasi Piala Eropa 2020Grup DRepublik Irlandia 1-0 GeorgiaSwiss 3-3 DenmarkGrup FMalta 0-2 SpanyolNorwegia 3-3 SwediaRumania 4-1 Kepulauan FaroeGrup JArmenia 0-2 FinlandiaBosnia Herzegovina 2-2 YunaniItalia 6-0 LiechtensteinBaca juga: Kualifikasi Piala Eropa: Italia Lumat Liechtenstein 6-0Hasil Pertandingan Uji CobaMaroko 0-1 ArgentinaSenegal 2-1 MaliKorea Selatan 2-1 KolombiaRepublik Ceko 1-3 BrasilParaguay 2-4 MeksikoBaca juga: Laga Persahabatan: Sempat Tertinggal, Brasil Tundukkan Republik Ceko 3-1 (mrp/din) kualifikasi piala eropa 2020 timnas spanyol timnas italia","Hasil Lengkap Kualifikasi Piala Eropa 2020 dan Laga Ujicoba Malam Tadi"
"dict","sport","","Garuda Muda Nyaris Imbang Lawan Brunei"
"dict","sport","Madrid - Satu lagi nama pesepakbola top dikaitkan dengan Real Madrid. Kali ini Miralem Pjanic dikabarkan masuk daftar incaran Zinedine Zidane.Kembalinya Zidane membuat Madrid dikabarkan makin gencar mengejar sejumlah nama besar. Beberapa pemain yang santer dikaitkan dengan Los Blancos belakangan ini adalah Kylian Mbappe dan Eden Hazard.Kini nama Pjanic disebut-sebut juga ada dalam daftar pemain yang diingikan Zidane di bursa transfer musim panas nanti. Tuttosport mengklaim bahwa Zidane sudah meyakinkan Presiden Madrid, Florentino Perez, tentang perlunya mendatangkan gelandang Juventus itu. googletag.cmd.push(function() { googletag.display('div-gpt-ad-1535945694694-0'); }); Baca juga: Mbappe Dikabarkan Siap ke Madrid, James dan Isco Jadi Tumbal?Kabarnya Madrid harus membayar 90 juta euro (Rp 1,4 triliun) untuk meyakinkan Juventus agar melepas Pjanic. Jika itu terwujud, maka gelandang internasional Bosnia Herzegovina itu akan jadi salah satu rekrutan termahal Madrid setelah Gareth Bale (101 juta euro) dan Cristiano Ronaldo (96 juta euro).Pjanic sendiri masih terikat kontrak dengan Juventus sampai 2023. Meski demikian, agen si pemain dikabarkan akan bertemu dengan Juventus untuk mendiskusikan masa depan Pjanic.Pertemuan tersebut akan membahas dua kemungkinan. Yang pertama membicarakan tentang pembaruan nilai kontrak, atau potensi transfer Pjanic.Pjanic saat ini dapat bayaran 6,5 juta euro per tahun (Rp 104 miliar) di Juventus. Angka tersebut menempatkannya sebagai pemain dengan gaji tertinggi ketiga di Juventus setelah Cristiano Ronaldo dan Paulo Dybala.Baca juga: Daripada Hazard, Madrid Disarankan Beli Sterling Saja (nds/rin) real madrid zinedine zidane miralem pjanic","Zidane Minta Perez Datangkan Pjanic"
