"_type","category","isi","judul"
"dict","finance","Jakarta - Menteri Pendayagunaan Aparatur Negara dan Reformasi Birokrasi (PANRB) Syafruddin menegaskan bahwa Aparatur Sipil Negara (ASN) alias PNS dilarang terlibat dalam politik praktis, seperti mencalonkan diri sebagai anggota legislatif maupun pengurus dan anggota partai politik (Parpol)Lewat surat edaran Nomor: B/94/M.SM.00.00/2019 tentang Pelaksanaan Netralitas ASN, Syafruddin menegaskan ASN yang menjadi bakal calon anggota DPR, DPD, DPRD Provinsi, dan DPRD Kabupaten/Kota wajib melengkapi surat pengunduran diri yang tidak dapat ditarik kembali.Sementara, bila aparatur yang menyalonkan diri sebagai caleg namun tidak mengundurkan diri, akan diberi sanksi pemberhentian tidak hormat alias pemecatan terhitung 21 hari kerja setelah terbukti yang bersangkutan menjadi anggota atau pengurus partai politik. googletag.cmd.push(function() { googletag.display('div-gpt-ad-1535944306169-0'); }); ""Terhadap ASN yang tidak mengundurkan diri sebagaimana dimaksud, diberhentikan tidak dengan hormat sebagai ASN terhitung mulai akhir bulan ASN yang bersangkutan menjadi anggota dan/atau pengurus partai politik,"" tegas Syafruddin seperti dikutip dari laman setkab.go.id, Rabu (3/4/2019).Perlu diketahui, pemberhentian ini bukan mengacu pada kewajiban mengajukan surat pengunduran diri apabila ASN menjadi anggota/pengurus partai politik atau pun caleg, melainkan pemberhentian ini adalah larangan keras bagi ASN untuk menjadi anggota/pengurus partai politik.Bagi aparatur negara yang menjadi anggota/pengurus partai politik lalu mengajukan surat pengunduran diri, usul pemberhentiannya akan diterima paling lambat 14 hari setelah pengajuan.""Keputusan pemberhentian sebagaimana dimaksud ditetapkan paling lama 14 (empat belas) hari kerja setelah usul pemberhentian diterima,"" jelasnya.Selain itu, bagi calon anggota legislatif yang telah lolos seleksi calon pegawai ASN atau CPNS, maka dinyatakan telah melanggar peraturan perundang-undangan dan kelulusannya akan dibatalkan.Baca juga: Ingat! PNS akan Kena Sanksi Jika Tak Netral di Pilpres 2019 (fdl/fdl) pns pemilu 2019 politik asn menpan rb","PNS Ikut Politik Praktis, MenpanRB: Mundur atau Dipecat!"
"dict","finance","Jakarta - Sebuah iklan kampanye pasangan calon (paslon) presiden dan wakil presiden nomor urut 02 Prabowo-Sandiaga, sempat viral lantaran isinya yang menyindir pembangunan infrastruktur pemerintahan Jokowi.Dikutip dari akun Instagram @cuknews, Rabu (3/4/2019). Iklan berdurasi 59 detik ini diunggah sejak enam hari lalu atau tangga 29 Maret 2019.Iklan diawali oleh pasangan suami istri yang tengah mengendarai mobil di jalan tol. Mereka berdiskusi mengenai biaya pembangunan jalan tol yang besar dan berpendapat menjadi salah satu penyebab mahalnya tarif jalan tol. googletag.cmd.push(function() { googletag.display('div-gpt-ad-1535944306169-0'); }); Demikian petikan artikel paling populer sepanjang hari ini di kanal detikfinance. Berikut 5 artikel paling populer di detikFinance, Rabu (3/4/2019).Viral Iklan Kampanye 02 Sindir Infrastruktur JokowiSebuah iklan kampanye pasangan calon (paslon) presiden dan wakil presiden nomor urut 02 Prabowo-Sandiaga, sempat viral lantaran isinya yang menyindir pembangunan infrastruktur pemerintahan Jokowi.Dikutip dari akun Instagram @cuknews, Rabu (3/4/2019). Iklan berdurasi 59 detik ini diunggah sejak enam hari lalu atau tangga 29 Maret 2019.Iklan diawali oleh pasangan suami istri yang tengah mengendarai mobil di jalan tol. Mereka berdiskusi mengenai biaya pembangunan jalan tol yang besar dan berpendapat menjadi salah satu penyebab mahalnya tarif jalan tol.PNS Jabar Diminta Pakai Bandara Kertajati, Ini Kata PengamatPemprov Jawa Barat (Jabar) mengimbau pegawai negeri sipil (PNS) di lingkungannya untuk bisa menggunakan Bandara Kertajati karena masih sepi. Tingkat okupansi penumpang pesawat di Bandara Kertajati, Jawa Barat masih rendah, yakni di bawah 70% per hari.Melihat hal ini, Pengamat Penerbangan Alvin Lie menilai hal itu karena persiapan awal yang tidak matang. Menurutnya pembangunan Bandara Kertajati merupakan proyek yang mengabaikan aspek ekonomi. Sebab, tak ada konsultasi perencanaan untuk menghitung daya tarik baik dari masyarakat dan juga maskapai penerbangan.""Kertajati itu pembangunan mengabaikan aspek ekonomi. Jadi saat membangun apakah tidak konsultasi dengan maskapai? Apakah sudah menghitung daya tarik siapa saja yang akan menggunakan jasa penerbangan karena itu ada hitung-hitungannya,"" kata dia kepada detikFinance, Rabu (3/4/2019).10 Perusahaan Raksasa yang Terancam Brexit Problematika Brexit dalam sektor bisnis tak hanya berdampak pada Inggris sendiri, namun juga terhadap bisnis di luar Inggris.Contohnya Jepang, yang beberapa perusahaannya harus menanggung resiko akibat ini. Jepang tak henti mengingatkan Inggris untuk merundingkan kembali langkah ini.Menurut Jepang, Brexit akan memberi dampak yang serius bagi perdagangan dan investasi. Apabila Inggris tidak mengamankan inisiasinya atas Brexit, perdagangan, investasi, dan bisnis Jepang terpaksa hengkang dari Inggris.Baca juga: Suburnya Bisnis Sewa Modem Luar NegeriSambil menunggu boarding, Sakinah sibuk mengutak-atik perangkat yang bentuknya mirip dengan hardisk eskternal. Perangkat itu adalah modem wifi.Bagi wanita yang memiliki nama panjang Sakina Rakhma Diah Setiawan, internet dianggap sebagai salah satu modal paling penting saat melancong ke luar negeri.""Penting banget. Ini modal gue buat jalan-jalan di Taiwan,"" tuturnya saat berbincang dengan detikFinance.Soal Iklan Kampanye 02, Habiburokhman: Isinya Saya SetujuJubir Badan Pemenangan Nasional (BPN) Prabowo Subianto-Sandiaga Uno, Andre Rosiade mengatakan bahwa video itu bukan resmi produksi tim BPN, namun buatan relawan.""saya rasa nggak tahu dari mana, tapi itu bukan resmi (BPN), jadi itu bukan resmi. Saya rasa itu ada relawan kami yang membuat. Itu buatan pendukung kami,"" kata Andre saat dihubungi detikFinance, Jakarta, Rabu (3/4/2019).Meski bukan iklan kampanye yang resmi diluncurkan BPN, Andre menilai bahwa pembangunan infrastruktur memang seharusnya memberikan dampak yang merata bagi seluruh masyarakat, baik pengguna jalan tol itu sendiri maupun masyarakat sekitar. (zlf/zlf) round-up berita populer","Viral Iklan Sindir Infrastruktur Jokowi dan Suburnya Bisnis Sewa Modem"
"dict","finance","Jakarta - Industri telco beberapa tahun ini tengah mengalami kelesuan. Banyak dari perusahaan telco besar termasuk Telkomsel hingga Indosat masih mengalami kerugian. Masa suram dari industri telco dimulai ketika berkembangnya aplikasi. Dengan adanya aplikasi komunikasi untuk pesan, telepon hingga panggilan video membuat perusahaan telco kehilangan pemasukan dari pulsa. Apalagi selama ini perusahaan telco sangat bergantung dari pemasukan panggilan pulsa dan SMS.""Pasar telekomunikasi di sektor ritel atau end user consumer tahun 2018 kemarin memang lesu. Menurut BPS sektor komunikasi dan informasi hanya tumbuh 7.04% di 2018 melambat dalam 4 tahun terakhir. Pasar smartphone juga mulai jenuh dengan penetrasi 133% (wearesocial Jan 2019). Artinya jumlah smartphone sudah melampaui total populasi Indonesia,"" kata Pengamat ekonomi dari Institute for Development of Economics and Finance (INDEF), Bhima Yudhistira. googletag.cmd.push(function() { googletag.display('div-gpt-ad-1535944306169-0'); }); Kini industri telco mulai mendapatkan ancaman baru yakni perusahaan penyewaan modem ke luar negeri. Sejak muncul di 2016, pemain di industri ini semakin banyak.Coba saja ketik sewa modem ke luar negeri di mesin pencari Google, pasti muncul deretan situs penyewaan modem.Salah satu pemain yang sudah berkembang cukup masif adalah PT Yelooo Integra Datanet Tbk alias Passpod. Umur perusahaan ini baru 2 tahun, tapi sudah bisa mejeng di pasar modal.Saat berdiri di 2016 di bulan keempat saja sudah mengantongi omset Rp 100 jutaan. Sekarang perusahaan bisa mengantongi omset sekitar Rp 1,5-3 miliar per bulan.Bahkan pernah Passpod berhenti menawarkan modemnya bukan karena gulung tikar tapi karena modemnya yang berjumlah 2 ribu perangkat habis disewa semua bersamaan. Itu terjadi pada Desember 2017.Melihat potensi yang luar biasa, perusahaan terus menambah jumlah modemnya hingga kini ada sekitar 11 ribu modem. Pada saat IPO Passpod berhasil mengumpulkan hampir Rp501 miliar, dari target perolehan dana Rp48 miliar. Uang itu salah satunya digunakan untuk pengembangan bisnis.Menurut Hiro industri penyewaan modem wifi memiliki potensi yang luar biasa seiring dengan perubahan gaya hidup masyarakat kekinian yang lebih gemar plesiran. Apalagi pertumbuhan masyarakat kelas menengah saat ini begitu tinggi.""Size-nya besar banget, bayangkan dalam satu tahun ada 8,2 juta orang yang ke luar negeri dari Indonesia. Itu pasar yang luar biasa,"" tutupnya.Potensi perkembangan bisnis sewa modem juga di dukung dengan gaya hidup milenial saat ini. Ibaratnya generasi ini lebih mementingkan melepas penat dengan jalan-jalan dan rela berhemat di pos pengeluaran lainnya.Baca juga: Milenial Jadi Pasar 'Seksi' Bisnis Sewa ModemSakina Rakhma Diah Setiawan misalnya, wanita berusia 29 tahun ini dalam setahun bisa 3-4 kali melancong ke luar negeri. Dalam tripnya yang terakhir ke Taiwan dia memanfaatkan modem wifi. Sakinah mengaku baru pertama kali menggunakan jasa sewa modem wifi untuk ke luar negeri. Biasanya dia menggunakan paket roaming ataupun membeli SIM card baru.Menurutnya sewa modem wifi memiliki beberapa keunggulan. Misalnya, kuota yang tak terbatas dan masa beterai yang tahan lama. Baginya internet dianggap sebagai salah satu modal paling penting saat melancong ke luar negeri. Dia membutuhkan akses internet untuk mencari informasi tentang perjalanan maupun tujuan wisata yang hendak dia sambangi. Apalagi dia sangat gemar traveling seorang diri, jadi internet satu-satunya teman sekaligus pemandu baginya. Di luar itu, internet merupakan bahan utama bagi dia untuk update di Instagram. Foto ditempat tujuan wisata ibaratnya menjadi oleh-oleh wajib bagi setiap pelancong saat ini.Ada juga Suci Sarasina yang gemar melancong ke luar negeri bersama teman-temannya. Dalam setahun dia bisa 2 kali pergi ke luar negeri, meski hanya sebatas Asia Tenggara.Sejak 2017 Suci mengaku lebih memilih modem wifi ketimbang paket roaming ataupun SIM Card. Alasannya karena 1 perangkat bisa dipakai bersama teman-temannya. Baik Sakinah maupun Suci memiliki pemasukan sekitar Rp 7-8 juta per bulan.Namun tidak semua milenial yang gemar travelling ke luar negeri memilih untuk menggunakan modem wifi. Sapto (28 tahun) misalnya, dia lebih memilih menggunakan paket roaming. Alasannya membeli paket jauh lebih simpel, tak perlu ribet menenteng perangkat modem. Dia juga khawatir modemnya sewaannya hilang. Selain itu faktor harga juga menjadi alasannya.Baca juga: Suburnya Bisnis Sewa Modem Luar Negeri (das/fdl) bisnis peluang usaha liputan khusus modem bisnis modem","Bisnis Sewa Modem, Ancaman Baru Bagi Perusahaan Provider"
"dict","finance","Solo - Presiden Joko Widodo berkunjung ke Kabupaten Sragen menemui para pelaku usaha pertanian. Dalam kesempatan itu, Jokowi meminta salah seorang warga maju ke atas panggung untuk berdialog.Awalnya Jokowi meminta warga yang memiliki tempat penggilingan padi untuk naik ke atas panggung. Beberapa orang terlihat ingin maju ke depan.""Gadah (punya) penggilingan? Oke maju sini. Satu saja, jangan dua, satu cukup,"" kata Jokowi di GOR Diponegoro, Sragen, Rabu (3/4/2019). googletag.cmd.push(function() { googletag.display('div-gpt-ad-1535944306169-0'); }); Jokowi lalu berdialog dengan pemilik penggilingan padi di Jenar, Sragen, Endang. Beberapa orang lain juga dipanggil untuk mewakili penjual pupuk dan petani.Dalam dialog itu, Jokowi menyampaikan pentingnya modernisasi peralatan pertanian. Presiden tidak mau kalah dengan negara-negara tetangga.Baca juga: TKN Buka Suara soal Iklan Kampanye Sindir Infrastruktur JokowiJokowi mengajak pemilik penggilingan padi tidak lagi menjemur padi di jalan dan pelataran. Tempat penggilingan padi harus memiliki mesin pengering.""Ini sudah bertahun-tahun masa akan kita terus-teruskan. Setuju mboten? Yang setuju tunjuk jari,"" kata Jokowi disambut para peserta yang mengacungkan jari telunjuk.Jokowi kemudian juga mewacanakan agar setiap tempat penggilingan padi memiliki alat pengemasan. Setiap daerah bisa membuat kemasan dan merek beras sendiri.""Di kecamatan apa diberi merek apa, di kecamatan lain diberi merek apa. Setiap penggilingan punya mesin pengemasan, setuju mboten? Yang setuju tunjuk jari,"" tanya Jokowi yang kembali disambut acungan jari telunjuk para peserta.Baca juga: Soal Iklan Kampanye 02, Habiburokhman: Isinya Saya SetujuJokowi mengaku tidak ingin tertinggal dengan negara-negara tetangga di bidang pertanian dan bidang lainnya. Dia mengajak petani meninggalkan pola-pola lama.""Kita ini negara besar, masa kita kalah dengan tetangga kita urusan ekspor, urusan investasi, kalah dengan Malaysia, kalah dengan Singapura, Filipina, kalah dengan Thailand, kalah dengan Vietnam. Kalau kita diam tidak mau mengubah, bisa kalah dengan Laos, kalah dengan Kamboja,"" tutupnya. (zlf/zlf) jokowi joko widodo ekspor beras","Jokowi: RI Negara Besar, Masa Urusan Ekspor Kalah Sama Tetangga?"
"dict","finance","Jakarta - Salah satu akun Instagram telah mengunggah iklan kampanye Capres dan Cawapres Nomor Urut 02 Prabowo Subianto-Sandiaga Uno.Menariknya, bahan iklan kampanye ini memanfaatkan infrastruktur, khususnya jalan tol yang telah dibangun era Presiden Joko Widodo (Jokowi).Bukan soal manfaatnya, iklan kampanye Prabowo-Sandi ini justru menonjolkan dampak negatif dari gencarnya pemerintah bangun infrastruktur.Berikut selengkapnya: (hek/ang) prabowo sandiaga jokowi maruf amin iklan kampanye Sebelumnya Jurus Prabowo-Sandi Tekan Utang: Pangkas Proyek Infrastruktur 1 / 4 Selanjutnya Begini Iklannya","Infrastruktur Jokowi Jadi Bahan Iklan Kampanye Prabowo"
"dict","finance","Jakarta - Tingkat keterisian (okupansi) di Bandara Internasional Jawa Barat (BIJB) Kertajati masih di bawah rata-rata. Hal ini pun membuat Pemerintah Provinsi (Pemprov) Jawa Barat turun tangan.Pemprov meminta agar Aparatur Sipil Negara (ASN) menggunakan Bandara Kertajati untuk setiap perjalanan udara. Lantas, apa sih masalah yang membuat bandara sepi?Dirangkum detikFinance, Kamis (4/4/2019) ini ulasan selengkapnya: (ang/ang) bandara kertajati bandara kertajati sepi Sebelumnya Bandara Bali Utara Jangan Sampai Sepi Seperti Kertajati 1 / 4 Selanjutnya Kata Pengamat","Bandara Kertajati Sepi Terus, Salahnya di Mana?"
"dict","finance","Jakarta - Nama Steve Jobs sudah terukir di dalam sejarah dunia. Bagaimana tidak, ia merupakan salah satu pendiri Apple di mana produknya kini dipakai hampir di seluruh belahan dunia.Steve Jobs seorang tokoh besar. Namun, masa kecilnya sedikit berbeda dengan orang kebanyakan. Ini kisahnya yang sangat inspiratif.Mengutip Investopedia, Rabu (3/4/2019), Steve Jobs lahir pada 24 Februari 1955. Ia merupakan anak kandung dari pasangan Joanne Carole Schieble dan Abdulfattah Jandali. googletag.cmd.push(function() { googletag.display('div-gpt-ad-1535944306169-0'); }); Tapi, sejak kecil Steve Jobs tidak tinggal bersama orang tuanya. Ia diadopsi oleh pasangan Paul dan Clara Jobs yang berasal dari kelas pekerja San Francisco, Sunset Distric. Schieble sendiri mulanya tidak suka putranya dibesarkan orang-orang tidak berpendidikan, dan hanya setuju jika mereka berjanji untuk menguliahkan putranya.Pada tahun 1961, keluarga Jobs pindah ke Mountain View, California. Di rumah yang lebih besar, Paul Jobs kembali ke hobinya untuk membangun kembali mobil dan berbagai keperluan rumah tangga. Steve Jobs muda saat itu juga turut membantu.Hal itu yang kemudian melatarbelakangi Steve Jobs tertarik pada bidang elektronik, yang ia bagi ke banyak insinyur di lingkungan barunya. Namun, di luar tetangganya yang insinyur itu dia kesulitan mencari teman.Steve Jobs telah belajar membac asaat kecil. Oleh karena itu, sekolah menurutnya hal yang membosankan hingga akhirnya sering mengalami masalah disiplin dan akademis.Di usia 13 tahun, Bill Hewlett dari Hewlett Packard menawarkan Steve Jobs pekerjaan musim panas untuk menyusun penghitungan frekuensi. Pada musim gugur berikutnya, Jobs mulai belajar di Homestead High School di mana ia bertemu Steve Wozniak, jagoan elektronik dari sekolah tersebut. Singkat cerita, pada tahun 1972, Steve Wozniak membangun papan sirkuit dengan versi sendiri dari video game Pong, yang dia berikan kepada Jobs. Dengan papan sebagai resumenya, Jobs meyakinkan perusahaan Atari Inc untuk memberinya pekerjaan sebagai teknisi, setelah itu ia meninggalkan studinya di Reed College di Oregon.Setelah meninggalkan Atari dan menghabiskan tujuh bulan mengunjungi ashram dan tempat suci lainnya di India pada tahun 1972, Jobs akhirnya kembali ke perusahaan Atari. Di sana, Steve Jobs bekerja dengan Wozniak untuk mendesain papan sirkuit.Baca juga: Berbagi Kiat Sukses dari Juragan Cendol di Kelas Kreatif BanyuwangiPada saat yang sama, Wozniak juga mengerjakan apa yang ia sebut 'kotak biru' yang akan memancarkan nada yang tepat untuk mengelabui jaringan telepon agar pengguna panggilan jarak jauh bisa saling akses dengan biaya gratis.Bersama Wozniak, Jobs akhirnya menyelesaikan komputer Apple I pada tahun 1976. Jobs pun segera menyarankan agar mereka mencoba untuk menjualnya.Bersama dengan temannya Ronald Wayne, mereka akhirnya membentuk Apple Computer di garasi rumah Jobs di Los Altos, California. Komputer-komputer Apple pada saat awal tentu jauh dari mesin Apple yang rapi seperti yang kita kenal sekarang. Gambaran Apple I saat itu adalah sebagai papan sirkuit dengan chip di atasnya, satu set TV DuMont, satu set kaset Panasonic dan satu keyboard.Wayne kemudian meninggalkan Apple, sementara Daniel Kottke, teman Jobs dari Reed College dan petualangannya di India bergabung dengan perusahaan. Dengan produk dan visi, ketiganya siap memulai produksi.Baca juga: Rahasia Bill Gates Jadi Orang Terkaya Dunia Tahun ke TahunKesulitan yang mereka dapatkan saat awal adalah modal, sehingga mereka menghabiskan waktu berjam-jam untuk menelepon calon investor. Mereka menerima putaran awal pendanaan dari Mike Markkula, seorang manajer pemasaran dan insinyur produk Intel Corp.Siapa sangka, perusahaan yang mereka rintis dari sebuah garasi kini menjadi salah satu perusahaan teknologi ternama di dunia. Komputer Mac, pemutar musik iPod, ponsel iPhone, dan tablet iPad, adalah contoh kesuksesan produk Apple. (ang/ang) sosok steve jobs kisah inspiratif orang kaya orang terkaya","Kisah Masa Kecil Steve Jobs Sebelum Sukses Ciptakan Apple"
"dict","finance","Jakarta - Apa harapan anda dalam keuangan ketika sudah bekerja dan memiliki penghasilan sendiri? Umumnya tentu kita semua berharap memiliki keuangan yang mapan dan memiliki kondisi keuangan yang stabil. Harapan tersebut tentu disertai dengan impian atau tujuan keuangan seperti, memiliki rumah, memiliki kendaraan, menikah, liburan dan tentu masih banyak lagi. Hal ini terjadi karena tak bisa kita pungkiri bahwa ketika seseorang baru mulai bekerja dan merintis karir di tengah usia produktif yang sedang semangat-semangatnya dalam mengumpulkan pundi-pundi keuangan.Namun bila kita lihat yang sering terjadi di sekitar kita atau mungkin malah diri sendiri, justru kerap kali melakukan kesalahan-kesalahan yang dapat menjadi perusak keuangan anda ke depannya nanti. Nah apa kesalahan tersebut yang sebaiknya sudah bisa kita antisipasi sedari sekarang, yuk simak ulasan berikut ini. googletag.cmd.push(function() { googletag.display('div-gpt-ad-1535944306169-0'); }); Tidak memiliki perencanaan keuanganMemiliki perencanaan keuangan merupakan salah satu cara untuk membuat gambaran keuangan dengan lebih jelas. Jadi bisa kita bayangkan bila seseorang tidak memiliki perencanaan keuangan, betapa kaburnya keuangan orang tersebut. Toh untuk orang yang sudahmemiliki perencanaan keuangan saja belum menjadi jaminan mutlak untuk keuangan yang lebih baik, apalagi yang tidak memiliki perencanaan keuangan sama sekali. Bisa saja anda terjebak dengan gaya hidup yang menuntut anda untuk terus belanja melebihi dari apa yang anda butuhkan dan melebihi penghasilan anda sendiri. Perencanaan keuangan pada dasarnya adalah pengalokasian dari penghasilan Anda dalam satu bulan untuk belanja kebutuhan, membayar tagihan, investasi dan simpanan. Rencana keuangan yang sehat tentunya pengalokasian yang tepat sasaran serta punya tujuan penghematan. Ini adalah salah satu elemen kunci untuk mendapatkan keuangan yang stabil dan sesuai harapan anda. Ini masih dalam tahap single lho, belum lagi kalau anda sudah menikah dan tidak memiliki perencanaan keuangan bersama? Kita bisa melihat dari sekitar kita ataupun data serta fakta di lapangan yang menunjukkan bahwa keuangan menjadi salah satu penyebab keributan dalam rumah tangga. Ditambah ketika pada saatnya anda memiliki anak, sebagai keluarga muda yang memiliki anak pertama, ini bisa memicu anda untuk menghabiskan sejumlah dana untuk keperluan anak yang sebenarnya dapat anda kurangi. Bisa jadi anda adalah salah satu orangtua muda yang terseret arus membelikan berbagai barang-barang atau pernak-pernik anak yang berlebihan.Maka pastikan untuk bersikap saling terbuka dan mau belajar dengan pasangan tentang keuangan agar memiliki tujuan keuangan yang selaras. Tidak membayar penuh tagihan kartu kreditMenyambung dari atas yaitu tidak memiliki perencanaan keuangan disertai gaya hidup yang tidak terkendali dan berakibat pada besarnya pengeluaran, tentu ini menjadi salah satu cikal bakal anda dalam berutang. Overspending seperti ini bisa menjadi semakin buruk dengan kebiasaan Anda menggunakan kartu kredit yang tidak terkendali. Sebenarnya Kartu kredit bisa memberi banyak keuntungan bila kita bijak menggunakannya. Namun kita semua sering mendengar atau melihat atau anda melakukannya sendiri dengan membayar tagihan kartu kredit sejumlah minimal payment, yang sebenarnya ini justru membuat keuangan anda akan semakin berat karena bunga berbunga yang besar.Maka dari itu, biasakan membayar penuh tagihan kartu kredit tanpa alasan apapun. Bila tidak yakin bisa membayar penuh, maka jangan gunakan kartu kredit untuk bertransaksi. Pastikan anda sudah memiliki dana tunainya ketika menggunakan kartu kredit, karena kartu kredit hanyalah sebagai sarana pembayaran saja untuk mempermudah. Apabila diperhatikan, hal simple seperti tidak membayar utang sementara anda memiliki cukup banyak dana di tabungan atau deposito anda, sering kali membuat anda menjadi rugi secara keuangan. Baca juga: 4 Hal yang Membuat Keuangan Bulanan Berantakan (3)Nah, informasi simple tapi berguna seperti inilah yang sering dibagikan di workshop yang dilaksanakan oleh tim IARFC Indonesia atau tim AAM & Associates.Di Jakarta dibuka workshop sehari tentang bagaimana cara Mengelola Gaji dan Mengatur Uang bulanan dan Belajar dan Teknik Menjadi Kaya Raya dan juga workshop sehari tentang Reksadana. Karena banyak permintaan, dibuka lagi workshop Komunikasi yang memukau lawan bicara anda (menghipnotis), cocok untuk anda orang sales & marketing, untuk komunikasi ke pasangan, anak, boss, anak buah, ke siapapun, info.Untuk ilmu yang lebih lengkap lagi, anda bisa belajar tentang perencanaan keuangan komplit, bahkan bisa jadi konsultannya dengan sertifikat Internasional bisa ikutan workshop Basic Financial Planning dan workshop Intermediate dan Advance Financial Planning di Pertengahan Info lainnya bisa dilihat di www.IARFCIndonesia.com (jangan lupa tanyakan DISKON paket).Mumpung bulannya pesta demokrasi, tanyakan juga adanya DISKON PESTA DEMOKRASI hanya di bulan April ini saja. Anda bisa diskusi tanya jawab dengan cara bergabung di akun telegram group kami ""Seputar Keuangan"" atau klik di sini.Baca juga: Beli Rumah Nanti dengan Harga Sekarang (2)Disclaimer: artikel ini merupakan kiriman dari mitra yang bekerja sama dengan detikcom. Redaksi detikcom tidak bertanggung jawab atas isi artikel yang dikirim oleh mitra. Tanggung jawab sepenuhnya ada di penulis artikel. (ang/ang) aidil akbar tips keuangan","Jangan Sampai Dompet Jebol, Hindari Kesalahan Keuangan Ini (1)"
