"_type","category","isi","judul"
"dict","sport","Munich - Bayern Munich bekerja ekstra keras untuk melewati tim divisi dua Heidenheim di perempatfinal DFB-Pokal. Bertanding di kandang sendiri, Bayern menang 5-4.Dua gol disumbangkan Robert Lewandowski yang baru masuk di babak kedua. Gol-gol Bayern lainnya dicetak oleh Leon Goretzka, Thomas Mueller, dan Serge Gnabry.Pada pertandingan di Allianz Arena, Kamis (4/4/2019) dinihari WIB, Bayern tertinggal 1-2 di babak pertama. Heidenheim memanfaatkan keunggulan jumlah pemain usai Die Roten bermain dengan 10 orang usai Niklas Suele dikartu merah kala pertandingan baru berjalan 13 menit. googletag.cmd.push(function() { googletag.display('div-gpt-ad-1535945694694-0'); }); Bayern akhirnya bangkit setelah restart dengan mencetak tiga gol tambahan untuk berbalik unggul. Namun, Heidenheim menolak menyerah sehingga mampu menyamakan skor 4-4, sebelum gol penalti Lewandowski mengakhiri perlawanan tim tamu. Bayern, yang menyimpan beberapa pemain utamanya, memulai dengan menjanjikan. Die Roten sudah unggul di menit ke-12 setelah Goretzka membuka skor pertandingan.Namun, arah pertandingan berbalik usai kartu merah Suele. Di menit ke-26, Robert Glatzel membawa timnya menyamakan skor menjadi 1-1 setelah memaksimalkan umpan Marc Schnatterer. Baca juga: Hasil Liga Jerman: Diimbangi Freiburg, Bayern Kehilangan Puncak KlasemenHeidenheim membungkam publik Bayern. Kini giliran Schnatterer yang menaklukkan penjagaan kiper Sven Ulreich sehingga Heidenheim unggul 2-1 di menit ke-39 untuk dipertahankan saat half-time.Strategi memasukkan Lewandowski dan Kingsley Coman terbukti tepat. Hanya delapan menit setelah kickoff babak kedua, Lewandowski memberikan dampak instan.Dari situasi tendangan sudut, Lewandowski menyundul bola yang diteruskan Thomas Mueller dengan sepakan voli dari tengah kotak penalti yang menembus gawang Heidenheim. Skor kini 2-2.Hanya butuh tiga menit bagi Bayern untuk kembali di depan. Lewandowski mencetak gol ketiga tim tuan rumah sehingga berbalik unggul dalam kedudukan 3-2 di menit ke-56.Serge Gnabry dengan leluasa menggiring bola menuju kotak penalti, sebelum mengirim operan kepada Mueller. Lewandowski menyelesaikan umpan akurat Mueller dengan sontekan dari jarak dekat yang menggetarkan gawang Heidenheim.Baca juga: Operasi Lutut, Lucas Hernandez Bakal Siap 100 Persen Musim DepanGempuran serangan Bayern menghasilkan gol keempat kurang dari 10 menit kemudian. Mats Hummels menanduk bola sepak pojok, yang dituntaskan Gnabry dengan sontekan mudah dari dekat tiang. VAR dibutuhkan sebelum gol itu disahkan.Heidenheim belum tamat. Di menit ke-74, Glatzel mencetak gol keduanya atau yang ketiga untuk Heidenheim usai memanfaatkan lengahnya lini belakang Bayern yang bertahan terlalu tinggi.Hanya tiga menit kemudian, kedudukan seimbang lagi! Wasit menunjuk titik putih setelah pelanggaran Hummels. Glatzel maju sebagai eksekutor dan mengecoh Ulreich dengan tembakan ke arah tengah gawang Bayern. Kedudukan 4-4.Sepuluh menit sebelum waktu normal habis, Ulreich membuat dua penyelamatan gemilang yang menghindarkan Bayern dari kebobolan lagi. Heidenheim mulai bertahan lebih rapat.Penalti kedua diberikan wasit di pertandingan ini, kali ini kepada Bayern. Setelah Marnon Busch melakukan handball saat mengawal Lewandowski.Baca juga: Operasi Lutut, Lucas Hernandez Bakal Siap 100 Persen Musim DepanStriker Polandia itu maju mengambil penalti tersebut untuk disarangkan ke gawang Heidenheim setelah mengirim Kevin Mueller ke arah yang salah. Bayern 5, Heindeheim 4. Bayern hampir saja membunuh pertandingan. Akan tetapi, sepakan keras kaki kanan Gnabry hanya menghantam mistar gawang Heidenheim di menit ke-89.Laga kian keras di masa injury time, di mana para pemain kedua kubu saling melakukan pelanggaran. Di detk-detik terakhir, Bayern memperoleh tendangan penjuru. Meski tak melahirkan gol tambahan, Bayern sukses mempertahankan keunggulan sampai laga bubar.Susunan PemainBAYERN MUNICH: Ulreich, Kimmich, Rafinha (Lewandowski 46'), Hummels, Sule, Gnabry, James Rodriguez (Coman 46'), Thiago Alcantara, Goretzka, Ribery (Boateng 24'), MuellerHEIDENHEIM: Kevin Mueller, Busch, Theuerkauf (Thomalla 73'), Mainka, Beermann, Dorsch (Feick 52'), Schnatterer (Multhaup 67'), Griesbeck, Andrich, Glatzel, Dovedan (rin/cas) bayern munich dfb pokal","Drama 9 Gol di Allianz Arena, Bayern Munich Maju ke Semifinal DFB-Pokal"
"dict","hot","Jakarta - Anak Sandra Dewi memang baru menginjak usia 1 tahun. Namun jangan sepelekan usia yang masih kecil ini lho. Di usianya yang masih balita ini, Raphael Moeis sudah memiliki jet pribadi.Hal tersebut terlihat dari salah satu akun Instagram kerabat Sandra Dewi dan suami, Harvey.Baca juga: Jadi Bridesmaid, Sandra Dewi Menarik Perhatian di Pernikahan Yuanita Christiani ""Hari ini Senin 25 Maret 2019 tepat jam 09.00 Jet pribadinya @raphaelmoeis mendarat di Halim Pedana Kusuma. Dan langsung upacara pemberkatan pesawat berama Romo Agustinus Handoko MSC. Selamat Harvey dan @sandradewi88 Semoga memperlancar usaha dan Bisnisnya. Tuhan memberkati. #privatejet,"" tulis kerabat Sandra dan Harvey, Benyamin Ratu dilihat dari Instagram miliknya, Selasa (2/4/2019).Dalam postingan itu terlihat suami Sandra Dewi, duduk di antara beberapa orang lainnya. Senyuman suami Sandra Dewi pun mengembang kala itu.Baca juga: Dewi Sandra Percaya Diri Tanpa Riasan, Inneke Koesherawati Jadi PanutanPostingan itu langsung dikomentari oleh Sandra Dewi sendiri dalam kolom komentarnya.""Wuih makasih waktunya pak Benyamin Ratu dan ibu Ning Ratu, sudah mau ikut berkati,"" balas Sandra Dewi.Tonton juga: Wah! Anak Sandra Dewi Kecil-kecil Sudah Punya Jet Pribadi[Gambas:Video 20detik]Baca juga: Tatjana Saphira dan Dewi Sandra Ungkap Rahasia Cantik Luar DalamPostingan tersebut juga langsung mendapatkan komentar dari netter.""Diberkati utk menjadi berkat bagi sesama,"" ungkap netter.""Punya jet pribadi benaran tapi gak ada yg tau diam""aja tanpa sensasi pamer""@lambe_turah tapi ada tu artis yg 1 indonesia tau y dia punya jet pribadi kesana kesini naik jet pribadi tau y sewaan,"" kata warganet. [Gambas:Instagram] (wes/doc) sandra dewi suami sandra dewi anak sandra dewi raphael moeis anak sandra dewi punya privat jet Photo Gallery 1 celeb Sandra Dewi Cerita Anaknya Jadi Model dan Rencana Tambah Momongan celeb Sandra Dewi Cerita Anaknya Jadi Model dan Rencana Tambah Momongan celeb Sandra Dewi Cerita Anaknya Jadi Model dan Rencana Tambah Momongan celeb Sandra Dewi Cerita Anaknya Jadi Model dan Rencana Tambah Momongan celeb Sandra Dewi Cerita Anaknya Jadi Model dan Rencana Tambah Momongan celeb Sandra Dewi Cerita Anaknya Jadi Model dan Rencana Tambah Momongan celeb Sandra Dewi Cerita Anaknya Jadi Model dan Rencana Tambah Momongan 1 celeb Dina Lorenza, Sophia Latjuba, Ayu Ting Ting, hingga Sandra Dewi celeb Dina Lorenza, Sophia Latjuba, Ayu Ting Ting, hingga Sandra Dewi celeb Dina Lorenza, Sophia Latjuba, Ayu Ting Ting, hingga Sandra Dewi celeb Dina Lorenza, Sophia Latjuba, Ayu Ting Ting, hingga Sandra Dewi celeb Dina Lorenza, Sophia Latjuba, Ayu Ting Ting, hingga Sandra Dewi celeb Dina Lorenza, Sophia Latjuba, Ayu Ting Ting, hingga Sandra Dewi celeb Dina Lorenza, Sophia Latjuba, Ayu Ting Ting, hingga Sandra Dewi celeb Dina Lorenza, Sophia Latjuba, Ayu Ting Ting, hingga Sandra Dewi celeb Dina Lorenza, Sophia Latjuba, Ayu Ting Ting, hingga Sandra Dewi 2 celeb Selain Sophia Latjuba, Sandra Dewi Juga Ulang Tahun Lho! celeb Selain Sophia Latjuba, Sandra Dewi Juga Ulang Tahun Lho! celeb Selain Sophia Latjuba, Sandra Dewi Juga Ulang Tahun Lho! celeb Selain Sophia Latjuba, Sandra Dewi Juga Ulang Tahun Lho! celeb Selain Sophia Latjuba, Sandra Dewi Juga Ulang Tahun Lho! celeb Selain Sophia Latjuba, Sandra Dewi Juga Ulang Tahun Lho! 3 celeb Para Perempuan Cantik Penakluk Hati Denny Sumargo celeb Para Perempuan Cantik Penakluk Hati Denny Sumargo celeb Para Perempuan Cantik Penakluk Hati Denny Sumargo celeb Para Perempuan Cantik Penakluk Hati Denny Sumargo celeb Para Perempuan Cantik Penakluk Hati Denny Sumargo celeb Para Perempuan Cantik Penakluk Hati Denny Sumargo celeb Para Perempuan Cantik Penakluk Hati Denny Sumargo celeb Para Perempuan Cantik Penakluk Hati Denny Sumargo celeb Para Perempuan Cantik Penakluk Hati Denny Sumargo 4 celeb Gemes! Lucunya Raphael Moeis, Putra Sandra Dewi celeb Gemes! Lucunya Raphael Moeis, Putra Sandra Dewi celeb Gemes! Lucunya Raphael Moeis, Putra Sandra Dewi celeb Gemes! Lucunya Raphael Moeis, Putra Sandra Dewi celeb Gemes! Lucunya Raphael Moeis, Putra Sandra Dewi celeb Gemes! Lucunya Raphael Moeis, Putra Sandra Dewi celeb Gemes! Lucunya Raphael Moeis, Putra Sandra Dewi celeb Gemes! Lucunya Raphael Moeis, Putra Sandra Dewi 5 celeb Pose Monyong, Sandra Dewi Tetap Cantik? celeb Pose Monyong, Sandra Dewi Tetap Cantik? celeb Pose Monyong, Sandra Dewi Tetap Cantik? celeb Pose Monyong, Sandra Dewi Tetap Cantik? celeb Pose Monyong, Sandra Dewi Tetap Cantik? celeb Pose Monyong, Sandra Dewi Tetap Cantik? 6 celeb Penampakan Dhawiya saat Ditangkap, Lihat Liburan Cita Citata celeb Penampakan Dhawiya saat Ditangkap, Lihat Liburan Cita Citata celeb Penampakan Dhawiya saat Ditangkap, Lihat Liburan Cita Citata celeb Penampakan Dhawiya saat Ditangkap, Lihat Liburan Cita Citata celeb Penampakan Dhawiya saat Ditangkap, Lihat Liburan Cita Citata celeb Penampakan Dhawiya saat Ditangkap, Lihat Liburan Cita Citata celeb Penampakan Dhawiya saat Ditangkap, Lihat Liburan Cita Citata celeb Penampakan Dhawiya saat Ditangkap, Lihat Liburan Cita Citata celeb Penampakan Dhawiya saat Ditangkap, Lihat Liburan Cita Citata 7 celeb Chelsea Olivia hingga Sandra Dewi, Para Seleb Cantik Bergaya Oriental celeb Chelsea Olivia hingga Sandra Dewi, Para Seleb Cantik Bergaya Oriental celeb Chelsea Olivia hingga Sandra Dewi, Para Seleb Cantik Bergaya Oriental celeb Chelsea Olivia hingga Sandra Dewi, Para Seleb Cantik Bergaya Oriental celeb Chelsea Olivia hingga Sandra Dewi, Para Seleb Cantik Bergaya Oriental celeb Chelsea Olivia hingga Sandra Dewi, Para Seleb Cantik Bergaya Oriental celeb Chelsea Olivia hingga Sandra Dewi, Para Seleb Cantik Bergaya Oriental celeb Chelsea Olivia hingga Sandra Dewi, Para Seleb Cantik Bergaya Oriental celeb Chelsea Olivia hingga Sandra Dewi, Para Seleb Cantik Bergaya Oriental 8 celeb Wajah Lesu Fachri Albar Tertangkap Narkoba, Dilraba Dilmurat Tercantik di Asia celeb Wajah Lesu Fachri Albar Tertangkap Narkoba, Dilraba Dilmurat Tercantik di Asia celeb Wajah Lesu Fachri Albar Tertangkap Narkoba, Dilraba Dilmurat Tercantik di Asia celeb Wajah Lesu Fachri Albar Tertangkap Narkoba, Dilraba Dilmurat Tercantik di Asia celeb Wajah Lesu Fachri Albar Tertangkap Narkoba, Dilraba Dilmurat Tercantik di Asia celeb Wajah Lesu Fachri Albar Tertangkap Narkoba, Dilraba Dilmurat Tercantik di Asia celeb Wajah Lesu Fachri Albar Tertangkap Narkoba, Dilraba Dilmurat Tercantik di Asia celeb Wajah Lesu Fachri Albar Tertangkap Narkoba, Dilraba Dilmurat Tercantik di Asia celeb Wajah Lesu Fachri Albar Tertangkap Narkoba, Dilraba Dilmurat Tercantik di Asia celeb Wajah Lesu Fachri Albar Tertangkap Narkoba, Dilraba Dilmurat Tercantik di Asia 9 celeb Kecantikan Adik Sandra Dewi Ini Bikin Netizen Salah Fokus! celeb Kecantikan Adik Sandra Dewi Ini Bikin Netizen Salah Fokus! celeb Kecantikan Adik Sandra Dewi Ini Bikin Netizen Salah Fokus! celeb Kecantikan Adik Sandra Dewi Ini Bikin Netizen Salah Fokus! celeb Kecantikan Adik Sandra Dewi Ini Bikin Netizen Salah Fokus! celeb Kecantikan Adik Sandra Dewi Ini Bikin Netizen Salah Fokus! celeb Kecantikan Adik Sandra Dewi Ini Bikin Netizen Salah Fokus! celeb Kecantikan Adik Sandra Dewi Ini Bikin Netizen Salah Fokus! celeb Kecantikan Adik Sandra Dewi Ini Bikin Netizen Salah Fokus! celeb Kecantikan Adik Sandra Dewi Ini Bikin Netizen Salah Fokus! celeb Kecantikan Adik Sandra Dewi Ini Bikin Netizen Salah Fokus! 10 celeb 5 Artis Cantik Ini Ungkap Momen Indah Menyusui di Instagram celeb 5 Artis Cantik Ini Ungkap Momen Indah Menyusui di Instagram celeb 5 Artis Cantik Ini Ungkap Momen Indah Menyusui di Instagram celeb 5 Artis Cantik Ini Ungkap Momen Indah Menyusui di Instagram celeb 5 Artis Cantik Ini Ungkap Momen Indah Menyusui di Instagram celeb 5 Artis Cantik Ini Ungkap Momen Indah Menyusui di Instagram 11 celeb Sandra Dewi Sebut Wajahnya Ini Tak Layak Tayang, Menurut Kamu? celeb Sandra Dewi Sebut Wajahnya Ini Tak Layak Tayang, Menurut Kamu? celeb Sandra Dewi Sebut Wajahnya Ini Tak Layak Tayang, Menurut Kamu? celeb Sandra Dewi Sebut Wajahnya Ini Tak Layak Tayang, Menurut Kamu? celeb Sandra Dewi Sebut Wajahnya Ini Tak Layak Tayang, Menurut Kamu? celeb Sandra Dewi Sebut Wajahnya Ini Tak Layak Tayang, Menurut Kamu? 12 celeb Resmi Jadi Orangtua, Ini Senyum Bahagia Sandra Dewi dan Suami celeb Resmi Jadi Orangtua, Ini Senyum Bahagia Sandra Dewi dan Suami celeb Resmi Jadi Orangtua, Ini Senyum Bahagia Sandra Dewi dan Suami celeb Resmi Jadi Orangtua, Ini Senyum Bahagia Sandra Dewi dan Suami celeb Resmi Jadi Orangtua, Ini Senyum Bahagia Sandra Dewi dan Suami celeb Resmi Jadi Orangtua, Ini Senyum Bahagia Sandra Dewi dan Suami 13 celeb Dear Roro dan Alona, Bayi Sandra Dewi Sudah Punya Jam Miliaran Lho celeb Dear Roro dan Alona, Bayi Sandra Dewi Sudah Punya Jam Miliaran Lho celeb Dear Roro dan Alona, Bayi Sandra Dewi Sudah Punya Jam Miliaran Lho celeb Dear Roro dan Alona, Bayi Sandra Dewi Sudah Punya Jam Miliaran Lho celeb Dear Roro dan Alona, Bayi Sandra Dewi Sudah Punya Jam Miliaran Lho celeb Dear Roro dan Alona, Bayi Sandra Dewi Sudah Punya Jam Miliaran Lho celeb Dear Roro dan Alona, Bayi Sandra Dewi Sudah Punya Jam Miliaran Lho celeb Dear Roro dan Alona, Bayi Sandra Dewi Sudah Punya Jam Miliaran Lho 14 celeb Kebahagiaan Sandra Dewi Dikaruniai Anak Pertama celeb Kebahagiaan Sandra Dewi Dikaruniai Anak Pertama celeb Kebahagiaan Sandra Dewi Dikaruniai Anak Pertama celeb Kebahagiaan Sandra Dewi Dikaruniai Anak Pertama celeb Kebahagiaan Sandra Dewi Dikaruniai Anak Pertama celeb Kebahagiaan Sandra Dewi Dikaruniai Anak Pertama 15 celeb Potret Bahagia Keluarga Kecil Sandra Dewi celeb Potret Bahagia Keluarga Kecil Sandra Dewi celeb Potret Bahagia Keluarga Kecil Sandra Dewi celeb Potret Bahagia Keluarga Kecil Sandra Dewi celeb Potret Bahagia Keluarga Kecil Sandra Dewi celeb Potret Bahagia Keluarga Kecil Sandra Dewi 16 photo Sandra Dewi, Si Bumil Cantik Nan Menawan photo Sandra Dewi, Si Bumil Cantik Nan Menawan photo Sandra Dewi, Si Bumil Cantik Nan Menawan photo Sandra Dewi, Si Bumil Cantik Nan Menawan photo Sandra Dewi, Si Bumil Cantik Nan Menawan 17 celeb Hamil Tua, Sandra Dewi Makin Cantik Aja celeb Hamil Tua, Sandra Dewi Makin Cantik Aja celeb Hamil Tua, Sandra Dewi Makin Cantik Aja celeb Hamil Tua, Sandra Dewi Makin Cantik Aja celeb Hamil Tua, Sandra Dewi Makin Cantik Aja celeb Hamil Tua, Sandra Dewi Makin Cantik Aja celeb Hamil Tua, Sandra Dewi Makin Cantik Aja celeb Hamil Tua, Sandra Dewi Makin Cantik Aja 18 celeb Sandra Dewi Si Bumil Cantik celeb Sandra Dewi Si Bumil Cantik celeb Sandra Dewi Si Bumil Cantik celeb Sandra Dewi Si Bumil Cantik celeb Sandra Dewi Si Bumil Cantik celeb Sandra Dewi Si Bumil Cantik celeb Sandra Dewi Si Bumil Cantik 19 celeb Tante Sandra Dewi yang Cantik dan Awet Muda Banget di Usia 50 Tahun celeb Tante Sandra Dewi yang Cantik dan Awet Muda Banget di Usia 50 Tahun celeb Tante Sandra Dewi yang Cantik dan Awet Muda Banget di Usia 50 Tahun celeb Tante Sandra Dewi yang Cantik dan Awet Muda Banget di Usia 50 Tahun celeb Tante Sandra Dewi yang Cantik dan Awet Muda Banget di Usia 50 Tahun celeb Tante Sandra Dewi yang Cantik dan Awet Muda Banget di Usia 50 Tahun celeb Tante Sandra Dewi yang Cantik dan Awet Muda Banget di Usia 50 Tahun celeb Tante Sandra Dewi yang Cantik dan Awet Muda Banget di Usia 50 Tahun 20 1","Mantap! Kecil-kecil Anak Sandra Dewi Sudah Punya Jet Pribadi"
"dict","sport","Empoli - Napoli menuai hasil negatif saat melawat ke markas Empoli di lanjutan Liga Italia. Partenopei kalah dengan skor 1-2.Dalam pertandingan di Carlo Castellani, Kamis (4/4/2019) dinihari WIB, babak pertama masih sama kuat 1-1. Napoli lebih banyak menebar ancaman.Dalam data yang dilansir oleh ESPN FC, Partenopei membukukan sebanyak sembilan kali tembakan. Sementara itu, tim tuan rumah melepaskan lima kali percobaan. googletag.cmd.push(function() { googletag.display('div-gpt-ad-1535945694694-0'); }); Empoli unggul lebih duku. Diego Farias yang membukukan namanya di papan skor pada menit ke-28.Tendangan kaki kanan Farias dari dalam kotak penalti masuk ke pojok kanan bawah gawang Napoli.Tim asuhan Carlo Ancelotti itu baru bisa membalas pada menit ke-44. Piotr Zielinski yang menjebol gawang Empoli dengan tembakan keras dari luar kotak penalti.Selepas restart, Napoli kebobolan lagi pada menit ke-52. Giovanni Di Lorenzo pembobolnya, gol kedua Empoli itu hasul dari tendangan sudut yang disundul dengan sempurna pemain nomor punggung dua itu.Baca juga: Hasil Liga Italia: Napoli Hajar Roma 4-1 di OlimpicoNapoli mengancam lagi pada menit ke-61. Tendangan Dries Mertens dari jarak jauh belum optimal, masih bisa diblok barisan belakang Empoli.Usaha Napoli tujuh menit berselang juga tak berbuah hasil. Tendangan Arkadiusz Milik meneruskan umpan Zielinski mentah di barisan belakang Empoli.Umpan Hamed Junior Traore gagal dimanfaatkan Farias pada menit ke-75. Percobaannya masih bisa diantisipasi hingga cuma berbuah tendangan sudut.Percobaan terakhir Napoli lewat tendangan bebas pada menit terakhir terbuang percuma. Umpan Jose Callejon ke jantung pertahanan Empoli tak akurat.Di sisa pertandingan tak ada gol tambahan, Napoli tumbang 1-2 di kandang Empoli.Dengan hasil ini, Napoli tetap menempati posisi kedua klasemen dengan raihan 63 poin. Sementara itu, Empoli ada di posisi ke-17 dengan koleksi 28 poin.Baca juga: Roma vs Napoli: Menanti Serigala Ibu Kota yang Lebih GalakSusunan PemainEmpoli: Provedel; Maietta, Silvestre, Veseli; Di Lorenzo, Krunic (Brighi 40), Bennacer, Traore, Pajac; Farias, CaputoNapoli: Meret; Malcuit, Luperto, Koulibaly, Mario Rui; Callejon, Allan, Zielinski, Younes (Ruiz 58); Ounas (Mertens 57), Milik (cas/rin) napoli empoli liga italia","Hasil Liga Italia: Napoli Tumbang di Kandang Empoli"
"dict","sport","Manchester - Babak pertama Manchester City vs Cardiff City sudah selesai. Untuk sementara, The Citizens unggul 2-0.Saat menjalani pertandingan Liga Inggris di Etihad Stadium, Kamis (4/4/2019) dinihari WIB, City mampu unggul cepat. Kevin De Bruyne yang mencatatkan nama di papan skor pada menit keenam.Aymeric Laporte mengirim umpan terobosan. De Bruyne bisa menguasai bola lalu melepaskan tembakan dari sudut sempit. Kiper Cardiff, Neil Etheridge, gagal mengantisipasi bola masuk ke gawang. googletag.cmd.push(function() { googletag.display('div-gpt-ad-1535945694694-0'); }); City harus melakukan pergantian pada menit ke-19. Oleksandr Zinchenko mengalami cedera, hingga harus digantikan Kyle Walker.Cardiff belum bisa mengancam hingga menit ke-30. Mereka belum bisa melepaskan tembakan. Sementara itu, City sudah melakukan tujuh percobaan, tiga di antaranya mencapai sasaran dalam data yang dilansir oleh situs resmi Premier League.Baca juga: Bernardo Silva Yakin City Bisa Menangi QuadrupleGabriel Jesus melewatkan peluang emas pada menit ke-40. Dalam skema serangan balik cepat, De Bruyne mengirim umpan matang. Bolanya ditendang menyamping dari dalam kotak penalti oleh pemain Brasil itu.City menggandakan keunggulan pada menit ke-44. Leroy Sane pencetak golnya. Umpan silang Riyad Mahrez mengarah ke Gabriel Jesus. Bolanya disodorkan kepada Sane dengan dada, dikirim oleh pemain Jerman itu masuk ke gawang dengan tendangan keras dari dalam kotak penalti. Di sisa babak pertama tak ada gol lagi, City unggul 1-0 saat jeda.Susunan Pemain:Man City: Ederson; Danilo, Stones, Laporte, Zinchenko (Walker 19); Foden, Fernandinho, De Bruyne; Sané, Gabriel Jesus, MahrezCardiff: Etheridge; Peltier, Morrison, Manga, Bennett; Ralls, Gunnarsson; Hoilett, Camarasa, Murphy; NiasseBaca juga: Lupakan Quadruple, City Harus Fokus ke Cardiff (cas/rin) manchester city cardiff city liga inggris","Babak I: City 2-0 Cardiff"
"dict","sport","Manchester - Manchester City memetik poin penuh saat melawan Cardiff City pada lanjutan Liga Inggris. The Citizens menang 2-0.Dalam pertandingan Liga Inggris di Etihad Stadium, Kamis (4/4/2019) dinihari WIB, City memetik kemenangan dengan nyaman.Pada babak pertama, tim asuhan Josep Guardiola itu unggul 2-0. Kevin de Bruyne menjebol gawang tim tamu pada menit keenam, gol itu dicatat Opta sebagai gol ke-17 City dalam 15 menit awal pertandingan musim ini. Leroy Sane menggandakan keunggulan City pada menit ke-44. googletag.cmd.push(function() { googletag.display('div-gpt-ad-1535945694694-0'); }); City mendominasi pertandingan dengan catatan penguasaan bola lebih dari 79 persen. Percobaan tim asuhan Josep Guardiola itu sebanyak 26 kali, 11 mencapi sasaran.Kendati tampil dominan, City tak bisa menambah gol pada babak kedua. Hingga peluit panjang dibunyikan, skor 2-0 untuk kemenangan City tak berubah.Baca juga: Babak I: City 2-0 CardiffDengan tambahan tiga angka ini, City mengambil alih posisi teratas klasemen Liga Inggris dari Liverpool. City mengumpulkan 80 poin, unggul satu angka dari Liverpool.Sementara itu, Cardiff ada di posisi ke-18 dengan raihan sebanyak 28 angka hasil dari 32 kali bertanding.Susunan Pemain:Man City: Ederson; Danilo, Stones, Laporte, Zinchenko (Walker 19); Foden, Fernandinho, De Bruyne; Sané, Gabriel Jesus, MahrezCardiff: Etheridge; Peltier, Morrison, Manga, Bennett; Ralls, Gunnarsson (Bacuna 81); Hoilett, Camarasa (Reid 83), Murphy (Mendez-Laing 60); NiasseBaca juga: Bernardo Silva Yakin City Bisa Menangi Quadruple (cas/rin) manchester city cardiff city liga inggris","Hasil Liga Inggris: City Taklukkan Cardiff 2-0"
"dict","sport","London - Tuntas sudah laga babak I antara Chelsea vs Brighton dalam lanjutan Liga Inggris. Chelsea sementara unggul 1-0, berkat gol Olivier Giroud di menit ke-38.Chelsea menjamu Brighton di Stamford Bridge, Kamis (4/4/2019) dinihari WIB. The Blues menguasai permainan dengan 69 persen ball possesion dengan satu percobaan on target dari total 11, yang bisa dikonversi menjadi gol. Sedangkan Brighton kesulitan mengimbangi agresivitas tim tuan rumah. Si Burung Camar hanya bisa menciptakan satu percobaan saja, itupun tidak tepat sasaran. googletag.cmd.push(function() { googletag.display('div-gpt-ad-1535945694694-0'); }); Baca juga: Roman Abramovich Sudah Tidak Punya Royal Box di Chelsea?Jalannya PertandinganChelsea mendominasi penguasaan bola. Tapi peluang nyata pertama baru hadir di menit ke-11 saat N'Golo Kante bekerja sama dengan Callum Hudson-Odoi di sayap kanan. Pemain yang disebut terakhir melakukan tusukan sebelum melepaskan tembakan melengkung ke arah tiang jauh meski diblok sehingga melambung.Setelahnya, sepak pojok Chelsea mengancam gawang Brighton lagi. Tendangan Hazard disambut Olivier Giroud dengan sundulan di dalam kotak penalti, tapi bola belum tepat sasaran.Di menit ke-15, klaim penalti Chelsea ditolak. Kante jatuh dalam kawalan Gaetan Bong tapi wasit tidak menganggap ada pelanggaran.Brighton akhirnya bisa keluar dari tekanan. Empat menit kemudian, Alireza Jahanbaksh melepaskan umpan silang yang diteruskan Solomon March dengan sontekan, tapi bola hanya bersarang di sisi luar jala gawang Kepa Arrizabalaga.Chelsea terus mengurung Brighton. Di menit ke-27, crossing Cesar Azpilicueta menemui Giroud yang diteruskan dengan tandukan tapi bola masih melenceng. Usaha Chelsea kembali menemui jalan buntu saat sepakan Giroud diblok dua pemain bertahan lawan. Delapan menit kemudian, Brighton gagal memanfaatkan peluang. Yves Bissouma melewati penjagaan Hudson-Odoi dan Azpilicueta, sebelum menusuk dari byline. Sebuah umpan silang dilepaskan Bissouma di depan gawang tapi tidak ada kawan yang menyambar.Peluang emas juga dilewatkan Chelsea di menit ke-37. Sundulan Giroud menemui Hazard, tapi dalam posisi tidak terkawal, sepakan kaki kirinya dari tengah kotak penalti justru melambung tinggi.Kebuntuan Chelsea akhirnya terpecah semenit berselang. Giroud membuka keunggulan untuk memimpin 1-0. Dari sisi kanan, Hudson-Odoi mengirim umpan silang mendatar yang diselesaikan Giroud dengan sontekan dari tiang dekat. Di akhir waktu normal, peluang lain Chelsea terlahir. Dari kiri kotak penalti, Hazard melepaskan bola lambung kepada Hudson-Odoi. Tapi pemain yang disebut terakhir kurang tenang sehingga gagal mengantisipasi, momentum pun hilang.Susunan PemainCHELSEA: Kepa, David Luiz, Azpilicueta, Emerson, Christensen, Jorginho, Kante, Loftus-Cheek, Hazard, Giroud, Hudson-OdoiBRIGHTON & HOVE ALBION: Ryan, Bong, Bruno Saltor, Duffy, Dunk, Stephens, Proepper, March (Knockaert 31'), Bissouma, Andone, Jahanbakhsh (rin/cas) chelsea brighton & hove albion liga inggris","Babak I, Gol Giroud Antar Chelsea Memimpin 1-0 atas Brighton"
