"_type","category","isi","judul"
"dict","finance","Jakarta - Kementerian Keuangan (Kemenkeu) menganggarkan sebesar Rp 25,59 triliun untuk kegiatan pemilihan umum (Pemilu) serentak pada 17 April 2019. Angka ini naik 61% dibanding anggaran untuk Pemilu 2014 yang sebesar Rp 15,62 triliun.""Berdasarkan data, alokasi anggaran untuk persiapan awal di tahun 2017 sekitar Rp 465,71 miliar. Kemudian pada 2018 (alokasi) mencapai Rp 9,33 triliun. Selanjutnya di 2019 ini, kita sudah menganggarkan sampai Rp 15,79 triliun. Jadi totalnya dalam 3 tahun itu kita menyiapkan anggaran sebanyak Rp 25,59 triliun,"" kata Direktur Jenderal Anggaran (Dirjen Anggaran) Kementerian Keuangan Askolani dalam keterangannya, Rabu (27/3/2019).Askolani menjelaskan, alokasi penganggaran untuk Pemilu 2019 terbagi dalam kelompok penyelenggaraan, pengawasan, dan kegiatan pendukung seperti keamanan. googletag.cmd.push(function() { googletag.display('div-gpt-ad-1535944306169-0'); }); Selain anggaran penyelenggaraan Pemilu sebesar Rp 25,6 triliun, juga dialokasikan anggaran untuk pengawasan sebesar Rp 4,85 triliun (naik dibanding 2014 sebesar Rp 3,67 triliun), dan anggaran keamanan dialokasikan sebesar Rp 3,29 triliun (anggaran 2014 Rp 1,7 triliun). Begitupun anggaran untuk kegiatan pendukung pemilu, meningkat dari Rp 1,7 triliun pada Pemilu 2014 menjadi Rp 3,29 triliun pada Pemilu 2019.Askolani menyampaikan terdapat dua faktor utama kenaikan anggaran pemilu ini. Pertama, adanya pemekaran daerah. ""KPU Provinsi jumlahnya bertambah satu ya, dari 33 sekarang jadi 34. Kemudian untuk KPU kabupaten, itu bertambah 17 KPU Kabupaten dari 497 menjadi 514 KPU Kabupaten/Kota,"" terangnya.Baca juga: Kritik Serapan Anggaran KemenPANRB, Sri Mulyani: Tahun Lalu Hanya 85%Hal ini selanjutnya berdampak pula pada kenaikan jumlah penyelenggara pemilu di daerah, baik PPK, PPS, hingga KPPS. ""Inilah yang menyebabkan biaya bertambah. Karena memang penyelenggaranya dan lembaganya juga bertambah,"" ungkap Askolani. Sebab kedua, adanya kenaikan honorarium bagi para penyelenggara pemilu, seperti PPK, PPS, dan KPPS. Termasuk juga panitia yang ada di luar negeri. ""Kita hitung sesuai usulan KPU untuk mengadopsi dampak dari inflasi,"" katanya.Disebut Hemat AnggaranSementara itu Kepala Biro Perencanaan Data Komisi Pemilihan Umum (KPU) Sumariyandon mengemukakan, meski mengalami peningkatan anggaran yang signifikan dibandingkan periode sebelumnya, pelaksanaan pemilu serentak tahun ini juga mampu menghemat anggaran dalam jumlah yang tidak kalah signifikan.Untuk biaya honor petugas pemilu, misalnya, efisiensi anggaran mencapai 50%. Selain itu, KPU juga bisa memangkas biaya pemutakhiran data pemilih karena hanya perlu dilakukan sebanyak satu kali pada awal persiapan pemilu.Baca juga: Sri Mulyani: Utang Waktu Pemilu Perhatiannya Sangat TinggiUpaya mengefisiensikan anggaran oleh KPU juga dilakukan dalam beberapa aspek. Dalam hal pengadaan logistik, misalnya, KPU telah melaksanakannya secara elektronik melalui Katalog Nasional. Upaya ini diakui Sumariyandono mampu menghemat anggaran yang cukup besar dari pagu yang tersedia.""Tahun Anggaran 2018, pengadaan logistik dapat menghemat 50,57% atau setara dengan Rp 483 miliar, sedangkan Tahun Anggaran 2019, efisiensi mencapai 31,4% atau setara dengan Rp 355 miliar,"" jelas Sumariyandono.Tidak sampai di situ, KPU juga mengupayakan terobosan baru berupa penggunaan kotak suara dari bahan karton yang kedap air. Dari upaya tersebut, biaya pengadaan kotak suara diketahui bisa dipangkas hingga 70%.KPU memastikan bahwa kotak suara tersebut telah lulus uji kekuatan maupun kelayakan penggunaan. Upaya lain KPU dalam menekan biaya salah satunya dari sisi fasilitasi kampanye bagi para calon anggota parlemen. Dari sepuluh kali fasilitasi kampanye yang diperbolehkan Undang-Undang, KPU membatasi pemberian fasilitasi sebanyak tiga kali saja.Sebagai informasi, praktik pemilu serentak telah dilakukan di sejumlah negara di dunia. Sumariyandono menyebutkan, Amerika Serikat menjadi salah satu contohnya. ""Gubernur atau kepala daerah di AS dipilih bersamaan dengan pemilihan presiden serta para senator,"" ungkap Sumariyandono.Selain itu, dia menambahkan, pemilu serentak juga dilaksanakan oleh 12 negara dari total 18 negara di kawasan Amerika Latin. (fdl/fdl) pemilu 2019 kemenkeu anggaran pemilu anggaran","Fantastis! Anggaran untuk Pemilu 2019 Capai Rp 25 T"
"dict","finance","Jakarta - Industri sawit Indonesia mengalami diskriminasi di Eropa karena disebut merusak lingkungan, hingga membuat harga sawit jatuh. Memang seperti apa faktanya?Menurut Ketua Umum Gabungan Pengusaha Kelapa Sawit Indonesia (GAPKI) Joko Supriyono pada dasarnya penggunaan lahan untuk kelapa sawit hanya sebesar 17 juta ha. Sedangkan lahan untuk penggunaan minyak nabati mencapai 278 juta ha.Ia menilai hal tersebut tak sebanding karena klaim kerusakan lingkungan dalam bentuk deforestasi atau mengubah lahan hutan menjadi bukan hutan yang ditujukan kepada kepala sawit Indonesia. googletag.cmd.push(function() { googletag.display('div-gpt-ad-1535944306169-0'); }); ""Penggunaan lahan di dunia itu untuk minyak nabati luas perkebunannya 278 juta ha dan sawitnya cuma 17 juta ha. Jadi 17 juta ha versus 278 juta ha lho,"" kata dia dalam paparan Pengembangan Industri Kelapa Sawit Menuju Kemandirian Energi di Ayana Midplaza Hotel, Jakarta, Rabu (27/3/2019).Baca juga: Bamsoet Sebut Diskriminasi Sawit dari Uni Eropa Cacat Ilmiah""Jadi kalau dibilang sawit penyebab utama deforestasi itu datanya cuma segitu (17 juta ha),"" sambung dia.Untuk itu, ia berharap agar Uni Eropa dan masyarakat paham maksud dari kerusakan lingkungan yang sebenarnya. Pasalnya, yang menggunakan lahan paling besar justru dari industri minyak nabati.""Jadi yang paling banyak kontribusi (deforestasi) itu minyak nabati,"" tutup dia.Sebagai informasi, sawit mengalami diskriminasi dalam bentuk kampanye hitam sawit di Eropa sejak tahun 2012.Baca juga: Uni Eropa Diskriminasi Sawit RI, JK: You Larang 10, Kita Lawan 10! (fdl/fdl) sawit harga sawit petani sawit","Sawit RI Disebut Merusak Lingkungan, Seperti Apa Faktanya?"
"dict","finance","Jakarta - Menteri Kelautan dan Perikanan Susi Pudjiastuti irit bicara saat dimintai tanggapan soal niatan calon wakil presiden nomor 02 Sandiaga Uno yang ingin melegalkan cantrang.Mulanya, Susi hanya diam saat dimintai tanggapan terkait rencana tersebut. Kemudian, terlontar dua kata dari mulutnya.""Kasihan saja,"" kata Susi di Kantor Badan Pemeriksa Keuangan (BPK) Jakarta, Rabu (27/3/2019). googletag.cmd.push(function() { googletag.display('div-gpt-ad-1535944306169-0'); }); Susi hari ini mengunjungi kantor auditor pemerintah tersebut. Susi bersama beberapa menteri lain menyerahkan Laporan Keuangan Pemerintah Pusat (LKPP) 2018 unaudited.Lebih lanjut, Susi sendiri tak memberi keterangan lanjutan apa maksud pernyataannya itu. Dia langsung masuk mobil dan meninggalkan kantor BPK.Baca juga: Kagumnya Jokowi Pada Pasar Ikan Muara Baru yang Seperti TsukijiSebelumnya, Sandiaga mengumbar 'janji manis' kepada para nelayan di Kabupaten Lamongan di mana dirinya akan mengizinkan pemakaian penggunaan cantrang. Janji itu disampaikan Sandi saat berkampanye di Desa Sedayu Lawas, Kecamatan Brondong, Lamongan.""Kebijakan itu sangat merugikan nelayan. Jangan hanya karena kita memperhatikan lingkungan, lantas membuat para nelayan dibatasi mencari ikan. Insya Allah di bawah Prabowo-Sandi nelayan Pantura sejahtera,"" kata Sandiaga, kemarin (26/3/2019).Sandi juga berjanji akan memenuhi semua kebutuhan nelayan, seperti penyediaan bahan bakar yang murah dan memberikan bantuan. Dia berjanji akan membuat nelayan sejahtera.Dalam orasinya yang singkat, Sandi juga berjanji akan fokus membenahi ekonomi bangsa dengan program-program yang pro dengan kesejahteraan masyarakat. Antara lain dengan membuka lapangan pekerjaan bagi kalangan muda dan memenuhi kebutuhan para emak-emak.Baca juga: Geram Ada Rumpon di Tengah Laut, Susi: Saya Sapu Itu! (eds/eds) susi pudjiastuti sandiaga uno cantrang","Sandi Mau Izinkan Cantrang, Susi: Kasihan"
"dict","sport","Jakarta - Argentina kembali ke jalur kemenangan saat tampil tanpa sang bintang, Lionel Messi. Menghadapi Maroko, La Albiceleste menang tipis 1-0.Argentina menghadapi Maroko di Stade Ibn Batouta, Rabu (27/3/2019) dinihari WIB pada laga persahabatan. Pada pertandingan sebelumnya di mana Messi comeback memperkuat timnas, Argentina malah keok 1-3 dari Venezuela.Baca juga: Laga Persahabatan: Messi Comeback, Argentina Dikalahkan Venezuela 1-3 googletag.cmd.push(function() { googletag.display('div-gpt-ad-1535945694694-0'); }); Bermain tanpa Messi, Argentina memainkan pola awal 4-4-2 dengan Paulo Dybala dan Lautaro Martinez berduet di depan. Absennya Messi membuat Argentina kesulitan mengontrol permainan dan dalam kreasi serangan.Tim besutan Lionel Scaloni itu bahkan kalah dominan dalam hal penguasaan bola dari Maroko, dengan perbandingan 43%-57%. Argentina melepaskan 13 tembakan di mana hanya dua yang on target, sementara Maroko punya 10 percobaan juga dengan dua yang mengarah ke gawang.Baca juga: Messi Cedera, Maroko ke Argentina: Masa Sih?Maroko lebih dulu mengancam, mendapatkan peluang setelah 11 menit laga berjalan. Khalid Boutalib punya ruang tembak usai menerima bola dari Younes Belhanda, namun tendangannya lemah dan mudah diamankan Esteban Andrada.Kedua tim pada prosesnya sama-sama kesulitan menciptakan peluang bersih. Saat laga terlihat akan tuntas dengan skor kacamata, Angel Correa menjadi pembeda.Dia menusuk dari sisi kiri, melewati Achraf Hakimi, lalu melepaskan sepakan yang menaklukkan kiper Maroko Yassine Bounou. Itu jadi satu-satunya gol di pertandingan kali ini.Baca juga: Bukan Messi yang Harus Lebih Baik di Argentina, tapi Pemain-Pemain LainSusunan pemain:Maroko: Yassine Bounou; Noussair Mazraoui, Medhi Benatia (Abdelhamid 61'), Manuel da Costa (Idrissi 87'), Achraf Hakimi; Mbark Boussoufa (Fajr 74'), Karim El Ahmadi (Bennasser 61'), Romain Saiss; Younes Belhanda (Bourabia 87'), Khalid Boutaib (Alioui 75'), Sofiane BoufalArgentina: Esteban Andrada (Juan Musso 67'); Gonzalo Montiel, German Pezzella, Walter Kannemann, Marcos Acuna; Roberto Pereyra (Ivan Marcone 92'), Leandro Paredes (Federico Zaracho 76'), Guido Rodriguez, Rodrigo De Paul (Rodrigo De Paul 62'); Paulo Dybala (Giovani Lo Celso 79'), Lautaro Martinez (Matias Suarez 56') (raw/yna) timnas argentina timnas maroko lionel messi","Laga Persahabatan: Tanpa Messi, Argentina Atasi Maroko"
"dict","finance","Jakarta - Tak jauh dari Pelabuhan Saketa, Halmahera Selatan berdiri sebuah rumah yang tampak bagus dibanding rumah lainnya di kampung itu. Rumah berkelir putih itu, mentereng dengan keramik putih dan desain pintu bergaya modern. Di depan rumah tersebut, sudah ada spanduk biru besar betuliskan ""Agen BRILink"". Ya, rumah tersebut adalah milik Badarudin Saleh (40).Dengan ramah, Badarudin mempersilakan kami masuk. Sembari tersenyum, Badar, biasa dia disapa, mengatakan segala yang didapat tak lepas dari pendapatannya sebagai agen BRILink sejak 2016.Baca juga: Dulu Warga Madapolo Kirim Uang Ratusan Juta Lewat Laut""Hampir bersamaan dengan datangnya kapal Seva. Saya awalnya tidak tahu soal BRILink namun ditawari. Awalnya takut belum pernah juga,"" cerita dia kepada detikFinance, Kamis (7/5/2019). googletag.cmd.push(function() { googletag.display('div-gpt-ad-1535944306169-0'); }); Namun dorongan untuk menyediakan layanan perbankan untuk masyarakat kampung yang tak ada bank di dalamnya begitu kuat. Dia ingin masyarakat terbantu saat ingin bayar listrik, transfer, atau menarik uang tunai.Kendati demikian, masalah jaringan membuatnya kesulitan melayani masyarakat. Jaringan yang kerap mati hidup ini juga diakali Badar dengan cara yang sebenarnya mengandung risiko untuk Badar.""Pernah jaringan tidak bisa sampai 1 minggu. Kadang kalau sudah percaya, saya kasih saja duitnya nanti kalau jaringan sudah normal, saya narik uang mereka. Saya juga harus pergi sampai Gane Timur, Samafa yang ada jaringan di sana sampai ratusan kilo. Jadi saya kumpulin di sana kalau ada jaringan saya ambil (transaksi) di situ,"" Badar mengaku tidak mau juga pelanggannya jauh-jauh datang tapi jaringan tidak bisa. Apalagi setiap hari puluhan warga datang untuk melakukan transaksi di rumahnya.""Apalagi mereka harus ongkos ke sini jadi kasihan juga,"" kata Badar yang juga seorang sopir antar BBM ini.Oleh karena itu, Badar berharap agar provider jaringan tersebut bisa memperbaiki sinyalnya di Pulau Saketa. Baca juga: Sebelum Ada Bank Terapung, Warga Simpan Uang di Dalam TanahSementara itu, Saiful Azis (35), pelanggan Badar, mengaku sering menarik uang di tempat Badar meski jaringan suka ngadat. Namun karena sudah terpercaya, dia pun rela mengantre bersama warga lainnya.""Sering saya ke sini sebulan sampai 5 kali. Kalau di sini tinggal pakai motor kalau ke Bacan butuh 2 hari. Paling banyak saya tarik Rp 6 sampai 10 juta,"" tutur nelayan ini.Sementara itu Pimpinan Cabang Pembantu Kantor BRI Labuha Halmahera Selatan Erys P Saragih mengatakan agen BRILink merupakan salah satu kunci keberhasilan BRI.""Dengan adanya agen BRILink kita nggak perlu infrastruktur dan SDM karena mereka merupakan nasabah karakter bagus sehingga dengan adanya mereka nasabah enggak perlu sewa kapal datang ke Labuha karena mereka ditempatkan di tengah masyarakat,"" tuturnya. Baca berita lainnya mengenai Teras BRI Kapal Bahtera Seva di Ekspedisi Bahtera Seva. (ega/ara) bahtera seva bri bahteraseva-bri bahteraseva bahteraseva-halmahera bri","Agen BRILink Cari Sinyal hingga Ratusan Kilo Biar Bisa Transaksi"
"dict","sport","Ta' Qali - Timnas Spanyol meraih kemenangan keduanya di Grup F Kualifikasi Piala Eropa 2020. Menghadapi Malta, La Furia Roja menang 2-0 lewat dua gol Alvaro Morata.Bermain di Ta' Qali National Stadium, Rabu (27/3/2019), Spanyol tampil mendominasi atas Malta. Di babak pertama, Tim Matador melepaskan 9 percobaan dan 2 yang on target, sementara tuan rumah tidak diberi kesempatan sama sekali.Peluang pertama datang di meni keempat. Berawal dari tendangan bebas yang dilepaskan Juan Bernat, Sergio Ramos bisa menanduk bola, namun bola masih melayang ke atas gawang Malta. googletag.cmd.push(function() { googletag.display('div-gpt-ad-1535945694694-0'); }); Baca juga: Enrique: Spanyol Mandul? Kami Lebih Tajam dari Barca LohSpanyol kembali menebar ancaman pada menit ke-16 dan 18. Kerja sama Saul Niguez dan Sergi Roberto dua kali menghasilkan tendangan ke gawang, namun arahnya masih belum menemui sasaran.Pada menit ke-30, Spanyol akhirnya memecah kebuntuan lewat gol Alvaro Morata. Menerima umpan lambung ke kotak penalti dari Mario Hermosso, Morata melepaskan sepakan kaki kiri dari sudut sempit. Bola sempat mengenai kiper Henry Bonello, namun tetap mampu bergulir ke gawang Malta.Usai unggul 1-0, Spanyol sempat mengancam beberapa kali lagi lewat Saul dan Marco Asensio. Malta masih mampu menjaga gawangnya tak kebobolan lagi, sehingga skor tetap bertahan hingga jeda.Di babak kedua, Spanyol masih mendominasi Malta. Morata dan Asensio masih leluasa menebar ancaman ke gawang lawan, namun belum ada gol tambahan tercipta.Keunggulan Spanyol bertambah di menit ke-73. Crossing Jesus Navas, yang menggantikan Saul, bisa ditanduk dengan sempurna Morata, yang membuat bola bersarang ke gawang Malta. Di sisa waktu pertandingan, tidak ada gol tambahan. Spanyol mengakhiri laga dengan kemenangan 2-0 atas Malta. Dengan hasil ini, Spanyol sementara memuncaki Grup F dengan enam poin, usai di laga perdana juga menang 2-1 atas Norwegia. Adapun Malta turun ke posisi empat dengan tiga poin.Baca juga: Enrique: Morata Jauh Lebih Baik Sejak Tinggalkan ChelseaSusunan PemainMalta: Bonello, Mbong (Muscat 65'), Muscat, Caruana (Micallef 85'), Borg, Zerafa, Mintoff (Mifsud 70'), Fenech, Guillaumier, Corbalan, NwokoSpanyol: Kepa, Gaya, Hermoso, Sergio Ramos, Sergi Roberto, Saul (Navas 65'), Rodri, Canales, Bernat (Muniain 56'), Asensio, Morata (Rodrigo 79') (yna/raw) timnas spanyol timnas malta kualifikasi piala eropa 2020 alvaro morata","Hasil Kualifikasi Piala Eropa: Morata Dua Gol, Spanyol Tekuk Malta 2-0"
"dict","finance","Halmahera Selatan - Masih lekat dalam ingatan Aman H Hasanah (53) sekitar 5 tahun lalu saat dirinya dipanggil ke SMA anaknya. Semula, dia berpikir tidak-tidak soal ini, dia khawatir anaknya buat masalah hingga menyebabkan dirinya dipanggil ke sekolah.Namun fakta yang didapat Aman sungguh di luar dugaan. Saat itu dia mengaku kaget luar biasa. Bercampur haru, dia ceritakan kabar bahagia itu kepada detikFinance.""Staf guru panggil saya ke kantor. Katanya suruh anak saya masuk kedokteran karena anak saya mau dan mampu,"" ucap Aman berkisah di tempat kerjanya, Madapolo, Halmahera Selatan, Rabu (6/3/2019). googletag.cmd.push(function() { googletag.display('div-gpt-ad-1535944306169-0'); }); Baca juga: Agen BRILink Cari Sinyal hingga Ratusan Kilo Biar Bisa TransaksiAman pun buru-buru mengecek keuangannya. Dia pun menyanggupinya karena merasa mampu membiayai sekolah anaknya, apalagi dia sudah sengaja menabung selama 2 tahun.""Saya diskusi dengan dosen-dosen satu bulan berapa harus saya siapkan uang itu. Apalagi nggak ada beasiswa. Rp 10 juta satu semester sampai koas kira-kira saya harus siapkan Rp 55 juta saya pikir saya mampu,"" lanjut Aman.Kesungguhan dan rasa optimis Aman ini sempat dipertanyakan oleh anak bungsunya itu. Anaknya tahu benar jika bapaknya hanya seorang nelayan dengan kapal Pajeko.""Dalam perjalann tes itu dia menangis. Lalu saya tanya kenapa apa dia menangis apa karena kesusah pelajaran. Tapi dia malah tanya sama saya apa saya punya uang untuk biaya sekolah,"" cerita Aman sembari sesekali mengusap matanya yang mulai berair.""Banyak yang punya uang banyak tapi nggak mampu tapi anak saya mampu jadi dokter. Jadi kalau garis tangan di situ dia pasti jadi,"" tuturnya optimis.Akhirnya, anaknya pun melenggang mulus diterima di universitas negeri di Palu fakultas Kedokteran dan akan lulus di tahun 2020. Aman mengaku segala mimpi anaknya menjadi dokter tersebut dia bangun dari satu perahu yang disebut dengan Pajeko.Baca juga: Dulu Warga Madapolo Kirim Uang Ratusan Juta Lewat LautPerahu Pajeko mempunyai desain dan struktur terbuat dari kayu dan terinspirasi dari nelayan-nelayan di Ambon. Aman telah berganti banyak perahu Pajeko sejak 2001, kali ini dia tengah membuat perahu yang bermuatan 17 ton ikan dengan panjang 17 m dan lebar 3 m. Di dalamnya terdiri dari 2 ruang palka ikan, 2 ruang mesin, dan tempat penampungan ikan.""Bahan baku dari Bitung dan Ambon. Kain mat dari Ternate. Sekarang yang kerja ini 8 orang dari tangga 1 Februari , minggu ini selesai. Biayanya Rp 350 juta. Uang pembuatan dari uang sendiri dari hasil kapal Pajeko sebelumnya. Kapal sebelumnya itu sudah lama sudah 13 tahun makanya saya ganti jadi bahan fiber,"" paparnya pemilih perahu Pajeko dengan nama 'Family' ini.Dari kapal Pajeko sebelumnya, Aman mengaku bisa meraup pendapatan kotor Rp 10 sampai 50 juta dengan jumlah ikan yang didapat 25 box dalam sehari.Aman mengaku sempat mengalami kesulitan keuangan selama dia tidak melaut dan membuat Pajeko ini. Apalagi dia harus membayar kuliah anaknya.""Saya pinjam Rp 100 juta kepada BRI untuk bayar tukang. Baru kali ini saya pinjam lagi karena anak sekolah dan saya bangun kapal,"" tuturnya.Dia mengaku lebih mudah jika meminjam dari BRI. Bahkan dengan adanya Teras BRI Kapal Bahtera Seva III dia tidak perlu pergi ke Pulau Bacan untuk meminjam uang. ""Enak sekali dengan adanya kapal BRI ini,"" tutupnya senang. Baca juga: Tolong! Petani Pala di Madapolo Butuh Binaan Jaga Kualitas EksporSebagai informasi, Teras BRI Kapal Bahtera Seva III atau sering disebut Bahtera Seva yang melayani perbankan di sekitar Halmahera Selatan, Maluku Utara.Bank terapung ini beroperasi selama 4 hari setiap minggu yang mempunyai rute Pulau Bacan (homeport), Pulau Batang Lomang, Mandioli, Madapolo, Pasipalele, Saketa, Kayoa, lalu kembali lagi ke homeport. Adapun jadwal pelayarannya dari Selasa hingga Jumat. Baca berita lainnya mengenai Teras BRI Kapal Bahtera Seva di Ekspedisi Bahtera Seva. (ega/hns) bahtera seva bri bahteraseva bahteraseva-bri bahteraseva-halmahera bri","Dari Perahu Pajeko, Bapak Wujudkan Mimpi Anak Jadi Dokter"
"dict","finance","Halmahera selatan - ""Bismillah,"" doa dari sang kapten memulai perjalanan Teras BRI Kapal Bahtera Seva III dari Pulau Kayoa menuju homeport di Pulau Bacan. Perjalanan di Kayoa menuju Pulau Bacan memang lebih ""spesial"" dibanding dengan perjalanan sebelumnya. Kenapa? Jebakan karang dan pertemuan arus alasannya.Oleh karena itu, saat mesin mulai menderu, seorang nelayan dengan kapal kecil telah bersiap di depan kapal kami. Nelayan tersebut 'menuntun' kapal melewati jebakan karang yang ada di kanan kiri kapal.Dengan perlahan dan hati-hati sang kapten piawai dan lihai hingga akhirnya kapal buatan Amerika ini lolos dari jebakan karang. Tapi tunggu dulu, ini baru satu tantangan. Lepas dari jebakan karang, kapal yang dikomandoi Indra Asmara Yudha (32) harus menghadapi tantangan berikutnya berupa pertemuan arus yang terus berlangsung hingga satu sampai dua jam ke depan. googletag.cmd.push(function() { googletag.display('div-gpt-ad-1535944306169-0'); }); Baca juga: Sebelum Ada Bank Terapung, Warga Simpan Uang di Dalam TanahSelama itu, kapal terus menerus terombang-ambing hebat sampai jika tak ada yang bisa berdiri normal semua terguncang dan memilih duduk diam.""Lalu lintas di sini sebenarnya sepi yang paling riskan itu memang karang sama pusaran air. Arusnya gitu muter-muter sehingga membawa kapal jadi liar. Biasanya itu akibat efek dari gaya luar makanya kalau kapal ke kanan kita balasnya ke kiri. Itu ada di arah Batang Lomang dan satu lagi saat keluar dari Kayoa,"" cerita Indra kepada detikFinance di atas Teras BRI Kapal Bahtera Seva III, Kamis (7/3/2019).Soal ombak, Indra menceritakan di Halmahera Selatan bergantung dari musim. Jika musim barat, ombak yang menghadang itu besar tapi ada jedanya satu atau dua hari""Nanti begitu lagi kalau musim timur ombak kecil tapi kontinyu. Cuma kita pikiran alat-alat di sini kadang bisa geser itu yang kita pikirkan. Kalau kapal masih bisa dikendalikan saat musim ombak,"" jelas pria yang sudah jadi kapten selama 2 bulan tersebut.Foto: Agung Pambudy/detikcomLebih jauh, Indra mengatakan setidaknya ada tantangan lain, selain jebakan karang dan pertemuan arus. Tantangan tersebut adalah dermaga yang masih jauh dari kata layak.""Karena di Desa Batang Lomang, lelei, Madapolo, Kayoa terbuat dari kayu dan konstruksinya tidak sekuat cor-coran yang kuat jadi nggak bisa sembrono nanti bisa roboh dermaganya. Kebetulan juga banyak karang jadi harus melewati bener-bener harus fokus GPS on track kalau lari bisa nyangkut ke karang,"" curhat dia.Sementara itu, Chief Engineer Aditya Okianto mengatakan dari sisi teknis tak ada kendala yang berarti saat mengarungi 6 pulau. Kendati demikian dia mengaku kesulitan dalam mencari sparepart jika ada material yang harus diganti.""Tapi perusahaan kita menerapkan plan maintance system untuk merawat umur mesin agar tidak breakdown di tengah. Ke depan saya berharap semoga kerja sama dengan BRI terus berlangsung sampai batas waktu yang ditentukan,"" tukas Aditya.Baca juga: Cerita Nelayan Lari Pertama Kali Lihat Bank TerapungSebagai informasi, Teras BRI Kapal Bahtera Seva III atau sering disebut Bahtera Seva yang melayani perbankan di sekitar Halmahera Selatan, Maluku Utara.Bank terapung ini beroperasi selama 4 hari setiap minggu yang mempunyai rute Pulau Bacan (homeport), Pulau Batang Lomang, Mandioli, Madapolo, Pasipalele, Saketa, Kayoa, lalu kembali lagi ke homeport. Adapun jadwal pelayarannya dari Selasa hingga Jumat. Baca berita lainnya mengenai Teras BRI Kapal Bahtera Seva di Ekspedisi Bahtera Seva. (ega/hns) halmahera selatan bahtera seva bri bahteraseva bahteraseva-bri bahteraseva-halmahera bri","Menegangkan! Saat Kapal Bank Terjang Gelombang dan Jebakan Karang"
