"_type","category","isi","judul"
"dict","hot","Jakarta - Hotman Paris ditanya pilihannya saat ditanya Syahrini atau Luna Maya. Hotman lebih memilih Luna Maya ketimbang Syahrini. Apa alasannya?Hal itu terungkap saat Hotman menjadi bintang tamu di acara 'Call Me Mel' yang dipandu Melanie Ricardo. Melanie menanyakan apakah Hotman menyukai Luna Maya.""Lo naksir sama Luna Maya? Jujur bang. Apakah Anda memiliki perasaan suka sama Luna Maya?"" tanya Melanie, dilihat detikHOT, Kamis (28/3/2019). googletag.cmd.push(function() { googletag.display('div-gpt-ad-1535944650921-0'); }); ""Suka tapi belum naksir,"" jawab Hotman tertawa.Baca juga: Mantap! Demi Meriam Belina, Hotman Paris Pernah Belikan Vila Rp 3 Miliar""Baru suka karena Luna belum respons,"" timpal Melanie lagi.Melanie kemudian iseng memberi pertanyaan pilihan kepada Hotman. Pengacara kondang itu diminta untuk memilih di antara Syahrini atau Luna Maya.""Syahrini atau Luna Maya?"" kata Melanie.""Luna Maya sekarang. Syahrini udah punya orang,"" sebut Hotman. (nkn/doc) syahrini luna maya hotman paris hotman paris hutapea Photo Gallery 1 celeb Raffi Ahmad Reunian dengan Luna Maya celeb Raffi Ahmad Reunian dengan Luna Maya celeb Raffi Ahmad Reunian dengan Luna Maya celeb Raffi Ahmad Reunian dengan Luna Maya celeb Raffi Ahmad Reunian dengan Luna Maya celeb Raffi Ahmad Reunian dengan Luna Maya 1 celeb Jangan Iri! Mengintip Kemesraan Reino Barack dan Syahrini celeb Jangan Iri! Mengintip Kemesraan Reino Barack dan Syahrini celeb Jangan Iri! Mengintip Kemesraan Reino Barack dan Syahrini celeb Jangan Iri! Mengintip Kemesraan Reino Barack dan Syahrini celeb Jangan Iri! Mengintip Kemesraan Reino Barack dan Syahrini celeb Jangan Iri! Mengintip Kemesraan Reino Barack dan Syahrini 2 celeb Resmi Nikah, Syahrini dan Reino Barack Pamer Cincin celeb Resmi Nikah, Syahrini dan Reino Barack Pamer Cincin celeb Resmi Nikah, Syahrini dan Reino Barack Pamer Cincin celeb Resmi Nikah, Syahrini dan Reino Barack Pamer Cincin celeb Resmi Nikah, Syahrini dan Reino Barack Pamer Cincin celeb Resmi Nikah, Syahrini dan Reino Barack Pamer Cincin 3 celeb Luna Maya Menenangkan Diri di Tanah Suci celeb Luna Maya Menenangkan Diri di Tanah Suci celeb Luna Maya Menenangkan Diri di Tanah Suci celeb Luna Maya Menenangkan Diri di Tanah Suci celeb Luna Maya Menenangkan Diri di Tanah Suci celeb Luna Maya Menenangkan Diri di Tanah Suci celeb Luna Maya Menenangkan Diri di Tanah Suci 4 celeb Hotman Paris Ngaku Dicuekin Syahrini, BFF Nia Ramadhani-Jedar celeb Hotman Paris Ngaku Dicuekin Syahrini, BFF Nia Ramadhani-Jedar celeb Hotman Paris Ngaku Dicuekin Syahrini, BFF Nia Ramadhani-Jedar celeb Hotman Paris Ngaku Dicuekin Syahrini, BFF Nia Ramadhani-Jedar celeb Hotman Paris Ngaku Dicuekin Syahrini, BFF Nia Ramadhani-Jedar celeb Hotman Paris Ngaku Dicuekin Syahrini, BFF Nia Ramadhani-Jedar celeb Hotman Paris Ngaku Dicuekin Syahrini, BFF Nia Ramadhani-Jedar 5 celeb Tak Diundang Nikahan Syahrini, Hotman Paris Ngaku Dicuekin celeb Tak Diundang Nikahan Syahrini, Hotman Paris Ngaku Dicuekin celeb Tak Diundang Nikahan Syahrini, Hotman Paris Ngaku Dicuekin celeb Tak Diundang Nikahan Syahrini, Hotman Paris Ngaku Dicuekin celeb Tak Diundang Nikahan Syahrini, Hotman Paris Ngaku Dicuekin celeb Tak Diundang Nikahan Syahrini, Hotman Paris Ngaku Dicuekin celeb Tak Diundang Nikahan Syahrini, Hotman Paris Ngaku Dicuekin celeb Tak Diundang Nikahan Syahrini, Hotman Paris Ngaku Dicuekin celeb Tak Diundang Nikahan Syahrini, Hotman Paris Ngaku Dicuekin 6 celeb Pujian Melaney Ricardo untuk Luna Maya celeb Pujian Melaney Ricardo untuk Luna Maya celeb Pujian Melaney Ricardo untuk Luna Maya celeb Pujian Melaney Ricardo untuk Luna Maya celeb Pujian Melaney Ricardo untuk Luna Maya celeb Pujian Melaney Ricardo untuk Luna Maya celeb Pujian Melaney Ricardo untuk Luna Maya 7 celeb Luna Maya, Don't Worry Be Happy! celeb Luna Maya, Don't Worry Be Happy! celeb Luna Maya, Don't Worry Be Happy! celeb Luna Maya, Don't Worry Be Happy! celeb Luna Maya, Don't Worry Be Happy! celeb Luna Maya, Don't Worry Be Happy! celeb Luna Maya, Don't Worry Be Happy! celeb Luna Maya, Don't Worry Be Happy! celeb Luna Maya, Don't Worry Be Happy! 8 celeb Resmi Menikah, Ini Transformasi Penampilan Syahrini celeb Resmi Menikah, Ini Transformasi Penampilan Syahrini celeb Resmi Menikah, Ini Transformasi Penampilan Syahrini celeb Resmi Menikah, Ini Transformasi Penampilan Syahrini celeb Resmi Menikah, Ini Transformasi Penampilan Syahrini celeb Resmi Menikah, Ini Transformasi Penampilan Syahrini celeb Resmi Menikah, Ini Transformasi Penampilan Syahrini celeb Resmi Menikah, Ini Transformasi Penampilan Syahrini celeb Resmi Menikah, Ini Transformasi Penampilan Syahrini celeb Resmi Menikah, Ini Transformasi Penampilan Syahrini celeb Resmi Menikah, Ini Transformasi Penampilan Syahrini celeb Resmi Menikah, Ini Transformasi Penampilan Syahrini 9 celeb Pesona Luna Maya dengan Dress Floral celeb Pesona Luna Maya dengan Dress Floral celeb Pesona Luna Maya dengan Dress Floral celeb Pesona Luna Maya dengan Dress Floral celeb Pesona Luna Maya dengan Dress Floral celeb Pesona Luna Maya dengan Dress Floral celeb Pesona Luna Maya dengan Dress Floral celeb Pesona Luna Maya dengan Dress Floral 10 celeb Ini Foto Jadul Tamara Bleszynski yang Bikin Hotman Paris Naksir celeb Ini Foto Jadul Tamara Bleszynski yang Bikin Hotman Paris Naksir celeb Ini Foto Jadul Tamara Bleszynski yang Bikin Hotman Paris Naksir celeb Ini Foto Jadul Tamara Bleszynski yang Bikin Hotman Paris Naksir celeb Ini Foto Jadul Tamara Bleszynski yang Bikin Hotman Paris Naksir celeb Ini Foto Jadul Tamara Bleszynski yang Bikin Hotman Paris Naksir celeb Ini Foto Jadul Tamara Bleszynski yang Bikin Hotman Paris Naksir celeb Ini Foto Jadul Tamara Bleszynski yang Bikin Hotman Paris Naksir 11 photo Luna Maya-Gading Marten, Si Penguasa Piala Maya photo Luna Maya-Gading Marten, Si Penguasa Piala Maya photo Luna Maya-Gading Marten, Si Penguasa Piala Maya photo Luna Maya-Gading Marten, Si Penguasa Piala Maya photo Luna Maya-Gading Marten, Si Penguasa Piala Maya photo Luna Maya-Gading Marten, Si Penguasa Piala Maya photo Luna Maya-Gading Marten, Si Penguasa Piala Maya 12 celeb Luna Maya Mendadak Cengeng Lihat Orang Nikah, Baper? celeb Luna Maya Mendadak Cengeng Lihat Orang Nikah, Baper? celeb Luna Maya Mendadak Cengeng Lihat Orang Nikah, Baper? celeb Luna Maya Mendadak Cengeng Lihat Orang Nikah, Baper? celeb Luna Maya Mendadak Cengeng Lihat Orang Nikah, Baper? celeb Luna Maya Mendadak Cengeng Lihat Orang Nikah, Baper? celeb Luna Maya Mendadak Cengeng Lihat Orang Nikah, Baper? 13 on-stage Saat Syahrini Jauh dari Glamor dan Kemewahan on-stage Saat Syahrini Jauh dari Glamor dan Kemewahan on-stage Saat Syahrini Jauh dari Glamor dan Kemewahan on-stage Saat Syahrini Jauh dari Glamor dan Kemewahan on-stage Saat Syahrini Jauh dari Glamor dan Kemewahan on-stage Saat Syahrini Jauh dari Glamor dan Kemewahan on-stage Saat Syahrini Jauh dari Glamor dan Kemewahan 14 celeb Cetar! Gaya Syahrini Anggun Banget celeb Cetar! Gaya Syahrini Anggun Banget celeb Cetar! Gaya Syahrini Anggun Banget celeb Cetar! Gaya Syahrini Anggun Banget celeb Cetar! Gaya Syahrini Anggun Banget celeb Cetar! Gaya Syahrini Anggun Banget 15 celeb Persahabatan Ayu Dewi, Luna Maya dan Melaney Ricardo celeb Persahabatan Ayu Dewi, Luna Maya dan Melaney Ricardo celeb Persahabatan Ayu Dewi, Luna Maya dan Melaney Ricardo celeb Persahabatan Ayu Dewi, Luna Maya dan Melaney Ricardo celeb Persahabatan Ayu Dewi, Luna Maya dan Melaney Ricardo celeb Persahabatan Ayu Dewi, Luna Maya dan Melaney Ricardo celeb Persahabatan Ayu Dewi, Luna Maya dan Melaney Ricardo celeb Persahabatan Ayu Dewi, Luna Maya dan Melaney Ricardo 16 celeb Tom Cruise dan Deretan Selebriti yang Kabarnya Operasi Plastik celeb Tom Cruise dan Deretan Selebriti yang Kabarnya Operasi Plastik celeb Tom Cruise dan Deretan Selebriti yang Kabarnya Operasi Plastik celeb Tom Cruise dan Deretan Selebriti yang Kabarnya Operasi Plastik celeb Tom Cruise dan Deretan Selebriti yang Kabarnya Operasi Plastik celeb Tom Cruise dan Deretan Selebriti yang Kabarnya Operasi Plastik celeb Tom Cruise dan Deretan Selebriti yang Kabarnya Operasi Plastik 17 celeb Bisakah Ariel kembali Bersama Luna Maya? celeb Bisakah Ariel kembali Bersama Luna Maya? celeb Bisakah Ariel kembali Bersama Luna Maya? celeb Bisakah Ariel kembali Bersama Luna Maya? celeb Bisakah Ariel kembali Bersama Luna Maya? celeb Bisakah Ariel kembali Bersama Luna Maya? celeb Bisakah Ariel kembali Bersama Luna Maya? 18 celeb Dewi Perssik, Maria Ozawa, Claudio Martinez hingga Luna Maya celeb Dewi Perssik, Maria Ozawa, Claudio Martinez hingga Luna Maya celeb Dewi Perssik, Maria Ozawa, Claudio Martinez hingga Luna Maya celeb Dewi Perssik, Maria Ozawa, Claudio Martinez hingga Luna Maya celeb Dewi Perssik, Maria Ozawa, Claudio Martinez hingga Luna Maya celeb Dewi Perssik, Maria Ozawa, Claudio Martinez hingga Luna Maya celeb Dewi Perssik, Maria Ozawa, Claudio Martinez hingga Luna Maya celeb Dewi Perssik, Maria Ozawa, Claudio Martinez hingga Luna Maya celeb Dewi Perssik, Maria Ozawa, Claudio Martinez hingga Luna Maya celeb Dewi Perssik, Maria Ozawa, Claudio Martinez hingga Luna Maya celeb Dewi Perssik, Maria Ozawa, Claudio Martinez hingga Luna Maya celeb Dewi Perssik, Maria Ozawa, Claudio Martinez hingga Luna Maya 19 celeb Luna Maya Makin Mirip Suzanna celeb Luna Maya Makin Mirip Suzanna celeb Luna Maya Makin Mirip Suzanna celeb Luna Maya Makin Mirip Suzanna celeb Luna Maya Makin Mirip Suzanna celeb Luna Maya Makin Mirip Suzanna 20 1","Ternyata! Hotman Paris Lebih Pilih Luna Maya Dibanding Syahrini"
"dict","sport","Jakarta - Manchester United kabarnya akan memberi kontrak tetap untuk Ole Gunnar Solskjaer dalam waktu sangat dekat. Dari statistiknya yang cemerlang, Ole sangat pantas dipermanenkan.Solskjaer akan dapat kontrak permanen jadi berita terpanas dari Liga Inggris setelah jeda internasional. Manajer asal Norwegia itu kabarnya akan menandatangani deal anyar dengan The Red Devils sebelum duel dengan Watford, Sabtu (30/3/2019) malam WIB pukul 22.00 WIB.Mempermanenkan kontrak Solskjaer jadi hal yang paling ditunggu pemain dan suporter Manchester United dalam beberapa bulan terakhir. Pria 46 tahun itu dianggap sangat pantas dikontrak tetap setelah mengantar MU bangkit dari keterpurukan. googletag.cmd.push(function() { googletag.display('div-gpt-ad-1535945694694-0'); }); Baca juga: MU Permanenkan Solskjaer Sebelum Laga Kontra Watford?Mengutip dari Opta, Solskjaer memang punya statistik mentereng sejak ditunjuk sebagai pengganti Jose Mourinho pada Desember 2018. Berikut data dan statistik penampilan Solskjaer yang membuatnya pantas dapat kontrak baru.- Ole Gunnar Solskjaer menjalani start fenomenal di Manchester United. Dia memenangi 14 dari 19 pertandingan pertamanya. Dari jumlah tersebut cuma tiga kekalahan diderita, meski dua di antaranya diterima pada dua laga terakhir.- Khusus di Premier League, Solskjaer memberi MU 10 kemenangan dari 13 laga. Dengan rasio kemenangan sebesar 76,9% dan rata-rata poin 2,4 per pertandingan, Solskjaer sejauh ini adalah manajer terbaik MU di era Premier League.Perbandingan rasio kemenangan Ole Gunnar Solskjaer dengan manajer Manchester United lainnya (ist Opta)Perbandingan rata-rata poin per pertandingan yang didapat Ole Gunnar Solskjaer dengan manajer Manchester United lainnya (ist Opta)Baca juga: Delapan Lagi, Solskjaer!- Solskjaer meraih enam kemenangan beruntun di Liga Inggris pada awal kerjanya di Manchester United (mengalahkan Cardiff City, Hudderfield Town, Bournemouth, Newcastle United, Tottenham Hotspur dan Brighton and Hove Albion). Ini adalah rentetan kemenangan terpanjang yang bisa dimenangi manajer Manchester United di awal kedatangannya.- Dari 13 laga Premier League pertamanya sebagai manajer, Solsjaer mengumpulkan 34 poin. Dia berdiri di posisi tiga daftar manajer dengan jumlah poin terbanyak setelah 13 laga, bersama Felipe Scolari dan Jose Mourinho. Cuma Guus Hiddink dan Carlo Ancelotti yang punya poin lebih banyak dari jumlah pertandingan yang sama.Daftar manajer dengan poin terbanyak di Liga Inggris setelah melewati 13 pertandingan Foto: ist (Opta)- Solskjaer tak terkalahkan pada 12 laga pertama Premier Legue sebagai manajer MU - untuk kemudian tumbang 0-2 oleh Arsenal di laga ke-13. Solskjaer bersama Maurizio Sarri kini menjadi manajer dengan rentetan laga tak terkalahkan terpanjang di awal periode kepelatihan.Bersama Maurizio Sarri, Solskjaer memegang rekor sebagai manajer pendatang baru dengan rentatan awal laga tak kalah paling panjang Foto: ist (Opta)- Solskjaer mengantar MU meraih kemenangan sensasional 3-1 saat berhadapan dengan Paris Saint Germain di Prancis. Itu menjadi kemenangan keenam beruntun The Red Devils di laga away. Tak pernah sebelumnya ada manajer MU bisa punya rentetan kemenangan sepanjang itu di luar Old Trafford.Rekor Ole Gunnar Solskjaer bersama Manchester United di laga away Foto: ist (Opta)- Sejak Solskjaer datang pada 18 Desember, MU berhasil mengumpulkan 32 poin di Liga Inggris. Tak ada klub lain yang punya poin lebih banyak dibanding MU pada periode yang sama.Sejak Ole Gunnar Solskjaer datang, tak ada klub Liga Inggris yang meraih poin sebanyak Manchester United Foto: ist (Opta) (din/yna) ole gunnar solskjaer manchester united liga inggris klasemen liga inggris","7 Statistik Cemerlang Solskjaer Jelang Dikontrak Permanen Manchester United"
"dict","sport","London - Gareth Bale sedang berjuang untuk masa depannya di Real Madrid. Eks pemain Madrid, Rafael van der Vaart, menyarankan Bale untuk lebih egois di dalam permainan.Kontrak bintang sepakbola Wales itu masih terikat kontrak sampai 2022 di Santiago Bernabeu. Namun, sejak akhir musim lalu, masa depan Bale dispekulasikan terlebih setelah di musim ini dianggap gagal menggantikan peran Cristiano Ronaldo.Di sepanjang 2018/19, Bale baru dimainkan sebanyak 35 kali dengan sumbangan 14 gol dan lima assist untuk Madrid di semua kompetisi. Pemain yang didatangkan dari Tottenham Hotspur itu disoraki Madridista dalam kekalahan 0-1 dari Barcelona, awal bulan ini. googletag.cmd.push(function() { googletag.display('div-gpt-ad-1535945694694-0'); }); Baca juga: Video Gareth Bale Kesulitan Berkomunikasi dengan Bahasa SpanyolTidak sedikit yang percaya bahwa Bale akan dilego di musim panas nanti. Sekalipun, Bale kembali ke starting XI Los Blancos di debut kedua Zinedine Zidane saat mengalahkan Celta Vigo 2-0, nyaris dua pekan silam.Saat masih aktif bermain, Van der Vaart pernah bermain bersama Bale di antara 2010 dan 2013. Menurut mantan pemain asal Belanda itu, Bale harus lebih egois lagi tapi dalam konteks positif.Baca juga: Courtois Nantikan Kedatangan Hazard di Real Madrid""Aneh, tapi di Belanda kami mengatakan bahwa terkadang Anda perlu menjadi keparat,"" Van der Vaart mengatakan kepada Standard Sport. ""Anda juga bisa menjadi keparat yang positif kok.""""Dia itu bernilai 100 juta euro. Mereka membayar banyak uang dan dia harus melakukannya. Di tahun terakhir dia di Spurs, dia mengambil setiap tembakan bebas, dia memutuskan segalanya. Itulah yang harus dia lakukan [di Real]. Aku sadar itu sulit, karena mereka punya banyak sekali pemain bagus, tapi dia seharusnya lebih seperti itu.""""Gareth adalah seorang pemain yang menakjubkan, tapi dia adalah seseorang yang harus merasakan kepercayaan diri. Dia harus merasa bahwa dia diterima. Tapi aku tahu bahwa Real itu klub yang sulit kalau Anda tidak tampil bagus. Tidak peduli apakah Anda Ronaldo, Bale atau Van der Vaart. Mereka akan mendepak Anda meski baru setahun.""Pada pertandingan berikutnya, Madrid akan menjamu Huesca dalam lanjutan LaLiga, Senin (1/4/2019) dinihari WIB. (rin/nds) gareth bale real madrid tottenham hotspur","Bale Mesti Lebih Egois untuk Sukses di Madrid"
"dict","sport","Madrid - Thibaut Courtois bicara soal perbedaan main untuk Real Madrid dan Atletico Madrid. Baginya, ada tuntutan yang lebih besar saat jadi pemain Madrid.Courtois pernah memperkuat Atletico pada 2011-2014 dengan status sebagai pemain pinjaman dari Chelsea. Bersama Atletico, kiper asal Belgia itu memenangi empat trofi, termasuk LaLiga dan Liga Europa.Kini Courtois sudah jadi pemain Madrid sejak awal musim ini. Kepindahan Courtois ke Madrid sempat memantik kemarahan suporter Atletico.Baca juga: Courtois Nantikan Kedatangan Hazard di Real MadridBicara soal perbedaan kedua klub, Courtois menyebut tekanan di Madrid lebih besar daripada Atletico. Ia juga terkesan dengan fasilitas yang dimiliki Madrid.""Tekanan lebih besar di (Real) Madrid, fans lebih menuntut dan saya suka itu,"" ujar Courtois kepada El Transistor seperti dikutip Marca. googletag.cmd.push(function() { googletag.display('div-gpt-ad-1535945694694-0'); }); ""Anda tidak bisa membandingkan satu stadion dengan yang lain, Bernabeu dengan (Vicente) Calderon.""""Kalau Anda lihat Valdebebas, Anda lihat betapa hebatnya Madrid, itu adalah hal terbaik yang pernah saya lihat. Atletico tidak punya itu,"" katanya.Baca juga: Bale Mesti Lebih Egois untuk Sukses di Madrid (nds/rin) thibaut courtois real madrid atletico madrid","Courtois: Tuntutan Fans Madrid Lebih Tinggi ketimbang Atletico"
"dict","sport","Jakarta - Babak delapan besar Piala Presiden dibuka dengan pertemuan Persija Jakarta dengan Kalteng Putra. Berikut jadwal siaran langsung Persija Jakarta vs Kalteng Putra.Dari empat pertandingan babak delapan besar Piala Presiden, laga Persija vs Kalteng Putra akan menjadi yang pertama digelar. Duel tersebut akan dilangsungkan di Stadion Patriot Candrabhaga, Bekasi, Kamis (28/3) sore hari ini.Duel itu akan disiarkan langsung di stasiun televisi Indosiar. Kick off Persija vs Kalteng Putra dijadwalkan pukul 15.30 WIB. googletag.cmd.push(function() { googletag.display('div-gpt-ad-1535945694694-0'); }); Baca juga: Jadwal Perempatfinal Piala Presiden 2019: Dibuka Persija Vs Kalteng PutraBerstatus juara bertahan, Persija diunggulkan bisa menang pada duel ini. Pelatih Ivan Kolev tak mau sesumbar dengan keunggulan Macan Kemayoran.""Untuk statistik saya bisa bicara apa, ini statistik ya, semua itu tergantung dari Tuhan, besok kami kerja keras, kalau kami bisa menang kenapa tidak jadi juara. Tapi kalau kami tidak bisa menang, tidak juara, tentu itu statistik,"" kata Kolev dalam konferensi pers.Pelatih Kalteng Putra, Gomes de Oliviera, sudah menyiapkan cara untuk bisa meladeni pemainan Persija. Meski lawan lebih diunggulkan, Kalteng bertekad tak mau mengecewakan masyarakat di Palangkaraya.Baca juga: Kolev Bicara tentang Kans Persija Pertahankan Gelar Juara Piala Presiden""Kami akan main maksimal, melakukan yang terbaik dari masing masing pemain, dan kolektivitas yang diandalkan membangun tim baru tidak gampang tapi juga tidak susah,"" kata Gomes.Jadwal Pertandingan Piala Presiden: Persija Jakarta vs Kalteng PutraKamis (28/3/2019)LIVE Indosiar - 15.30 WIB (din/mrp) persija jakarta piala presiden kalteng putra jadwal piala presiden jadwal persija jakarta","Piala Presiden: Jadwal Siaran Langsung Persija vs Kalteng Putra"
"dict","sport","Manchester - Manchester United diminta tidak memikirkan soal siapa pemain top buruan musim depan. Karena yang terpenting untuk Setan Merah adalah lolos ke Liga Champions.MU tengah menapak bangkit bersama Ole Gunnar Solskjaer setelah hancur-hancuran bersama Jose Mourinho di paruh pertama musim. Saat ini MU masih dalam jalur yang tepat untuk bisa finis empat besar.Meski baru menelan kekalahan dari Arsenal dan juga tersingkir dari Piala FA, MU ada di posisi kelima dengan 58 poin dari 30 laga, selisih dua angka dari The Gunners di posisi keempat. Dengan menyisakan delapan pekan, peluang MU finis empat besar masih terbuka lebar.Sementara itu, MU sebenarnya juga berpeluang lolos jika mereka berhasil menjuarai Liga Champions di mana mereka akan lebih dulu menghadapi Barcelona di perempatfinal. Dari dua jalur tersebut, finis empat besar di Premier League paling realistis didapat. googletag.cmd.push(function() { googletag.display('div-gpt-ad-1535945694694-0'); }); Baca juga: Delapan Lagi, Solskjaer!Maka hal itu penting untuk dicapai The Red Devils di akhir musim untuk mempermudah jalan mereka mendapatkan pemain bintang di musim panas nanti. Tanpa Liga Champions, MU akan kehilangan daya tarik di depan para pemaon.""Saya rasa Manchester United harus bisa mengincar semua pemain top selevel dia (Gareth Bale). Itulah Manchester United,"" ujar mantan striker Mu, Andy Cole, seperti dikutip FourFourTwo.""Tapi pertanyaannya sekarang, apakah para pemain itu mau pindah ke Manchester United?,"" sambungnya.""Jika Manchester United gagal lolos ke Liga Champions... Para pemain top itu cuma mau main di sana loh.""Baca juga: MU Pantau UmtitiMU sendiri kencang diisukan akan menggaet Gareth Bale dan Antoine Griezmann musim panas nanti untuk mempertajam lini serang. Selain itu, ada beberapa nama top lain seperti Raphael Varane, Samuel Umtiti, Jadon Sancho, dan Kalidou Koulibaly.""Orang-orang tidak akan berpikir soal uang ketika Anda bermain di level elit. Orang-orang kadang berpikir ini semua soal uang, tapi Anda bicara soal pemain di level top.""""Anda ingin bermain di Liga Champions atau mendapat lebih banyak uang? Mereka bakal memilih Liga Champions, karena mereka ingin menjuarainya - kompetisi yang spesial.""""Jika Manchester United gagal ke Liga Champions, akan semakin sulit untuk mereka mendatangkan pemain top. Akan sangat sulit,"" demikian dia.Baca juga: MU Permanenkan Solskjaer Sebelum Laga Kontra Watford? (mrp/din) manchester united liga inggris 2018/2019 liga inggris andy cole","Pesan untuk MU: Finis Empat Besar Dulu, Baru Pikirkan Pemain Top"
"dict","sport","London - Harry Kane tak ragu untuk berkomitmen sepenuhnya bersama Tottenham Hotspur. Tapi, Kane pun ingin Spurs lebih serius mengejar trofi juara.Bukan rahasia lagi jika masa depan Kane terus dispekulasikan ketika Real Madrid dan Manchester United mendekatinya. Terutama Madrid yang butuh striker baru sepeninggal Cristiano Ronaldo.Musim panas nanti rumor soal Kane akan makin kencang beredar dan Spurs harus siap-siap mengeluarkan tenaga ekstra mempertahankan pemain terbaiknya itu. Bukan pekerjaan mudah mengingat klub peminat seperti Madrid punya jaminan gaji besar dan tentunya trofi. googletag.cmd.push(function() { googletag.display('div-gpt-ad-1535945694694-0'); }); Baca juga: Tak Ada Alasan untuk Pochettino Tinggalkan TottenhamSesuatu yang belum didapatkan Kane sejauh ini bersama Spurs. Penyerang 24 tahun itu boleh jadi pemain paling konsisten dalam hal bikin bol dalam beberapa musim terakhir, tapi dia masih nirgelar.""Saya selalu katakan sepanjang klub ini punya ambisi yang tepat serta bergerak di jalur yang benar, maka saya ingin tetap bertahan di sini,"" ujar Kane seperti dikutip ESPN.Pernyataan Kane tersebut boleh jadi akan membuat Spurs makin berpikir untuk mengubah target mereka dari sekadar meramaikan bursa juara menjadi penantang serius gelar juara Premier League. Apalagi musim panas nanti, Spurs harus belanja besar setelah tak mendatangkan siapapun musim ini.Baca juga: Liverpool Mesti Langsung Tokcer Usai Jeda Internasional, Tottenham MenungguWalaupun niatan Spurs untuk memperkuat tim bisa jadi terganjal keuangan klub yang baru dikeruk usai pembangunan stadion baru mereka berkapasitas 62.062 penonton.""Ini adalah sesuatu yang harus Anda perhatikan setiap saat. Semua orang melihat dan bilang bahwa ini adalah tim terbaik yang kami punya, mungkin yang terbaik sepanjang sejarah, dan juga manajer terbaik. Tapi yang terpenting kami punya sesuatu untuk ditunjukkan.""Ini bukan cuma soal ketika kami melihat 10 tahun ke belakang, kami punya tim hebat. Ini seeprti 'Lihat, yang mereka lakukan. Lihat yang mereka menangi.' Ini adalah tantangan untuk kami, apakah kami bisa lebih baik lagi dan lagi? Akan sulit untuk beberapa tahun ke depan setelah pembangunan stadion dan juga kondisi keuangan.Baca juga: Tottenham Berminat Datangkan Perisic? (mrp/cas) harry kane tottenham hotspur liga inggris 2018/2019 liga inggris","Harry Kane Mau Saja Bertahan di Spurs, tapi..."
