"_type","category","isi","judul"
"dict","hot","Foto: (IG/Marvel Studios) Jakarta - 'Avengers: Endgame' merilis poster terbaru jelang penayangan filmnya bulan depan. Tak hanya satu, Marvel merilis poster bergambar satu demi satu karakter ke dalam dua poster yang berbeda.Poster berwarna menampilkan para superhero yang bertahan dari misi Thanos menghapus separuh jagat raya.Sementara poster bernuansa hitam-putih menampilkan para superhero yang telah menjadi korban dari misi Thanos tersebut. googletag.cmd.push(function() { googletag.display('div-gpt-ad-1535944650921-0'); }); Ada yang terungkap dari poster tersebut. Yakni kematian beberapa karakter yang tak diketahui sebelumnya.Foto: (IG/Marvel Studios)Di antaranya adik T'Challa sang Black Panther, Shuri hingga kematian Star Lord pemimpin Guardians of the Galaxy.Shuri diketahui lumpuh setelah menghadapi Proxima Midnight saat melindungi Vision. Akan tetapi tak diketahui nasib Shuri setelah Thanos menuntaskan misinya mengumpulkan Infinity Stones.Baca juga: Sebulan Lagi Tayang, 'Avengers: Endgame' Rilis Poster TerbaruSelain keduanya, ada pula Hope van Dyne 'The Wasp' yang jadi bagian dari mereka yang menghilang bersama separuh jagat raya. Karakter The Wasp ikut diabadikan di poster terbaru tersebut.Terhitung sebulan lagi Marvel merilis 'Avengers: Endgame'. Film ini menjadi film berdurasi terpanjang Marvel Cinematic Universe.Tonton juga: Trailer ""Avengers: Endgame"" Sengaja Dimanipulasi?[Gambas:Video 20detik] (doc/nkn) avengers endgame avengers 4 avengers infinity war marvel avengers Photo Gallery 1 screenshoot-movie Avengers: Endgame Lewat, Ini Deretan Film dengan Durasi Paling Panjang screenshoot-movie Avengers: Endgame Lewat, Ini Deretan Film dengan Durasi Paling Panjang screenshoot-movie Avengers: Endgame Lewat, Ini Deretan Film dengan Durasi Paling Panjang screenshoot-movie Avengers: Endgame Lewat, Ini Deretan Film dengan Durasi Paling Panjang screenshoot-movie Avengers: Endgame Lewat, Ini Deretan Film dengan Durasi Paling Panjang screenshoot-movie Avengers: Endgame Lewat, Ini Deretan Film dengan Durasi Paling Panjang screenshoot-movie Avengers: Endgame Lewat, Ini Deretan Film dengan Durasi Paling Panjang screenshoot-movie Avengers: Endgame Lewat, Ini Deretan Film dengan Durasi Paling Panjang 1 screenshoot-movie Ramai di Medsos, Ini Serba-serbi Avengers Endgame screenshoot-movie Ramai di Medsos, Ini Serba-serbi Avengers Endgame screenshoot-movie Ramai di Medsos, Ini Serba-serbi Avengers Endgame screenshoot-movie Ramai di Medsos, Ini Serba-serbi Avengers Endgame screenshoot-movie Ramai di Medsos, Ini Serba-serbi Avengers Endgame screenshoot-movie Ramai di Medsos, Ini Serba-serbi Avengers Endgame screenshoot-movie Ramai di Medsos, Ini Serba-serbi Avengers Endgame screenshoot-movie Ramai di Medsos, Ini Serba-serbi Avengers Endgame screenshoot-movie Ramai di Medsos, Ini Serba-serbi Avengers Endgame screenshoot-movie Ramai di Medsos, Ini Serba-serbi Avengers Endgame 2 screenshoot-movie Aksi Goose yang Curi Perhatian di 'Captain Marvel' screenshoot-movie Aksi Goose yang Curi Perhatian di 'Captain Marvel' screenshoot-movie Aksi Goose yang Curi Perhatian di 'Captain Marvel' screenshoot-movie Aksi Goose yang Curi Perhatian di 'Captain Marvel' screenshoot-movie Aksi Goose yang Curi Perhatian di 'Captain Marvel' screenshoot-movie Aksi Goose yang Curi Perhatian di 'Captain Marvel' 3 red-carpet Para Seleb Cantik nan Seksi di Red Carpet 'Captain Marvel' red-carpet Para Seleb Cantik nan Seksi di Red Carpet 'Captain Marvel' red-carpet Para Seleb Cantik nan Seksi di Red Carpet 'Captain Marvel' red-carpet Para Seleb Cantik nan Seksi di Red Carpet 'Captain Marvel' red-carpet Para Seleb Cantik nan Seksi di Red Carpet 'Captain Marvel' red-carpet Para Seleb Cantik nan Seksi di Red Carpet 'Captain Marvel' red-carpet Para Seleb Cantik nan Seksi di Red Carpet 'Captain Marvel' red-carpet Para Seleb Cantik nan Seksi di Red Carpet 'Captain Marvel' 4 red-carpet Brie Larson Bawa Pesawat Antariksanya di Red Carpet Captain Marvel red-carpet Brie Larson Bawa Pesawat Antariksanya di Red Carpet Captain Marvel red-carpet Brie Larson Bawa Pesawat Antariksanya di Red Carpet Captain Marvel red-carpet Brie Larson Bawa Pesawat Antariksanya di Red Carpet Captain Marvel red-carpet Brie Larson Bawa Pesawat Antariksanya di Red Carpet Captain Marvel red-carpet Brie Larson Bawa Pesawat Antariksanya di Red Carpet Captain Marvel red-carpet Brie Larson Bawa Pesawat Antariksanya di Red Carpet Captain Marvel 5 screenshoot-movie Saat Brie Larson Bertemu si Kecil Carol Danvers screenshoot-movie Saat Brie Larson Bertemu si Kecil Carol Danvers screenshoot-movie Saat Brie Larson Bertemu si Kecil Carol Danvers screenshoot-movie Saat Brie Larson Bertemu si Kecil Carol Danvers screenshoot-movie Saat Brie Larson Bertemu si Kecil Carol Danvers screenshoot-movie Saat Brie Larson Bertemu si Kecil Carol Danvers screenshoot-movie Saat Brie Larson Bertemu si Kecil Carol Danvers screenshoot-movie Saat Brie Larson Bertemu si Kecil Carol Danvers screenshoot-movie Saat Brie Larson Bertemu si Kecil Carol Danvers screenshoot-movie Saat Brie Larson Bertemu si Kecil Carol Danvers 6 red-carpet Aksi Captain Marvel, Brie Larson dan Samuel L Jackson di Oscar 2019 red-carpet Aksi Captain Marvel, Brie Larson dan Samuel L Jackson di Oscar 2019 red-carpet Aksi Captain Marvel, Brie Larson dan Samuel L Jackson di Oscar 2019 red-carpet Aksi Captain Marvel, Brie Larson dan Samuel L Jackson di Oscar 2019 red-carpet Aksi Captain Marvel, Brie Larson dan Samuel L Jackson di Oscar 2019 7 screenshoot-movie Senyum Manis dan Tawa Brie Larson bersama Cast 'Captain Marvel' screenshoot-movie Senyum Manis dan Tawa Brie Larson bersama Cast 'Captain Marvel' screenshoot-movie Senyum Manis dan Tawa Brie Larson bersama Cast 'Captain Marvel' screenshoot-movie Senyum Manis dan Tawa Brie Larson bersama Cast 'Captain Marvel' screenshoot-movie Senyum Manis dan Tawa Brie Larson bersama Cast 'Captain Marvel' screenshoot-movie Senyum Manis dan Tawa Brie Larson bersama Cast 'Captain Marvel' screenshoot-movie Senyum Manis dan Tawa Brie Larson bersama Cast 'Captain Marvel' screenshoot-movie Senyum Manis dan Tawa Brie Larson bersama Cast 'Captain Marvel' 8 screenshoot-movie Sebelum Meninggal, Pria Ini Ingin Nonton Avengers Lebih Awal screenshoot-movie Sebelum Meninggal, Pria Ini Ingin Nonton Avengers Lebih Awal screenshoot-movie Sebelum Meninggal, Pria Ini Ingin Nonton Avengers Lebih Awal screenshoot-movie Sebelum Meninggal, Pria Ini Ingin Nonton Avengers Lebih Awal screenshoot-movie Sebelum Meninggal, Pria Ini Ingin Nonton Avengers Lebih Awal screenshoot-movie Sebelum Meninggal, Pria Ini Ingin Nonton Avengers Lebih Awal 9 screenshoot-movie Deretan Meme Lucu Captain Marvel screenshoot-movie Deretan Meme Lucu Captain Marvel screenshoot-movie Deretan Meme Lucu Captain Marvel screenshoot-movie Deretan Meme Lucu Captain Marvel screenshoot-movie Deretan Meme Lucu Captain Marvel screenshoot-movie Deretan Meme Lucu Captain Marvel screenshoot-movie Deretan Meme Lucu Captain Marvel screenshoot-movie Deretan Meme Lucu Captain Marvel screenshoot-movie Deretan Meme Lucu Captain Marvel screenshoot-movie Deretan Meme Lucu Captain Marvel 10 screenshoot-movie Saat NASA Buat Laporan dengan Poster Film Hollywood screenshoot-movie Saat NASA Buat Laporan dengan Poster Film Hollywood screenshoot-movie Saat NASA Buat Laporan dengan Poster Film Hollywood screenshoot-movie Saat NASA Buat Laporan dengan Poster Film Hollywood screenshoot-movie Saat NASA Buat Laporan dengan Poster Film Hollywood screenshoot-movie Saat NASA Buat Laporan dengan Poster Film Hollywood screenshoot-movie Saat NASA Buat Laporan dengan Poster Film Hollywood screenshoot-movie Saat NASA Buat Laporan dengan Poster Film Hollywood 11 celeb Tanpa Palu dan Jubah, Chris Hemsworth Adalah Sosok Ayah Sederhana celeb Tanpa Palu dan Jubah, Chris Hemsworth Adalah Sosok Ayah Sederhana celeb Tanpa Palu dan Jubah, Chris Hemsworth Adalah Sosok Ayah Sederhana celeb Tanpa Palu dan Jubah, Chris Hemsworth Adalah Sosok Ayah Sederhana celeb Tanpa Palu dan Jubah, Chris Hemsworth Adalah Sosok Ayah Sederhana celeb Tanpa Palu dan Jubah, Chris Hemsworth Adalah Sosok Ayah Sederhana celeb Tanpa Palu dan Jubah, Chris Hemsworth Adalah Sosok Ayah Sederhana celeb Tanpa Palu dan Jubah, Chris Hemsworth Adalah Sosok Ayah Sederhana celeb Tanpa Palu dan Jubah, Chris Hemsworth Adalah Sosok Ayah Sederhana celeb Tanpa Palu dan Jubah, Chris Hemsworth Adalah Sosok Ayah Sederhana celeb Tanpa Palu dan Jubah, Chris Hemsworth Adalah Sosok Ayah Sederhana 12 screenshoot-movie Duh, Captain Marvel Pukul Nenek-nenek di Bus screenshoot-movie Duh, Captain Marvel Pukul Nenek-nenek di Bus screenshoot-movie Duh, Captain Marvel Pukul Nenek-nenek di Bus screenshoot-movie Duh, Captain Marvel Pukul Nenek-nenek di Bus screenshoot-movie Duh, Captain Marvel Pukul Nenek-nenek di Bus screenshoot-movie Duh, Captain Marvel Pukul Nenek-nenek di Bus screenshoot-movie Duh, Captain Marvel Pukul Nenek-nenek di Bus screenshoot-movie Duh, Captain Marvel Pukul Nenek-nenek di Bus screenshoot-movie Duh, Captain Marvel Pukul Nenek-nenek di Bus screenshoot-movie Duh, Captain Marvel Pukul Nenek-nenek di Bus 13 screenshoot-movie Yuk, Lihat Penampilan Perdana dan Alur 'Captain Marvel'! screenshoot-movie Yuk, Lihat Penampilan Perdana dan Alur 'Captain Marvel'! screenshoot-movie Yuk, Lihat Penampilan Perdana dan Alur 'Captain Marvel'! screenshoot-movie Yuk, Lihat Penampilan Perdana dan Alur 'Captain Marvel'! screenshoot-movie Yuk, Lihat Penampilan Perdana dan Alur 'Captain Marvel'! screenshoot-movie Yuk, Lihat Penampilan Perdana dan Alur 'Captain Marvel'! screenshoot-movie Yuk, Lihat Penampilan Perdana dan Alur 'Captain Marvel'! screenshoot-movie Yuk, Lihat Penampilan Perdana dan Alur 'Captain Marvel'! screenshoot-movie Yuk, Lihat Penampilan Perdana dan Alur 'Captain Marvel'! 14 celeb Ini Youtuber Korea yang Lamar Anya Geraldine, Saingan Bio One? celeb Ini Youtuber Korea yang Lamar Anya Geraldine, Saingan Bio One? celeb Ini Youtuber Korea yang Lamar Anya Geraldine, Saingan Bio One? celeb Ini Youtuber Korea yang Lamar Anya Geraldine, Saingan Bio One? celeb Ini Youtuber Korea yang Lamar Anya Geraldine, Saingan Bio One? celeb Ini Youtuber Korea yang Lamar Anya Geraldine, Saingan Bio One? 15 screenshoot-movie Kisah dan Fakta-fakta Unik di Balik Film Terkenal screenshoot-movie Kisah dan Fakta-fakta Unik di Balik Film Terkenal screenshoot-movie Kisah dan Fakta-fakta Unik di Balik Film Terkenal screenshoot-movie Kisah dan Fakta-fakta Unik di Balik Film Terkenal screenshoot-movie Kisah dan Fakta-fakta Unik di Balik Film Terkenal screenshoot-movie Kisah dan Fakta-fakta Unik di Balik Film Terkenal screenshoot-movie Kisah dan Fakta-fakta Unik di Balik Film Terkenal screenshoot-movie Kisah dan Fakta-fakta Unik di Balik Film Terkenal 16 culture Lucunya Para Superhero saat Pensiun dan Menua culture Lucunya Para Superhero saat Pensiun dan Menua culture Lucunya Para Superhero saat Pensiun dan Menua culture Lucunya Para Superhero saat Pensiun dan Menua culture Lucunya Para Superhero saat Pensiun dan Menua culture Lucunya Para Superhero saat Pensiun dan Menua culture Lucunya Para Superhero saat Pensiun dan Menua culture Lucunya Para Superhero saat Pensiun dan Menua culture Lucunya Para Superhero saat Pensiun dan Menua culture Lucunya Para Superhero saat Pensiun dan Menua 17 celeb Lihat Wajah Imut Para Bintang Avengers Yuk! celeb Lihat Wajah Imut Para Bintang Avengers Yuk! celeb Lihat Wajah Imut Para Bintang Avengers Yuk! celeb Lihat Wajah Imut Para Bintang Avengers Yuk! celeb Lihat Wajah Imut Para Bintang Avengers Yuk! celeb Lihat Wajah Imut Para Bintang Avengers Yuk! celeb Lihat Wajah Imut Para Bintang Avengers Yuk! celeb Lihat Wajah Imut Para Bintang Avengers Yuk! 18 screenshoot-movie Filmnya Sukses, Para Bintang Avengers Buat Tato screenshoot-movie Filmnya Sukses, Para Bintang Avengers Buat Tato screenshoot-movie Filmnya Sukses, Para Bintang Avengers Buat Tato screenshoot-movie Filmnya Sukses, Para Bintang Avengers Buat Tato screenshoot-movie Filmnya Sukses, Para Bintang Avengers Buat Tato screenshoot-movie Filmnya Sukses, Para Bintang Avengers Buat Tato screenshoot-movie Filmnya Sukses, Para Bintang Avengers Buat Tato screenshoot-movie Filmnya Sukses, Para Bintang Avengers Buat Tato 19 screenshoot-movie Ini Deretan Aktor yang Hampir Jadi Avengers screenshoot-movie Ini Deretan Aktor yang Hampir Jadi Avengers screenshoot-movie Ini Deretan Aktor yang Hampir Jadi Avengers screenshoot-movie Ini Deretan Aktor yang Hampir Jadi Avengers screenshoot-movie Ini Deretan Aktor yang Hampir Jadi Avengers screenshoot-movie Ini Deretan Aktor yang Hampir Jadi Avengers screenshoot-movie Ini Deretan Aktor yang Hampir Jadi Avengers screenshoot-movie Ini Deretan Aktor yang Hampir Jadi Avengers screenshoot-movie Ini Deretan Aktor yang Hampir Jadi Avengers 20 1","Yang Terungkap dari Poster Terbaru 'Avengers: Endgame'"
"dict","sport","Jakarta - Louis van Gaal menilai taktik Ole Gunnar Solskjaer di Manchester United bukanlah seperti gaya Sir Alex Ferguson. Taktiknya disebut terapan ala Jose Mourinho.MU saat ini ditangani Solskjaer, yang menggantikan Mourinho. Bersama manajer asal Norwegia itu, permainan The Red Devils bisa membaik, dengan catatan meraih 14 kemenangan, 3 kali kalah, dan 2 kali imbang dari 19 laga.Ddampaknya membawa klub bisa kembali bersaing di lima besar Premier League dan melaju ke perempatfinal Liga Champions. Solskjaer pun mulai dibanding-bandingkan dengan Ferguson, manajer legendaris MU, berkat gaya melatihnya. Van Gaal rupanya punya pandangan berbeda. googletag.cmd.push(function() { googletag.display('div-gpt-ad-1535945694694-0'); }); Baca juga: Ibra: Kenapa Sih MU Terus Dikaitkan dengan Ferguson?Van Gaal, yang posisinya digantikan Mourinho pada musim 2016/2017, menilai taktik Solskjaer sedianya bukan bergaya Ferguson. Van Gaal menyebut, taktik manajer yang juga mantan pemain MU itu lebih bergaya Mourinho sebab masih mengandalkan pakem bertahan dan melancarkan serangan balik.""Pelatih setelah saya [Mourinho] mengubah taktik menjadi parkir bus dan bermain serangan balik. Sekarang ada pelatih lain yang juga memarkir bus dan bermain serangan balik. Perbedaan anatra Mourinho dan Solskjaer adalah Solskjaer yang menang,"" kata Van Gaal kepada BBC.Baca juga: Carrick: Solskjaer Punya Gaya Melatihnya Sendiri""Cara MU bermain saat ini bukanlah cara Ferguson. Itu sepakbola bertahan dan serangan balik. Jika anda suka, ya sudah. Jika anda itu lebih baik daripada serangan saya yang membosankan, tak masalah. Tapi itu bukanlah saya yang sesungguhnya.""""Penting untuk MU bisa lolos ke Liga Champions [musim depan], seperti ketika saya jadi manajer. Tapi mereka juga bisa memenangkan Liga Champions sebab mereka bermain dengan sistem bertahan dan itu sangat sulit dikalahkan, terlepas anda suka atau tidak, itu adalah hasil kerja Mourinho,"" jelasnya.Baca juga: Cantona: Solskjaer Anak Spiritual Sir Alex, Layak Dipermanenkan MU (yna/raw) louis van gaal manchester united ole gunnar solskjaer jose mourinho sir alex ferguson","Van Gaal: MU-nya Solskjaer Bukan seperti Ferguson, tapi Mourinho"
"dict","hot","","Senyum Bahagia Mandy Moore saat Dapat Walk of Fame"
"dict","finance","Jakarta - Sudah memiliki penghasilan tetap tapi belum memiliki rumah sendiri? Kira-kira penyebabnya apa ya? Padahal kalau kita berpikir, penghasilan yang didapatkan sudah di atas UMR. Tapi, masih saja belum bisa memiliki rumah.Biasanya, penyebab utama yang menjadi alasan tidak dapat memiliki rumah adalah harga rumah yang ditawarkan. Seperti kita ketahui, setiap tahunnya rumah yang dijual mengalami perubahan harga yang membuat semakin tinggi harga jual. Apalagi, peningkatan harga rumah hampir pasti akan terus terjadi di setiap tahunnya. Hal tersebut biasanya yang membuat seseorang menunda atau tidak memiliki rumah dalam jangka waktu yang cukup lama. googletag.cmd.push(function() { googletag.display('div-gpt-ad-1535944306169-0'); }); Hal ini dikarenakan harga yang ditawarkan tidak sesuai dengan pendapatan yang mereka miliki. Dan hal tersebut yang menyebabkan seseorang tetap memilih mengontrak ketimbang membeli rumah.Bila kita perhatikan, terdapat beberapa penyebab pada peningkatan harga rumah yang saat ini sering terjadi. Satu hal yang pasti karena jumlah tanah yang tidak pernah bertambah, berikutnya karena tanah-tanah yang tersedia saat ini memiliki tren kenaikan harga jual yang cukup lumayan tinggi untuk setiap meternya. Hal-hal tersebut kemudian menjadikan harga sebuah bangunan rumah dapat bertambah tinggi setiap tahunnya.Kemudian penyebab lain yang dapat mempengaruhi meningkatnya harga rumah adalah terjadinya inflasi. Setiap negara akan mengalami perubahan inflasi. Kecepatan inflasi yang terjadi ini akan sangat mempengaruhi suku bunga, percepatan kredit pinjaman, dan harga bahan dasar bangunan.Lalu, peningkatan harga juga bisa terjadi karena pertumbuhan status sosial. Pendapatan yang dimiliki oleh orang-orang dengan status sosial kelas menengah atas akan mempengaruhi perubahan harga dari sebuah properti. Hal ini disebabkan adanya keinginan memiliki rumah yang sesuai kebutuhan.Penyebab selanjutnya adanya perbaikan tata kelola pada suatu daerah. Suatu daerah akan dapat berubah jika tata kelolanya baik dilakukan. Perubahan tersebut terjadi jika terdapat peningkatan atau berkembangnya berbagai fasilitas publik serta meningkatnya ketersediaan lapangan kerja pada daerah tersebut. Penyebab ini akan membuat harga hunian akan meningkat pula.Sebagai contoh, kita dapat perhatikan di kawasan Jakarta, harga rumah yang ditawarkan memang cukup tinggi. Namun, ternyata masih banyak minat. Hal tersebut disebabkan oleh adanya fasilitas yang disediakan. Dari segi transportasi, ruang publik, lapangan pekerjaan, dan lain sebagainya.Hal tersebut dapat dilihat secara gamblang, namun akan sangat berbeda bila kita membandingkan dengan lokasi rumah yang berada di pinggiran Jakarta. Harga yang ditawarkan tidak terlalu tinggi, padahal masih memiliki fasilitas yang sama dengan kota Jakarta.Semua orang pasti memiliki impian untuk memiliki rumah idaman, apalagi jika rumah tersebut dapat ditempati bersama keluarga. Berbagai konsep pastinya telah di impikan oleh setiap orang pada rumah idamannya. Lalu, bagaimana sebenarnya rumah yang ideal bagi anda dan keluarga?Rumah idaman yang ideal itu haruslah nyaman bagi para penghuninya, yaitu yang bikin betah tinggal di dalam rumah tersebut. Rumah idaman tidak harus mengenai ukuran yang besar, mewah, dan mahal. Tetapi rumah idaman dapat diciptakan secara sederhana namun nyaman bagi para penghuninya. Karena, pada rumah idaman kenyamanan adalah paling utama bagi para penghuninya.Menciptakan rumah idaman yang ideal sebenarnya tidaklah rumit. Hanya saja, bagaimana cara atau strateginya agar dengan dana yang cekak, anda tetap berpeluang besar menerapkan strategi tersebut sehingga terwujud rumah yang di idam idamkan selama ini.Pernahkah terpikir untuk membangun rumah sendiri? Apabila Anda bermimpi memiliki sebuah rumah idaman untuk menjadi hunian di masa depan dengan dana terbatas, insya Allah hal itu tetap dapat terwujud. Memang benar, bahwa membangun rumah dengan dana terbatas, diperlukan pengetahuan dan strategi khusus agar tetap dapat memiliki rumah idaman. Lalu, bagaimana langkah mengawalinya?Ternyata perencanaan keuangan tidak hanya bicara secara keuangan saja tapi juga hal-hal lain yang harus dipersiapkan. Mengapa? Karena UUD alias ujung-ujungnya pasti duit juga. Baca juga: Segudang Masalah Keuangan Milenial (6)Banyak orang mengeluh bahwa membangun rumah itu perlu persiapan keuangan yang matang, karena biasanya hampir selalu over bujet. Di kelas atau workshop yang dilaksanakan oleh tim IARFC Indonesia atau tim AAM & Associates.Di Jakarta dibuka workshop sehari tentang bagaimana cara Mengelola Gaji dan Mengatur Uang bulanan dan Belajar dan Teknik Menjadi Kaya Raya dan juga workshop sehari tentang Reksadana. Ada juga workshop khusus tentang Asuransi membahas Keuntungan dan Kerugian dari Unitlink yang sudah anda beli. Karena banyak permintaan, dibuka lagi workshop Komunikasi yang memukau lawan bicara anda (menghipnotis), cocok untuk anda orang sales & marketing, untuk komunikasi ke pasangan, anak, boss, anak buah, ke siapapun, info.Untuk ilmu yang lebih lengkap lagi, anda bisa belajar tentang perencanaan keuangan komplit, bahkan bisa jadi konsultannya dengan sertifikat Internasional bisa ikutan workshop Basic Financial Planning dan workshop Intermediate dan Advance Financial Planning di Pertengahan Info lainnya bisa dilihat di www.IARFCIndonesia.com (jangan lupa tanyakan DISKON paket)Anda bisa diskusi tanya jawab dengan cara bergabung di akun telegram group kami ""Seputar Keuangan"" atau klik di sini.Baca juga: 4 Hal yang Membuat Keuangan Bulanan Berantakan (2)Disclaimer: artikel ini merupakan kiriman dari mitra yang bekerja sama dengan detikcom. Redaksi detikcom tidak bertanggung jawab atas isi artikel yang dikirim oleh mitra. Tanggung jawab sepenuhnya ada di penulis artikel. (ang/ang)","Beli Rumah Nanti dengan Harga Sekarang (1)"
"dict","hot","","Scott Walker, Cinta Laura, Kim Lim, Irish Bella hingga Mandy Moore"
"dict","hot","","Sule Dekat dengan Baby Shima, Ini Pendapat Naomi Zaskia"
"dict","finance","Jakarta - Tarif MRT Jakarta akhirnya ditentukan setelah perjalanan panjang. Tarif final sudah ditentukan sebesar Rp 10.000/10km.Foto: Fuad Hasim/Tim InfografisBaca juga: 10 Sistem MRT Terbesar di DuniaBaca juga: Ada MRT, Apa Imbasnya ke Pertokoan di Blok M-Fatmawati? (eds/ang)","Tarik Ulur Tarif MRT Jakarta hingga Ditetapkan Anies"
"dict","hot","","Saat Netizen Kampanye di Instagram Lisa BLACKPINK"
"dict","finance","Jakarta - Bandara Kulon Progo atau New Yogyakarta International Airport (NYIA) ditargetkan beroperasi April 2019 atau bulan depan. Bandara NYIA nantinya langsung melayani penerbangan rute internasional.Direktur Utama PT Angkasa Pura I (Persero) Faik Fahmi menjelaskan progres terkini pembangunan NYIA. Kesiapan operasi untuk melayani penerbangan internasional juga dikebut agar selesai bulan depan.Baca juga: Bandara Kulon Progo bakal Dongkrak Turis Asing ke YogyakartaAwalnya, seluruh penerbangan internasional di Bandara Internasional Adisutjipto dialihkan ke NYIA. Maskapai lain juga disebut banyak yang tertarik melayani rute penerbangan dari dan ke NYIA.Selain pengembangan Bandara NYIA, Faik juga membeberkan rencana pengoperasian dan pengembangan bandara. Dengan demikian, jumlah bandara yang akan dikelola AP I nantinya bertambah.Berikut petikan wawancara lengkap detikFinance dengan Faik Fahmi selaku Direktur Angkasa Pura I seperti ditulis Rabu (27/3/2019). (ara/zlf) bandara kulon progo kulon progo new yogyakarta international airport nyia angkasa pura i Sebelumnya Ada Underpass Terpanjang di RI di Bandara Baru Yogyakarta 1 / 9 Selanjutnya Selesai 100% di Desember","Melihat Kesiapan Operasi Bandara Kulon Progo"
"dict","hot","","Nicole Scherzinger vs Heidi Klum, Seksian Mana?"
"dict","finance","Jakarta - Amerika Serikat (AS) kini sedang terancam dilanda resesi. Hal ini ditandai dengan meningkatnya harga emas namun terjadi tekanan pada harga logam industri. Hingga obligasi pemerintah yang imbal hasilnya merangkak naik. Jika AS Resesi, apakah benar akan berdampak ke negara-negara lain termasuk Indonesia?Berikut berita selengkapnya: (ang/ang) ekonomi as resesi Sebelumnya Ini Kerugian Warga AS Karena Pemerintahan Tutup 16 Hari 1 / 4 Selanjutnya Ancaman Resesi","Ekonomi AS Terancam Resesi, Berimbas ke RI?"
