"_type","category","isi","judul"
"dict","sport","Munich - Bayern Munich meresmikan transfer Lucas Hernandez dari Atletico Madrid. Die Roten menebusnya dengan nilai transfer mencapai 80 juta euro atau Rp 1,2 triliun.Dilansir situs resmi Bayern, raksasa Bundesliga itu menebus Lucas Hernandez dari Atletico sebesar 80 juta euro* atau sekitar Rp 1,28 triliun. Bayern memilih mengaktifkan klausul rilis pemain berusia 23 tahun tersebut, dan menjadikannya rekrutan Prancis kedua setelah Benjamin Pavard.Lucas Hernandez langsung dikontrak Bayern selama lima tahun atau hingga 2024. Ia baru akan bergabung dengan Thomas Mueller dkk pada 1 Juli mendatang, saat bursa transfer musim panas dibuka. googletag.cmd.push(function() { googletag.display('div-gpt-ad-1535945694694-0'); }); Atletico sendiri sedianya menawarkan perpanjangan kontrak kepada Lucas Hernandez. Bek asal Prancis itu rupanya lebih memilih hengkang dan menerima tawaran Bayern.Baca juga: Bayern Resmi Rekrut Benjamin Pavard""Saya sangat senang bisa merekrut salah satu pemain bertahan terbaik di dunia, pemenang Piala Dunia, dalam sosok Lucas Hernandez. Lucas bisa bermain di tengah atau bek kiri. Lebih lanjut, Lucas akan meneruskan tradisi hebat kami pada pemain Prancis dan menambah kuat tim kami,"" ungkap direktur olahraga Bayern, Hasan Salihamidzic.Lucas Hernandez juga bangga bisa bergabung dengan raksasa seperti Bayern. Tak lupa, ia mengucapkan terima kasih ke Atletico, yang sudah ia bela sejak masih duduk di akademi.""Ini hari yang sangat penting dalam karier sepakbola saya. FC Bayern Munich adalah salah satu klub terbaik di Eropa dan dunia. Saya senang bisa berjuang meraih titel bersama Bayern. Saya ucapkan terima kasih ke Atletico, manajemen, pelatih, rekan tim dan fans untuk 12 tahun yang indah,"" kata Lucas.Lucas Hernandez rupanya diketahui mengalami kerusakan ligamen pada lutut kanannya. Ia pun akan dioperasi Atletico lebih dulu sebelum hijrah ke Bayern.Baca juga: Timo Werner Menuju Bayern Munich""Selama pemeriksaan medis, kami menemukan kerusakan pada ligamentum agunan medial di lutut kanan sang pemain yang membutuhkan operasi. Berdasarkan pengalaman, Lucas Hernandez akan tersedia untuk FC Bayern pada awal musim Bundesliga 2019/20, terang kepala medis Bayern Dr. Hans-Wilhelm Mller-Wohlfahrt.Masih terbilang belia, Lucas Hernandez sudah kenyang pengalaman. Di Atletico, ia sudah bermain 67 kali dan bikin satu gol, dengan mengantar klubnya memenangi Liga Europa 2017/2018, Piala Super Eropa dan runner up Liga Champions 2015/2016. Sementara di Prancis, ia membawa Les Bleus juara Piala Dunia 2018 di Rusia.*) kurs 1 euro = Rp 15,998.11 Baca juga: Bayern dan Chelsea Sedang Negosiasikan Hudson-Odoi (yna/raw) bayern munich lucas hernandez atletico madrid bursa transfer","Rogoh Rp 1,2 Triliun, Bayern Dapatkan Lucas Hernandez dari Atletico"
"dict","sport","Jakarta - Isu rasialisme kembali mencuat belakangan ini di sepakbola Eropa. Ada usulan agar hukumannya diperberat, misalnya pengurangan poin.Pelecehan ras terjadi kala Inggris menang 5-1 atas Montenegro di Kualifikasi Piala Eropa 2020, Selasa (26/3/2019) kemarin. Sejumlah pemain Inggris mendapatkan hinaan rasialis, di antaranya Raheem Sterling dan Danny Rose.Baca juga: Sterling Tak Lelah Melawan Aksi Rasialisme googletag.cmd.push(function() { googletag.display('div-gpt-ad-1535945694694-0'); }); UEFA telah membuka penyelidikan terkait insiden ini. Tentu saja ada potensi hukuman menanti Montenegro sebagai tuan rumah.Denda kemungkinan akan jadi hukuman minimal untuk hal semacam ini. Tapi sanksi tersebut dinilai sudah tak relevan lagi untuk isu rasialis saat ini.Eks penyerang Manchester United Dwight Yorke menyarankan mulai diterapkannya hukuman yang lebih keras. Pelecehan rasial bisa disanksi dengan pengurangan poin untuk menekan insiden.Baca juga: Isu Rasial di Liga Inggris, Sterling Dapat Dukungan dari Pogba""Saya rasa denda saja tidaklah cukup. Menurut saya, kita sudah mengalami progres dalam beberapa tahun di mana rasialisme jadi kekhawatiran, tapi isu ini jelas kembali ke pertandingan,"" kata Yorke dikutip Sky Sports.""Ini adalah sesuatu yang perlu kita hilangkan dari olahraga kita. Dan satu-satunya cara Anda bisa melakukannya adalah membuat keputusan yang sangat sulit.""""Uang bukan jadi soal. Kita perlu pengurangan poin, kalian tahulah, untuk menghukum para rasialis ini dari pertandingan. Saya rasa orang-orang yang memimpin harus membuat sejumlah keputusan yang sangat-sangat sulit dan kita telah melihat bahwa denda saja tidak cukup,"" imbuhnya.Baca juga: Lagi, Inter Dihukum Terkait Aksi Rasialisme (raw/yna) rasialisme timnas inggris kualifikasi piala eropa 2020 raheem sterling","Denda Tak Lagi Cukup untuk Atasi Rasialisme, Pengurangan Poin Dirasa Pas"
"dict","sport","Jakarta - MotoGP Argentina akan digelar akhir pekan ini. Seri kedua di 2019 itu akan menjadi ujian yang sempurna untuk Andrea Dovizioso dan tim Mission Winnow Ducati.Seri kedua MotoGP 2019 akan digelar di Sirkuit Termas de Rio Hondo, Argentina, Minggu (31/3/2019) waktu setempat. Datang ke Negeri Tango, Ducati dan Dovizioso dibayangi statistik kurang mengesankan.Sejak Argentina kembali menggelar MotoGP pada 2014, Ducati cukup kesulitan di sana. Hanya sekali pabrikan Italia itu masuk podium, yakni ketika Dovizioso finis kedua pada musim 2015. googletag.cmd.push(function() { googletag.display('div-gpt-ad-1535945783791-0'); }); Baca juga: Harapkan Cuaca Bagus, Rossi Berhasrat Kembali ke Podium MotoGP ArgentinaPodium itu juga satu-satunya yang didapat Dovizioso di MotoGP Argentina. Selebihnya, runner up MotoGP 2018 itu selalu terlempar di luar lima besar, bahkan sempat gagal finis di 2017.Ducati dan Dovizioso sendiri baru saja mengawali MotoGP 2019 dengan apik. Di seri pembuka di Qatar, Dovizioso memenangkan balapan, mengalahkan sang juara bertahan dari tim Repsol Honda Marc Marquez.Baca juga: CEO Ducati: Ducati Curang? Diam lah dan Coba Kalahkan Kami di LintasanTak ayal, di tengah start oke pada MotoGP 2019, seri Argentina bisa menjadi ujian yang bagus untuk Ducati dan Dovizioso. Pebalap Italia itu pun mengatakan tujuannya pada akhir pekan nanti adalah bisa meraih podium.""Argentina, dan balapannya pada khususnya, akan menjadi ujian yang bagus bagi kami dan memungkinkan kami mencoba menemukan solusi baru,"" kata Dovizioso di situs resmi MotoGP.""Tujuan kami adalah untuk naik podium, terutama di trek yang secara teoritis akan membuat kami menderita, demi memperjuangkan gelar sampai akhir,"" tambahnya.Selain kemenangan di Qatar, motivasi Ducati juga diprediksi membuncah mengingat baru saja memenangkan Pengadilan Banding MotoGP, terkait komponen wingletnya yang dinyatakan sah atau legal.Baca juga: Winglet Ducati Diputuskan Sah, Dovizioso Tetap Juara MotoGP Qatar (yna/raw) ducati motogp argentina motogp argentina 2019 andrea dovizioso motogp 2019","MotoGP Argentina, Ujian Sempurna Dovizioso dan Ducati"
"dict","sport","Jakarta - Mauricio Pochettino belakangan dikaitkan dengan sejumlah tim. Tapi melihat situasi Tottenham Hotspur saat ini, pria Argentina itu tak punya alasan untuk pergi.Pochettino belakangan dikaitkan dengan sejumlah klub. Dia disebut-sebut jadi salah satu yang dipantau Manchester United untuk kandidat manajer tetap musim depan.Baca juga: Semoga Tottenham Cepat Klik dengan Stadion Baru googletag.cmd.push(function() { googletag.display('div-gpt-ad-1535945694694-0'); }); Pria 47 tahun itu juga sempat dikaitkan dengan Real Madrid. Tapi kemudian Los Blancos memilih mengangkat kembali Zinedine Zidane sebagai pelatih.Eks penyerang Tottenham Teddy Sheringham percaya Pochettino takkan ke mana-mana. Tim sedang konsisten bersaing di empat besar dalam empat musim terakhir ini, plus faktor stadion baru.Baca juga: Liverpool Mesti Langsung Tokcer Usai Jeda Internasional, Tottenham Menunggu""Menurut saya, kenapa dia menginginkan pergi dari Tottenham? Klub sedang menanjak, ini klub yang fantastis, saya rasa semua suporter juga mencintainya,"" ungkapnya dikutip Sky Sports.""Tidak ada semacam perpecahan 60-40 atau semacam itu, di mana orang-orang menginginkan dia pergi. Semuanya bisa melihat bahwa klub sedang menanjak, tim sedang menanjak.""Baca juga: Van Gaal: Mungkin Ku Salah Dulu Lebih Pilih MU ketimbang Tottenham""Mereka baru pindah ke stadion baru, dia bekerja dengan sejumlah pemain terbaik, bukan cuma di negara ini tapi di dunia. Kalau saya harus bertaruh, saya akan bilang dia bakal bertahan dan menantikan musim baru,"" imbuhnya. (raw/yna) mauricio pochettino tottenham hotspur manchester united","Tak Ada Alasan untuk Pochettino Tinggalkan Tottenham"
"dict","hot","","Ini Sosialita dan Juga Putri Pemilik Klub Bola yang Terseret Kasus Seungri"
"dict","sport","Jakarta - Georgina Rodriguez dikabarkan tengah hamil anak kelima Cristiano Ronaldo. Benarkah demikian?Georgina sebelumnya sudah memberi satu anak hasil hubungannya dengan Ronaldo. Pada November 2017, ia melahirkan putri cantik bernama Alana Martina. Itu anak keempat Ronaldo, atau yang pertama dari hubungannya bersama Georgina.Baca juga: Tangis Bahagia Georgina Sambut Hat-trick Ronaldo googletag.cmd.push(function() { googletag.display('div-gpt-ad-1535945694694-0'); }); Kini, Georgina dikabarkan tengah mengandung lagi. Seperti dikutip dari AS, rumor itu pertama kali dihembuskan harian Portugal Correio Da Manha.Harian itu menyoroti perut buncit Georgina, saat menyaksikan Ronaldo membela Timnas Portugal menghadapi Serbia di Estadio de la Luz, Senin (25/3), dalam Kualifikasi Piala Eropa 2020. Di laga itu, Ronaldo cuma bermain 30 menit akibat mengalami cedera.Georgina Rodriguez saat menyaksikan Ronaldo membela Timnas Portugal. (Foto: screenshot video correio da manha)Baca juga: Ronaldo-Georgina Ternyata Belum BertunanganGeorgina, yang mengenakan gaun ketat, memperlihatkan perutnya yang agak buncit. Saat menyaksikan sang kekasih, perutnya terlihat agak lebih besar dari biasanya sehingga disebut-sebut tengah mengandung lagi.Termasuk Alana, Ronaldo sudah punya empat anak. Tiga lainnya adalah Cristiano Junior dan si kembar Eva serta Mateo yang berasal dari ibu pengganti (surrogate mom). So, apakah anak kelima penyerang Juventus itu segera hadir?Baca juga: Terungkap! Calon Mertua Ronaldo Gembong Narkoba (yna/raw) cristiano ronaldo georgina rodriguez","Georgina Rodriguez Hamil Anak Kelima Cristiano Ronaldo?"
"dict","sport","Jakarta - Cristiano Ronaldo didenda UEFA terkait selebrasi selangkangannya saat menghadapi Atletico Madrid. Penyerang Juventus itu menganggapnya hal yang normal.Ronaldo mencetak hat-trick saat Juventus mengalahkan Atletico Madrid 3-0 di leg kedua babak 16 besar Liga Champions, 13 Maret 2019. Dalam kemenangan yang mengantar Si Nyonya Tua ke perempatfinal itu, CR7 merayakan golnya dengan menonjolkan selangkangannya.Gaya selebrasi Ronaldo itu ditujukan untuk membalas aksi pelatih Atletico Madrid, Diego Simeone. Pada leg pertama, 21 Februari 2019, pelatih asal Argentina itu merayakan gol timnya juga dengan gaya serupa, ketika Los Colchoneros menang 2-0. googletag.cmd.push(function() { googletag.display('div-gpt-ad-1535945694694-0'); }); Baca juga: Ronaldo Didenda Rp 320 Juta karena Selebrasi SelangkanganUEFA rupanya mendakwa Ronaldo bersalah atas perayaan golnya. Pemilik lima gelar Ballon d'Or itu lantas disanksi dengan denda sebesar 20 ribu euro atau sekitar Rp 320 juta. Simeone juga dihukum serupa.Ronaldo, seperti dilansir AS, rupanya sudah dimintai tanggapan soal dendanya. Usai melakoni laga bersama Timnas Portugal, pemain yang dibeli Juventus seharga 100 juta euro itu mengomentari singkat hukumannya.""Itu normal,"" kata Ronaldo, yang diwawancara saat hendak masuk bus timnya.Juventus sendiri melaju ke perempatfinal dengan agregat 3-2. Di babak delapan besar, raksasa Serie A itu akan ditantang Ajax Amsterdam, yang sebelumnya menyingkirkan Real Madrid--mantan klub Ronaldo.Baca juga: Juventus: Ronaldo Cedera Minor Saja (yna/raw) cristiano ronaldo uefa juventus liga champions liga champions 2018/2019","Denda UEFA adalah Hal Normal Bagi Ronaldo"
"dict","hot","Jakarta - Tingkah laku Hotman Paris memang kontoversial. Kadang melihat perilakunya bisa bikin geleng-geleng kepala.Banyak yang bertanya-tanya bagaimana perasaan keluarga Hotman Paris. Melaney Ricardo pun ngobrol bareng dengan salah satu anak Hotman Paris, Frank Hutapea.Dalam video yang diposting di channel YouTube Melaney Ricardo, Frank Hutapea yang juga merupakan pengacara memberitahukan rasanya menjadi anak seorang Hotman Paris. Ada kalanya, Frank mendapat ekspektasi yang tinggi ketika menangani sebuah perkara. googletag.cmd.push(function() { googletag.display('div-gpt-ad-1535944650921-0'); }); Baca juga: Tak Hanya Sandiaga, Hotman Paris Juga Sering Dilamar Wanita""Wah it's a blessing also beban in disguise,"" ucap Frank dilansir, Rabu (27/3/2019).""Ya rasanya kadang-kadang orang tuh ekspektasi gue udah punya jam terbang sebanyak dia. Terus kan jadi lawyer nggak gampang,"" ungkapnya.Pria berkepala plontos lulusan salah satu universitas di Indonesia dan London itu menjelaskan seorang pengacara bisa lihai karena jam kerja. Akan tetapi, menjadi anak Hotman, Frank juga mendapatkan keuntungan yang belum tentu orang lain bisa rasakan.Baca juga: Hotman Paris Kerap Bikin Pusing Anak, Kenapa?""Privilege kebetulan saya dapat networking it's easy to network karena memang well di satu sisi nggak mau bawa nama juga, tapi di sisi kedua kadang mereka teman lama saya,"" ucapnya.Video: Tak Hanya Sandiaga, Hotman Paris Juga Sering Dilamar Wanita[Gambas:Video 20detik]""Frank pengin nggak, dikenal sebagai lawyer tanpa embel-embel Hotman?"" tanya Melaney.""Pengin banget. Kalau lawyer itu kan dari kualitas by doing. Kualitas itu orang akan nilai sendiri,"" tukas Frank.Tonton juga: Tak Hanya Sandiaga, Hotman Paris Juga Sering Dilamar Wanita[Gambas:Video 20detik]Baca juga: Hotman Paris Kerap Bikin Pusing Anak, Kenapa?Sosok Hotman Paris yang berani mengeluarkan opininya ternyata bisa membuat Frank pusing. Menurutnya, ada beberapa hal yang baiknya menurut Frank, Hotman diam.""Lebih pusing saya. Mendingan silent kadang-kadang. Bukannya ketakutan tapi dia sudah keburu post, tiba-tiba habis (Hotman) post wah ada kehebohan apa. Sudah sering itu kadang-kadang juga, ada teman atau gimana saya sampein langsung ke papa,"" jelasnya.""Kalau ITE nggak, dia kan tahu limitnya. Tapi lebih ke social effect-nya aja,"" tegas Frank Hutapea. (pus/nkn) hotman paris hotman paris hutapea anak hotman paris melaney ricardo youtube artis Photo Gallery 1 celeb Hotman Paris Ngaku Dicuekin Syahrini, BFF Nia Ramadhani-Jedar celeb Hotman Paris Ngaku Dicuekin Syahrini, BFF Nia Ramadhani-Jedar celeb Hotman Paris Ngaku Dicuekin Syahrini, BFF Nia Ramadhani-Jedar celeb Hotman Paris Ngaku Dicuekin Syahrini, BFF Nia Ramadhani-Jedar celeb Hotman Paris Ngaku Dicuekin Syahrini, BFF Nia Ramadhani-Jedar celeb Hotman Paris Ngaku Dicuekin Syahrini, BFF Nia Ramadhani-Jedar celeb Hotman Paris Ngaku Dicuekin Syahrini, BFF Nia Ramadhani-Jedar 1 celeb Tak Diundang Nikahan Syahrini, Hotman Paris Ngaku Dicuekin celeb Tak Diundang Nikahan Syahrini, Hotman Paris Ngaku Dicuekin celeb Tak Diundang Nikahan Syahrini, Hotman Paris Ngaku Dicuekin celeb Tak Diundang Nikahan Syahrini, Hotman Paris Ngaku Dicuekin celeb Tak Diundang Nikahan Syahrini, Hotman Paris Ngaku Dicuekin celeb Tak Diundang Nikahan Syahrini, Hotman Paris Ngaku Dicuekin celeb Tak Diundang Nikahan Syahrini, Hotman Paris Ngaku Dicuekin celeb Tak Diundang Nikahan Syahrini, Hotman Paris Ngaku Dicuekin celeb Tak Diundang Nikahan Syahrini, Hotman Paris Ngaku Dicuekin 2 celeb Pujian Melaney Ricardo untuk Luna Maya celeb Pujian Melaney Ricardo untuk Luna Maya celeb Pujian Melaney Ricardo untuk Luna Maya celeb Pujian Melaney Ricardo untuk Luna Maya celeb Pujian Melaney Ricardo untuk Luna Maya celeb Pujian Melaney Ricardo untuk Luna Maya celeb Pujian Melaney Ricardo untuk Luna Maya 3 celeb Teman Sejati! Persahabatan Denny Cagur dan Raffi Ahmad celeb Teman Sejati! Persahabatan Denny Cagur dan Raffi Ahmad celeb Teman Sejati! Persahabatan Denny Cagur dan Raffi Ahmad celeb Teman Sejati! Persahabatan Denny Cagur dan Raffi Ahmad celeb Teman Sejati! Persahabatan Denny Cagur dan Raffi Ahmad celeb Teman Sejati! Persahabatan Denny Cagur dan Raffi Ahmad celeb Teman Sejati! Persahabatan Denny Cagur dan Raffi Ahmad 4 celeb Ini Foto Jadul Tamara Bleszynski yang Bikin Hotman Paris Naksir celeb Ini Foto Jadul Tamara Bleszynski yang Bikin Hotman Paris Naksir celeb Ini Foto Jadul Tamara Bleszynski yang Bikin Hotman Paris Naksir celeb Ini Foto Jadul Tamara Bleszynski yang Bikin Hotman Paris Naksir celeb Ini Foto Jadul Tamara Bleszynski yang Bikin Hotman Paris Naksir celeb Ini Foto Jadul Tamara Bleszynski yang Bikin Hotman Paris Naksir celeb Ini Foto Jadul Tamara Bleszynski yang Bikin Hotman Paris Naksir celeb Ini Foto Jadul Tamara Bleszynski yang Bikin Hotman Paris Naksir 5 celeb Persahabatan Ayu Dewi, Luna Maya dan Melaney Ricardo celeb Persahabatan Ayu Dewi, Luna Maya dan Melaney Ricardo celeb Persahabatan Ayu Dewi, Luna Maya dan Melaney Ricardo celeb Persahabatan Ayu Dewi, Luna Maya dan Melaney Ricardo celeb Persahabatan Ayu Dewi, Luna Maya dan Melaney Ricardo celeb Persahabatan Ayu Dewi, Luna Maya dan Melaney Ricardo celeb Persahabatan Ayu Dewi, Luna Maya dan Melaney Ricardo celeb Persahabatan Ayu Dewi, Luna Maya dan Melaney Ricardo 6 celeb Tom Cruise dan Deretan Selebriti yang Kabarnya Operasi Plastik celeb Tom Cruise dan Deretan Selebriti yang Kabarnya Operasi Plastik celeb Tom Cruise dan Deretan Selebriti yang Kabarnya Operasi Plastik celeb Tom Cruise dan Deretan Selebriti yang Kabarnya Operasi Plastik celeb Tom Cruise dan Deretan Selebriti yang Kabarnya Operasi Plastik celeb Tom Cruise dan Deretan Selebriti yang Kabarnya Operasi Plastik celeb Tom Cruise dan Deretan Selebriti yang Kabarnya Operasi Plastik 7 celeb Gaya Dewi Perssik di Polda, Tiru Syahrini? celeb Gaya Dewi Perssik di Polda, Tiru Syahrini? celeb Gaya Dewi Perssik di Polda, Tiru Syahrini? celeb Gaya Dewi Perssik di Polda, Tiru Syahrini? celeb Gaya Dewi Perssik di Polda, Tiru Syahrini? celeb Gaya Dewi Perssik di Polda, Tiru Syahrini? celeb Gaya Dewi Perssik di Polda, Tiru Syahrini? 8 celeb Hobah! Dewi Perssik Ajak Goyang Hotman Paris di Depan Suami celeb Hobah! Dewi Perssik Ajak Goyang Hotman Paris di Depan Suami celeb Hobah! Dewi Perssik Ajak Goyang Hotman Paris di Depan Suami celeb Hobah! Dewi Perssik Ajak Goyang Hotman Paris di Depan Suami celeb Hobah! Dewi Perssik Ajak Goyang Hotman Paris di Depan Suami 9 celeb Hotman Paris, Dicaci dan Dipuji Netizen celeb Hotman Paris, Dicaci dan Dipuji Netizen celeb Hotman Paris, Dicaci dan Dipuji Netizen celeb Hotman Paris, Dicaci dan Dipuji Netizen celeb Hotman Paris, Dicaci dan Dipuji Netizen celeb Hotman Paris, Dicaci dan Dipuji Netizen celeb Hotman Paris, Dicaci dan Dipuji Netizen 10 celeb Gaya Genit Geng Menteri Ceria celeb Gaya Genit Geng Menteri Ceria celeb Gaya Genit Geng Menteri Ceria celeb Gaya Genit Geng Menteri Ceria celeb Gaya Genit Geng Menteri Ceria celeb Gaya Genit Geng Menteri Ceria 11 celeb Ketika Inul dan Hotman Paris Mesra Banget celeb Ketika Inul dan Hotman Paris Mesra Banget celeb Ketika Inul dan Hotman Paris Mesra Banget celeb Ketika Inul dan Hotman Paris Mesra Banget celeb Ketika Inul dan Hotman Paris Mesra Banget celeb Ketika Inul dan Hotman Paris Mesra Banget celeb Ketika Inul dan Hotman Paris Mesra Banget 12 celeb Saat Chef Aiko Ditemani Hotman Paris celeb Saat Chef Aiko Ditemani Hotman Paris celeb Saat Chef Aiko Ditemani Hotman Paris celeb Saat Chef Aiko Ditemani Hotman Paris celeb Saat Chef Aiko Ditemani Hotman Paris celeb Saat Chef Aiko Ditemani Hotman Paris 13 celeb Aksi Sosial Melaney Ricardo Untuk Anak-anak Penderita Kanker celeb Aksi Sosial Melaney Ricardo Untuk Anak-anak Penderita Kanker celeb Aksi Sosial Melaney Ricardo Untuk Anak-anak Penderita Kanker celeb Aksi Sosial Melaney Ricardo Untuk Anak-anak Penderita Kanker celeb Aksi Sosial Melaney Ricardo Untuk Anak-anak Penderita Kanker celeb Aksi Sosial Melaney Ricardo Untuk Anak-anak Penderita Kanker celeb Aksi Sosial Melaney Ricardo Untuk Anak-anak Penderita Kanker celeb Aksi Sosial Melaney Ricardo Untuk Anak-anak Penderita Kanker 14 celeb Penampilan Melaney Ricardo Pasca Melahirkan celeb Penampilan Melaney Ricardo Pasca Melahirkan celeb Penampilan Melaney Ricardo Pasca Melahirkan celeb Penampilan Melaney Ricardo Pasca Melahirkan celeb Penampilan Melaney Ricardo Pasca Melahirkan celeb Penampilan Melaney Ricardo Pasca Melahirkan 15 photo Dicatut Paedofil di Facebook, Melaney Ricardo Ambil Jalur Hukum photo Dicatut Paedofil di Facebook, Melaney Ricardo Ambil Jalur Hukum photo Dicatut Paedofil di Facebook, Melaney Ricardo Ambil Jalur Hukum photo Dicatut Paedofil di Facebook, Melaney Ricardo Ambil Jalur Hukum photo Dicatut Paedofil di Facebook, Melaney Ricardo Ambil Jalur Hukum 16 photo Inul Daratista dan Hotman Paris Lengket Banget photo Inul Daratista dan Hotman Paris Lengket Banget photo Inul Daratista dan Hotman Paris Lengket Banget photo Inul Daratista dan Hotman Paris Lengket Banget photo Inul Daratista dan Hotman Paris Lengket Banget photo Inul Daratista dan Hotman Paris Lengket Banget 17 photo Selebriti Jenguk Julia Perez di Rutan 18 photo Melaney Ricardo & Tyson Kompak Merah-merah 19 photo Kebahagiaan Melaney Ricardo Sambut Si Buah Hati 20 1","Frank Hutapea Ungkap Rasanya Jadi Anak Hotman Paris, Enak atau Terbebani?"
"dict","sport","Jakarta - Ole Gunnar Solskjaer punya delapan laga tersisa di Premier League musim ini. Dwight Yorke berharap mantan rekannya itu bisa menuntaskannya dengan positif.MU saat ini ada di posisi lima Liga Inggris dengan 58 poin dari 30 pertandingan. 'Setan Merah' tertinggal tiga poin dan dua poin dari Tottenham Hotspur dan Arsenal di posisi 3-4.Baca juga: MU Pantau Umtiti googletag.cmd.push(function() { googletag.display('div-gpt-ad-1535945694694-0'); }); Ada delapan pertandingan tersisa untuk MU mencoba menutup selisih itu dan finis di zona Liga Champions. Skuat Ole Gunnar Solskjaer akan menghadapi Watford, Wolverhampton Wandereres, West Ham United, dan Everton.Lalu derby kontra Manchester City mengikuti, disusul laga lawan Chelsea, Huddersfield Town FC, dan Cardiff City.Solskjaer sejauh ini punya catatan yang relatif bagus di liga. Ia sempat membawa MU tanpa kekalahan di 12 pertandingan, hanya dua kali berimbang di periode itu.Baca juga: Van Gaal: Di Maria Gagal di MU Akibat KesalahannyaSampai kemudian catatan itu dihentikan Arsenal. Yorke berharap di periode akhir ini, MU bisa kembali ke jalur positif dan merebut satu posisi di Liga Champions.""Dia sudah melakukan pekerjaan yang luar biasa, sebuah pekerjaan yang mana kami semua bangga,"" ungkapnya dikutip Sky Sports.""Dia mendatangkan kembali identitas ke klub, dan kami menampilkan hal-hal bagus, memenangi pertandingan-pertandingan. Itulah yang utama.""Baca juga: MU Permanenkan Solskjaer Sebelum Laga Kontra Watford?""Dia punya delapan laga tersisa, maris berharap dia terus berada di jalur kemenangan itu. Lalu keputusan akan dibuat terkait kariernya,"" tandas Yorke.Saksikan juga video 'Gol-gol Cantik Alex Grimaldo, Bek Kiri Incaran MU':[Gambas:Video 20detik] (raw/yna) ole gunnar solskjaer manchester united tottenham hotspur arsenal liga inggris premier league","Delapan Lagi, Solskjaer!"
"dict","hot","","Sule Dekat dengan Baby Shima, Ini Pendapat Naomi Zaskia"
"dict","sport","Jakarta - Cristiano Ronaldo diketahui melakukan perjalanan ke Barcelona. Bintang Juventus itu mampir setelah membela tim nasional Portugal. Ada apa?Perjalanan ini kabarnya terkait cedera yang dialami Ronaldo. Dia seperti diketahui mendapatkan cedera paha saat membela Portugal menghadapi Serbia di Estadio da Luz, Selasa (26/3/2019) lalu, pada laga Kualifikasi Piala Eropa 2020.Baca juga: Georgina Rodriguez Hamil Anak Kelima Cristiano Ronaldo? googletag.cmd.push(function() { googletag.display('div-gpt-ad-1535945694694-0'); }); Cedera membuat penyerang Juventus ini tak mampu menyelesaikan pertandingan dan digantikan Pizzi pada menit ke-31. Usai laga yang berakhir 1-1 itu, Ronaldo mengungkapkan bahwa cederanya tak parah dan yakin akan pulih dalam dua pekan.Laporan yang diungkapkan Juventus mengonfirmasi bahwa mantan pemain Manchester United dan Real Madrid itu mengalami cedera minor.Baca juga: Denda UEFA adalah Hal Normal Bagi RonaldoMeski begitu, pria 33 tahun ini memutuskan terbang ke Barcelona untuk berkonsultasi mengenai cederanya. Ronaldo ingin mendapatkan opini kedua terkait kondisinya.Juventus telah memberi izin Ronaldo untuk menuju Barcelona, Selasa (26/3) waktu Eropa. Ia akan kembali ke Kota Turin keesokan harinya untuk kemudian menjalani program pemulihan cedera.Baca juga: Juventus: Ronaldo Cedera Minor SajaJika dilihat dari perkiraan awal, Ronaldo kemungkinan besar bakal absen di tiga laga Serie A yaitu menghadapi Empoli, Cagliari dan AC Milan. Ia baru akan kembali fit saat Bianconeri bertandang ke Ajax pada leg pertama babak perempatfinal Liga Champions.Saksikan juga video 'Tak Cetak Gol, Ronaldo Malah Cedera':[Gambas:Video 20detik] (raw/yna) cristiano ronaldo juventus timnas portugal kualifikasi piala eropa 2020","Cristiano Ronaldo ke Barcelona, Mau Apa?"
